code,term
S797,Multiple injuries of hip and thigh
S798,Other specified injuries of hip and thigh
S799,Unspecified injury of hip and thigh
S80,Superficial injury of lower leg
S80-S89,Injuries to the knee and lower leg
S800,Contusion of knee
S801,Contusion of other and unspecified parts of lower leg
S807,Multiple superficial injuries of lower leg
S808,Other superficial injuries of lower leg
S809,"Superficial injury of lower leg, unspecified"
S81,Open wound of lower leg
S810,Open wound of knee
S817,Multiple open wounds of lower leg
S818,Open wound of other parts of lower leg
S819,"Open wound of lower leg, part unspecified"
S82,"Fracture of lower leg, including ankle"
S820,Fracture of patella
S821,Fracture of upper end of tibia
S822,Fracture of shaft of tibia
S823,Fracture of lower end of tibia
S824,Fracture of fibula alone
S825,Fracture of medial malleolus
S826,Fracture of lateral malleolus
S827,Multiple fractures of lower leg
S828,Fractures of other parts of lower leg
S829,"Fracture of lower leg, part unspecified"
S83,"Dislocation, sprain and strain of joints and ligaments of knee"
S830,Dislocation of patella
S831,Dislocation of knee
S832,"Tear of meniscus, current"
S833,"Tear of articular cartilage of knee, current"
S834,Sprain and strain involving (fibular)(tibial) collateral ligament of knee
S835,Sprain and strain involving (anterior)(posterior) cruciate ligament of knee
S836,Sprain and strain of other and unspecified parts of knee
S837,Injury to multiple structures of knee
S84,Injury of nerves at lower leg level
S840,Injury of tibial nerve at lower leg level
S841,Injury of peroneal nerve at lower leg level
S842,Injury of cutaneous sensory nerve at lower leg level
S847,Injury of multiple nerves at lower leg level
S848,Injury of other nerves at lower leg level
S849,Injury of unspecified nerve at lower leg level
S85,Injury of blood vessels at lower leg level
S850,Injury of popliteal artery
S851,Injury of (anterior)(posterior) tibial artery
S852,Injury of peroneal artery
S853,Injury of greater saphenous vein at lower leg level
S854,Injury of lesser saphenous vein at lower leg level
S855,Injury of popliteal vein
S857,Injury of multiple blood vessels at lower leg level
S858,Injury of other blood vessels at lower leg level
S859,Injury of unspecified blood vessel at lower leg level
S86,Injury of muscle and tendon at lower leg level
S860,Injury of Achilles tendon
S861,Injury of other muscle(s) and tendon(s) of posterior muscle group at lower leg level
S862,Injury of muscle(s) and tendon(s) of anterior muscle group at lower leg level
S863,Injury of muscle(s) and tendon(s) of peroneal muscle group at lower leg level
S867,Injury of multiple muscles and tendons at lower leg level
S868,Injury of other muscles and tendons at lower leg level
S869,Injury of unspecified muscle and tendon at lower leg level
S87,Crushing injury of lower leg
S870,Crushing injury of knee
S878,Crushing injury of other and unspecified parts of lower leg
S88,Traumatic amputation of lower leg
S880,Traumatic amputation at knee level
S881,Traumatic amputation at level between knee and ankle
S889,"Traumatic amputation of lower leg, level unspecified"
S89,Other and unspecified injuries of lower leg
S897,Multiple injuries of lower leg
S898,Other specified injuries of lower leg
S899,Unspecified injury of lower leg
S90,Superficial injury of ankle and foot
S90-S99,Injuries to the ankle and foot
S900,Contusion of ankle
S901,Contusion of toe(s) without damage to nail
S902,Contusion of toe(s) with damage to nail
S903,Contusion of other and unspecified parts of foot
S907,Multiple superficial injuries of ankle and foot
S908,Other superficial injuries of ankle and foot
S909,"Superficial injury of ankle and foot, unspecified"
S91,Open wound of ankle and foot
S910,Open wound of ankle
S911,Open wound of toe(s) without damage to nail
S912,Open wound of toe(s) with damage to nail
S913,Open wound of other parts of foot
S917,Multiple open wounds of ankle and foot
S92,"Fracture of foot, except ankle"
S920,Fracture of calcaneus
S921,Fracture of talus
S922,Fracture of other tarsal bone(s)
S923,Fracture of metatarsal bone
S924,Fracture of great toe
S925,Fracture of other toe
S927,Multiple fractures of foot
S929,"Fracture of foot, unspecified"
S93,"Dislocation, sprain and strain of joints and ligaments at ankle and foot level"
S930,Dislocation of ankle joint
S931,Dislocation of toe(s)
S932,Rupture of ligaments at ankle and foot level
S933,Dislocation of other and unspecified parts of foot
S934,Sprain and strain of ankle
S935,Sprain and strain of toe(s)
S936,Sprain and strain of other and unspecified parts of foot
S94,Injury of nerves at ankle and foot level
S940,Injury of lateral plantar nerve
S941,Injury of medial plantar nerve
S942,Injury of deep peroneal nerve at ankle and foot level
S943,Injury of cutaneous sensory nerve at ankle and foot level
S947,Injury of multiple nerves at ankle and foot level
S948,Injury of other nerves at ankle and foot level
S949,Injury of unspecified nerve at ankle and foot level
S95,Injury of blood vessels at ankle and foot level
S950,Injury of dorsal artery of foot
S951,Injury of plantar artery of foot
S952,Injury of dorsal vein of foot
S957,Injury of multiple blood vessels at ankle and foot level
S958,Injury of other blood vessels at ankle and foot level
S959,Injury of unspecified blood vessel at ankle and foot level
S96,Injury of muscle and tendon at ankle and foot level
S960,Injury of muscle and tendon of long flexor muscle of toe at ankle and foot level
S961,Injury of muscle and tendon of long extensor muscle of toe at ankle and foot level
S962,Injury of intrinsic muscle and tendon at ankle and foot level
S967,Injury of multiple muscles and tendons at ankle and foot level
S968,Injury of other muscles and tendons at ankle and foot level
S969,Injury of unspecified muscle and tendon at ankle and foot level
S97,Crushing injury of ankle and foot
S970,Crushing injury of ankle
S971,Crushing injury of toe(s)
S978,Crushing injury of other parts of ankle and foot
S98,Traumatic amputation of ankle and foot
S980,Traumatic amputation of foot at ankle level
S981,Traumatic amputation of one toe
S982,Traumatic amputation of two or more toes
S983,Traumatic amputation of other parts of foot
S984,"Traumatic amputation of foot, level unspecified"
S99,Other and unspecified injuries of ankle and foot
S997,Multiple injuries of ankle and foot
S998,Other specified injuries of ankle and foot
S999,Unspecified injury of ankle and foot
T00,Superficial injuries involving multiple body regions
T00-T07,Injuries involving multiple body regions
T000,Superficial injuries involving head with neck
T001,"Superficial injuries involving thorax with abdomen, lower back and pelvis"
T002,Superficial injuries involving multiple regions of upper limb(s)
T003,Superficial injuries involving multiple regions of lower limb(s)
T006,Superficial injuries involving multiple regions of upper limb(s) with lower limb(s)
T008,Superficial injuries involving other combinations of body regions
T009,"Multiple superficial injuries, unspecified"
T01,Open wounds involving multiple body regions
T010,Open wounds involving head with neck
T011,"Open wounds involving thorax with abdomen, lower back and pelvis"
T012,Open wounds involving multiple regions of upper limb(s)
T013,Open wounds involving multiple regions of lower limb(s)
T016,Open wounds involving multiple regions of upper limb(s) with lower limb(s)
T018,Open wounds involving other combinations of body regions
T019,"Multiple open wounds, unspecified"
T02,Fractures involving multiple body regions
T020,Fractures involving head with neck
T021,Fractures involving thorax with lower back and pelvis
T022,Fractures involving multiple regions of one upper limb
T023,Fractures involving multiple regions of one lower limb
T024,Fractures involving multiple regions of both upper limbs
T025,Fractures involving multiple regions of both lower limbs
T026,Fractures involving multiple regions of upper limb(s) with lower limb(s)
T027,Fractures involving thorax with lower back and pelvis with limb(s)
T028,Fractures involving other combinations of body regions
T029,"Multiple fractures, unspecified"
T03,"Dislocations, sprains and strains involving multiple body regions"
T030,"Dislocations, sprains and strains involving head with neck"
T031,"Dislocations, sprains and strains involving thorax with lower back and pelvis"
T032,"Dislocations, sprains and strains involving multiple regions of upper limb(s)"
T033,"Dislocations, sprains and strains involving multiple regions of lower limb(s)"
T034,"Dislocations, sprains and strains involving multiple regions of upper limb(s) with lower limb(s)"
T038,"Dislocations, sprains and strains involving other combinations of body regions"
T039,"Multiple dislocations, sprains and strains, unspecified"
T04,Crushing injuries involving multiple body regions
T040,Crushing injuries involving head with neck
T041,"Crushing injuries involving thorax with abdomen, lower back and pelvis"
T042,Crushing injuries involving multiple regions of upper limb(s)
T043,Crushing injuries involving multiple regions of lower limb(s)
T044,Crushing injuries involving multiple regions of upper limb(s) with lower limb(s)
T047,"Crushing injuries of thorax with abdomen, lower back and pelvis with limb(s)"
T048,Crushing injuries involving other combinations of body regions
T049,"Multiple crushing injuries, unspecified"
T05,Traumatic amputations involving multiple body regions
T050,Traumatic amputation of both hands
T051,"Traumatic amputation of one hand and other arm [any level, except hand]"
T052,Traumatic amputation of both arms [any level]
T053,Traumatic amputation of both feet
T054,"Traumatic amputation of one foot and other leg [any level, except foot]"
T055,Traumatic amputation of both legs [any level]
T056,"Traumatic amputation of upper and lower limbs, any combination [any level]"
T058,Traumatic amputations involving other combinations of body regions
T059,"Multiple traumatic amputations, unspecified"
T06,"Other injuries involving multiple body regions, not elsewhere classified"
T060,Injuries of brain and cranial nerves with injuries of nerves and spinal cord at neck level
T061,Injuries of nerves and spinal cord involving other multiple body regions
T062,Injuries of nerves involving multiple body regions
T063,Injuries of blood vessels involving multiple body regions
T064,Injuries of muscles and tendons involving multiple body regions
T065,Injuries of intrathoracic organs with intra-abdominal and pelvic organs
T068,Other specified injuries involving multiple body regions
T07,Unspecified multiple injuries
T08,"Fracture of spine, level unspecified"
T08-T14,"Injuries to unspecified part of trunk, limb or body region"
T09,"Other injuries of spine and trunk, level unspecified"
T090,"Superficial injury of trunk, level unspecified"
T091,"Open wound of trunk, level unspecified"
T092,"Dislocation, sprain and strain of unspecified joint and ligament of trunk"
T093,"Injury of spinal cord, level unspecified"
T094,"Injury of unspecified nerve, spinal nerve root and plexus of trunk"
T095,Injury of unspecified muscle and tendon of trunk
T096,"Traumatic amputation of trunk, level unspecified"
T098,"Other specified injuries of trunk, level unspecified"
T099,"Unspecified injury of trunk, level unspecified"
T10,"Fracture of upper limb, level unspecified"
T11,"Other injuries of upper limb, level unspecified"
T110,"Superficial injury of upper limb, level unspecified"
T111,"Open wound of upper limb, level unspecified"
T112,"Dislocation, sprain and strain of unspecified joint and ligament of upper limb, level unspecified"
T113,"Injury of unspecified nerve of upper limb, level unspecified"
T114,"Injury of unspecified blood vessel of upper limb, level unspecified"
T115,"Injury of unspecified muscle and tendon of upper limb, level unspecified"
T116,"Traumatic amputation of upper limb, level unspecified"
T118,"Other specified injuries of upper limb, level unspecified"
T119,"Unspecified injury of upper limb, level unspecified"
T12,"Fracture of lower limb, level unspecified"
T13,"Other injuries of lower limb, level unspecified"
T130,"Superficial injury of lower limb, level unspecified"
T131,"Open wound of lower limb, level unspecified"
T132,"Dislocation, sprain and strain of unspecified joint and ligament of lower limb, level unspecified"
T133,"Injury of unspecified nerve of lower limb, level unspecified"
T134,"Injury of unspecified blood vessel of lower limb, level unspecified"
T135,"Injury of unspecified muscle and tendon of lower limb, level unspecified"
T136,"Traumatic amputation of lower limb, level unspecified"
T138,"Other specified injuries of lower limb, level unspecified"
T139,"Unspecified injury of lower limb, level unspecified"
T14,Injury of unspecified body region
T140,Superficial injury of unspecified body region
T141,Open wound of unspecified body region
T142,Fracture of unspecified body region
T143,"Dislocation, sprain and strain of unspecified body region"
T144,Injury of nerve(s) of unspecified body region
T145,Injury of blood vessel(s) of unspecified body region
T146,Injury of muscles and tendons of unspecified body region
T147,Crushing injury and traumatic amputation of unspecified body region
T148,Other injuries of unspecified body region
T149,"Injury, unspecified"
T15,Foreign body on external eye
T15-T19,Effects of foreign body entering through natural orifice
T150,Foreign body in cornea
T151,Foreign body in conjunctival sac
T158,Foreign body in other and multiple parts of external eye
T159,"Foreign body on external eye, part unspecified"
T16,Foreign body in ear
T17,Foreign body in respiratory tract
T170,Foreign body in nasal sinus
T171,Foreign body in nostril
T172,Foreign body in pharynx
T173,Foreign body in larynx
T174,Foreign body in trachea
T175,Foreign body in bronchus
T178,Foreign body in other and multiple parts of respiratory tract
T179,"Foreign body in respiratory tract, part unspecified"
T18,Foreign body in alimentary tract
T180,Foreign body in mouth
T181,Foreign body in oesophagus
T182,Foreign body in stomach
T183,Foreign body in small intestine
T184,Foreign body in colon
T185,Foreign body in anus and rectum
T188,Foreign body in other and multiple parts of alimentary tract
T189,"Foreign body in alimentary tract, part unspecified"
T19,Foreign body in genitourinary tract
T190,Foreign body in urethra
T191,Foreign body in bladder
T192,Foreign body in vulva and vagina
T193,Foreign body in uterus [any part]
T198,Foreign body in other and multiple parts of genitourinary tract
T199,"Foreign body in genitourinary tract, part unspecified"
T20,Burn and corrosion of head and neck
T20-T25,"Burns and corrosions of external body surface, specified by site"
T20-T32,Burns and corrosions
T200,Burn of unspecified degree of head and neck
T201,Burn of first degree of head and neck
T202,Burn of second degree of head and neck
T203,Burn of third degree of head and neck
T204,Corrosion of unspecified degree of head and neck
T205,Corrosion of first degree of head and neck
T206,Corrosion of second degree of head and neck
T207,Corrosion of third degree of head and neck
T21,Burn and corrosion of trunk
T210,Burn of unspecified degree of trunk
T211,Burn of first degree of trunk
T212,Burn of second degree of trunk
T213,Burn of third degree of trunk
T214,Corrosion of unspecified degree of trunk
T215,Corrosion of first degree of trunk
T216,Corrosion of second degree of trunk
T217,Corrosion of third degree of trunk
T22,"Burn and corrosion of shoulder and upper limb, except wrist and hand"
T220,"Burn of unspecified degree of shoulder and upper limb, except wrist and hand"
T221,"Burn of first degree of shoulder and upper limb, except wrist and hand"
T222,"Burn of second degree of shoulder and upper limb, except wrist and hand"
T223,"Burn of third degree of shoulder and upper limb, except wrist and hand"
T224,"Corrosion of unspecified degree of shoulder and upper limb, except wrist and hand"
T225,"Corrosion of first degree of shoulder and upper limb, except wrist and hand"
T226,"Corrosion of second degree of shoulder and upper limb, except wrist and hand"
T227,"Corrosion of third degree of shoulder and upper limb, except wrist and hand"
T23,Burn and corrosion of wrist and hand
T230,Burn of unspecified degree of wrist and hand
T231,Burn of first degree of wrist and hand
T232,Burn of second degree of wrist and hand
T233,Burn of third degree of wrist and hand
T234,Corrosion of unspecified degree of wrist and hand
T235,Corrosion of first degree of wrist and hand
T236,Corrosion of second degree of wrist and hand
T237,Corrosion of third degree of wrist and hand
T24,"Burn and corrosion of hip and lower limb, except ankle and foot"
T240,"Burn of unspecified degree of hip and lower limb, except ankle and foot"
T241,"Burn of first degree of hip and lower limb, except ankle and foot"
T242,"Burn of second degree of hip and lower limb, except ankle and foot"
T243,"Burn of third degree of hip and lower limb, except ankle and foot"
T244,"Corrosion of unspecified degree of hip and lower limb, except ankle and foot"
T245,"Corrosion of first degree of hip and lower limb, except ankle and foot"
T246,"Corrosion of second degree of hip and lower limb, except ankle and foot"
T247,"Corrosion of third degree of hip and lower limb, except ankle and foot"
T25,Burn and corrosion of ankle and foot
T250,Burn of unspecified degree of ankle and foot
T251,Burn of first degree of ankle and foot
T252,Burn of second degree of ankle and foot
T253,Burn of third degree of ankle and foot
T254,Corrosion of unspecified degree of ankle and foot
T255,Corrosion of first degree of ankle and foot
T256,Corrosion of second degree of ankle and foot
T257,Corrosion of third degree of ankle and foot
T26,Burn and corrosion confined to eye and adnexa
T26-T28,Burns and corrosions confined to eye and internal organs
T260,Burn of eyelid and periocular area
T261,Burn of cornea and conjunctival sac
T262,Burn with resulting rupture and destruction of eyeball
T263,Burn of other parts of eye and adnexa
T264,"Burn of eye and adnexa, part unspecified"
T265,Corrosion of eyelid and periocular area
T266,Corrosion of cornea and conjunctival sac
T267,Corrosion with resulting rupture and destruction of eyeball
T268,Corrosion of other parts of eye and adnexa
T269,"Corrosion of eye and adnexa, part unspecified"
T27,Burn and corrosion of respiratory tract
T270,Burn of larynx and trachea
T271,Burn involving larynx and trachea with lung
T272,Burn of other parts of respiratory tract
T273,"Burn of respiratory tract, part unspecified"
T274,Corrosion of larynx and trachea
T275,Corrosion involving larynx and trachea with lung
T276,Corrosion of other parts of respiratory tract
T277,"Corrosion of respiratory tract, part unspecified"
T28,Burn and corrosion of other internal organs
T280,Burn of mouth and pharynx
T281,Burn of oesophagus
T282,Burn of other parts of alimentary tract
T283,Burn of internal genitourinary organs
T284,Burn of other and unspecified internal organs
T285,Corrosion of mouth and pharynx
T286,Corrosion of oesophagus
T287,Corrosion of other parts of alimentary tract
T288,Corrosion of internal genitourinary organs
T289,Corrosion of other and unspecified internal organs
T29,Burns and corrosions of multiple body regions
T29-T32,Burns and corrosions of multiple and unspecified body regions
T290,"Burns of multiple regions, unspecified degree"
T291,"Burns of multiple regions, no more than first-degree burns mentioned"
T292,"Burns of multiple regions, no more than second-degree burns mentioned"
T293,"Burns of multiple regions, at least one burn of third degree mentioned"
T294,"Corrosions of multiple regions, unspecified degree"
T295,"Corrosions of multiple regions, no more than first-degree corrosions mentioned"
T296,"Corrosions of multiple regions, no more than second-degree corrosions mentioned"
T297,"Corrosions of multiple regions, at least one corrosion of third degree mentioned"
T30,"Burn and corrosion, body region unspecified"
T300,"Burn of unspecified body region, unspecified degree"
T301,"Burn of first degree, body region unspecified"
T302,"Burn of second degree, body region unspecified"
T303,"Burn of third degree, body region unspecified"
T304,"Corrosion of unspecified body region, unspecified degree"
T305,"Corrosion of first degree, body region unspecified"
T306,"Corrosion of second degree, body region unspecified"
T307,"Corrosion of third degree, body region unspecified"
T31,Burns classified according to extent of body surface involved
T310,Burns involving less than 10% of body surface
T311,Burns involving 10-19% of body surface
T312,Burns involving 20-29% of body surface
T313,Burns involving 30-39% of body surface
T314,Burns involving 40-49% of body surface
T315,Burns involving 50-59% of body surface
T316,Burns involving 60-69% of body surface
T317,Burns involving 70-79% of body surface
T318,Burns involving 80-89% of body surface
T319,Burns involving 90% or more of body surface
T32,Corrosions classified according to extent of body surface involved
T320,Corrosions involving less than 10% of body surface
T321,Corrosions involving 10-19% of body surface
T322,Corrosions involving 20-29% of body surface
T323,Corrosions involving 30-39% of body surface
T324,Corrosions involving 40-49% of body surface
T325,Corrosions involving 50-59% of body surface
T326,Corrosions involving 60-69% of body surface
T327,Corrosions involving 70-79% of body surface
T328,Corrosions involving 80-89% of body surface
T329,Corrosions involving 90% or more of body surface
T33,Superficial frostbite
T33-T35,Frostbite
T330,Superficial frostbite of head
T331,Superficial frostbite of neck
T332,Superficial frostbite of thorax
T333,"Superficial frostbite of abdominal wall, lower back and pelvis"
T334,Superficial frostbite of arm
T335,Superficial frostbite of wrist and hand
T336,Superficial frostbite of hip and thigh
T337,Superficial frostbite of knee and lower leg
T338,Superficial frostbite of ankle and foot
T339,Superficial frostbite of other and unspecified sites
T34,Frostbite with tissue necrosis
T340,Frostbite with tissue necrosis of head
T341,Frostbite with tissue necrosis of neck
T342,Frostbite with tissue necrosis of thorax
T343,"Frostbite with tissue necrosis of abdominal wall, lower back and pelvis"
T344,Frostbite with tissue necrosis of arm
T345,Frostbite with tissue necrosis of wrist and hand
T346,Frostbite with tissue necrosis of hip and thigh
T347,Frostbite with tissue necrosis of knee and lower leg
T348,Frostbite with tissue necrosis of ankle and foot
T349,Frostbite with tissue necrosis of other and unspecified sites
T35,Frostbite involving multiple body regions and unspecified frostbite
T350,Superficial frostbite involving multiple body regions
T351,Frostbite with tissue necrosis involving multiple body regions
T352,Unspecified frostbite of head and neck
T353,"Unspecified frostbite of thorax, abdomen, lower back and pelvis"
T354,Unspecified frostbite of upper limb
T355,Unspecified frostbite of lower limb
T356,Unspecified frostbite involving multiple body regions
T357,Unspecified frostbite of unspecified site
T36,Poisoning by systemic antibiotics
T36-T50,"Poisoning by drugs, medicaments and biological substances"
T360,Poisoning: Penicillins
T361,Poisoning: Cefalosporins and other beta-lactam antibiotics
T362,Poisoning: Chloramphenicol group
T363,Poisoning: Macrolides
T364,Poisoning: Tetracyclines
T365,Poisoning: Aminoglycosides
T366,Poisoning: Rifamycins
T367,"Poisoning: Antifungal antibiotics, systemically used"
T368,Poisoning: Other systemic antibiotics
T369,"Poisoning: Systemic antibiotic, unspecified"
T37,Poisoning by other systemic anti-infectives and antiparasitics
T370,Poisoning: Sulfonamides
T371,Poisoning: Antimycobacterial drugs
T372,Poisoning: Antimalarials and drugs acting on other blood protozoa
T373,Poisoning: Other antiprotozoal drugs
T374,Poisoning: Anthelminthics
T375,Poisoning: Antiviral drugs
T378,Poisoning: Other specified systemic anti-infectives and antiparasitics
T379,"Poisoning: Systemic anti-infective and antiparasitic, unspecified"
T38,"Poisoning by hormones and their synthetic substitutes and antagonists, not elsewhere classified"
T380,Poisoning: Glucocorticoids and synthetic analogues
T381,Poisoning: Thyroid hormones and substitutes
T382,Poisoning: Antithyroid drugs
T383,Poisoning: Insulin and oral hypoglycaemic [antidiabetic] drugs
T384,Poisoning: Oral contraceptives
T385,Poisoning: Other estrogens and progestogens
T386,"Poisoning: Antigonadotrophins, antiestrogens, antiandrogens, not elsewhere classified"
T387,Poisoning: Androgens and anabolic congeners
T388,Poisoning: Other and unspecified hormones and their synthetic substitutes
T389,Poisoning: Other and unspecified hormone antagonists
T39,"Poisoning by nonopioid analgesics, antipyretics and antirheumatics"
T390,Poisoning: Salicylates
T391,Poisoning: 4-Aminophenol derivatives
T392,Poisoning: Pyrazolone derivatives
T393,Poisoning: Other nonsteroidal anti-inflammatory drugs [NSAID]
T394,"Poisoning: Antirheumatics, not elsewhere classified"
T398,"Poisoning: Other nonopioid analgesics and antipyretics, not elsewhere classified"
T399,"Poisoning: Nonopioid analgesic, antipyretic and antirheumatic, unspecified"
T40,Poisoning by narcotics and psychodysleptics [hallucinogens]
T400,Poisoning: Opium
T401,Poisoning: Heroin
T402,Poisoning: Other opioids
T403,Poisoning: Methadone
T404,Poisoning: Other synthetic narcotics
T405,Poisoning: Cocaine
T406,Poisoning: Other and unspecified narcotics
T407,Poisoning: Cannabis (derivatives)
T408,Poisoning: Lysergide [LSD]
T409,Poisoning: Other and unspecified psychodysleptics [hallucinogens]
T41,Poisoning by anaesthetics and therapeutic gases
T410,Poisoning: Inhaled anaesthetics
T411,Poisoning: Intravenous anaesthetics
T412,Poisoning: Other and unspecified general anaesthetics
T413,Poisoning: Local anaesthetics
T414,"Poisoning: Anaesthetic, unspecified"
