code,term
T415,Poisoning: Therapeutic gases
T42,"Poisoning by antiepileptic, sedative-hypnotic and antiparkinsonism drugs"
T420,Poisoning: Hydantoin derivatives
T421,Poisoning: Iminostilbenes
T422,Poisoning: Succinimides and oxazolidinediones
T423,Poisoning: Barbiturates
T424,Poisoning: Benzodiazepines
T425,"Poisoning: Mixed antiepileptics, not elsewhere classified"
T426,Poisoning: Other antiepileptic and sedative-hypnotic drugs
T427,"Poisoning: Antiepileptic and sedative-hypnotic drugs, unspecified"
T428,Poisoning: Antiparkinsonism drugs and other central muscle-tone depressants
T43,"Poisoning by psychotropic drugs, not elsewhere classified"
T430,Poisoning: Tricyclic and tetracyclic antidepressants
T431,Poisoning: Monoamine-oxidase-inhibitor antidepressants
T432,Poisoning: Other and unspecified antidepressants
T433,Poisoning: Phenothiazine antipsychotics and neuroleptics
T434,Poisoning: Butyrophenone and thioxanthene neuroleptics
T435,Poisoning: Other and unspecified antipsychotics and neuroleptics
T436,Poisoning: Psychostimulants with abuse potential
T438,"Poisoning: Other psychotropic drugs, not elsewhere classified"
T439,"Poisoning: Psychotropic drug, unspecified"
T44,Poisoning by drugs primarily affecting the autonomic nervous system
T440,Poisoning: Anticholinesterase agents
T441,Poisoning: Other parasympathomimetics [cholinergics]
T442,"Poisoning: Ganglionic blocking drugs, not elsewhere classified"
T443,"Poisoning: Other parasympatholytics [anticholinergics and antimuscarinics] and spasmolytics, not elsewhere classified"
T444,"Poisoning: Predominantly alpha-adrenoreceptor agonists, not elsewhere classified"
T445,"Poisoning: Predominantly beta-adrenoreceptor agonists, not elsewhere classified"
T446,"Poisoning: Alpha-adrenoreceptor antagonists, not elsewhere classified"
T447,"Poisoning: Beta-adrenoreceptor antagonists, not elsewhere classified"
T448,"Poisoning: Centrally acting and adrenergic-neuron-blocking agents, not elsewhere classified"
T449,Poisoning: Other and unspecified drugs primarily affecting the autonomic nervous system
T45,"Poisoning by primarily systemic and haematological agents, not elsewhere classified"
T450,Poisoning: Antiallergic and antiemetic drugs
T451,Poisoning: Antineoplastic and immunosuppressive drugs
T452,"Poisoning: Vitamins, not elsewhere classified"
T453,"Poisoning: Enzymes, not elsewhere classified"
T454,Poisoning: Iron and its compounds
T455,Poisoning: Anticoagulants
T456,Poisoning: Fibrinolysis-affecting drugs
T457,"Poisoning: Anticoagulant antagonists, vitamin K and other coagulants"
T458,Poisoning: Other primarily systemic and haematological agents
T459,"Poisoning: Primarily systemic and haematological agent, unspecified"
T46,Poisoning by agents primarily affecting the cardiovascular system
T460,Poisoning: Cardiac-stimulant glycosides and drugs of similar action
T461,Poisoning: Calcium-channel blockers
T462,"Poisoning: Other antidysrhythmic drugs, not elsewhere classified"
T463,"Poisoning: Coronary vasodilators, not elsewhere classified"
T464,Poisoning: Angiotensin-converting-enzyme inhibitors
T465,"Poisoning: Other antihypertensive drugs, not elsewhere classified"
T466,Poisoning: Antihyperlipidaemic and antiarteriosclerotic drugs
T467,Poisoning: Peripheral vasodilators
T468,"Poisoning: Antivaricose drugs, including sclerosing agents"
T469,Poisoning: Other and unspecified agents primarily affecting the cardiovascular system
T47,Poisoning by agents primarily affecting the gastrointestinal system
T470,Poisoning: Histamine H 2 -receptor antagonists
T471,Poisoning: Other antacids and anti-gastric-secretion drugs
T472,Poisoning: Stimulant laxatives
T473,Poisoning: Saline and osmotic laxatives
T474,Poisoning: Other laxatives
T475,Poisoning: Digestants
T476,Poisoning: Antidiarrhoeal drugs
T477,Poisoning: Emetics
T478,Poisoning: Other agents primarily affecting the gastrointestinal system
T479,"Poisoning: Agent primarily affecting the gastrointestinal system, unspecified"
T48,Poisoning by agents primarily acting on smooth and skeletal muscles and the respiratory system
T480,Poisoning: Oxytocic drugs
T481,Poisoning: Skeletal muscle relaxants [neuromuscular blocking agents]
T482,Poisoning: Other and unspecified agents primarily acting on muscles
T483,Poisoning: Antitussives
T484,Poisoning: Expectorants
T485,Poisoning: Anti-common-cold drugs
T486,"Poisoning: Antiasthmatics, not elsewhere classified"
T487,Poisoning: Other and unspecified agents primarily acting on the respiratory system
T49,"Poisoning by topical agents primarily affecting skin and mucous membrane and by ophthalmological, otorhinolaryngological and dental drugs"
T490,"Poisoning: Local antifungal, anti-infective and anti-inflammatory drugs, not elsewhere classified"
T491,Poisoning: Antipruritics
T492,Poisoning: Local astringents and local detergents
T493,"Poisoning: Emollients, demulcents and protectants"
T494,"Poisoning: Keratolytics, keratoplastics and other hair treatment drugs and preparations"
T495,Poisoning: Ophthalmological drugs and preparations
T496,Poisoning: Otorhinolaryngological drugs and preparations
T497,"Poisoning: Dental drugs, topically applied"
T498,Poisoning: Other topical agents
T499,"Poisoning: Topical agent, unspecified"
T50,"Poisoning by diuretics and other and unspecified drugs, medicaments and biological substances"
T500,Poisoning: Mineralocorticoids and their antagonists
T501,Poisoning: Loop [high-ceiling] diuretics
T502,"Poisoning: Carbonic-anhydrase inhibitors, benzothiadiazides and other diuretics"
T503,"Poisoning: Electrolytic, caloric and water-balance agents"
T504,Poisoning: Drugs affecting uric acid metabolism
T505,Poisoning: Appetite depressants
T506,"Poisoning: Antidotes and chelating agents, not elsewhere classified"
T507,Poisoning: Analeptics and opioid receptor antagonists
T508,Poisoning: Diagnostic agents
T509,"Poisoning: Other and unspecified drugs, medicaments and biological substances"
T51,Toxic effect of alcohol
T51-T65,Toxic effects of substances chiefly nonmedicinal as to source
T510,Toxic effect: Ethanol
T511,Toxic effect: Methanol
T512,Toxic effect: 2-Propanol
T513,Toxic effect: Fusel oil
T518,Toxic effect: Other alcohols
T519,"Toxic effect: Alcohol, unspecified"
T52,Toxic effect of organic solvents
T520,Toxic effect: Petroleum products
T521,Toxic effect: Benzene
T522,Toxic effect: Homologues of benzene
T523,Toxic effect: Glycols
T524,Toxic effect: Ketones
T528,Toxic effect: Other organic solvents
T529,"Toxic effect: Organic solvent, unspecified"
T53,Toxic effect of halogen derivatives of aliphatic and aromatic hydrocarbons
T530,Toxic effect: Carbon tetrachloride
T531,Toxic effect: Chloroform
T532,Toxic effect: Trichloroethylene
T533,Toxic effect: Tetrachloroethylene
T534,Toxic effect: Dichloromethane
T535,Toxic effect: Chlorofluorocarbons
T536,Toxic effect: Other halogen derivatives of aliphatic hydrocarbons
T537,Toxic effect: Other halogen derivatives of aromatic hydrocarbons
T539,"Toxic effect: Halogen derivative of aliphatic and aromatic hydrocarbons, unspecified"
T54,Toxic effect of corrosive substances
T540,Toxic effect: Phenol and phenol homologues
T541,Toxic effect: Other corrosive organic compounds
T542,Toxic effect: Corrosive acids and acid-like substances
T543,Toxic effect: Corrosive alkalis and alkali-like substances
T549,"Toxic effect: Corrosive substance, unspecified"
T55,Toxic effect of soaps and detergents
T56,Toxic effect of metals
T560,Toxic effect: Lead and its compounds
T561,Toxic effect: Mercury and its compounds
T562,Toxic effect: Chromium and its compounds
T563,Toxic effect: Cadmium and its compounds
T564,Toxic effect: Copper and its compounds
T565,Toxic effect: Zinc and its compounds
T566,Toxic effect: Tin and its compounds
T567,Toxic effect: Beryllium and its compounds
T568,Toxic effect: Other metals
T569,"Toxic effect: Metal, unspecified"
T57,Toxic effect of other inorganic substances
T570,Toxic effect: Arsenic and its compounds
T571,Toxic effect: Phosphorus and its compounds
T572,Toxic effect: Manganese and its compounds
T573,Toxic effect: Hydrogen cyanide
T578,Toxic effect: Other specified inorganic substances
T579,"Toxic effect: Inorganic substance, unspecified"
T58,Toxic effect of carbon monoxide
T59,"Toxic effect of other gases, fumes and vapours"
T590,Toxic effect: Nitrogen oxides
T591,Toxic effect: Sulfur dioxide
T592,Toxic effect: Formaldehyde
T593,Toxic effect: Lacrimogenic gas
T594,Toxic effect: Chlorine gas
T595,Toxic effect: Fluorine gas and hydrogen fluoride
T596,Toxic effect: Hydrogen sulfide
T597,Toxic effect: Carbon dioxide
T598,"Toxic effect: Other specified gases, fumes and vapours"
T599,"Toxic effect: Gases, fumes and vapours, unspecified"
T60,Toxic effect of pesticides
T600,Toxic effect: Organophosphate and carbamate insecticides
T601,Toxic effect: Halogenated insecticides
T602,Toxic effect: Other and unspecified insecticides
T603,Toxic effect: Herbicides and fungicides
T604,Toxic effect: Rodenticides
T608,Toxic effect: Other pesticides
T609,"Toxic effect: Pesticide, unspecified"
T61,Toxic effect of noxious substances eaten as seafood
T610,Toxic effect: Ciguatera fish poisoning
T611,Toxic effect: Scombroid fish poisoning
T612,Toxic effect: Other fish and shellfish poisoning
T618,Toxic effect: Toxic effect of other seafoods
T619,Toxic effect: Toxic effect of unspecified seafood
T62,Toxic effect of other noxious substances eaten as food
T620,Toxic effect: Ingested mushrooms
T621,Toxic effect: Ingested berries
T622,Toxic effect: Other ingested (parts of) plant(s)
T628,Toxic effect: Other specified noxious substances eaten as food
T629,"Toxic effect: Noxious substance eaten as food, unspecified"
T63,Toxic effect of contact with venomous animals
T630,Toxic effect: Snake venom
T631,Toxic effect: Venom of other reptiles
T632,Toxic effect: Venom of scorpion
T633,Toxic effect: Venom of spider
T634,Toxic effect: Venom of other arthropods
T635,Toxic effect: Toxic effect of contact with fish
T636,Toxic effect: Toxic effect of contact with other marine animals
T638,Toxic effect: Toxic effect of contact with other venomous animals
T639,Toxic effect: Toxic effect of contact with unspecified venomous animal
T64,Toxic effect of aflatoxin and other mycotoxin food contaminants
T65,Toxic effect of other and unspecified substances
T650,Toxic effect: Cyanides
T651,Toxic effect: Strychnine and its salts
T652,Toxic effect: Tobacco and nicotine
T653,Toxic effect: Nitroderivatives and aminoderivatives of benzene and its homologues
T654,Toxic effect: Carbon disulfide
T655,Toxic effect: Nitroglycerin and other nitric acids and esters
T656,"Toxic effect: Paints and dyes, not elsewhere classified"
T658,Toxic effect: Toxic effect of other specified substances
T659,Toxic effect: Toxic effect of unspecified substance
T66,Unspecified effects of radiation
T66-T78,Other and unspecified effects of external causes
T67,Effects of heat and light
T670,Heatstroke and sunstroke
T671,Heat syncope
T672,Heat cramp
T673,"Heat exhaustion, anhydrotic"
T674,Heat exhaustion due to salt depletion
T675,"Heat exhaustion, unspecified"
T676,"Heat fatigue, transient"
T677,Heat oedema
T678,Other effects of heat and light
T679,"Effect of heat and light, unspecified"
T68,Hypothermia
T69,Other effects of reduced temperature
T690,Immersion hand and foot
T691,Chilblains
T698,Other specified effects of reduced temperature
T699,"Effect of reduced temperature, unspecified"
T70,Effects of air pressure and water pressure
T700,Otitic barotrauma
T701,Sinus barotrauma
T702,Other and unspecified effects of high altitude
T703,Caisson disease [decompression sickness]
T704,Effects of high-pressure fluids
T708,Other effects of air pressure and water pressure
T709,"Effect of air pressure and water pressure, unspecified"
T71,Asphyxiation
T73,Effects of other deprivation
T730,Effects of hunger
T731,Effects of thirst
T732,Exhaustion due to exposure
T733,Exhaustion due to excessive exertion
T738,Other effects of deprivation
T739,"Effect of deprivation, unspecified"
T74,Maltreatment syndromes
T740,Neglect or abandonment
T741,Physical abuse
T742,Sexual abuse
T743,Psychological abuse
T748,Other maltreatment syndromes
T749,"Maltreatment syndrome, unspecified"
T75,Effects of other external causes
T750,Effects of lightning
T751,Drowning and nonfatal submersion
T752,Effects of vibration
T753,Motion sickness
T754,Effects of electric current
T758,Other specified effects of other external causes
T76,Unspecified effects of external causes
T78,"Adverse effects, not elsewhere classified"
T780,Anaphylactic shock due to adverse food reaction
T781,"Other adverse food reactions, not elsewhere classified"
T782,"Anaphylactic shock, unspecified"
T783,Angioneurotic oedema
T784,"Allergy, unspecified"
T788,"Other adverse effects, not elsewhere classified"
T789,"Adverse effect, unspecified"
T79,"Certain early complications of trauma, not elsewhere classified"
T79-T79,Certain early complications of trauma
T790,Air embolism (traumatic)
T791,Fat embolism (traumatic)
T792,Traumatic secondary and recurrent haemorrhage
T793,"Post-traumatic wound infection, not elsewhere classified"
T794,Traumatic shock
T795,Traumatic anuria
T796,Traumatic ischaemia of muscle
T797,Traumatic subcutaneous emphysema
T798,Other early complications of trauma
T799,Unspecified early complication of trauma
T80,"Complications following infusion, transfusion and therapeutic injection"
T80-T88,"Complications of surgical and medical care, not elsewhere classified"
T800,"Air embolism following infusion, transfusion and therapeutic injection"
T801,"Vascular complications following infusion, transfusion and therapeutic injection"
T802,"Infections following infusion, transfusion and therapeutic injection"
T803,ABO incompatibility reaction
T804,Rh incompatibility reaction
T805,Anaphylactic shock due to serum
T806,Other serum reactions
T808,"Other complications following infusion, transfusion and therapeutic injection"
T809,"Unspecified complication following infusion, transfusion and therapeutic injection"
T81,"Complications of procedures, not elsewhere classified"
T810,"Haemorrhage and haematoma complicating a procedure, not elsewhere classified"
T811,"Shock during or resulting from a procedure, not elsewhere classified"
T812,"Accidental puncture and laceration during a procedure, not elsewhere classified"
T813,"Disruption of operation wound, not elsewhere classified"
T814,"Infection following a procedure, not elsewhere classified"
T815,Foreign body accidentally left in body cavity or operation wound following a procedure
T816,Acute reaction to foreign substance accidentally left during a procedure
T817,"Vascular complications following a procedure, not elsewhere classified"
T818,"Other complications of procedures, not elsewhere classified"
T819,Unspecified complication of procedure
T82,"Complications of cardiac and vascular prosthetic devices, implants and grafts"
T820,Mechanical complication of heart valve prosthesis
T821,Mechanical complication of cardiac electronic device
T822,Mechanical complication of coronary artery bypass and valve grafts
T823,Mechanical complication of other vascular grafts
T824,Mechanical complication of vascular dialysis catheter
T825,Mechanical complication of other cardiac and vascular devices and implants
T826,Infection and inflammatory reaction due to cardiac valve prosthesis
T827,"Infection and inflammatory reaction due to other cardiac and vascular devices, implants and grafts"
T828,"Other specified complications of cardiac and vascular prosthetic devices, implants and grafts"
T829,"Unspecified complication of cardiac and vascular prosthetic device, implant and graft"
T83,"Complications of genitourinary prosthetic devices, implants and grafts"
T830,Mechanical complication of urinary (indwelling) catheter
T831,Mechanical complication of other urinary devices and implants
T832,Mechanical complication of graft of urinary organ
T833,Mechanical complication of intrauterine contraceptive device
T834,"Mechanical complication of other prosthetic devices, implants and grafts in genital tract"
T835,"Infection and inflammatory reaction due to prosthetic device, implant and graft in urinary system"
T836,"Infection and inflammatory reaction due to prosthetic device, implant and graft in genital tract"
T838,"Other complications of genitourinary prosthetic devices, implants and grafts"
T839,"Unspecified complication of genitourinary prosthetic device, implant and graft"
T84,"Complications of internal orthopaedic prosthetic devices, implants and grafts"
T840,Mechanical complication of internal joint prosthesis
T841,Mechanical complication of internal fixation device of bones of limb
T842,Mechanical complication of internal fixation device of other bones
T843,"Mechanical complication of other bone devices, implants and grafts"
T844,"Mechanical complication of other internal orthopaedic devices, implants and grafts"
T845,Infection and inflammatory reaction due to internal joint prosthesis
T846,Infection and inflammatory reaction due to internal fixation device [any site]
T847,"Infection and inflammatory reaction due to other internal orthopaedic prosthetic devices, implants and grafts"
T848,"Other complications of internal orthopaedic prosthetic devices, implants and grafts"
T849,"Unspecified complication of internal orthopaedic prosthetic device, implant and graft"
T85,"Complications of other internal prosthetic devices, implants and grafts"
T850,Mechanical complication of ventricular intracranial (communicating) shunt
T851,Mechanical complication of implanted electronic stimulator of nervous system
T852,Mechanical complication of intraocular lens
T853,"Mechanical complication of other ocular prosthetic devices, implants and grafts"
T854,Mechanical complication of breast prosthesis and implant
T855,"Mechanical complication of gastrointestinal prosthetic devices, implants and grafts"
T856,"Mechanical complication of other specified internal prosthetic devices, implants and grafts"
T857,"Infection and inflammatory reaction due to other internal prosthetic devices, implants and grafts"
T858,"Other complications of internal prosthetic devices, implants and grafts, not elsewhere classified"
T859,"Unspecified complication of internal prosthetic device, implant and graft"
T86,Failure and rejection of transplanted organs and tissues
T860,Bone-marrow transplant rejection
T861,Kidney transplant failure and rejection
T862,Heart transplant failure and rejection
T863,Heart-lung transplant failure and rejection
T864,Liver transplant failure and rejection
T868,Failure and rejection of other transplanted organs and tissues
T869,Failure and rejection of unspecified transplanted organ and tissue
T87,Complications peculiar to reattachment and amputation
T870,Complications of reattached (part of) upper extremity
T871,Complications of reattached (part of) lower extremity
T872,Complications of other reattached body part
T873,Neuroma of amputation stump
T874,Infection of amputation stump
T875,Necrosis of amputation stump
T876,Other and unspecified complications of amputation stump
T88,"Other complications of surgical and medical care, not elsewhere classified"
T880,Infection following immunization
T881,"Other complications following immunization, not elsewhere classified"
T882,Shock due to anaesthesia
T883,Malignant hyperthermia due to anaesthesia
T884,Failed or difficult intubation
T885,Other complications of anaesthesia
T886,Anaphylactic shock due to adverse effect of correct drug or medicament properly administered
T887,Unspecified adverse effect of drug or medicament
T888,"Other specified complications of surgical and medical care, not elsewhere classified"
T889,"Complication of surgical and medical care, unspecified"
T90,Sequelae of injuries of head
T90-T98,"Sequelae of injuries, of poisoning and of other consequences of external causes"
T900,Sequelae of superficial injury of head
T901,Sequelae of open wound of head
T902,Sequelae of fracture of skull and facial bones
T903,Sequelae of injury of cranial nerves
T904,Sequelae of injury of eye and orbit
T905,Sequelae of intracranial injury
T908,Sequelae of other specified injuries of head
T909,Sequelae of unspecified injury of head
T91,Sequelae of injuries of neck and trunk
T910,Sequelae of superficial injury and open wound of neck and trunk
T911,Sequelae of fracture of spine
T912,Sequelae of other fracture of thorax and pelvis
T913,Sequelae of injury of spinal cord
T914,Sequelae of injury of intrathoracic organs
T915,Sequelae of injury of intra-abdominal and pelvic organs
T918,Sequelae of other specified injuries of neck and trunk
T919,Sequelae of unspecified injury of neck and trunk
T92,Sequelae of injuries of upper limb
T920,Sequelae of open wound of upper limb
T921,Sequelae of fracture of arm
T922,Sequelae of fracture at wrist and hand level
T923,"Sequelae of dislocation, sprain and strain of upper limb"
T924,Sequelae of injury of nerve of upper limb
T925,Sequelae of injury of muscle and tendon of upper limb
T926,Sequelae of crushing injury and traumatic amputation of upper limb
T928,Sequelae of other specified injuries of upper limb
T929,Sequelae of unspecified injury of upper limb
T93,Sequelae of injuries of lower limb
T930,Sequelae of open wound of lower limb
T931,Sequelae of fracture of femur
T932,Sequelae of other fractures of lower limb
T933,"Sequelae of dislocation, sprain and strain of lower limb"
T934,Sequelae of injury of nerve of lower limb
T935,Sequelae of injury of muscle and tendon of lower limb
T936,Sequelae of crushing injury and traumatic amputation of lower limb
T938,Sequelae of other specified injuries of lower limb
T939,Sequelae of unspecified injury of lower limb
T94,Sequelae of injuries involving multiple and unspecified body regions
T940,Sequelae of injuries involving multiple body regions
T941,"Sequelae of injuries, not specified by body region"
T95,"Sequelae of burns, corrosions and frostbite"
T950,"Sequelae of burn, corrosion and frostbite of head and neck"
T951,"Sequelae of burn, corrosion and frostbite of trunk"
T952,"Sequelae of burn, corrosion and frostbite of upper limb"
T953,"Sequelae of burn, corrosion and frostbite of lower limb"
T954,Sequelae of burn and corrosion classifiable only according to extent of body surface involved
T958,"Sequelae of other specified burn, corrosion and frostbite"
T959,"Sequelae of unspecified burn, corrosion and frostbite"
T96,"Sequelae of poisoning by drugs, medicaments and biological substances"
T97,Sequelae of toxic effects of substances chiefly nonmedicinal as to source
T98,Sequelae of other and unspecified effects of external causes
T980,Sequelae of effects of foreign body entering through natural orifice
T981,Sequelae of other and unspecified effects of external causes
T982,Sequelae of certain early complications of trauma
T983,"Sequelae of complications of surgical and medical care, not elsewhere classified"
XIX,"Injury, poisoning and certain other consequences of external causes"
