Code,Term
L183,Emergency replacement of aneurysmal segment of suprarenal abdominal aorta by anastomosis of aorta to aorta
L193,Replacement of aneurysmal segment of suprarenal abdominal aorta by anastomosis of aorta to aorta NEC
L203,Emergency bypass of segment of suprarenal abdominal aorta by anastomosis of aorta to aorta NEC
L213,Bypass of segment of suprarenal abdominal aorta by anastomosis of aorta to aorta NEC
L424,Operations on aneurysm of renal artery
L464,Operations on aneurysm of visceral branch of abdominal aorta NEC
