code,term
Q101,Dilation of cervix uteri and curettage of products of conception from uterus
Q102,Curettage of products of conception from uterus NEC
Q111,Vacuum aspiration of products of conception from uterus NEC
Q112,Dilation of cervix uteri and evacuation of products of conception from uterus NEC
Q113,Evacuation of products of conception from uterus NEC
Q115,Vacuum aspiration of products of conception from uterus using rigid cannula
Q116,Vacuum aspiration of products of conception from uterus using flexible cannula
Q118,Other specified other evacuation of contents of uterus
Q119,Unspecified other evacuation of contents of uterus
