code,term
T840,Mechanical complication of internal joint prosthesis
T841,Mechanical complication of internal fixation device of bones of limb
T842,Mechanical complication of internal fixation device of other bones
T843,Mechanical complication of other bone devices, implants and grafts
T844,Mechanical complication of other internal orthopaedic devices, implants and grafts
T848,Other complications of internal orthopaedic prosthetic devices, implants and grafts
T849,Unspecified complication of internal orthopaedic prosthetic device, implant and graft
