code,term
S663,Injury of extensor muscle and tendon of other finger at wrist and hand level
S664,Injury of intrinsic muscle and tendon of thumb at wrist and hand level
S665,Injury of intrinsic muscle and tendon of other finger at wrist and hand level
S666,Injury of multiple flexor muscles and tendons at wrist and hand level
S667,Injury of multiple extensor muscles and tendons at wrist and hand level
S668,Injury of other muscles and tendons at wrist and hand level
S669,Injury of unspecified muscle and tendon at wrist and hand level
S670,Crushing injury of thumb and other finger(s)
S678,Crushing injury of other and unspecified parts of wrist and hand
S680,Traumatic amputation of thumb (complete)(partial)
S681,Traumatic amputation of other single finger (complete)(partial)
S682,Traumatic amputation of two or more fingers alone (complete)(partial)
S683,Combined traumatic amputation of (part of) finger(s) with other parts of wrist and hand
S684,Traumatic amputation of hand at wrist level
S688,Traumatic amputation of other parts of wrist and hand
S689,Traumatic amputation of wrist and hand, level unspecified
S697,Multiple injuries of wrist and hand
S698,Other specified injuries of wrist and hand
S699,Unspecified injury of wrist and hand
S710,Open wound of hip
S711,Open wound of thigh
S717,Multiple open wounds of hip and thigh
S718,Open wound of other and unspecified parts of pelvic girdle
S720,Fracture of neck of femur
S7200,Fracture of neck of femur: closed
S7201,Fracture of neck of femur: open
S721,Pertrochanteric fracture
S7210,Pertrochanteric fracture: closed
S7211,Pertrochanteric fracture: open
S722,Subtrochanteric fracture
S7220,Subtrochanteric fracture: closed
S7221,Subtrochanteric fracture: open
S723,Fracture of shaft of femur
S7230,Fracture of shaft of femur: closed
S7231,Fracture of shaft of femur: open
S724,Fracture of lower end of femur
S7240,Fracture of lower end of femur: closed
S7241,Fracture of lower end of femur: open
S727,Multiple fractures of femur
S7270,Multiple fractures of femur: closed
S7271,Multiple fractures of femur: open
S728,Fractures of other parts of femur
S7280,Fractures of other parts of femur: closed
S7281,Fractures of other parts of femur: open
S729,Fracture of femur, part unspecified
S7290,Fracture of femur, part unspecified: closed
S7291,Fracture of femur, part unspecified: open
S730,Dislocation of hip
S731,Sprain and strain of hip
S740,Injury of sciatic nerve at hip and thigh level
S741,Injury of femoral nerve at hip and thigh level
S742,Injury of cutaneous sensory nerve at hip and thigh level
S747,Injury of multiple nerves at hip and thigh level
S748,Injury of other nerves at hip and thigh level
S749,Injury of unspecified nerve at hip and thigh level
S750,Injury of femoral artery
S751,Injury of femoral vein at hip and thigh level
S752,Injury of greater saphenous vein at hip and thigh level
S757,Injury of multiple blood vessels at hip and thigh level
S758,Injury of other blood vessels at hip and thigh level
S759,Injury of unspecified blood vessel at hip and thigh level
S760,Injury of muscle and tendon of hip
S761,Injury of quadriceps muscle and tendon
S762,Injury of adductor muscle and tendon of thigh
S763,Injury of muscle and tendon of the posterior muscle group at thigh level
S764,Injury of other and unspecified muscles and tendons at thigh level
S767,Injury of multiple muscles and tendons at hip and thigh level
S770,Crushing injury of hip
S771,Crushing injury of thigh
S772,Crushing injury of hip with thigh
S780,Traumatic amputation at hip joint
S781,Traumatic amputation at level between hip and knee
S789,Traumatic amputation of hip and thigh, level unspecified
S797,Multiple injuries of hip and thigh
S798,Other specified injuries of hip and thigh
S799,Unspecified injury of hip and thigh
S810,Open wound of knee
S817,Multiple open wounds of lower leg
S818,Open wound of other parts of lower leg
S819,Open wound of lower leg, part unspecified
S820,Fracture of patella
S8200,Fracture of patella: closed
S8201,Fracture of patella: open
S821,Fracture of upper end of tibia
S8210,Fracture of upper end of tibia: closed
S8211,Fracture of upper end of tibia: open
S822,Fracture of shaft of tibia
S8220,Fracture of shaft of tibia: closed
S8221,Fracture of shaft of tibia: open
S823,Fracture of lower end of tibia
S8230,Fracture of lower end of tibia: closed
S8231,Fracture of lower end of tibia: open
S824,Fracture of fibula alone
S8240,Fracture of fibula alone: closed
S8241,Fracture of fibula alone: open
S825,Fracture of medial malleolus
S8250,Fracture of medial malleolus: closed
S8251,Fracture of medial malleolus: open
S826,Fracture of lateral malleolus
S8260,Fracture of lateral malleolus: closed
S8261,Fracture of lateral malleolus: open
S827,Multiple fractures of lower leg
S8270,Multiple fractures of lower leg: closed
S8271,Multiple fractures of lower leg: open
S828,Fractures of other parts of lower leg
S8280,Fractures of other parts of lower leg: closed
S8281,Fractures of other parts of lower leg: open
S829,Fracture of lower leg, part unspecified
S8290,Fracture of lower leg, part unspecified: closed
S8291,Fracture of lower leg, part unspecified: open
S830,Dislocation of patella
S831,Dislocation of knee
S832,Tear of meniscus, current
S833,Tear of articular cartilage of knee, current
S834,Sprain and strain involving (fibular)(tibial) collateral ligament of knee
S835,Sprain and strain involving (anterior)(posterior) cruciate ligament of knee
S836,Sprain and strain of other and unspecified parts of knee
S837,Injury to multiple structures of knee
S840,Injury of tibial nerve at lower leg level
S841,Injury of peroneal nerve at lower leg level
S842,Injury of cutaneous sensory nerve at lower leg level
S847,Injury of multiple nerves at lower leg level
S848,Injury of other nerves at lower leg level
S849,Injury of unspecified nerve at lower leg level
S850,Injury of popliteal artery
S851,Injury of (anterior)(posterior) tibial artery
S852,Injury of peroneal artery
S853,Injury of greater saphenous vein at lower leg level
S854,Injury of lesser saphenous vein at lower leg level
S855,Injury of popliteal vein
S857,Injury of multiple blood vessels at lower leg level
S858,Injury of other blood vessels at lower leg level
S859,Injury of unspecified blood vessel at lower leg level
S860,Injury of Achilles tendon
S861,Injury of other muscle(s) and tendon(s) of posterior muscle group at lower leg level
S862,Injury of muscle(s) and tendon(s) of anterior muscle group at lower leg level
S863,Injury of muscle(s) and tendon(s) of peroneal muscle group at lower leg level
S867,Injury of multiple muscles and tendons at lower leg level
S868,Injury of other muscles and tendons at lower leg level
S869,Injury of unspecified muscle and tendon at lower leg level
S870,Crushing injury of knee
S878,Crushing injury of other and unspecified parts of lower leg
S880,Traumatic amputation at knee level
S881,Traumatic amputation at level between knee and ankle
S889,Traumatic amputation of lower leg, level unspecified
S897,Multiple injuries of lower leg
S898,Other specified injuries of lower leg
S899,Unspecified injury of lower leg
S910,Open wound of ankle
S911,Open wound of toe(s) without damage to nail
S912,Open wound of toe(s) with damage to nail
S913,Open wound of other parts of foot
S917,Multiple open wounds of ankle and foot
S920,Fracture of calcaneus
S9200,Fracture of calcaneus: closed
S9201,Fracture of calcaneus: open
S921,Fracture of talus
S9210,Fracture of talus: closed
S9211,Fracture of talus: open
S922,Fracture of other tarsal bone(s)
S9220,Fracture of other tarsal bone(s): closed
S9221,Fracture of other tarsal bone(s): open
S923,Fracture of metatarsal bone
S9230,Fracture of metatarsal bone: closed
S9231,Fracture of metatarsal bone: open
S924,Fracture of great toe
S9240,Fracture of great toe: closed
S9241,Fracture of great toe: open
S925,Fracture of other toe
S9250,Fracture of other toe: closed
S9251,Fracture of other toe: open
S927,Multiple fractures of foot
S9270,Multiple fractures of foot: closed
S9271,Multiple fractures of foot: open
S929,Fracture of foot, unspecified
S9290,Fracture of foot, unspecified: closed
S9291,Fracture of foot, unspecified: open
S930,Dislocation of ankle joint
S931,Dislocation of toe(s)
S932,Rupture of ligaments at ankle and foot level
S933,Dislocation of other and unspecified parts of foot
S934,Sprain and strain of ankle
S935,Sprain and strain of toe(s)
S936,Sprain and strain of other and unspecified parts of foot
S940,Injury of lateral plantar nerve
S941,Injury of medial plantar nerve
S942,Injury of deep peroneal nerve at ankle and foot level
S943,Injury of cutaneous sensory nerve at ankle and foot level
S947,Injury of multiple nerves at ankle and foot level
S948,Injury of other nerves at ankle and foot level
S949,Injury of unspecified nerve at ankle and foot level
S950,Injury of dorsal artery of foot
S951,Injury of plantar artery of foot
S952,Injury of dorsal vein of foot
S957,Injury of multiple blood vessels at ankle and foot level
S958,Injury of other blood vessels at ankle and foot level
S959,Injury of unspecified blood vessel at ankle and foot level
S960,Injury of muscle and tendon of long flexor muscle of toe at ankle and foot level
S961,Injury of muscle and tendon of long extensor muscle of toe at ankle and foot level
S962,Injury of intrinsic muscle and tendon at ankle and foot level
S967,Injury of multiple muscles and tendons at ankle and foot level
S968,Injury of other muscles and tendons at ankle and foot level
S969,Injury of unspecified muscle and tendon at ankle and foot level
S970,Crushing injury of ankle
S971,Crushing injury of toe(s)
S978,Crushing injury of other parts of ankle and foot
S980,Traumatic amputation of foot at ankle level
S981,Traumatic amputation of one toe
S982,Traumatic amputation of two or more toes
S983,Traumatic amputation of other parts of foot
S984,Traumatic amputation of foot, level unspecified
S997,Multiple injuries of ankle and foot
S998,Other specified injuries of ankle and foot
S999,Unspecified injury of ankle and foot
T010,Open wounds involving head with neck
T012,Open wounds involving multiple regions of upper limb(s)
T013,Open wounds involving multiple regions of lower limb(s)
T016,Open wounds involving multiple regions of upper limb(s) with lower limb(s)
T020,Fractures involving head with neck
T0200,Fractures involving head with neck: closed
T0201,Fractures involving head with neck: open
T021,Fractures involving thorax with lower back and pelvis
T0210,Fractures involving thorax with lower back and pelvis: closed
T0211,Fractures involving thorax with lower back and pelvis: open
T022,Fractures involving multiple regions of one upper limb
T0220,Fractures involving multiple regions of one upper limb: closed
T0221,Fractures involving multiple regions of one upper limb: open
T023,Fractures involving multiple regions of one lower limb
T0230,Fractures involving multiple regions of one lower limb: closed
T0231,Fractures involving multiple regions of one lower limb: open
T024,Fractures involving multiple regions of both upper limbs
T0240,Fractures involving multiple regions of both upper limbs: closed
T0241,Fractures involving multiple regions of both upper limbs: open
T025,Fractures involving multiple regions of both lower limbs
T0250,Fractures involving multiple regions of both lower limbs: closed
T0251,Fractures involving multiple regions of both lower limbs: open
T026,Fractures involving multiple regions of upper limb(s) with lower limb(s)
T0260,Fractures involving multiple regions of upper limb(s) with lower limb(s): closed
T0261,Fractures involving multiple regions of upper limb(s) with lower limb(s): open
T027,Fractures involving thorax with lower back and pelvis with limb(s)
T0270,Fractures involving thorax with lower back and pelvis with limb(s): closed
T0271,Fractures involving thorax with lower back and pelvis with limb(s): open
T030,Dislocations, sprains and strains involving head with neck
T031,Dislocations, sprains and strains involving thorax with lower back and pelvis
T032,Dislocations, sprains and strains involving multiple regions of upper limb(s)
T033,Dislocations, sprains and strains involving multiple regions of lower limb(s)
T034,Dislocations, sprains and strains involving multiple regions of upper limb(s) with lower limb(s)
T040,Crushing injuries involving head with neck
T041,Crushing injuries involving thorax with abdomen, lower back and pelvis
T042,Crushing injuries involving multiple regions of upper limb(s)
T043,Crushing injuries involving multiple regions of lower limb(s)
T044,Crushing injuries involving multiple regions of upper limb(s) with lower limb(s)
T047,Crushing injuries of thorax with abdomen, lower back and pelvis with limb(s)
T050,Traumatic amputation of both hands
T051,Traumatic amputation of one hand and other arm [any level, except hand]
T052,Traumatic amputation of both arms [any level]
T053,Traumatic amputation of both feet
T054,Traumatic amputation of one foot and other leg [any level, except foot]
T055,Traumatic amputation of both legs [any level]
T056,Traumatic amputation of upper and lower limbs, any combination [any level]
T060,Injuries of brain and cranial nerves with injuries of nerves and spinal cord at neck level
T061,Injuries of nerves and spinal cord involving other multiple body regions
T062,Injuries of nerves involving multiple body regions
T065,Injuries of intrathoracic organs with intra-abdominal and pelvic organs
T091,Open wound of trunk, level unspecified
T092,Dislocation, sprain and strain of unspecified joint and ligament of trunk
T093,Injury of spinal cord, level unspecified
T094,Injury of unspecified nerve, spinal nerve root and plexus of trunk
T095,Injury of unspecified muscle and tendon of trunk
T098,Other specified injuries of trunk, level unspecified
T099,Unspecified injury of trunk, level unspecified
T10X,Fracture of upper limb, level unspecified
T10X0,Fracture of upper limb, level unspecified: closed
T10X1,Fracture of upper limb, level unspecified: open
T111,Open wound of upper limb, level unspecified
T112,Dislocation, sprain and strain of unspecified joint and ligament of upper limb, level unspecified
T113,Injury of unspecified nerve of upper limb, level unspecified
T114,Injury of unspecified blood vessel of upper limb, level unspecified
T115,Injury of unspecified muscle and tendon of upper limb, level unspecified
T116,Traumatic amputation of upper limb, level unspecified
T118,Other specified injuries of upper limb, level unspecified
T119,Unspecified injury of upper limb, level unspecified
T12X,Fracture of lower limb, level unspecified
T12X0,Fracture of lower limb, level unspecified: closed
T12X1,Fracture of lower limb, level unspecified: open
T131,Open wound of lower limb, level unspecified
T132,Dislocation, sprain and strain of unspecified joint and ligament of lower limb, level unspecified
T133,Injury of unspecified nerve of lower limb, level unspecified
T134,Injury of unspecified blood vessel of lower limb, level unspecified
T135,Injury of unspecified muscle and tendon of lower limb, level unspecified
T136,Traumatic amputation of lower limb, level unspecified
T138,Other specified injuries of lower limb, level unspecified
T139,Unspecified injury of lower limb, level unspecified
T790,Air embolism (traumatic)
T791,Fat embolism (traumatic)
T792,Traumatic secondary and recurrent haemorrhage
T793,Post-traumatic wound infection, not elsewhere classified
T794,Traumatic shock
T795,Traumatic anuria
T796,Traumatic ischaemia of muscle
T797,Traumatic subcutaneous emphysema
T798,Other early complications of trauma
T799,Unspecified early complication of trauma
T800,Air embolism following infusion, transfusion and therapeutic injection
