code,term
T802,Infections following infusion, transfusion and therapeutic injection
T806,Other serum reactions
T809,Unspecified complication following infusion, transfusion and therapeutic injection
T810,Haemorrhage and haematoma complicating a procedure, not elsewhere classified
T811,Shock during or resulting from a procedure, not elsewhere classified
T812,Accidental puncture and laceration during a procedure, not elsewhere classified
T813,Disruption of operation wound, not elsewhere classified
T814,Infection following a procedure, not elsewhere classified
T815,Foreign body accidentally left in body cavity or operation wound following a procedure
T816,Acute reaction to foreign substance accidentally left during a procedure
T818,Other complications of procedures, not elsewhere classified
T819,Unspecified complication of procedure
T856,Mechanical complication of other specified internal prosthetic devices, implants and grafts
T857,Infection and inflammatory reaction due to other internal prosthetic devices, implants and grafts
T858,Other complications of internal prosthetic devices, implants and grafts, not elsewhere classified
T859,Unspecified complication of internal prosthetic device, implant and graft
T880,Infection following immunization
T881,Other complications following immunization, not elsewhere classified
T882,Shock due to anaesthesia
T883,Malignant hyperthermia due to anaesthesia
T884,Failed or difficult intubation
T885,Other complications of anaesthesia
T888,Other specified complications of surgical and medical care, not elsewhere classified
T889,Complication of surgical and medical care, unspecified
