code,term
S010,Open wound of scalp
S011,Open wound of eyelid and periocular area
S012,Open wound of nose
S013,Open wound of ear
S014,Open wound of cheek and temporomandibular area
S015,Open wound of lip and oral cavity
S017,Multiple open wounds of head
S018,Open wound of other parts of head
S019,Open wound of head, part unspecified
S020,Fracture of vault of skull
S0200,Fracture of vault of skull: closed
S0201,Fracture of vault of skull: open
S021,Fracture of base of skull
S0210,Fracture of base of skull: closed
S0211,Fracture of base of skull: open
S023,Fracture of orbital floor
S0231,Fracture of orbital floor: open
S024,Fracture of malar and maxillary bones
S0240,Fracture of malar and maxillary bones: closed
S0241,Fracture of malar and maxillary bones: open
S025,Fracture of tooth
S0250,Fracture of tooth: closed
S0251,Fracture of tooth: open
S026,Fracture of mandible
S0260,Fracture of mandible: closed
S0261,Fracture of mandible: open
S027,Multiple fractures involving skull and facial bones
S0270,Multiple fractures involving skull and facial bones: closed
S0271,Multiple fractures involving skull and facial bones: open
S028,Fractures of other skull and facial bones
S0280,Fractures of other skull and facial bones: closed
S0281,Fractures of other skull and facial bones: open
S029,Fracture of skull and facial bones, part unspecified
S0290,Fracture of skull and facial bones, part unspecified: closed
S0291,Fracture of skull and facial bones, part unspecified: open
S030,Dislocation of jaw
S032,Dislocation of tooth
S033,Dislocation of other and unspecified parts of head
S034,Sprain and strain of jaw
S035,Sprain and strain of joints and ligaments of other and unspecified parts of head
S040,Injury of optic nerve and pathways
S041,Injury of oculomotor nerve
S042,Injury of trochlear nerve
S043,Injury of trigeminal nerve
S044,Injury of abducent nerve
S045,Injury of facial nerve
S046,Injury of acoustic nerve
S047,Injury of accessory nerve
S048,Injury of other cranial nerves
S049,Injury of unspecified cranial nerve
S050,Injury of conjunctiva and corneal abrasion without mention of foreign body
S051,Contusion of eyeball and orbital tissues
S052,Ocular laceration and rupture with prolapse or loss of intraocular tissue
S053,Ocular laceration without prolapse or loss of intraocular tissue
S054,Penetrating wound of orbit with or without foreign body
S055,Penetrating wound of eyeball with foreign body
S056,Penetrating wound of eyeball without foreign body
S057,Avulsion of eye
S058,Other injuries of eye and orbit
S059,Injury of eye and orbit, unspecified
S060,Concussion
S0600,Concussion: without open intracranial wound
S0601,Concussion: with open intracranial wound
S061,Traumatic cerebral oedema
S0610,Traumatic cerebral oedema: without open intracranial wound
S0611,Traumatic cerebral oedema: with open intracranial wound
S062,Diffuse brain injury
S0620,Diffuse brain injury: without open intracranial wound
S0621,Diffuse brain injury: with open intracranial wound
S063,Focal brain injury
S0630,Focal brain injury: without open intracranial wound
S0631,Focal brain injury: with open intracranial wound
S064,Epidural haemorrhage
S0640,Epidural haemorrhage: without open intracranial wound
S0641,Epidural haemorrhage: with open intracranial wound
S065,Traumatic subdural haemorrhage
S0650,Traumatic subdural haemorrhage: without open intracranial wound
S0651,Traumatic subdural haemorrhage: with open intracranial wound
S066,Traumatic subarachnoid haemorrhage
S0660,Traumatic subarachnoid haemorrhage: without open intracranial wound
S0661,Traumatic subarachnoid haemorrhage: with open intracranial wound
S067,Intracranial injury with prolonged coma
S0670,Intracranial injury with prolonged coma: without open intracranial wound
S0671,Intracranial injury with prolonged coma: with open intracranial wound
S068,Other intracranial injuries
S0680,Other intracranial injuries: without open intracranial wound
S0681,Other intracranial injuries: with open intracranial wound
S069,Intracranial injury, unspecified
S0690,Intracranial injury, unspecified: without open intracranial wound
S0691,Intracranial injury, unspecified: with open intracranial wound
S070,Crushing injury of face
S071,Crushing injury of skull
S078,Crushing injury of other parts of head
S079,Crushing injury of head, part unspecified
S080,Avulsion of scalp
S081,Traumatic amputation of ear
S088,Traumatic amputation of other parts of head
S089,Traumatic amputation of unspecified part of head
S090,Injury of blood vessels of head, not elsewhere classified
S091,Injury of muscle and tendon of head
S092,Traumatic rupture of ear drum
S097,Multiple injuries of head
S098,Other specified injuries of head
S099,Unspecified injury of head
S110,Open wound involving larynx and trachea
S111,Open wound involving thyroid gland
S112,Open wound involving pharynx and cervical oesophagus
S117,Multiple open wounds of neck
S118,Open wound of other parts of neck
S119,Open wound of neck, part unspecified
S120,Fracture of first cervical vertebra
S1200,Fracture of first cervical vertebra: closed
S1201,Fracture of first cervical vertebra: open
S121,Fracture of second cervical vertebra
S1210,Fracture of second cervical vertebra: closed
S1211,Fracture of second cervical vertebra: open
S122,Fracture of other specified cervical vertebra
S1220,Fracture of other specified cervical vertebra: closed
S1221,Fracture of other specified cervical vertebra: open
S127,Multiple fractures of cervical spine
S1270,Multiple fractures of cervical spine: closed
S1271,Multiple fractures of cervical spine: open
S128,Fracture of other parts of neck
S1280,Fracture of other parts of neck: closed
S1281,Fracture of other parts of neck: open
S129,Fracture of neck, part unspecified
S1290,Fracture of neck, part unspecified: closed
S1291,Fracture of neck, part unspecified: open
S131,Dislocation of cervical vertebra
S132,Dislocation of other and unspecified parts of neck
S133,Multiple dislocations of neck
S134,Sprain and strain of cervical spine
S135,Sprain and strain of thyroid region
S136,Sprain and strain of joints and ligaments of other and unspecified parts of neck
S140,Concussion and oedema of cervical spinal cord
S141,Other and unspecified injuries of cervical spinal cord
S142,Injury of nerve root of cervical spine
S143,Injury of brachial plexus
S144,Injury of peripheral nerves of neck
S145,Injury of cervical sympathetic nerves
S146,Injury of other and unspecified nerves of neck
S150,Injury of carotid artery
S151,Injury of vertebral artery
S152,Injury of external jugular vein
S153,Injury of internal jugular vein
S157,Injury of multiple blood vessels at neck level
S158,Injury of other blood vessels at neck level
S159,Injury of unspecified blood vessel at neck level
S16X,Injury of muscle and tendon at neck level
S170,Crushing injury of larynx and trachea
S178,Crushing injury of other parts of neck
S179,Crushing injury of neck, part unspecified
S197,Multiple injuries of neck
S198,Other specified injuries of neck
S199,Unspecified injury of neck
S210,Open wound of breast
S211,Open wound of front wall of thorax
S212,Open wound of back wall of thorax
S217,Multiple open wounds of thoracic wall
S218,Open wound of other parts of thorax
S219,Open wound of thorax, part unspecified
S220,Fracture of thoracic vertebra
S2200,Fracture of thoracic vertebra: closed
S2201,Fracture of thoracic vertebra: open
S221,Multiple fractures of thoracic spine
S2210,Multiple fractures of thoracic spine: closed
S2211,Multiple fractures of thoracic spine: open
S222,Fracture of sternum
S2220,Fracture of sternum: closed
S2221,Fracture of sternum: open
S223,Fracture of rib
S2230,Fracture of rib: closed
S2231,Fracture of rib: open
S224,Multiple fractures of ribs
S2240,Multiple fractures of ribs: closed
S2241,Multiple fractures of ribs: open
S225,Flail chest
S2250,Flail chest: closed
S2251,Flail chest: open
S228,Fracture of other parts of bony thorax
S2280,Fracture of other parts of bony thorax: closed
S2281,Fracture of other parts of bony thorax: open
S229,Fracture of bony thorax, part unspecified
S2290,Fracture of bony thorax, part unspecified: closed
S2291,Fracture of bony thorax, part unspecified: open
S240,Concussion and oedema of thoracic spinal cord
S241,Other and unspecified injuries of thoracic spinal cord
S243,Injury of peripheral nerves of thorax
S245,Injury of other nerves of thorax
S246,Injury of unspecified nerve of thorax
S250,Injury of thoracic aorta
S251,Injury of innominate or subclavian artery
S252,Injury of superior vena cava
S253,Injury of innominate or subclavian vein
S254,Injury of pulmonary blood vessels
S257,Injury of multiple blood vessels of thorax
S258,Injury of other blood vessels of thorax
S259,Injury of unspecified blood vessel of thorax
S260,Injury of heart with haemopericardium
S2600,Injury of heart with haemopericardium: without open wound into thoracic cavity
S2601,Injury of heart with haemopericardium: with open wound into thoracic cavity
S268,Other injuries of heart
S2680,Other injuries of heart: without open wound into thoracic cavity
S2681,Other injuries of heart: with open wound into thoracic cavity
S269,Injury of heart, unspecified
S2690,Injury of heart, unspecified: without open wound into thoracic cavity
S2691,Injury of heart, unspecified: with open wound into thoracic cavity
S270,Traumatic pneumothorax
S2700,Traumatic pneumothorax: without open wound into thoracic cavity
S2701,Traumatic pneumothorax: with open wound into thoracic cavity
S271,Traumatic haemothorax
S2710,Traumatic haemothorax: without open wound into thoracic cavity
S2711,Traumatic haemothorax: with open wound into thoracic cavity
S272,Traumatic haemopneumothorax
S2720,Traumatic haemopneumothorax: without open wound into thoracic cavity
S2721,Traumatic haemopneumothorax: with open wound into thoracic cavity
S273,Other injuries of lung
S2730,Other injuries of lung: without open wound into thoracic cavity
S2731,Other injuries of lung: with open wound into thoracic cavity
S274,Injury of bronchus
S2740,Injury of bronchus: without open wound into thoracic cavity
S2741,Injury of bronchus: with open wound into thoracic cavity
S275,Injury of thoracic trachea
S2750,Injury of thoracic trachea: without open wound into thoracic cavity
S2751,Injury of thoracic trachea: with open wound into thoracic cavity
S276,Injury of pleura
S2760,Injury of pleura: without open wound into thoracic cavity
S2761,Injury of pleura: with open wound into thoracic cavity
S277,Multiple injuries of intrathoracic organs
S2770,Multiple injuries of intrathoracic organs: without open wound into thoracic cavity
S2771,Multiple injuries of intrathoracic organs: with open wound into thoracic cavity
S278,Injury of other specified intrathoracic organs
S2780,Injury of other specified intrathoracic organs: without open wound into thoracic cavity
S2781,Injury of other specified intrathoracic organs: with open wound into thoracic cavity
S279,Injury of unspecified intrathoracic organ
S2790,Injury of unspecified intrathoracic organ: without open wound into thoracic cavity
S2791,Injury of unspecified intrathoracic organ: with open wound into thoracic cavity
S280,Crushed chest
S321,Fracture of sacrum
S3210,Fracture of sacrum: closed
S3211,Fracture of sacrum: open
S322,Fracture of coccyx
S3220,Fracture of coccyx: closed
S3221,Fracture of coccyx: open
S323,Fracture of ilium
S3230,Fracture of ilium: closed
S3231,Fracture of ilium: open
S324,Fracture of acetabulum
S3240,Fracture of acetabulum: closed
S3241,Fracture of acetabulum: open
S325,Fracture of pubis
S3250,Fracture of pubis: closed
S3251,Fracture of pubis: open
S327,Multiple fractures of lumbar spine and pelvis
S3270,Multiple fractures of lumbar spine and pelvis: closed
S3271,Multiple fractures of lumbar spine and pelvis: open
S328,Fracture of other and unspecified parts of lumbar spine and pelvis
S3280,Fracture of other and unspecified parts of lumbar spine and pelvis: closed
S3281,Fracture of other and unspecified parts of lumbar spine and pelvis: open
S340,Concussion and oedema of lumbar spinal cord
S341,Other injury of lumbar spinal cord
S343,Injury of cauda equina
S344,Injury of lumbosacral plexus
S346,Injury of peripheral nerve(s) of abdomen, lower back and pelvis
S348,Injury of other and unspecified nerves at abdomen, lower back and pelvis level
S350,Injury of abdominal aorta
S351,Injury of inferior vena cava
S352,Injury of coeliac or mesenteric artery
S353,Injury of portal or splenic vein
S354,Injury of renal blood vessels
S355,Injury of iliac blood vessels
S357,Injury of multiple blood vessels at abdomen, lower back and pelvis level
S358,Injury of other blood vessels at abdomen, lower back and pelvis level
S359,Injury of unspecified blood vessel at abdomen, lower back and pelvis level
S360,Injury of spleen
S3600,Injury of spleen: without open wound into cavity
S3601,Injury of spleen: with open wound into cavity
S361,Injury of liver or gallbladder
S3610,Injury of liver or gallbladder: without open wound into cavity
S3611,Injury of liver or gallbladder: with open wound into cavity
S362,Injury of pancreas
S3620,Injury of pancreas: without open wound into cavity
S3621,Injury of pancreas: with open wound into cavity
S363,Injury of stomach
S3630,Injury of stomach: without open wound into cavity
S3631,Injury of stomach: with open wound into cavity
S364,Injury of small intestine
S3640,Injury of small intestine: without open wound into cavity
S3641,Injury of small intestine: with open wound into cavity
S365,Injury of colon
S3650,Injury of colon: without open wound into cavity
S3651,Injury of colon: with open wound into cavity
S366,Injury of rectum
S3660,Injury of rectum: without open wound into cavity
S3661,Injury of rectum: with open wound into cavity
S367,Injury of multiple intra-abdominal organs
S3670,Injury of multiple intra-abdominal organs: without open wound into cavity
S3671,Injury of multiple intra-abdominal organs: with open wound into cavity
S368,Injury of other intra-abdominal organs
S3680,Injury of other intra-abdominal organs: without open wound into cavity
S3681,Injury of other intra-abdominal organs: with open wound into cavity
S369,Injury of unspecified intra-abdominal organ
S3690,Injury of unspecified intra-abdominal organ: without open wound into cavity
S3691,Injury of unspecified intra-abdominal organ: with open wound into cavity
S370,Injury of kidney
S3700,Injury of kidney: without open wound into cavity
S3701,Injury of kidney: with open wound into cavity
S371,Injury of ureter
S3710,Injury of ureter: without open wound into cavity
S3711,Injury of ureter: with open wound into cavity
S372,Injury of bladder
S3720,Injury of bladder: without open wound into cavity
S3721,Injury of bladder: with open wound into cavity
S373,Injury of urethra
S3730,Injury of urethra: without open wound into cavity
S3731,Injury of urethra: with open wound into cavity
S374,Injury of ovary
S3740,Injury of ovary: without open wound into cavity
S3741,Injury of ovary: with open wound into cavity
S375,Injury of fallopian tube
S3750,Injury of fallopian tube: without open wound into cavity
S3751,Injury of fallopian tube: with open wound into cavity
S376,Injury of uterus
S3760,Injury of uterus: without open wound into cavity
S3761,Injury of uterus: with open wound into cavity
S377,Injury of multiple pelvic organs
S3770,Injury of multiple pelvic organs: without open wound into cavity
S3771,Injury of multiple pelvic organs: with open wound into cavity
S378,Injury of other pelvic organs
S3780,Injury of other pelvic organs: without open wound into cavity
S3781,Injury of other pelvic organs: with open wound into cavity
S379,Injury of unspecified pelvic organ
S3790,Injury of unspecified pelvic organ: without open wound into cavity
S3791,Injury of unspecified pelvic organ: with open wound into cavity
S380,Crushing injury of external genital organs
S381,Crushing injury of other and unspecified parts of abdomen, lower back and pelvis
S382,Traumatic amputation of external genital organs
S383,Traumatic amputation of other and unspecified parts of abdomen, lower back and pelvis
S390,Injury of muscle and tendon of abdomen, lower back and pelvis
S396,Injury of intra-abdominal organ(s) with pelvic organ(s)
S397,Other multiple injuries of abdomen, lower back and pelvis
S398,Other specified injuries of abdomen, lower back and pelvis
S399,Unspecified injury of abdomen, lower back and pelvis
S410,Open wound of shoulder
S411,Open wound of upper arm
S417,Multiple open wounds of shoulder and upper arm
S418,Open wound of other and unspecified parts of shoulder girdle
S420,Fracture of clavicle
S4200,Fracture of clavicle: closed
S4201,Fracture of clavicle: open
S421,Fracture of scapula
S4210,Fracture of scapula: closed
S4211,Fracture of scapula: open
S422,Fracture of upper end of humerus
S4220,Fracture of upper end of humerus: closed
S4221,Fracture of upper end of humerus: open
S423,Fracture of shaft of humerus
S4230,Fracture of shaft of humerus: closed
S4231,Fracture of shaft of humerus: open
S424,Fracture of lower end of humerus
S4240,Fracture of lower end of humerus: closed
S4241,Fracture of lower end of humerus: open
S427,Multiple fractures of clavicle, scapula and humerus
S4270,Multiple fractures of clavicle, scapula and humerus: closed
S4271,Multiple fractures of clavicle, scapula and humerus: open
S428,Fracture of other parts of shoulder and upper arm
S4280,Fracture of other parts of shoulder and upper arm: closed
S4281,Fracture of other parts of shoulder and upper arm: open
S429,Fracture of shoulder girdle, part unspecified
S4290,Fracture of shoulder girdle, part unspecified: closed
S4291,Fracture of shoulder girdle, part unspecified: open
S430,Dislocation of shoulder joint
S431,Dislocation of acromioclavicular joint
S432,Dislocation of sternoclavicular joint
S433,Dislocation of other and unspecified parts of shoulder girdle
S434,Sprain and strain of shoulder joint
S435,Sprain and strain of acromioclavicular joint
S436,Sprain and strain of sternoclavicular joint
S437,Sprain and strain of other and unspecified parts of shoulder girdle
S440,Injury of ulnar nerve at upper arm level
S441,Injury of median nerve at upper arm level
S442,Injury of radial nerve at upper arm level
S443,Injury of axillary nerve
S444,Injury of musculocutaneous nerve
S445,Injury of cutaneous sensory nerve at shoulder and upper arm level
S447,Injury of multiple nerves at shoulder and upper arm level
S448,Injury of other nerves at shoulder and upper arm level
S449,Injury of unspecified nerve at shoulder and upper arm level
S450,Injury of axillary artery
S451,Injury of brachial artery
S452,Injury of axillary or brachial vein
S453,Injury of superficial vein at shoulder and upper arm level
S457,Injury of multiple blood vessels at shoulder and upper arm level
S458,Injury of other blood vessels at shoulder and upper arm level
S459,Injury of unspecified blood vessel at shoulder and upper arm level
S460,Injury of muscle(s) and tendon(s) of the rotator cuff of shoulder
S461,Injury of muscle and tendon of long head of biceps
S462,Injury of muscle and tendon of other parts of biceps
S463,Injury of muscle and tendon of triceps
S467,Injury of multiple muscles and tendons at shoulder and upper arm level
S468,Injury of other muscles and tendons at shoulder and upper arm level
S469,Injury of unspecified muscle and tendon at shoulder and upper arm level
S47X,Crushing injury of shoulder and upper arm
S480,Traumatic amputation at shoulder joint
S481,Traumatic amputation at level between shoulder and elbow
S489,Traumatic amputation of shoulder and upper arm, level unspecified
S497,Multiple injuries of shoulder and upper arm
S498,Other specified injuries of shoulder and upper arm
S499,Unspecified injury of shoulder and upper arm
S510,Open wound of elbow
S517,Multiple open wounds of forearm
S518,Open wound of other parts of forearm
S519,Open wound of forearm, part unspecified
S520,Fracture of upper end of ulna
S5200,Fracture of upper end of ulna: closed
S5201,Fracture of upper end of ulna: open
S521,Fracture of upper end of radius
S5210,Fracture of upper end of radius: closed
S5211,Fracture of upper end of radius: open
S522,Fracture of shaft of ulna
S5220,Fracture of shaft of ulna: closed
S5221,Fracture of shaft of ulna: open
S523,Fracture of shaft of radius
S5230,Fracture of shaft of radius: closed
S5231,Fracture of shaft of radius: open
S524,Fracture of shafts of both ulna and radius
S5240,Fracture of shafts of both ulna and radius: closed
S5241,Fracture of shafts of both ulna and radius: open
S525,Fracture of lower end of radius
S5250,Fracture of lower end of radius: closed
S5251,Fracture of lower end of radius: open
S526,Fracture of lower end of both ulna and radius
S5260,Fracture of lower end of both ulna and radius: closed
S5261,Fracture of lower end of both ulna and radius: open
S527,Multiple fractures of forearm
S5270,Multiple fractures of forearm: closed
S5271,Multiple fractures of forearm: open
S528,Fracture of other parts of forearm
S5280,Fracture of other parts of forearm: closed
S5281,Fracture of other parts of forearm: open
S529,Fracture of forearm, part unspecified
S5290,Fracture of forearm, part unspecified: closed
S5291,Fracture of forearm, part unspecified: open
S530,Dislocation of radial head
S531,Dislocation of elbow, unspecified
S532,Traumatic rupture of radial collateral ligament
S533,Traumatic rupture of ulnar collateral ligament
S534,Sprain and strain of elbow
S540,Injury of ulnar nerve at forearm level
S541,Injury of median nerve at forearm level
S542,Injury of radial nerve at forearm level
S543,Injury of cutaneous sensory nerve at forearm level
S547,Injury of multiple nerves at forearm level
S548,Injury of other nerves at forearm level
S549,Injury of unspecified nerve at forearm level
S550,Injury of ulnar artery at forearm level
S551,Injury of radial artery at forearm level
S552,Injury of vein at forearm level
S557,Injury of multiple blood vessels at forearm level
S558,Injury of other blood vessels at forearm level
S559,Injury of unspecified blood vessel at forearm level
S560,Injury of flexor muscle and tendon of thumb at forearm level
S561,Injury of long flexor muscle and tendon of other finger(s) at forearm level
S562,Injury of other flexor muscle and tendon at forearm level
S563,Injury of extensor or abductor muscles and tendons of thumb at forearm level
S564,Injury of extensor muscle and tendon of other finger(s) at forearm level
S565,Injury of other extensor muscle and tendon at forearm level
S567,Injury of multiple muscles and tendons at forearm level
S568,Injury of other and unspecified muscles and tendons at forearm level
S570,Crushing injury of elbow
S578,Crushing injury of other parts of forearm
S579,Crushing injury of forearm, part unspecified
S580,Traumatic amputation at elbow level
S581,Traumatic amputation at level between elbow and wrist
S589,Traumatic amputation of forearm, level unspecified
S597,Multiple injuries of forearm
S598,Other specified injuries of forearm
S599,Unspecified injury of forearm
S610,Open wound of finger(s) without damage to nail
S611,Open wound of finger(s) with damage to nail
S617,Multiple open wounds of wrist and hand
S618,Open wound of other parts of wrist and hand
S619,Open wound of wrist and hand, part unspecified
S620,Fracture of navicular [scaphoid] bone of hand
S6200,Fracture of navicular [scaphoid] bone of hand: closed
S6201,Fracture of navicular [scaphoid] bone of hand: open
S621,Fracture of other carpal bone(s)
S6210,Fracture of other carpal bone(s): closed
S6211,Fracture of other carpal bone(s): open
S622,Fracture of first metacarpal bone
S6220,Fracture of first metacarpal bone: closed
S6221,Fracture of first metacarpal bone: open
S623,Fracture of other metacarpal bone
S6230,Fracture of other metacarpal bone: closed
S6231,Fracture of other metacarpal bone: open
S624,Multiple fractures of metacarpal bones
S6240,Multiple fractures of metacarpal bones: closed
S6241,Multiple fractures of metacarpal bones: open
S625,Fracture of thumb
S6250,Fracture of thumb: closed
S6251,Fracture of thumb: open
S626,Fracture of other finger
S6260,Fracture of other finger: closed
S6261,Fracture of other finger: open
S627,Multiple fractures of fingers
S6270,Multiple fractures of fingers: closed
S6271,Multiple fractures of fingers: open
S628,Fracture of other and unspecified parts of wrist and hand
S6280,Fracture of other and unspecified parts of wrist and hand: closed
S6281,Fracture of other and unspecified parts of wrist and hand: open
S630,Dislocation of wrist
S631,Dislocation of finger
S632,Multiple dislocations of fingers
S633,Traumatic rupture of ligament of wrist and carpus
S634,Traumatic rupture of ligament of finger at metacarpophalangeal and interphalangeal joint(s)
S635,Sprain and strain of wrist
S636,Sprain and strain of finger(s)
S637,Sprain and strain of other and unspecified parts of hand
S640,Injury of ulnar nerve at wrist and hand level
S641,Injury of median nerve at wrist and hand level
S642,Injury of radial nerve at wrist and hand level
S643,Injury of digital nerve of thumb
S644,Injury of digital nerve of other finger
S647,Injury of multiple nerves at wrist and hand level
S648,Injury of other nerves at wrist and hand level
S649,Injury of unspecified nerve at wrist and hand level
S650,Injury of ulnar artery at wrist and hand level
S651,Injury of radial artery at wrist and hand level
S652,Injury of superficial palmar arch
S653,Injury of deep palmar arch
S654,Injury of blood vessel(s) of thumb
S655,Injury of blood vessel(s) of other finger
S657,Injury of multiple blood vessels at wrist and hand level
S658,Injury of other blood vessels at wrist and hand level
S659,Injury of unspecified blood vessel at wrist and hand level
S660,Injury of long flexor muscle and tendon of thumb at wrist and hand level
S661,Injury of flexor muscle and tendon of other finger at wrist and hand level
S662,Injury of extensor muscle and tendon of thumb at wrist and hand level
