-------------------------------------------------------------------------------
      name:  <unnamed>
       log:  /workspace/logs/2017_ckd_complete.log
  log type:  text
 opened on:   7 Jun 2024, 10:21:58

. clear

. 
. *Merge `dataset'_ckd with `dataset'_ckd_complete
. capture noisily import delimited ./output/`dataset'_ckd.csv, clear
(8 vars, 21,046 obs)

. tempfile `dataset'_ckd

. save ``dataset'_ckd', replace
(note: file /tmp/St00012.000001 not found)
file /tmp/St00012.000001 saved

. capture noisily import delimited ./output/input_`dataset'_ckd_complete.csv, c
> lear
(104 vars, 50,000 obs)

. merge 1:1 patient_id using ``dataset'_ckd'

    Result                           # of obs.
    -----------------------------------------
    not matched                        66,888
        from master                    47,921  (_merge==1)
        from using                     18,967  (_merge==2)

    matched                             2,079  (_merge==3)
    -----------------------------------------

. keep if _merge==3
(66,888 observations deleted)

. drop _merge

. tempfile `dataset'_ckd_complete

. save ``dataset'_ckd_complete', replace
(note: file /tmp/St00012.000002 not found)
file /tmp/St00012.000002 saved

. 
. /*Generate dummy data
> cd ckd-healthcare-use
> capture noisily import delimited ./output/2017_ckd.csv, clear
> tempfile 2017_ckd
> save ./output/2017_ckd, replace
> capture noisily import delimited ./output/input_2017_ckd_complete.csv, clear
> merge 1:1 patient_id using ./output/2017_ckd
> keep if _merge==3
> drop _merge
> tempfile 2017_ckd_complete
> save ./output/2017_ckd_complete, replace
> */
. 
. *CKD stage classification
. foreach var of varlist  dialysis_baseline_primary_care  ///
>                                                 dialysis_baseline_icd_10     
>            ///
>                                                 dialysis_baseline_opcs_4     
>            ///
>                                                 dialysis_baseline_date       
>            ///
>                                                 kt_baseline_primary_care     
>            ///
>                                                 kt_baseline_icd_10           
>                    ///
>                                                 kt_baseline_opcs_4           
>                    {
  2.         drop `var'
  3.         }

. tab modality_baseline, m

modality_baseline |      Freq.     Percent        Cum.
------------------+-----------------------------------
         Dialysis |        185        8.90        8.90
Kidney transplant |        211       10.15       19.05
 Modality unclear |         43        2.07       21.12
          Pre KRT |      1,640       78.88      100.00
------------------+-----------------------------------
            Total |      2,079      100.00

. *To reduce misclassification of dialysis, anyone with eGFR >15 with modality_
> baseline=="Dialysis" will be reclassified as non-dialysis (e.g. they may have
>  received acute dialysis and recovered)
. *For modality_baseline="Modality unclear" (i.e. whose dialysis and kidney tra
> nsplant baseline dates are identical), those with eGFR <15 will be assumed to
>  be on dialysis and those >15 as kidney transplant
. egen esrd_egfr = cut(baseline_egfr), at (0, 15, 5000)
(830 missing values generated)

. recode esrd_egfr 0=1 15=0
(esrd_egfr: 1249 changes made)

. tab esrd_egfr, m

  esrd_egfr |      Freq.     Percent        Cum.
------------+-----------------------------------
          0 |      1,249       60.08       60.08
          . |        830       39.92      100.00
------------+-----------------------------------
      Total |      2,079      100.00

. gen dialysis = 0

. replace dialysis = 1 if modality_baseline=="Dialysis"
(185 real changes made)

. replace dialysis = 1 if modality_baseline=="Modality unclear" & esrd_egfr!=.
(29 real changes made)

. replace dialysis = 0 if esrd_egfr==0
(137 real changes made)

. gen kidney_transplant = 0

. replace kidney_transplant = 1 if kidney_transplant_baseline_date!=""
(281 real changes made)

. replace kidney_transplant = 0 if dialysis==1
(12 real changes made)

. gen modality_unclear = 0

. replace modality_unclear = 1 if modality_baseline=="Modality unclear"
(43 real changes made)

. replace modality_unclear = 0 if dialysis==1
(0 real changes made)

. replace modality_unclear = 0 if kidney_transplant==1
(5 real changes made)

. tab modality_baseline dialysis

                  |       dialysis
modality_baseline |         0          1 |     Total
------------------+----------------------+----------
         Dialysis |       108         77 |       185 
Kidney transplant |       211          0 |       211 
 Modality unclear |        43          0 |        43 
          Pre KRT |     1,640          0 |     1,640 
------------------+----------------------+----------
            Total |     2,002         77 |     2,079 

. tab modality_baseline kidney_transplant

                  |   kidney_transplant
modality_baseline |         0          1 |     Total
------------------+----------------------+----------
         Dialysis |       165         20 |       185 
Kidney transplant |       183         28 |       211 
 Modality unclear |        38          5 |        43 
          Pre KRT |     1,424        216 |     1,640 
------------------+----------------------+----------
            Total |     1,810        269 |     2,079 

. tab modality_baseline modality_unclear

                  |   modality_unclear
modality_baseline |         0          1 |     Total
------------------+----------------------+----------
         Dialysis |       185          0 |       185 
Kidney transplant |       211          0 |       211 
 Modality unclear |         5         38 |        43 
          Pre KRT |     1,640          0 |     1,640 
------------------+----------------------+----------
            Total |     2,041         38 |     2,079 

. tab dialysis kidney_transplant

           |   kidney_transplant
  dialysis |         0          1 |     Total
-----------+----------------------+----------
         0 |     1,733        269 |     2,002 
         1 |        77          0 |        77 
-----------+----------------------+----------
     Total |     1,810        269 |     2,079 

. egen ckd_group = cut(baseline_egfr), at(0, 30, 60, 5000)
(830 missing values generated)

. recode ckd_group 0=3 30=2 60=1
(ckd_group: 1249 changes made)

. replace ckd_group = 4 if dialysis==1
(77 real changes made)

. replace ckd_group = 5 if kidney_transplant==1
(269 real changes made)

. replace ckd_group = 6 if modality_unclear==1
(38 real changes made)

. *ckd_group==. are those with albuminuria without available eGFR measurement o
> r code for KRT
. replace ckd_group = 1 if ckd_group==.
(643 real changes made)

. label define ckd_group 1 "Albuminuria" 2 "CKD stage 3" 3 "CKD stage 4/5" 4 "D
> ialysis" 5 "Transplant" 6 "KRT unclear modality"

. label values ckd_group ckd_group

. label var ckd_group "CKD group"

. tab ckd_group, m

           CKD group |      Freq.     Percent        Cum.
---------------------+-----------------------------------
         Albuminuria |      1,267       60.94       60.94
         CKD stage 3 |        409       19.67       80.62
       CKD stage 4/5 |         19        0.91       81.53
            Dialysis |         77        3.70       85.23
          Transplant |        269       12.94       98.17
KRT unclear modality |         38        1.83      100.00
---------------------+-----------------------------------
               Total |      2,079      100.00

. drop if ckd_group==.
(0 observations deleted)

. tab ckd_group modality_baseline

                     |              modality_baseline
           CKD group |  Dialysis  Kidney ..  Modalit..    Pre KRT |     Total
---------------------+--------------------------------------------+----------
         Albuminuria |        51        148          0      1,068 |     1,267 
         CKD stage 3 |        37         32          0        340 |       409 
       CKD stage 4/5 |         0          3          0         16 |        19 
            Dialysis |        77          0          0          0 |        77 
          Transplant |        20         28          5        216 |       269 
KRT unclear modality |         0          0         38          0 |        38 
---------------------+--------------------------------------------+----------
               Total |       185        211         43      1,640 |     2,079 

. 
. *Dialysis & kidney transplant outcome classification
. foreach var of varlist  dialysis_outcome_primary_care   ///
>                                                 dialysis_outcome_icd_10      
>            ///
>                                                 dialysis_outcome_opcs_4      
>            ///
>                                                 dialysis_outcome_date        
>            ///
>                                                 kt_outcome_primary_care      
>            ///
>                                                 kt_outcome_icd_10            
>                    ///
>                                                 kt_outcome_opcs_4            
>                    ///
>                                                 kidney_transplant_outcome_dat
> e  ///
>                                                 died                         
>                            {
  2.         drop `var'
  3.         }

. tab ckd_group modality_outcome, m

                     |              modality_outcome
           CKD group |  Deceased   Dialysis  Kidney ..  Modalit.. |     Total
---------------------+--------------------------------------------+----------
         Albuminuria |       116         67         48         13 |     1,267 
         CKD stage 3 |        39         20         19          1 |       409 
       CKD stage 4/5 |         2          1          1          0 |        19 
            Dialysis |         8          9          0          2 |        77 
          Transplant |        26         11          9          3 |       269 
KRT unclear modality |         1          3          1          2 |        38 
---------------------+--------------------------------------------+----------
               Total |       192        111         78         21 |     2,079 


                     | modality_o
                     |   utcome
           CKD group | Unchanged |     Total
---------------------+-----------+----------
         Albuminuria |     1,023 |     1,267 
         CKD stage 3 |       330 |       409 
       CKD stage 4/5 |        15 |        19 
            Dialysis |        58 |        77 
          Transplant |       220 |       269 
KRT unclear modality |        31 |        38 
---------------------+-----------+----------
               Total |     1,677 |     2,079 

. 
. *eGFR outcome classification based on updated mean eGFR over previous 18 mont
> hs by the end of year
. gen sex = 1 if male == "Male"
(1,102 missing values generated)

. replace sex = 0 if male == "Female"
(1,102 real changes made)

. label define sex 0"Female" 1"Male"

. label values sex sex

. replace creatinine_outcome = . if !inrange(creatinine_outcome, 20, 3000)
(923 real changes made, 923 to missing)

. gen mgdl_creatinine_outcome = creatinine_outcome/88.4
(923 missing values generated)

. gen min_creatinine_outcome=.
(2,079 missing values generated)

. replace min_creatinine_outcome = mgdl_creatinine_outcome/0.7 if sex==0
(620 real changes made)

. replace min_creatinine_outcome = mgdl_creatinine_outcome/0.9 if sex==1
(536 real changes made)

. replace min_creatinine_outcome = min_creatinine_outcome^-0.329  if sex==0
(620 real changes made)

. replace min_creatinine_outcome = min_creatinine_outcome^-0.411  if sex==1
(536 real changes made)

. replace min_creatinine_outcome = 1 if min_creatinine_outcome<1
(760 real changes made)

. gen max_creatinine_outcome=.
(2,079 missing values generated)

. replace max_creatinine_outcome = mgdl_creatinine_outcome/0.7 if sex==0
(620 real changes made)

. replace max_creatinine_outcome = mgdl_creatinine_outcome/0.9 if sex==1
(536 real changes made)

. replace max_creatinine_outcome = max_creatinine_outcome^-1.209
(1,156 real changes made)

. replace max_creatinine_outcome = 1 if max_creatinine_outcome>1
(1,319 real changes made)

. gen egfr_outcome = min_creatinine_outcome*max_creatinine_outcome*141
(923 missing values generated)

. replace egfr_outcome = egfr_outcome*(0.993^age)
(1,156 real changes made)

. replace egfr_outcome = egfr_outcome*1.018 if sex==0
(620 real changes made)

. drop creatinine_outcome

. drop mgdl_creatinine_outcome

. drop min_creatinine_outcome

. drop max_creatinine_outcome

. egen egfr_end = cut(egfr_outcome), at(0, 30, 60, 5000)
(923 missing values generated)

. recode egfr_end 0=3 30=2 60=1
(egfr_end: 1156 changes made)

. label define egfr_end 1 "≥60" 2 "30-59" 3 "<30"

. label values egfr_end egfr_end

. label var egfr_end "Final eGFR"

. gen ckd_progression = 0

. replace ckd_progression = 1 if egfr_end==2 & ckd_group==1
(177 real changes made)

. replace ckd_progression = 2 if egfr_end==3 & ckd_group==1
(6 real changes made)

. replace ckd_progression = 2 if egfr_end==3 & ckd_group==2
(4 real changes made)

. egen esrd_egfr_end = cut(egfr_outcome), at (0, 15, 5000)
(923 missing values generated)

. recode esrd_egfr_end 0=1 15=0
(esrd_egfr_end: 1156 changes made)

. tab esrd_egfr_end, m

esrd_egfr_e |
         nd |      Freq.     Percent        Cum.
------------+-----------------------------------
          0 |      1,156       55.60       55.60
          . |        923       44.40      100.00
------------+-----------------------------------
      Total |      2,079      100.00

. gen dialysis_outcome = 0

. replace dialysis_outcome = 1 if modality_outcome=="Dialysis"
(111 real changes made)

. replace dialysis_outcome = 1 if modality_outcome=="Modality unclear" & esrd_e
> gfr_end==1
(0 real changes made)

. gen kidney_transplant_outcome = 0

. replace kidney_transplant_outcome = 1 if modality_outcome=="Kidney transplant
> "
(78 real changes made)

. replace kidney_transplant_outcome = 1 if modality_outcome=="Modality unclear"
>  & esrd_egfr_end==0
(10 real changes made)

. replace ckd_progression = 5 if modality_outcome=="Modality unclear"
(21 real changes made)

. replace ckd_progression = 3 if dialysis_outcome==1
(111 real changes made)

. replace ckd_progression = 4 if kidney_transplant_outcome==1
(88 real changes made)

. replace ckd_progression = 6 if modality_outcome=="Deceased"
(192 real changes made)

. label define ckd_progression 0 "No progression" 1 "CKD 3" 2 "CKD 4/5 pre-KRT"
>  3 "Dialysis" 4 "Kidney transplant" 5 "KRT unclear modality" 6 "Deceased"

. label values ckd_progression ckd_progression

. label var ckd_progression "CKD progression"

. tab ckd_progression, m

     CKD progression |      Freq.     Percent        Cum.
---------------------+-----------------------------------
      No progression |      1,528       73.50       73.50
               CKD 3 |        143        6.88       80.38
     CKD 4/5 pre-KRT |          6        0.29       80.66
            Dialysis |        111        5.34       86.00
   Kidney transplant |         88        4.23       90.24
KRT unclear modality |         11        0.53       90.76
            Deceased |        192        9.24      100.00
---------------------+-----------------------------------
               Total |      2,079      100.00

. 
. *eGFR cut-offs to investigate timing of access formation
. egen access_egfr = cut(baseline_egfr), at (0, 15, 5000)
(830 missing values generated)

. recode access_egfr 0=1 15=2
(access_egfr: 1249 changes made)

. replace access_egfr=0 if ckd_group==4
(77 real changes made)

. replace access_egfr=3 if access_egfr==.
(753 real changes made)

. label define access_egfr 0 "Dialysis" 1 "eGFR 0-14" 2 "eGFR >= 15" 3 "Unknown
> "

. label values access_egfr access_egfr

. 
. *Totals for non-binary healthcare resource outcomes (including by month)
. foreach aggregate of varlist hospital_days critical_care_days emergency_days 
> op_appts neph_appts tx_appts gp_interactions icd1_days icd2_days icd3_days ic
> d4_days icd5_days icd6_days icd7_days icd8_days icd9_days icd10_days icd11_da
> ys icd12_days icd13_days icd14_days icd15_days icd16_days icd17_days icd18_da
> ys icd19_days icd20_days icd21_days icd22_days {
  2. bysort ckd_group: egen total_`aggregate' = total(`aggregate')
  3. egen overall_`aggregate' = total(`aggregate')
  4. tab ckd_group, sum(total_`aggregate')
  5. sum overall_`aggregate'
  6. }

            |   Summary of total_hospital_days
  CKD group |        Mean   Std. Dev.       Freq.
------------+------------------------------------
  Albuminur |         330           0       1,267
  CKD stage |          86           0         409
  CKD stage |           2           0          19
   Dialysis |          18           0          77
  Transplan |          77           0         269
  KRT uncle |           3           0          38
------------+------------------------------------
      Total |   228.73256   127.63336       2,079

    Variable |        Obs        Mean    Std. Dev.       Min        Max
-------------+---------------------------------------------------------
overall_ho~s |      2,079         516           0        516        516

            | Summary of total_critical_care_days
  CKD group |        Mean   Std. Dev.       Freq.
------------+------------------------------------
  Albuminur |         278           0       1,267
  CKD stage |          79           0         409
  CKD stage |           5           0          19
   Dialysis |          18           0          77
  Transplan |          75           0         269
  KRT uncle |           0           0          38
------------+------------------------------------
      Total |   195.37903    104.3988       2,079

    Variable |        Obs        Mean    Std. Dev.       Min        Max
-------------+---------------------------------------------------------
overall_cr~s |      2,079         455           0        455        455

            |   Summary of total_emergency_days
  CKD group |        Mean   Std. Dev.       Freq.
------------+------------------------------------
  Albuminur |         383           0       1,267
  CKD stage |          88           0         409
  CKD stage |           9           0          19
   Dialysis |          14           0          77
  Transplan |          45           0         269
  KRT uncle |           6           0          38
------------+------------------------------------
      Total |   257.25589   158.18315       2,079

    Variable |        Obs        Mean    Std. Dev.       Min        Max
-------------+---------------------------------------------------------
overall_em~s |      2,079         545           0        545        545

            |      Summary of total_op_appts
  CKD group |        Mean   Std. Dev.       Freq.
------------+------------------------------------
  Albuminur |         290           0       1,267
  CKD stage |          92           0         409
  CKD stage |           1           0          19
   Dialysis |           8           0          77
  Transplan |          56           0         269
  KRT uncle |           4           0          38
------------+------------------------------------
      Total |   202.45743   111.10058       2,079

    Variable |        Obs        Mean    Std. Dev.       Min        Max
-------------+---------------------------------------------------------
overall_op~s |      2,079         451           0        451        451

            |     Summary of total_neph_appts
  CKD group |        Mean   Std. Dev.       Freq.
------------+------------------------------------
  Albuminur |         292           0       1,267
  CKD stage |         118           0         409
  CKD stage |           5           0          19
   Dialysis |          12           0          77
  Transplan |          58           0         269
  KRT uncle |           4           0          38
------------+------------------------------------
      Total |   209.23473   106.62509       2,079

    Variable |        Obs        Mean    Std. Dev.       Min        Max
-------------+---------------------------------------------------------
overall_ne~s |      2,079         489           0        489        489

            |      Summary of total_tx_appts
  CKD group |        Mean   Std. Dev.       Freq.
------------+------------------------------------
  Albuminur |         298           0       1,267
  CKD stage |          83           0         409
  CKD stage |           4           0          19
   Dialysis |          16           0          77
  Transplan |          54           0         269
  KRT uncle |           5           0          38
------------+------------------------------------
      Total |    205.6455   116.52776       2,079

    Variable |        Obs        Mean    Std. Dev.       Min        Max
-------------+---------------------------------------------------------
overall_tx~s |      2,079         460           0        460        460

            |  Summary of total_gp_interactions
  CKD group |        Mean   Std. Dev.       Freq.
------------+------------------------------------
  Albuminur |         382           0       1,267
  CKD stage |         106           0         409
  CKD stage |           3           0          19
   Dialysis |          32           0          77
  Transplan |          72           0         269
  KRT uncle |           1           0          38
------------+------------------------------------
      Total |   264.20154   148.51767       2,079

    Variable |        Obs        Mean    Std. Dev.       Min        Max
-------------+---------------------------------------------------------
overall_gp~s |      2,079         596           0        596        596

            |     Summary of total_icd1_days
  CKD group |        Mean   Std. Dev.       Freq.
------------+------------------------------------
  Albuminur |         255           0       1,267
  CKD stage |         114           0         409
  CKD stage |           2           0          19
   Dialysis |          17           0          77
  Transplan |          55           0         269
  KRT uncle |           5           0          38
------------+------------------------------------
      Total |   185.68687   90.064481       2,079

    Variable |        Obs        Mean    Std. Dev.       Min        Max
-------------+---------------------------------------------------------
overall_ic~s |      2,079         448           0        448        448

            |     Summary of total_icd2_days
  CKD group |        Mean   Std. Dev.       Freq.
------------+------------------------------------
  Albuminur |         351           0       1,267
  CKD stage |         116           0         409
  CKD stage |           2           0          19
   Dialysis |          26           0          77
  Transplan |          81           0         269
  KRT uncle |           5           0          38
------------+------------------------------------
      Total |   248.28283   130.25947       2,079

    Variable |        Obs        Mean    Std. Dev.       Min        Max
-------------+---------------------------------------------------------
overa~2_days |      2,079         581           0        581        581

            |     Summary of total_icd3_days
  CKD group |        Mean   Std. Dev.       Freq.
------------+------------------------------------
  Albuminur |         303           0       1,267
  CKD stage |         142           0         409
  CKD stage |           2           0          19
   Dialysis |          18           0          77
  Transplan |          77           0         269
  KRT uncle |           6           0          38
------------+------------------------------------
      Total |   223.34969   104.00841       2,079

    Variable |        Obs        Mean    Std. Dev.       Min        Max
-------------+---------------------------------------------------------
overa~3_days |      2,079         548           0        548        548

            |     Summary of total_icd4_days
  CKD group |        Mean   Std. Dev.       Freq.
------------+------------------------------------
  Albuminur |         350           0       1,267
  CKD stage |         117           0         409
  CKD stage |          12           0          19
   Dialysis |          21           0          77
  Transplan |          47           0         269
  KRT uncle |           4           0          38
------------+------------------------------------
      Total |   243.35883   135.78299       2,079

    Variable |        Obs        Mean    Std. Dev.       Min        Max
-------------+---------------------------------------------------------
overa~4_days |      2,079         551           0        551        551

            |     Summary of total_icd5_days
  CKD group |        Mean   Std. Dev.       Freq.
------------+------------------------------------
  Albuminur |         338           0       1,267
  CKD stage |          93           0         409
  CKD stage |           6           0          19
   Dialysis |          25           0          77
  Transplan |          78           0         269
  KRT uncle |          15           0          38
------------+------------------------------------
      Total |   235.62963    128.9435       2,079

    Variable |        Obs        Mean    Std. Dev.       Min        Max
-------------+---------------------------------------------------------
overa~5_days |      2,079         555           0        555        555

            |     Summary of total_icd6_days
  CKD group |        Mean   Std. Dev.       Freq.
------------+------------------------------------
  Albuminur |         343           0       1,267
  CKD stage |          95           0         409
  CKD stage |           9           0          19
   Dialysis |          13           0          77
  Transplan |          60           0         269
  KRT uncle |          11           0          38
------------+------------------------------------
      Total |   236.25108   134.69668       2,079

    Variable |        Obs        Mean    Std. Dev.       Min        Max
-------------+---------------------------------------------------------
overa~6_days |      2,079         531           0        531        531

            |     Summary of total_icd7_days
  CKD group |        Mean   Std. Dev.       Freq.
------------+------------------------------------
  Albuminur |         293           0       1,267
  CKD stage |         133           0         409
  CKD stage |           8           0          19
   Dialysis |          26           0          77
  Transplan |          41           0         269
  KRT uncle |          16           0          38
------------+------------------------------------
      Total |   211.36075   106.67054       2,079

    Variable |        Obs        Mean    Std. Dev.       Min        Max
-------------+---------------------------------------------------------
overa~7_days |      2,079         517           0        517        517

            |     Summary of total_icd8_days
  CKD group |        Mean   Std. Dev.       Freq.
------------+------------------------------------
  Albuminur |         334           0       1,267
  CKD stage |          77           0         409
  CKD stage |           4           0          19
   Dialysis |          10           0          77
  Transplan |          62           0         269
  KRT uncle |          17           0          38
------------+------------------------------------
      Total |   227.43675   133.93794       2,079

    Variable |        Obs        Mean    Std. Dev.       Min        Max
-------------+---------------------------------------------------------
overa~8_days |      2,079         504           0        504        504

            |     Summary of total_icd9_days
  CKD group |        Mean   Std. Dev.       Freq.
------------+------------------------------------
  Albuminur |         248           0       1,267
  CKD stage |          82           0         409
  CKD stage |          14           0          19
   Dialysis |          25           0          77
  Transplan |          63           0         269
  KRT uncle |           5           0          38
------------+------------------------------------
      Total |   176.56662   90.399915       2,079

    Variable |        Obs        Mean    Std. Dev.       Min        Max
-------------+---------------------------------------------------------
overa~9_days |      2,079         437           0        437        437

            |     Summary of total_icd10_days
  CKD group |        Mean   Std. Dev.       Freq.
------------+------------------------------------
  Albuminur |         300           0       1,267
  CKD stage |          96           0         409
  CKD stage |           4           0          19
   Dialysis |          10           0          77
  Transplan |          66           0         269
  KRT uncle |           0           0          38
------------+------------------------------------
      Total |   210.66089   113.38951       2,079

    Variable |        Obs        Mean    Std. Dev.       Min        Max
-------------+---------------------------------------------------------
overa~0_days |      2,079         476           0        476        476

            |     Summary of total_icd11_days
  CKD group |        Mean   Std. Dev.       Freq.
------------+------------------------------------
  Albuminur |         373           0       1,267
  CKD stage |         116           0         409
  CKD stage |           1           0          19
   Dialysis |          12           0          77
  Transplan |          44           0         269
  KRT uncle |          11           0          38
------------+------------------------------------
      Total |   256.48485   148.05526       2,079

    Variable |        Obs        Mean    Std. Dev.       Min        Max
-------------+---------------------------------------------------------
over~11_days |      2,079         557           0        557        557

            |     Summary of total_icd12_days
  CKD group |        Mean   Std. Dev.       Freq.
------------+------------------------------------
  Albuminur |         333           0       1,267
  CKD stage |          99           0         409
  CKD stage |          10           0          19
   Dialysis |          22           0          77
  Transplan |          91           0         269
  KRT uncle |           1           0          38
------------+------------------------------------
      Total |   235.11448   123.79759       2,079

    Variable |        Obs        Mean    Std. Dev.       Min        Max
-------------+---------------------------------------------------------
over~12_days |      2,079         556           0        556        556

            |     Summary of total_icd13_days
  CKD group |        Mean   Std. Dev.       Freq.
------------+------------------------------------
  Albuminur |         311           0       1,267
  CKD stage |         134           0         409
  CKD stage |           8           0          19
   Dialysis |          10           0          77
  Transplan |          72           0         269
  KRT uncle |          10           0          38
------------+------------------------------------
      Total |   225.83598   110.26217       2,079

    Variable |        Obs        Mean    Std. Dev.       Min        Max
-------------+---------------------------------------------------------
over~13_days |      2,079         545           0        545        545

            |     Summary of total_icd14_days
  CKD group |        Mean   Std. Dev.       Freq.
------------+------------------------------------
  Albuminur |         310           0       1,267
  CKD stage |         129           0         409
  CKD stage |           2           0          19
   Dialysis |          42           0          77
  Transplan |          82           0         269
  KRT uncle |          16           0          38
------------+------------------------------------
      Total |   226.77682   106.57187       2,079

    Variable |        Obs        Mean    Std. Dev.       Min        Max
-------------+---------------------------------------------------------
over~14_days |      2,079         581           0        581        581

            |     Summary of total_icd15_days
  CKD group |        Mean   Std. Dev.       Freq.
------------+------------------------------------
  Albuminur |         330           0       1,267
  CKD stage |         104           0         409
  CKD stage |           2           0          19
   Dialysis |          30           0          77
  Transplan |          95           0         269
  KRT uncle |          14           0          38
------------+------------------------------------
      Total |    235.2482   119.85147       2,079

    Variable |        Obs        Mean    Std. Dev.       Min        Max
-------------+---------------------------------------------------------
over~15_days |      2,079         575           0        575        575

            |     Summary of total_icd16_days
  CKD group |        Mean   Std. Dev.       Freq.
------------+------------------------------------
  Albuminur |         334           0       1,267
  CKD stage |         112           0         409
  CKD stage |           0           0          19
   Dialysis |          31           0          77
  Transplan |          53           0         269
  KRT uncle |           3           0          38
------------+------------------------------------
      Total |    233.6431    127.5579       2,079

    Variable |        Obs        Mean    Std. Dev.       Min        Max
-------------+---------------------------------------------------------
over~16_days |      2,079         533           0        533        533

            |     Summary of total_icd17_days
  CKD group |        Mean   Std. Dev.       Freq.
------------+------------------------------------
  Albuminur |         339           0       1,267
  CKD stage |         100           0         409
  CKD stage |          12           0          19
   Dialysis |          23           0          77
  Transplan |          64           0         269
  KRT uncle |           7           0          38
------------+------------------------------------
      Total |   235.63925   130.52756       2,079

    Variable |        Obs        Mean    Std. Dev.       Min        Max
-------------+---------------------------------------------------------
over~17_days |      2,079         545           0        545        545

            |     Summary of total_icd18_days
  CKD group |        Mean   Std. Dev.       Freq.
------------+------------------------------------
  Albuminur |         325           0       1,267
  CKD stage |         106           0         409
  CKD stage |           0           0          19
   Dialysis |          28           0          77
  Transplan |          73           0         269
  KRT uncle |          13           0          38
------------+------------------------------------
      Total |   229.63733   120.73355       2,079

    Variable |        Obs        Mean    Std. Dev.       Min        Max
-------------+---------------------------------------------------------
over~18_days |      2,079         545           0        545        545

            |     Summary of total_icd19_days
  CKD group |        Mean   Std. Dev.       Freq.
------------+------------------------------------
  Albuminur |         288           0       1,267
  CKD stage |         101           0         409
  CKD stage |           9           0          19
   Dialysis |          20           0          77
  Transplan |          75           0         269
  KRT uncle |           8           0          38
------------+------------------------------------
      Total |    206.0582   104.13919       2,079

    Variable |        Obs        Mean    Std. Dev.       Min        Max
-------------+---------------------------------------------------------
over~19_days |      2,079         501           0        501        501

            |     Summary of total_icd20_days
  CKD group |        Mean   Std. Dev.       Freq.
------------+------------------------------------
  Albuminur |         288           0       1,267
  CKD stage |         113           0         409
  CKD stage |           6           0          19
   Dialysis |          21           0          77
  Transplan |          58           0         269
  KRT uncle |          25           0          38
------------+------------------------------------
      Total |   206.53968   104.26091       2,079

    Variable |        Obs        Mean    Std. Dev.       Min        Max
-------------+---------------------------------------------------------
over~20_days |      2,079         511           0        511        511

            |     Summary of total_icd21_days
  CKD group |        Mean   Std. Dev.       Freq.
------------+------------------------------------
  Albuminur |         256           0       1,267
  CKD stage |         120           0         409
  CKD stage |           8           0          19
   Dialysis |          11           0          77
  Transplan |          66           0         269
  KRT uncle |          15           0          38
------------+------------------------------------
      Total |   188.91534   87.520417       2,079

    Variable |        Obs        Mean    Std. Dev.       Min        Max
-------------+---------------------------------------------------------
over~21_days |      2,079         476           0        476        476

            |     Summary of total_icd22_days
  CKD group |        Mean   Std. Dev.       Freq.
------------+------------------------------------
  Albuminur |         271           0       1,267
  CKD stage |          82           0         409
  CKD stage |           4           0          19
   Dialysis |          29           0          77
  Transplan |          76           0         269
  KRT uncle |          23           0          38
------------+------------------------------------
      Total |   192.65127   98.783983       2,079

    Variable |        Obs        Mean    Std. Dev.       Min        Max
-------------+---------------------------------------------------------
over~22_days |      2,079         485           0        485        485

. 
. 
. 
. **Potential effect modifiers
. * Ethnicity
. * 1 = White ethnicities (white British, white Irish, with other)
. * 2 = Mixed ethnicities (white & black Caribbean, white & black African, whit
> e & Asian, other mixed ethnicities)
. * 3 = South Asian ethnicities (Indian, Pakistani, Bangladeshi, other South As
> ian)
. * 4 = Black ethnicities (black Caribbean, black African, other black)
. * 5 = Other ethnicities (Chinese, all other ethnicities)
. * . = Unknown ethnicity
. replace ethnicity = . if ethnicity==.
(0 real changes made)

. replace ethnicity=6 if ethnicity==2
(88 real changes made)

. replace ethnicity=2 if ethnicity==3
(77 real changes made)

. replace ethnicity=3 if ethnicity==4
(73 real changes made)

. replace ethnicity=4 if ethnicity==6
(88 real changes made)

. replace ethnicity=6 if ethnicity==.
(544 real changes made)

. label define ethnicity  1 "White"                                       ///
>                                                 2 "South Asian"              
>            ///                                             
>                                                 3 "Black"                    
>                    ///
>                                                 4 "Mixed"                    
>                    ///
>                                                 5 "Other"                    
>                    ///
>                                                 6 "Unknown"     

. label values ethnicity ethnicity

. 
. * Index of multiple deprivation
. * Ordered 1-5 from most deprived to least deprived
. label define imd 1 "1 Most deprived" 2 "2" 3 "3" 4 "4" 5 "5 Least deprived"

. label values imd imd

. 
. * Region
. rename region region_string

. gen region = 1 if region_string=="East Midlands"
(1,838 missing values generated)

. replace region = 2 if region_string=="East"
(228 real changes made)

. replace region = 3 if region_string=="London"
(408 real changes made)

. replace region = 4 if region_string=="North East"
(203 real changes made)

. replace region = 5 if region_string=="North West"
(190 real changes made)

. replace region = 6 if region_string=="South East"
(198 real changes made)

. replace region = 7 if region_string=="South West"
(191 real changes made)

. replace region = 8 if region_string=="West Midlands"
(204 real changes made)

. replace region = 9 if region_string=="Yorkshire and The Humber"
(216 real changes made)

. label define region     1 "East Midlands"                                    
>    ///
>                                                 2 "East"                     
>                                    ///
>                                                 3 "London"                   
>                                    ///
>                                                 4 "North East"               
>                            ///
>                                                 5 "North West"               
>                            ///
>                                                 6 "South East"               
>                            ///
>                                                 7 "South West"               
>                            ///
>                                                 8 "West Midlands"            
>                            ///
>                                                 9 "Yorkshire and The Humber" 
>            

. label values region region

. label var region "Region"

. 
. * Urban/rural
. replace rural_urban=. if rural_urban<1|rural_urban>8
(0 real changes made)

. label define rural_urban 1 "Urban major conurbation"                         
>                    ///
>                                                  2 "Urban minor conurbation" 
>                                            ///
>                                                  3 "Urban city and town"     
>                                                    ///
>                                                  4 "Urban city and town in a 
> sparse setting"            ///
>                                                  5 "Rural town and fringe"   
>                                                    ///
>                                                  6 "Rural town and fringe in 
> a sparse setting"          ///
>                                                  7 "Rural village and dispers
> ed"                                        ///
>                                                  8 "Rural village and dispers
> ed in a sparse setting"

. label values rural_urban rural_urban

. * Urban (binary)
. * Urban = 1-4 + missing, Rural = 5-8
. generate urban=.
(2,079 missing values generated)

. replace urban=1 if rural_urban<=4|rural_urban==.
(831 real changes made)

. replace urban=0 if rural_urban>4 & rural_urban!=.
(1,248 real changes made)

. label var urban "Urban/rural"

. label define urban 0 "Rural" 1 "Urban"

. label values urban urban

. drop rural_urban

. 
. *Age bands for standardisation
. egen agecat = cut(age), at(0,18,20,25,30,35,40,45,50,55,60,65,70,75,80,85,90,
> 200)

. drop if agecat==0
(0 observations deleted)

. 
. *Age-standardisation weights (European Standard Population 2013)
. gen weight = .
(2,079 missing values generated)

. replace weight = 0.027261 if agecat==18
(45 real changes made)

. replace weight = 0.074349 if agecat==20
(158 real changes made)

. replace weight = 0.074349 if agecat==25
(153 real changes made)

. replace weight = 0.080545 if agecat==30
(201 real changes made)

. replace weight = 0.086741 if agecat==35
(175 real changes made)

. replace weight = 0.086741 if agecat==40
(157 real changes made)

. replace weight = 0.086741 if agecat==45
(195 real changes made)

. replace weight = 0.086741 if agecat==50
(175 real changes made)

. replace weight = 0.080545 if agecat==55
(181 real changes made)

. replace weight = 0.074349 if agecat==60
(157 real changes made)

. replace weight = 0.068154 if agecat==65
(133 real changes made)

. replace weight = 0.061958 if agecat==70
(136 real changes made)

. replace weight = 0.049566 if agecat==75
(81 real changes made)

. replace weight = 0.030979 if agecat==80
(70 real changes made)

. replace weight = 0.018587 if agecat==85
(34 real changes made)

. replace weight = 0.012392 if agecat==90
(28 real changes made)

. 
. 
. *Age standardised counts for each non-binary healthcare resource outcomes
. foreach aggregate of varlist hospital_days critical_care_days emergency_days 
> op_appts neph_appts tx_appts gp_interactions icd1_days icd2_days icd3_days ic
> d4_days icd5_days icd6_days icd7_days icd8_days icd9_days icd10_days icd11_da
> ys icd12_days icd13_days icd14_days icd15_days icd16_days icd17_days icd18_da
> ys icd19_days icd20_days icd21_days icd22_days {
  2. replace `aggregate' = `aggregate' * weight
  3. }
variable hospital_days was byte now float
(176 real changes made)
variable critical_care_days was byte now float
(151 real changes made)
variable emergency_days was byte now float
(194 real changes made)
variable op_appts was byte now float
(159 real changes made)
variable neph_appts was byte now float
(172 real changes made)
variable tx_appts was byte now float
(149 real changes made)
variable gp_interactions was byte now float
(196 real changes made)
variable icd1_days was byte now float
(155 real changes made)
variable icd2_days was byte now float
(192 real changes made)
variable icd3_days was byte now float
(173 real changes made)
variable icd4_days was byte now float
(202 real changes made)
variable icd5_days was byte now float
(184 real changes made)
variable icd6_days was byte now float
(174 real changes made)
variable icd7_days was byte now float
(163 real changes made)
variable icd8_days was byte now float
(171 real changes made)
variable icd9_days was byte now float
(160 real changes made)
variable icd10_days was byte now float
(172 real changes made)
variable icd11_days was byte now float
(186 real changes made)
variable icd12_days was byte now float
(183 real changes made)
variable icd13_days was byte now float
(173 real changes made)
variable icd14_days was byte now float
(193 real changes made)
variable icd15_days was byte now float
(193 real changes made)
variable icd16_days was byte now float
(182 real changes made)
variable icd17_days was byte now float
(177 real changes made)
variable icd18_days was byte now float
(190 real changes made)
variable icd19_days was byte now float
(183 real changes made)
variable icd20_days was byte now float
(175 real changes made)
variable icd21_days was byte now float
(165 real changes made)
variable icd22_days was byte now float
(166 real changes made)

. 
. * Create variable for age-standardised total # of each aggregated outcome
. * `var'_`aggregate' = age-standardised total # of each aggregated outcome ove
> rall stratified by ethnicity/imd/region/urban
. * `var'_`aggregate'_ckd = age-standardised total # of each aggregated outcome
>  in each CKD group stratified by ethnicity/imd/region/urban
. foreach aggregate of varlist hospital_days critical_care_days emergency_days 
> op_appts neph_appts tx_appts gp_interactions icd1_days icd2_days icd3_days ic
> d4_days icd5_days icd6_days icd7_days icd8_days icd9_days icd10_days icd11_da
> ys icd12_days icd13_days icd14_days icd15_days icd16_days icd17_days icd18_da
> ys icd19_days icd20_days icd21_days icd22_days {
  2. egen overall_std_`aggregate' = total(`aggregate')
  3. bysort ckd_group: egen std_`aggregate' = total(`aggregate')
  4. foreach var of varlist ethnicity imd region urban {
  5. bysort `var': egen `var'_`aggregate' = total(`aggregate')
  6. bysort `var' ckd_group: egen `var'_`aggregate'_ckd = total(`aggregate')
  7. }
  8. }

. 
. foreach binary of varlist fistula_formation pd_insertion blood_pressure album
> inuria creatinine icd1 icd2 icd3 icd4 icd5 icd6 icd7 icd8 icd9 icd10 icd11 ic
> d12 icd13 icd14 icd15 icd16 icd17 icd18 icd19 icd20 icd21 icd22 {
  2. gen esp_`binary' = `binary' * weight
  3. egen overall_std_`binary' = total(esp_`binary')
  4. bysort ckd_group: egen std_`binary' = total(esp_`binary')
  5. foreach var of varlist ethnicity imd region urban {
  6. bysort `var': egen `var'_`binary' = total(esp_`binary')
  7. bysort `var' ckd_group: egen `var'_`binary'_ckd = total(esp_`binary')
  8. }
  9. }

. 
. *Merge cost data
. save "./output/`dataset'_ckd_complete.dta", replace
(note: file ./output/2017_ckd_complete.dta not found)
file ./output/2017_ckd_complete.dta saved

. capture noisily import delimited ./output/costs_`dataset'.csv, clear
(7 vars, 500 obs)

. keep patient_id apcs_cost ec_cost opa_cost

. merge 1:1 patient_id using ./output/`dataset'_ckd_complete
(note: variable patient_id was int, now long to accommodate using data's
       values)

    Result                           # of obs.
    -----------------------------------------
    not matched                         2,575
        from master                       498  (_merge==1)
        from using                      2,077  (_merge==2)

    matched                                 2  (_merge==3)
    -----------------------------------------

. drop if _merge==1
(498 observations deleted)

. foreach cost of varlist apcs_cost ec_cost opa_cost {
  2. sum `cost', d
  3. bysort ckd_group: egen total_`cost' = total(`cost')
  4. egen overall_`cost' = total(`cost')
  5. tab ckd_group, sum(total_`cost')
  6. sum overall_`cost'
  7. foreach var of varlist ethnicity imd region urban {
  8. bysort `var': egen `var'_`cost' = total(`cost')
  9. bysort `var' ckd_group: egen `var'_`cost'_ckd = total(`cost')
 10. }
 11. }

                          apcs_cost
-------------------------------------------------------------
no observations

            |     Summary of total_apcs_cost
  CKD group |        Mean   Std. Dev.       Freq.
------------+------------------------------------
  Albuminur |           0           0       1,267
  CKD stage |           0           0         409
  CKD stage |           0           0          19
   Dialysis |           0           0          77
  Transplan |           0           0         269
  KRT uncle |           0           0          38
------------+------------------------------------
      Total |           0           0       2,079

    Variable |        Obs        Mean    Std. Dev.       Min        Max
-------------+---------------------------------------------------------
overall_ap~t |      2,079           0           0          0          0

                           ec_cost
-------------------------------------------------------------
no observations

            |      Summary of total_ec_cost
  CKD group |        Mean   Std. Dev.       Freq.
------------+------------------------------------
  Albuminur |           0           0       1,267
  CKD stage |           0           0         409
  CKD stage |           0           0          19
   Dialysis |           0           0          77
  Transplan |           0           0         269
  KRT uncle |           0           0          38
------------+------------------------------------
      Total |           0           0       2,079

    Variable |        Obs        Mean    Std. Dev.       Min        Max
-------------+---------------------------------------------------------
overall_ec~t |      2,079           0           0          0          0

                          opa_cost
-------------------------------------------------------------
no observations

            |      Summary of total_opa_cost
  CKD group |        Mean   Std. Dev.       Freq.
------------+------------------------------------
  Albuminur |           0           0       1,267
  CKD stage |           0           0         409
  CKD stage |           0           0          19
   Dialysis |           0           0          77
  Transplan |           0           0         269
  KRT uncle |           0           0          38
------------+------------------------------------
      Total |           0           0       2,079

    Variable |        Obs        Mean    Std. Dev.       Min        Max
-------------+---------------------------------------------------------
overall_op~t |      2,079           0           0          0          0

. save "./output/`dataset'_ckd_complete.dta", replace
file ./output/2017_ckd_complete.dta saved

. 
. log close
      name:  <unnamed>
       log:  /workspace/logs/2017_ckd_complete.log
  log type:  text
 closed on:   7 Jun 2024, 10:22:03
-------------------------------------------------------------------------------
