-------------------------------------------------------------------------------
      name:  <unnamed>
       log:  /workspace/logs/2017_ckd_complete.log
  log type:  text
 opened on:  29 Apr 2024, 12:45:56

. clear

. 
. *Merge `dataset'_ckd with `dataset'_ckd_complete
. capture noisily import delimited ./output/`dataset'_ckd.csv, clear
(8 vars, 21,105 obs)

. tempfile `dataset'_ckd

. save ``dataset'_ckd', replace
(note: file /tmp/St00015.000001 not found)
file /tmp/St00015.000001 saved

. capture noisily import delimited ./output/input_`dataset'_ckd_complete.csv, c
> lear
(104 vars, 50,000 obs)

. merge 1:1 patient_id using ``dataset'_ckd'

    Result                           # of obs.
    -----------------------------------------
    not matched                        66,855
        from master                    47,875  (_merge==1)
        from using                     18,980  (_merge==2)

    matched                             2,125  (_merge==3)
    -----------------------------------------

. keep if _merge==3
(66,855 observations deleted)

. drop _merge

. tempfile `dataset'_ckd_complete

. save ``dataset'_ckd_complete', replace
(note: file /tmp/St00015.000002 not found)
file /tmp/St00015.000002 saved

. 
. /*Generate dummy data
> cd ckd-healthcare-use
> capture noisily import delimited ./output/2017_ckd.csv, clear
> tempfile 2017_ckd
> save ./output/2017_ckd, replace
> capture noisily import delimited ./output/input_2017_ckd_complete.csv, clear
> merge 1:1 patient_id using ./output/2017_ckd
> keep if _merge==3
> drop _merge
> tempfile 2017_ckd_complete
> save ./output/2017_ckd_complete, replace
> */
. 
. *CKD stage classification
. foreach var of varlist  dialysis_baseline_primary_care  ///
>                                                 dialysis_baseline_icd_10     
>            ///
>                                                 dialysis_baseline_opcs_4     
>            ///
>                                                 dialysis_baseline_date       
>            ///
>                                                 kt_baseline_primary_care     
>            ///
>                                                 kt_baseline_icd_10           
>                    ///
>                                                 kt_baseline_opcs_4           
>                    {
  2.         drop `var'
  3.         }

. tab modality_baseline, m

modality_baseline |      Freq.     Percent        Cum.
------------------+-----------------------------------
         Dialysis |        222       10.45       10.45
Kidney transplant |        209        9.84       20.28
 Modality unclear |         46        2.16       22.45
          Pre KRT |      1,648       77.55      100.00
------------------+-----------------------------------
            Total |      2,125      100.00

. *To reduce misclassification of dialysis, anyone with eGFR >15 with modality_
> baseline=="Dialysis" will be reclassified as non-dialysis (e.g. they may have
>  received acute dialysis and recovered)
. *For modality_baseline="Modality unclear" (i.e. whose dialysis and kidney tra
> nsplant baseline dates are identical), those with eGFR <15 will be assumed to
>  be on dialysis and those >15 as kidney transplant
. egen esrd_egfr = cut(baseline_egfr), at (0, 15, 5000)
(858 missing values generated)

. recode esrd_egfr 0=1 15=0
(esrd_egfr: 1267 changes made)

. tab esrd_egfr, m

  esrd_egfr |      Freq.     Percent        Cum.
------------+-----------------------------------
          0 |      1,267       59.62       59.62
          . |        858       40.38      100.00
------------+-----------------------------------
      Total |      2,125      100.00

. gen dialysis = 0

. replace dialysis = 1 if modality_baseline=="Dialysis"
(222 real changes made)

. replace dialysis = 1 if modality_baseline=="Modality unclear" & esrd_egfr!=.
(29 real changes made)

. replace dialysis = 0 if esrd_egfr==0
(145 real changes made)

. gen kidney_transplant = 0

. replace kidney_transplant = 1 if kidney_transplant_baseline_date!=""
(297 real changes made)

. replace kidney_transplant = 0 if dialysis==1
(13 real changes made)

. gen modality_unclear = 0

. replace modality_unclear = 1 if modality_baseline=="Modality unclear"
(46 real changes made)

. replace modality_unclear = 0 if dialysis==1
(0 real changes made)

. replace modality_unclear = 0 if kidney_transplant==1
(8 real changes made)

. tab modality_baseline dialysis

                  |       dialysis
modality_baseline |         0          1 |     Total
------------------+----------------------+----------
         Dialysis |       116        106 |       222 
Kidney transplant |       209          0 |       209 
 Modality unclear |        46          0 |        46 
          Pre KRT |     1,648          0 |     1,648 
------------------+----------------------+----------
            Total |     2,019        106 |     2,125 

. tab modality_baseline kidney_transplant

                  |   kidney_transplant
modality_baseline |         0          1 |     Total
------------------+----------------------+----------
         Dialysis |       205         17 |       222 
Kidney transplant |       174         35 |       209 
 Modality unclear |        38          8 |        46 
          Pre KRT |     1,424        224 |     1,648 
------------------+----------------------+----------
            Total |     1,841        284 |     2,125 

. tab modality_baseline modality_unclear

                  |   modality_unclear
modality_baseline |         0          1 |     Total
------------------+----------------------+----------
         Dialysis |       222          0 |       222 
Kidney transplant |       209          0 |       209 
 Modality unclear |         8         38 |        46 
          Pre KRT |     1,648          0 |     1,648 
------------------+----------------------+----------
            Total |     2,087         38 |     2,125 

. tab dialysis kidney_transplant

           |   kidney_transplant
  dialysis |         0          1 |     Total
-----------+----------------------+----------
         0 |     1,735        284 |     2,019 
         1 |       106          0 |       106 
-----------+----------------------+----------
     Total |     1,841        284 |     2,125 

. egen ckd_group = cut(baseline_egfr), at(0, 30, 60, 5000)
(858 missing values generated)

. recode ckd_group 0=3 30=2 60=1
(ckd_group: 1267 changes made)

. replace ckd_group = 4 if dialysis==1
(106 real changes made)

. replace ckd_group = 5 if kidney_transplant==1
(284 real changes made)

. replace ckd_group = 6 if modality_unclear==1
(38 real changes made)

. *ckd_group==. are those with albuminuria without available eGFR measurement o
> r code for KRT
. replace ckd_group = 1 if ckd_group==.
(632 real changes made)

. label define ckd_group 1 "Albuminuria" 2 "CKD stage 3" 3 "CKD stage 4/5" 4 "D
> ialysis" 5 "Transplant" 6 "KRT unclear modality"

. label values ckd_group ckd_group

. label var ckd_group "CKD group"

. tab ckd_group, m

           CKD group |      Freq.     Percent        Cum.
---------------------+-----------------------------------
         Albuminuria |      1,296       60.99       60.99
         CKD stage 3 |        386       18.16       79.15
       CKD stage 4/5 |         15        0.71       79.86
            Dialysis |        106        4.99       84.85
          Transplant |        284       13.36       98.21
KRT unclear modality |         38        1.79      100.00
---------------------+-----------------------------------
               Total |      2,125      100.00

. drop if ckd_group==.
(0 observations deleted)

. tab ckd_group modality_baseline

                     |              modality_baseline
           CKD group |  Dialysis  Kidney ..  Modalit..    Pre KRT |     Total
---------------------+--------------------------------------------+----------
         Albuminuria |        62        142          0      1,092 |     1,296 
         CKD stage 3 |        35         31          0        320 |       386 
       CKD stage 4/5 |         2          1          0         12 |        15 
            Dialysis |       106          0          0          0 |       106 
          Transplant |        17         35          8        224 |       284 
KRT unclear modality |         0          0         38          0 |        38 
---------------------+--------------------------------------------+----------
               Total |       222        209         46      1,648 |     2,125 

. 
. *Dialysis & kidney transplant outcome classification
. foreach var of varlist  dialysis_outcome_primary_care   ///
>                                                 dialysis_outcome_icd_10      
>            ///
>                                                 dialysis_outcome_opcs_4      
>            ///
>                                                 dialysis_outcome_date        
>            ///
>                                                 kt_outcome_primary_care      
>            ///
>                                                 kt_outcome_icd_10            
>                    ///
>                                                 kt_outcome_opcs_4            
>                    ///
>                                                 kidney_transplant_outcome_dat
> e  ///
>                                                 died                         
>                            {
  2.         drop `var'
  3.         }

. tab ckd_group modality_outcome, m

                     |              modality_outcome
           CKD group |  Deceased   Dialysis  Kidney ..  Modalit.. |     Total
---------------------+--------------------------------------------+----------
         Albuminuria |       145         58         56         13 |     1,296 
         CKD stage 3 |        37         18         18          5 |       386 
       CKD stage 4/5 |         2          0          0          0 |        15 
            Dialysis |        16          2          2          2 |       106 
          Transplant |        22         22         19          4 |       284 
KRT unclear modality |         4          2          0          0 |        38 
---------------------+--------------------------------------------+----------
               Total |       226        102         95         24 |     2,125 


                     | modality_o
                     |   utcome
           CKD group | Unchanged |     Total
---------------------+-----------+----------
         Albuminuria |     1,024 |     1,296 
         CKD stage 3 |       308 |       386 
       CKD stage 4/5 |        13 |        15 
            Dialysis |        84 |       106 
          Transplant |       217 |       284 
KRT unclear modality |        32 |        38 
---------------------+-----------+----------
               Total |     1,678 |     2,125 

. 
. *eGFR outcome classification based on updated mean eGFR over previous 18 mont
> hs by the end of year
. gen sex = 1 if male == "Male"
(1,096 missing values generated)

. replace sex = 0 if male == "Female"
(1,096 real changes made)

. label define sex 0"Female" 1"Male"

. label values sex sex

. replace creatinine_outcome = . if !inrange(creatinine_outcome, 20, 3000)
(937 real changes made, 937 to missing)

. gen mgdl_creatinine_outcome = creatinine_outcome/88.4
(937 missing values generated)

. gen min_creatinine_outcome=.
(2,125 missing values generated)

. replace min_creatinine_outcome = mgdl_creatinine_outcome/0.7 if sex==0
(613 real changes made)

. replace min_creatinine_outcome = mgdl_creatinine_outcome/0.9 if sex==1
(575 real changes made)

. replace min_creatinine_outcome = min_creatinine_outcome^-0.329  if sex==0
(613 real changes made)

. replace min_creatinine_outcome = min_creatinine_outcome^-0.411  if sex==1
(575 real changes made)

. replace min_creatinine_outcome = 1 if min_creatinine_outcome<1
(759 real changes made)

. gen max_creatinine_outcome=.
(2,125 missing values generated)

. replace max_creatinine_outcome = mgdl_creatinine_outcome/0.7 if sex==0
(613 real changes made)

. replace max_creatinine_outcome = mgdl_creatinine_outcome/0.9 if sex==1
(575 real changes made)

. replace max_creatinine_outcome = max_creatinine_outcome^-1.209
(1,188 real changes made)

. replace max_creatinine_outcome = 1 if max_creatinine_outcome>1
(1,366 real changes made)

. gen egfr_outcome = min_creatinine_outcome*max_creatinine_outcome*141
(937 missing values generated)

. replace egfr_outcome = egfr_outcome*(0.993^age)
(1,188 real changes made)

. replace egfr_outcome = egfr_outcome*1.018 if sex==0
(613 real changes made)

. drop creatinine_outcome

. drop mgdl_creatinine_outcome

. drop min_creatinine_outcome

. drop max_creatinine_outcome

. egen egfr_end = cut(egfr_outcome), at(0, 30, 60, 5000)
(937 missing values generated)

. recode egfr_end 0=3 30=2 60=1
(egfr_end: 1188 changes made)

. label define egfr_end 1 "≥60" 2 "30-59" 3 "<30"

. label values egfr_end egfr_end

. label var egfr_end "Final eGFR"

. gen ckd_progression = 0

. replace ckd_progression = 1 if egfr_end==2 & ckd_group==1
(171 real changes made)

. replace ckd_progression = 2 if egfr_end==3 & ckd_group==1
(8 real changes made)

. replace ckd_progression = 2 if egfr_end==3 & ckd_group==2
(4 real changes made)

. egen esrd_egfr_end = cut(egfr_outcome), at (0, 15, 5000)
(937 missing values generated)

. recode esrd_egfr_end 0=1 15=0
(esrd_egfr_end: 1188 changes made)

. tab esrd_egfr_end, m

esrd_egfr_e |
         nd |      Freq.     Percent        Cum.
------------+-----------------------------------
          0 |      1,188       55.91       55.91
          . |        937       44.09      100.00
------------+-----------------------------------
      Total |      2,125      100.00

. gen dialysis_outcome = 0

. replace dialysis_outcome = 1 if modality_outcome=="Dialysis"
(102 real changes made)

. replace dialysis_outcome = 1 if modality_outcome=="Modality unclear" & esrd_e
> gfr_end==1
(0 real changes made)

. gen kidney_transplant_outcome = 0

. replace kidney_transplant_outcome = 1 if modality_outcome=="Kidney transplant
> "
(95 real changes made)

. replace kidney_transplant_outcome = 1 if modality_outcome=="Modality unclear"
>  & esrd_egfr_end==0
(15 real changes made)

. replace ckd_progression = 5 if modality_outcome=="Modality unclear"
(24 real changes made)

. replace ckd_progression = 3 if dialysis_outcome==1
(102 real changes made)

. replace ckd_progression = 4 if kidney_transplant_outcome==1
(110 real changes made)

. replace ckd_progression = 6 if modality_outcome=="Deceased"
(226 real changes made)

. label define ckd_progression 0 "No progression" 1 "CKD 3" 2 "CKD 4/5 pre-KRT"
>  3 "Dialysis" 4 "Kidney transplant" 5 "KRT unclear modality" 6 "Deceased"

. label values ckd_progression ckd_progression

. label var ckd_progression "CKD progression"

. tab ckd_progression, m

     CKD progression |      Freq.     Percent        Cum.
---------------------+-----------------------------------
      No progression |      1,529       71.95       71.95
               CKD 3 |        142        6.68       78.64
     CKD 4/5 pre-KRT |          7        0.33       78.96
            Dialysis |        102        4.80       83.76
   Kidney transplant |        110        5.18       88.94
KRT unclear modality |          9        0.42       89.36
            Deceased |        226       10.64      100.00
---------------------+-----------------------------------
               Total |      2,125      100.00

. 
. *eGFR cut-offs to investigate timing of access formation
. egen access_egfr = cut(baseline_egfr), at (0, 15, 5000)
(858 missing values generated)

. recode access_egfr 0=1 15=2
(access_egfr: 1267 changes made)

. replace access_egfr=0 if ckd_group==4
(106 real changes made)

. replace access_egfr=3 if access_egfr==.
(752 real changes made)

. label define access_egfr 0 "Dialysis" 1 "eGFR 0-14" 2 "eGFR >= 15" 3 "Unknown
> "

. label values access_egfr access_egfr

. 
. *Totals for non-binary healthcare resource outcomes (including by month)
. foreach aggregate of varlist hospital_days critical_care_days emergency_days 
> op_appts neph_appts tx_appts gp_interactions icd1_days icd2_days icd3_days ic
> d4_days icd5_days icd6_days icd7_days icd8_days icd9_days icd10_days icd11_da
> ys icd12_days icd13_days icd14_days icd15_days icd16_days icd17_days icd18_da
> ys icd19_days icd20_days icd21_days icd22_days {
  2. bysort ckd_group: egen total_`aggregate' = total(`aggregate')
  3. egen overall_`aggregate' = total(`aggregate')
  4. tab ckd_group, sum(total_`aggregate')
  5. sum overall_`aggregate'
  6. }

            |   Summary of total_hospital_days
  CKD group |        Mean   Std. Dev.       Freq.
------------+------------------------------------
  Albuminur |         283           0       1,296
  CKD stage |          93           0         386
  CKD stage |           0           0          15
   Dialysis |          34           0         106
  Transplan |          98           0         284
  KRT uncle |           6           0          38
------------+------------------------------------
      Total |   204.39059   99.934851       2,125

    Variable |        Obs        Mean    Std. Dev.       Min        Max
-------------+---------------------------------------------------------
overall_ho~s |      2,125         514           0        514        514

            | Summary of total_critical_care_days
  CKD group |        Mean   Std. Dev.       Freq.
------------+------------------------------------
  Albuminur |         285           0       1,296
  CKD stage |          72           0         386
  CKD stage |          11           0          15
   Dialysis |          38           0         106
  Transplan |          75           0         284
  KRT uncle |          13           0          38
------------+------------------------------------
      Total |   199.12424   107.99097       2,125

    Variable |        Obs        Mean    Std. Dev.       Min        Max
-------------+---------------------------------------------------------
overall_cr~s |      2,125         494           0        494        494

            |   Summary of total_emergency_days
  CKD group |        Mean   Std. Dev.       Freq.
------------+------------------------------------
  Albuminur |         345           0       1,296
  CKD stage |         110           0         386
  CKD stage |           1           0          15
   Dialysis |          18           0         106
  Transplan |          54           0         284
  KRT uncle |          18           0          38
------------+------------------------------------
      Total |   238.83435   134.78707       2,125

    Variable |        Obs        Mean    Std. Dev.       Min        Max
-------------+---------------------------------------------------------
overall_em~s |      2,125         546           0        546        546

            |      Summary of total_op_appts
  CKD group |        Mean   Std. Dev.       Freq.
------------+------------------------------------
  Albuminur |         315           0       1,296
  CKD stage |          75           0         386
  CKD stage |           7           0          15
   Dialysis |          34           0         106
  Transplan |          55           0         284
  KRT uncle |          10           0          38
------------+------------------------------------
      Total |   215.01129   125.61445       2,125

    Variable |        Obs        Mean    Std. Dev.       Min        Max
-------------+---------------------------------------------------------
overall_op~s |      2,125         496           0        496        496

            |     Summary of total_neph_appts
  CKD group |        Mean   Std. Dev.       Freq.
------------+------------------------------------
  Albuminur |         295           0       1,296
  CKD stage |          93           0         386
  CKD stage |           0           0          15
   Dialysis |          28           0         106
  Transplan |          93           0         284
  KRT uncle |          17           0          38
------------+------------------------------------
      Total |   210.93835   106.56745       2,125

    Variable |        Obs        Mean    Std. Dev.       Min        Max
-------------+---------------------------------------------------------
overall_ne~s |      2,125         526           0        526        526

            |      Summary of total_tx_appts
  CKD group |        Mean   Std. Dev.       Freq.
------------+------------------------------------
  Albuminur |         331           0       1,296
  CKD stage |          79           0         386
  CKD stage |           5           0          15
   Dialysis |          26           0         106
  Transplan |          65           0         284
  KRT uncle |          23           0          38
------------+------------------------------------
      Total |   226.65176    131.1414       2,125

    Variable |        Obs        Mean    Std. Dev.       Min        Max
-------------+---------------------------------------------------------
overall_tx~s |      2,125         529           0        529        529

            |  Summary of total_gp_interactions
  CKD group |        Mean   Std. Dev.       Freq.
------------+------------------------------------
  Albuminur |         350           0       1,296
  CKD stage |          94           0         386
  CKD stage |           4           0          15
   Dialysis |          23           0         106
  Transplan |          63           0         284
  KRT uncle |           4           0          38
------------+------------------------------------
      Total |   240.20047   138.51215       2,125

    Variable |        Obs        Mean    Std. Dev.       Min        Max
-------------+---------------------------------------------------------
overall_gp~s |      2,125         538           0        538        538

            |     Summary of total_icd1_days
  CKD group |        Mean   Std. Dev.       Freq.
------------+------------------------------------
  Albuminur |         339           0       1,296
  CKD stage |         123           0         386
  CKD stage |           4           0          15
   Dialysis |          43           0         106
  Transplan |          70           0         284
  KRT uncle |           7           0          38
------------+------------------------------------
      Total |   240.74635   125.03228       2,125

    Variable |        Obs        Mean    Std. Dev.       Min        Max
-------------+---------------------------------------------------------
overall_ic~s |      2,125         586           0        586        586

            |     Summary of total_icd2_days
  CKD group |        Mean   Std. Dev.       Freq.
------------+------------------------------------
  Albuminur |         308           0       1,296
  CKD stage |          89           0         386
  CKD stage |          11           0          15
   Dialysis |          25           0         106
  Transplan |         106           0         284
  KRT uncle |           9           0          38
------------+------------------------------------
      Total |   219.66259   112.17893       2,125

    Variable |        Obs        Mean    Std. Dev.       Min        Max
-------------+---------------------------------------------------------
overa~2_days |      2,125         548           0        548        548

            |     Summary of total_icd3_days
  CKD group |        Mean   Std. Dev.       Freq.
------------+------------------------------------
  Albuminur |         267           0       1,296
  CKD stage |         102           0         386
  CKD stage |           0           0          15
   Dialysis |          35           0         106
  Transplan |          59           0         284
  KRT uncle |          18           0          38
------------+------------------------------------
      Total |   191.31953   96.442205       2,125

    Variable |        Obs        Mean    Std. Dev.       Min        Max
-------------+---------------------------------------------------------
overa~3_days |      2,125         481           0        481        481

            |     Summary of total_icd4_days
  CKD group |        Mean   Std. Dev.       Freq.
------------+------------------------------------
  Albuminur |         312           0       1,296
  CKD stage |         125           0         386
  CKD stage |           0           0          15
   Dialysis |          30           0         106
  Transplan |          47           0         284
  KRT uncle |          11           0          38
------------+------------------------------------
      Total |   220.96376   117.17672       2,125

    Variable |        Obs        Mean    Std. Dev.       Min        Max
-------------+---------------------------------------------------------
overa~4_days |      2,125         525           0        525        525

            |     Summary of total_icd5_days
  CKD group |        Mean   Std. Dev.       Freq.
------------+------------------------------------
  Albuminur |         348           0       1,296
  CKD stage |         105           0         386
  CKD stage |           1           0          15
   Dialysis |          21           0         106
  Transplan |         130           0         284
  KRT uncle |           0           0          38
------------+------------------------------------
      Total |   249.74071   125.61647       2,125

    Variable |        Obs        Mean    Std. Dev.       Min        Max
-------------+---------------------------------------------------------
overa~5_days |      2,125         605           0        605        605

            |     Summary of total_icd6_days
  CKD group |        Mean   Std. Dev.       Freq.
------------+------------------------------------
  Albuminur |         325           0       1,296
  CKD stage |          80           0         386
  CKD stage |           0           0          15
   Dialysis |          39           0         106
  Transplan |          87           0         284
  KRT uncle |           0           0          38
------------+------------------------------------
      Total |   226.31624   124.32637       2,125

    Variable |        Obs        Mean    Std. Dev.       Min        Max
-------------+---------------------------------------------------------
overa~6_days |      2,125         531           0        531        531

            |     Summary of total_icd7_days
  CKD group |        Mean   Std. Dev.       Freq.
------------+------------------------------------
  Albuminur |         407           0       1,296
  CKD stage |         103           0         386
  CKD stage |           0           0          15
   Dialysis |          34           0         106
  Transplan |          73           0         284
  KRT uncle |           0           0          38
------------+------------------------------------
      Total |     278.384   161.98167       2,125

    Variable |        Obs        Mean    Std. Dev.       Min        Max
-------------+---------------------------------------------------------
overa~7_days |      2,125         617           0        617        617

            |     Summary of total_icd8_days
  CKD group |        Mean   Std. Dev.       Freq.
------------+------------------------------------
  Albuminur |         325           0       1,296
  CKD stage |          79           0         386
  CKD stage |           2           0          15
   Dialysis |          30           0         106
  Transplan |          54           0         284
  KRT uncle |          15           0          38
------------+------------------------------------
      Total |   221.55765    130.0435       2,125

    Variable |        Obs        Mean    Std. Dev.       Min        Max
-------------+---------------------------------------------------------
overa~8_days |      2,125         505           0        505        505

            |     Summary of total_icd9_days
  CKD group |        Mean   Std. Dev.       Freq.
------------+------------------------------------
  Albuminur |         382           0       1,296
  CKD stage |         104           0         386
  CKD stage |           0           0          15
   Dialysis |          26           0         106
  Transplan |          80           0         284
  KRT uncle |           9           0          38
------------+------------------------------------
      Total |     264.016   148.85448       2,125

    Variable |        Obs        Mean    Std. Dev.       Min        Max
-------------+---------------------------------------------------------
overa~9_days |      2,125         601           0        601        601

            |     Summary of total_icd10_days
  CKD group |        Mean   Std. Dev.       Freq.
------------+------------------------------------
  Albuminur |         247           0       1,296
  CKD stage |          68           0         386
  CKD stage |           6           0          15
   Dialysis |          19           0         106
  Transplan |          69           0         284
  KRT uncle |          16           0          38
------------+------------------------------------
      Total |   173.49082   92.802848       2,125

    Variable |        Obs        Mean    Std. Dev.       Min        Max
-------------+---------------------------------------------------------
overa~0_days |      2,125         425           0        425        425

            |     Summary of total_icd11_days
  CKD group |        Mean   Std. Dev.       Freq.
------------+------------------------------------
  Albuminur |         380           0       1,296
  CKD stage |          95           0         386
  CKD stage |           7           0          15
   Dialysis |          26           0         106
  Transplan |          77           0         284
  KRT uncle |           5           0          38
------------+------------------------------------
      Total |   260.73835   150.19791       2,125

    Variable |        Obs        Mean    Std. Dev.       Min        Max
-------------+---------------------------------------------------------
over~11_days |      2,125         590           0        590        590

            |     Summary of total_icd12_days
  CKD group |        Mean   Std. Dev.       Freq.
------------+------------------------------------
  Albuminur |         314           0       1,296
  CKD stage |         109           0         386
  CKD stage |           2           0          15
   Dialysis |          30           0         106
  Transplan |          45           0         284
  KRT uncle |           2           0          38
------------+------------------------------------
      Total |   218.86306   121.29148       2,125

    Variable |        Obs        Mean    Std. Dev.       Min        Max
-------------+---------------------------------------------------------
over~12_days |      2,125         502           0        502        502

            |     Summary of total_icd13_days
  CKD group |        Mean   Std. Dev.       Freq.
------------+------------------------------------
  Albuminur |         394           0       1,296
  CKD stage |          88           0         386
  CKD stage |          12           0          15
   Dialysis |          36           0         106
  Transplan |          84           0         284
  KRT uncle |          11           0          38
------------+------------------------------------
      Total |   269.58212    156.3016       2,125

    Variable |        Obs        Mean    Std. Dev.       Min        Max
-------------+---------------------------------------------------------
over~13_days |      2,125         625           0        625        625

            |     Summary of total_icd14_days
  CKD group |        Mean   Std. Dev.       Freq.
------------+------------------------------------
  Albuminur |         278           0       1,296
  CKD stage |          77           0         386
  CKD stage |           5           0          15
   Dialysis |          26           0         106
  Transplan |          69           0         284
  KRT uncle |           7           0          38
------------+------------------------------------
      Total |   194.21318   105.68206       2,125

    Variable |        Obs        Mean    Std. Dev.       Min        Max
-------------+---------------------------------------------------------
over~14_days |      2,125         462           0        462        462

            |     Summary of total_icd15_days
  CKD group |        Mean   Std. Dev.       Freq.
------------+------------------------------------
  Albuminur |         379           0       1,296
  CKD stage |          56           0         386
  CKD stage |           7           0          15
   Dialysis |          20           0         106
  Transplan |          92           0         284
  KRT uncle |           0           0          38
------------+------------------------------------
      Total |   254.66024   156.47661       2,125

    Variable |        Obs        Mean    Std. Dev.       Min        Max
-------------+---------------------------------------------------------
over~15_days |      2,125         554           0        554        554

            |     Summary of total_icd16_days
  CKD group |        Mean   Std. Dev.       Freq.
------------+------------------------------------
  Albuminur |         335           0       1,296
  CKD stage |         100           0         386
  CKD stage |           0           0          15
   Dialysis |          48           0         106
  Transplan |          78           0         284
  KRT uncle |          21           0          38
------------+------------------------------------
      Total |   235.66965   125.15442       2,125

    Variable |        Obs        Mean    Std. Dev.       Min        Max
-------------+---------------------------------------------------------
over~16_days |      2,125         582           0        582        582

            |     Summary of total_icd17_days
  CKD group |        Mean   Std. Dev.       Freq.
------------+------------------------------------
  Albuminur |         309           0       1,296
  CKD stage |          89           0         386
  CKD stage |          10           0          15
   Dialysis |          13           0         106
  Transplan |         132           0         284
  KRT uncle |          23           0          38
------------+------------------------------------
      Total |     223.392    110.0908       2,125

    Variable |        Obs        Mean    Std. Dev.       Min        Max
-------------+---------------------------------------------------------
over~17_days |      2,125         576           0        576        576

            |     Summary of total_icd18_days
  CKD group |        Mean   Std. Dev.       Freq.
------------+------------------------------------
  Albuminur |         293           0       1,296
  CKD stage |         126           0         386
  CKD stage |           5           0          15
   Dialysis |          30           0         106
  Transplan |          75           0         284
  KRT uncle |           4           0          38
------------+------------------------------------
      Total |   213.20988   102.88473       2,125

    Variable |        Obs        Mean    Std. Dev.       Min        Max
-------------+---------------------------------------------------------
over~18_days |      2,125         533           0        533        533

            |     Summary of total_icd19_days
  CKD group |        Mean   Std. Dev.       Freq.
------------+------------------------------------
  Albuminur |         368           0       1,296
  CKD stage |         107           0         386
  CKD stage |          10           0          15
   Dialysis |          39           0         106
  Transplan |          33           0         284
  KRT uncle |          12           0          38
------------+------------------------------------
      Total |   250.51388   148.82976       2,125

    Variable |        Obs        Mean    Std. Dev.       Min        Max
-------------+---------------------------------------------------------
over~19_days |      2,125         569           0        569        569

            |     Summary of total_icd20_days
  CKD group |        Mean   Std. Dev.       Freq.
------------+------------------------------------
  Albuminur |         307           0       1,296
  CKD stage |         111           0         386
  CKD stage |           3           0          15
   Dialysis |          38           0         106
  Transplan |          80           0         284
  KRT uncle |           7           0          38
------------+------------------------------------
      Total |   220.13035   110.43348       2,125

    Variable |        Obs        Mean    Std. Dev.       Min        Max
-------------+---------------------------------------------------------
over~20_days |      2,125         546           0        546        546

            |     Summary of total_icd21_days
  CKD group |        Mean   Std. Dev.       Freq.
------------+------------------------------------
  Albuminur |         268           0       1,296
  CKD stage |         105           0         386
  CKD stage |          10           0          15
   Dialysis |          29           0         106
  Transplan |          95           0         284
  KRT uncle |          31           0          38
------------+------------------------------------
      Total |   197.28941   90.297179       2,125

    Variable |        Obs        Mean    Std. Dev.       Min        Max
-------------+---------------------------------------------------------
over~21_days |      2,125         538           0        538        538

            |     Summary of total_icd22_days
  CKD group |        Mean   Std. Dev.       Freq.
------------+------------------------------------
  Albuminur |         369           0       1,296
  CKD stage |          84           0         386
  CKD stage |           6           0          15
   Dialysis |          26           0         106
  Transplan |          83           0         284
  KRT uncle |          13           0          38
------------+------------------------------------
      Total |   252.96941   145.93863       2,125

    Variable |        Obs        Mean    Std. Dev.       Min        Max
-------------+---------------------------------------------------------
over~22_days |      2,125         581           0        581        581

. 
. 
. 
. **Potential effect modifiers
. * Ethnicity
. * 1 = White ethnicities (white British, white Irish, with other)
. * 2 = Mixed ethnicities (white & black Caribbean, white & black African, whit
> e & Asian, other mixed ethnicities)
. * 3 = South Asian ethnicities (Indian, Pakistani, Bangladeshi, other South As
> ian)
. * 4 = Black ethnicities (black Caribbean, black African, other black)
. * 5 = Other ethnicities (Chinese, all other ethnicities)
. * . = Unknown ethnicity
. replace ethnicity = . if ethnicity==.
(0 real changes made)

. replace ethnicity=6 if ethnicity==2
(61 real changes made)

. replace ethnicity=2 if ethnicity==3
(76 real changes made)

. replace ethnicity=3 if ethnicity==4
(98 real changes made)

. replace ethnicity=4 if ethnicity==6
(61 real changes made)

. replace ethnicity=6 if ethnicity==.
(571 real changes made)

. label define ethnicity  1 "White"                                       ///
>                                                 2 "South Asian"              
>            ///                                             
>                                                 3 "Black"                    
>                    ///
>                                                 4 "Mixed"                    
>                    ///
>                                                 5 "Other"                    
>                    ///
>                                                 6 "Unknown"     

. label values ethnicity ethnicity

. 
. * Index of multiple deprivation
. * Ordered 1-5 from most deprived to least deprived
. label define imd 1 "1 Most deprived" 2 "2" 3 "3" 4 "4" 5 "5 Least deprived"

. label values imd imd

. 
. * Region
. rename region region_string

. gen region = 1 if region_string=="East Midlands"
(1,935 missing values generated)

. replace region = 2 if region_string=="East"
(246 real changes made)

. replace region = 3 if region_string=="London"
(442 real changes made)

. replace region = 4 if region_string=="North East"
(222 real changes made)

. replace region = 5 if region_string=="North West"
(179 real changes made)

. replace region = 6 if region_string=="South East"
(219 real changes made)

. replace region = 7 if region_string=="South West"
(205 real changes made)

. replace region = 8 if region_string=="West Midlands"
(212 real changes made)

. replace region = 9 if region_string=="Yorkshire and The Humber"
(210 real changes made)

. label define region     1 "East Midlands"                                    
>    ///
>                                                 2 "East"                     
>                                    ///
>                                                 3 "London"                   
>                                    ///
>                                                 4 "North East"               
>                            ///
>                                                 5 "North West"               
>                            ///
>                                                 6 "South East"               
>                            ///
>                                                 7 "South West"               
>                            ///
>                                                 8 "West Midlands"            
>                            ///
>                                                 9 "Yorkshire and The Humber" 
>            

. label values region region

. label var region "Region"

. 
. * Urban/rural
. replace rural_urban=. if rural_urban<1|rural_urban>8
(0 real changes made)

. label define rural_urban 1 "Urban major conurbation"                         
>                    ///
>                                                  2 "Urban minor conurbation" 
>                                            ///
>                                                  3 "Urban city and town"     
>                                                    ///
>                                                  4 "Urban city and town in a 
> sparse setting"            ///
>                                                  5 "Rural town and fringe"   
>                                                    ///
>                                                  6 "Rural town and fringe in 
> a sparse setting"          ///
>                                                  7 "Rural village and dispers
> ed"                                        ///
>                                                  8 "Rural village and dispers
> ed in a sparse setting"

. label values rural_urban rural_urban

. * Urban (binary)
. * Urban = 1-4 + missing, Rural = 5-8
. generate urban=.
(2,125 missing values generated)

. replace urban=1 if rural_urban<=4|rural_urban==.
(837 real changes made)

. replace urban=0 if rural_urban>4 & rural_urban!=.
(1,288 real changes made)

. label var urban "Urban/rural"

. label define urban 0 "Rural" 1 "Urban"

. label values urban urban

. drop rural_urban

. 
. *Age bands for standardisation
. egen agecat = cut(age), at(0,18,20,25,30,35,40,45,50,55,60,65,70,75,80,85,90,
> 200)

. drop if agecat==0
(0 observations deleted)

. 
. *Age-standardisation weights (European Standard Population 2013)
. gen weight = .
(2,125 missing values generated)

. replace weight = 0.027261 if agecat==18
(65 real changes made)

. replace weight = 0.074349 if agecat==20
(169 real changes made)

. replace weight = 0.074349 if agecat==25
(188 real changes made)

. replace weight = 0.080545 if agecat==30
(184 real changes made)

. replace weight = 0.086741 if agecat==35
(159 real changes made)

. replace weight = 0.086741 if agecat==40
(167 real changes made)

. replace weight = 0.086741 if agecat==45
(192 real changes made)

. replace weight = 0.086741 if agecat==50
(173 real changes made)

. replace weight = 0.080545 if agecat==55
(175 real changes made)

. replace weight = 0.074349 if agecat==60
(126 real changes made)

. replace weight = 0.068154 if agecat==65
(131 real changes made)

. replace weight = 0.061958 if agecat==70
(150 real changes made)

. replace weight = 0.049566 if agecat==75
(103 real changes made)

. replace weight = 0.030979 if agecat==80
(75 real changes made)

. replace weight = 0.018587 if agecat==85
(46 real changes made)

. replace weight = 0.012392 if agecat==90
(22 real changes made)

. 
. 
. *Age standardised counts for each non-binary healthcare resource outcomes
. foreach aggregate of varlist hospital_days critical_care_days emergency_days 
> op_appts neph_appts tx_appts gp_interactions icd1_days icd2_days icd3_days ic
> d4_days icd5_days icd6_days icd7_days icd8_days icd9_days icd10_days icd11_da
> ys icd12_days icd13_days icd14_days icd15_days icd16_days icd17_days icd18_da
> ys icd19_days icd20_days icd21_days icd22_days {
  2. replace `aggregate' = `aggregate' * weight
  3. }
variable hospital_days was byte now float
(176 real changes made)
variable critical_care_days was byte now float
(168 real changes made)
variable emergency_days was byte now float
(173 real changes made)
variable op_appts was byte now float
(178 real changes made)
variable neph_appts was byte now float
(175 real changes made)
variable tx_appts was byte now float
(164 real changes made)
variable gp_interactions was byte now float
(179 real changes made)
variable icd1_days was byte now float
(196 real changes made)
variable icd2_days was byte now float
(187 real changes made)
variable icd3_days was byte now float
(171 real changes made)
variable icd4_days was byte now float
(182 real changes made)
variable icd5_days was byte now float
(204 real changes made)
variable icd6_days was byte now float
(178 real changes made)
variable icd7_days was byte now float
(201 real changes made)
variable icd8_days was byte now float
(173 real changes made)
variable icd9_days was byte now float
(191 real changes made)
variable icd10_days was byte now float
(146 real changes made)
variable icd11_days was byte now float
(194 real changes made)
variable icd12_days was byte now float
(170 real changes made)
variable icd13_days was byte now float
(213 real changes made)
variable icd14_days was byte now float
(170 real changes made)
variable icd15_days was byte now float
(187 real changes made)
variable icd16_days was byte now float
(194 real changes made)
variable icd17_days was byte now float
(190 real changes made)
variable icd18_days was byte now float
(184 real changes made)
variable icd19_days was byte now float
(189 real changes made)
variable icd20_days was byte now float
(183 real changes made)
variable icd21_days was byte now float
(195 real changes made)
variable icd22_days was byte now float
(191 real changes made)

. 
. * Create variable for age-standardised total # of each aggregated outcome
. * `var'_`aggregate' = age-standardised total # of each aggregated outcome ove
> rall stratified by ethnicity/imd/region/urban
. * `var'_`aggregate'_ckd = age-standardised total # of each aggregated outcome
>  in each CKD group stratified by ethnicity/imd/region/urban
. foreach aggregate of varlist hospital_days critical_care_days emergency_days 
> op_appts neph_appts tx_appts gp_interactions icd1_days icd2_days icd3_days ic
> d4_days icd5_days icd6_days icd7_days icd8_days icd9_days icd10_days icd11_da
> ys icd12_days icd13_days icd14_days icd15_days icd16_days icd17_days icd18_da
> ys icd19_days icd20_days icd21_days icd22_days {
  2. egen overall_std_`aggregate' = total(`aggregate')
  3. bysort ckd_group: egen std_`aggregate' = total(`aggregate')
  4. foreach var of varlist ethnicity imd region urban {
  5. bysort `var': egen `var'_`aggregate' = total(`aggregate')
  6. bysort `var' ckd_group: egen `var'_`aggregate'_ckd = total(`aggregate')
  7. }
  8. }

. 
. foreach binary of varlist fistula_formation pd_insertion blood_pressure album
> inuria creatinine icd1 icd2 icd3 icd4 icd5 icd6 icd7 icd8 icd9 icd10 icd11 ic
> d12 icd13 icd14 icd15 icd16 icd17 icd18 icd19 icd20 icd21 icd22 {
  2. gen esp_`binary' = `binary' * weight
  3. egen overall_std_`binary' = total(esp_`binary')
  4. bysort ckd_group: egen std_`binary' = total(esp_`binary')
  5. foreach var of varlist ethnicity imd region urban {
  6. bysort `var': egen `var'_`binary' = total(esp_`binary')
  7. bysort `var' ckd_group: egen `var'_`binary'_ckd = total(esp_`binary')
  8. }
  9. }

. 
. *Merge cost data
. save "./output/`dataset'_ckd_complete.dta", replace
(note: file ./output/2017_ckd_complete.dta not found)
file ./output/2017_ckd_complete.dta saved

. capture noisily import delimited ./output/costs_`dataset'.csv, clear
(7 vars, 500 obs)

. keep patient_id apcs_cost ec_cost opa_cost

. merge 1:1 patient_id using ./output/`dataset'_ckd_complete
(note: variable patient_id was int, now long to accommodate using data's
       values)

    Result                           # of obs.
    -----------------------------------------
    not matched                         2,621
        from master                       498  (_merge==1)
        from using                      2,123  (_merge==2)

    matched                                 2  (_merge==3)
    -----------------------------------------

. drop if _merge==1
(498 observations deleted)

. foreach cost of varlist apcs_cost ec_cost opa_cost {
  2. sum `cost', d
  3. bysort ckd_group: egen total_`cost' = total(`cost')
  4. egen overall_`cost' = total(`cost')
  5. tab ckd_group, sum(total_`cost')
  6. sum overall_`cost'
  7. foreach var of varlist ethnicity imd region urban {
  8. bysort `var': egen `var'_`cost' = total(`cost')
  9. bysort `var' ckd_group: egen `var'_`cost'_ckd = total(`cost')
 10. }
 11. }

                          apcs_cost
-------------------------------------------------------------
no observations

            |     Summary of total_apcs_cost
  CKD group |        Mean   Std. Dev.       Freq.
------------+------------------------------------
  Albuminur |           0           0       1,296
  CKD stage |           0           0         386
  CKD stage |           0           0          15
   Dialysis |           0           0         106
  Transplan |           0           0         284
  KRT uncle |           0           0          38
------------+------------------------------------
      Total |           0           0       2,125

    Variable |        Obs        Mean    Std. Dev.       Min        Max
-------------+---------------------------------------------------------
overall_ap~t |      2,125           0           0          0          0

                           ec_cost
-------------------------------------------------------------
no observations

            |      Summary of total_ec_cost
  CKD group |        Mean   Std. Dev.       Freq.
------------+------------------------------------
  Albuminur |           0           0       1,296
  CKD stage |           0           0         386
  CKD stage |           0           0          15
   Dialysis |           0           0         106
  Transplan |           0           0         284
  KRT uncle |           0           0          38
------------+------------------------------------
      Total |           0           0       2,125

    Variable |        Obs        Mean    Std. Dev.       Min        Max
-------------+---------------------------------------------------------
overall_ec~t |      2,125           0           0          0          0

                          opa_cost
-------------------------------------------------------------
no observations

            |      Summary of total_opa_cost
  CKD group |        Mean   Std. Dev.       Freq.
------------+------------------------------------
  Albuminur |           0           0       1,296
  CKD stage |           0           0         386
  CKD stage |           0           0          15
   Dialysis |           0           0         106
  Transplan |           0           0         284
  KRT uncle |           0           0          38
------------+------------------------------------
      Total |           0           0       2,125

    Variable |        Obs        Mean    Std. Dev.       Min        Max
-------------+---------------------------------------------------------
overall_op~t |      2,125           0           0          0          0

. save "./output/`dataset'_ckd_complete.dta", replace
file ./output/2017_ckd_complete.dta saved

. 
. log close
      name:  <unnamed>
       log:  /workspace/logs/2017_ckd_complete.log
  log type:  text
 closed on:  29 Apr 2024, 12:46:10
-------------------------------------------------------------------------------
