-------------------------------------------------------------------------------
      name:  <unnamed>
       log:  /workspace/logs/2018_ckd_complete.log
  log type:  text
 opened on:  29 Apr 2024, 13:18:12

. clear

. 
. *Merge `dataset'_ckd with `dataset'_ckd_complete
. capture noisily import delimited ./output/`dataset'_ckd.csv, clear
(8 vars, 21,015 obs)

. tempfile `dataset'_ckd

. save ``dataset'_ckd', replace
(note: file /tmp/St00015.000001 not found)
file /tmp/St00015.000001 saved

. capture noisily import delimited ./output/input_`dataset'_ckd_complete.csv, c
> lear
(104 vars, 50,000 obs)

. merge 1:1 patient_id using ``dataset'_ckd'

    Result                           # of obs.
    -----------------------------------------
    not matched                        66,861
        from master                    47,923  (_merge==1)
        from using                     18,938  (_merge==2)

    matched                             2,077  (_merge==3)
    -----------------------------------------

. keep if _merge==3
(66,861 observations deleted)

. drop _merge

. tempfile `dataset'_ckd_complete

. save ``dataset'_ckd_complete', replace
(note: file /tmp/St00015.000002 not found)
file /tmp/St00015.000002 saved

. 
. /*Generate dummy data
> cd ckd-healthcare-use
> capture noisily import delimited ./output/2017_ckd.csv, clear
> tempfile 2017_ckd
> save ./output/2017_ckd, replace
> capture noisily import delimited ./output/input_2017_ckd_complete.csv, clear
> merge 1:1 patient_id using ./output/2017_ckd
> keep if _merge==3
> drop _merge
> tempfile 2017_ckd_complete
> save ./output/2017_ckd_complete, replace
> */
. 
. *CKD stage classification
. foreach var of varlist  dialysis_baseline_primary_care  ///
>                                                 dialysis_baseline_icd_10     
>            ///
>                                                 dialysis_baseline_opcs_4     
>            ///
>                                                 dialysis_baseline_date       
>            ///
>                                                 kt_baseline_primary_care     
>            ///
>                                                 kt_baseline_icd_10           
>                    ///
>                                                 kt_baseline_opcs_4           
>                    {
  2.         drop `var'
  3.         }

. tab modality_baseline, m

modality_baseline |      Freq.     Percent        Cum.
------------------+-----------------------------------
         Dialysis |        187        9.00        9.00
Kidney transplant |        192        9.24       18.25
 Modality unclear |         43        2.07       20.32
          Pre KRT |      1,655       79.68      100.00
------------------+-----------------------------------
            Total |      2,077      100.00

. *To reduce misclassification of dialysis, anyone with eGFR >15 with modality_
> baseline=="Dialysis" will be reclassified as non-dialysis (e.g. they may have
>  received acute dialysis and recovered)
. *For modality_baseline="Modality unclear" (i.e. whose dialysis and kidney tra
> nsplant baseline dates are identical), those with eGFR <15 will be assumed to
>  be on dialysis and those >15 as kidney transplant
. egen esrd_egfr = cut(baseline_egfr), at (0, 15, 5000)
(823 missing values generated)

. recode esrd_egfr 0=1 15=0
(esrd_egfr: 1254 changes made)

. tab esrd_egfr, m

  esrd_egfr |      Freq.     Percent        Cum.
------------+-----------------------------------
          0 |      1,254       60.38       60.38
          . |        823       39.62      100.00
------------+-----------------------------------
      Total |      2,077      100.00

. gen dialysis = 0

. replace dialysis = 1 if modality_baseline=="Dialysis"
(187 real changes made)

. replace dialysis = 1 if modality_baseline=="Modality unclear" & esrd_egfr!=.
(25 real changes made)

. replace dialysis = 0 if esrd_egfr==0
(145 real changes made)

. gen kidney_transplant = 0

. replace kidney_transplant = 1 if kidney_transplant_baseline_date!=""
(310 real changes made)

. replace kidney_transplant = 0 if dialysis==1
(13 real changes made)

. gen modality_unclear = 0

. replace modality_unclear = 1 if modality_baseline=="Modality unclear"
(43 real changes made)

. replace modality_unclear = 0 if dialysis==1
(0 real changes made)

. replace modality_unclear = 0 if kidney_transplant==1
(5 real changes made)

. tab modality_baseline dialysis

                  |       dialysis
modality_baseline |         0          1 |     Total
------------------+----------------------+----------
         Dialysis |       120         67 |       187 
Kidney transplant |       192          0 |       192 
 Modality unclear |        43          0 |        43 
          Pre KRT |     1,655          0 |     1,655 
------------------+----------------------+----------
            Total |     2,010         67 |     2,077 

. tab modality_baseline kidney_transplant

                  |   kidney_transplant
modality_baseline |         0          1 |     Total
------------------+----------------------+----------
         Dialysis |       176         11 |       187 
Kidney transplant |       157         35 |       192 
 Modality unclear |        38          5 |        43 
          Pre KRT |     1,409        246 |     1,655 
------------------+----------------------+----------
            Total |     1,780        297 |     2,077 

. tab modality_baseline modality_unclear

                  |   modality_unclear
modality_baseline |         0          1 |     Total
------------------+----------------------+----------
         Dialysis |       187          0 |       187 
Kidney transplant |       192          0 |       192 
 Modality unclear |         5         38 |        43 
          Pre KRT |     1,655          0 |     1,655 
------------------+----------------------+----------
            Total |     2,039         38 |     2,077 

. tab dialysis kidney_transplant

           |   kidney_transplant
  dialysis |         0          1 |     Total
-----------+----------------------+----------
         0 |     1,713        297 |     2,010 
         1 |        67          0 |        67 
-----------+----------------------+----------
     Total |     1,780        297 |     2,077 

. egen ckd_group = cut(baseline_egfr), at(0, 30, 60, 5000)
(823 missing values generated)

. recode ckd_group 0=3 30=2 60=1
(ckd_group: 1254 changes made)

. replace ckd_group = 4 if dialysis==1
(67 real changes made)

. replace ckd_group = 5 if kidney_transplant==1
(297 real changes made)

. replace ckd_group = 6 if modality_unclear==1
(38 real changes made)

. *ckd_group==. are those with albuminuria without available eGFR measurement o
> r code for KRT
. replace ckd_group = 1 if ckd_group==.
(612 real changes made)

. label define ckd_group 1 "Albuminuria" 2 "CKD stage 3" 3 "CKD stage 4/5" 4 "D
> ialysis" 5 "Transplant" 6 "KRT unclear modality"

. label values ckd_group ckd_group

. label var ckd_group "CKD group"

. tab ckd_group, m

           CKD group |      Freq.     Percent        Cum.
---------------------+-----------------------------------
         Albuminuria |      1,289       62.06       62.06
         CKD stage 3 |        370       17.81       79.87
       CKD stage 4/5 |         16        0.77       80.65
            Dialysis |         67        3.23       83.87
          Transplant |        297       14.30       98.17
KRT unclear modality |         38        1.83      100.00
---------------------+-----------------------------------
               Total |      2,077      100.00

. drop if ckd_group==.
(0 observations deleted)

. tab ckd_group modality_baseline

                     |              modality_baseline
           CKD group |  Dialysis  Kidney ..  Modalit..    Pre KRT |     Total
---------------------+--------------------------------------------+----------
         Albuminuria |        68        119          0      1,102 |     1,289 
         CKD stage 3 |        38         37          0        295 |       370 
       CKD stage 4/5 |         3          1          0         12 |        16 
            Dialysis |        67          0          0          0 |        67 
          Transplant |        11         35          5        246 |       297 
KRT unclear modality |         0          0         38          0 |        38 
---------------------+--------------------------------------------+----------
               Total |       187        192         43      1,655 |     2,077 

. 
. *Dialysis & kidney transplant outcome classification
. foreach var of varlist  dialysis_outcome_primary_care   ///
>                                                 dialysis_outcome_icd_10      
>            ///
>                                                 dialysis_outcome_opcs_4      
>            ///
>                                                 dialysis_outcome_date        
>            ///
>                                                 kt_outcome_primary_care      
>            ///
>                                                 kt_outcome_icd_10            
>                    ///
>                                                 kt_outcome_opcs_4            
>                    ///
>                                                 kidney_transplant_outcome_dat
> e  ///
>                                                 died                         
>                            {
  2.         drop `var'
  3.         }

. tab ckd_group modality_outcome, m

                     |              modality_outcome
           CKD group |  Deceased   Dialysis  Kidney ..  Modalit.. |     Total
---------------------+--------------------------------------------+----------
         Albuminuria |       137         61         46          6 |     1,289 
         CKD stage 3 |        28         24         14          3 |       370 
       CKD stage 4/5 |         4          4          2          0 |        16 
            Dialysis |         6          6          2          0 |        67 
          Transplant |        37         19          8          3 |       297 
KRT unclear modality |         4          2          0          1 |        38 
---------------------+--------------------------------------------+----------
               Total |       216        116         72         13 |     2,077 


                     | modality_o
                     |   utcome
           CKD group | Unchanged |     Total
---------------------+-----------+----------
         Albuminuria |     1,039 |     1,289 
         CKD stage 3 |       301 |       370 
       CKD stage 4/5 |         6 |        16 
            Dialysis |        53 |        67 
          Transplant |       230 |       297 
KRT unclear modality |        31 |        38 
---------------------+-----------+----------
               Total |     1,660 |     2,077 

. 
. *eGFR outcome classification based on updated mean eGFR over previous 18 mont
> hs by the end of year
. gen sex = 1 if male == "Male"
(1,098 missing values generated)

. replace sex = 0 if male == "Female"
(1,098 real changes made)

. label define sex 0"Female" 1"Male"

. label values sex sex

. replace creatinine_outcome = . if !inrange(creatinine_outcome, 20, 3000)
(937 real changes made, 937 to missing)

. gen mgdl_creatinine_outcome = creatinine_outcome/88.4
(937 missing values generated)

. gen min_creatinine_outcome=.
(2,077 missing values generated)

. replace min_creatinine_outcome = mgdl_creatinine_outcome/0.7 if sex==0
(595 real changes made)

. replace min_creatinine_outcome = mgdl_creatinine_outcome/0.9 if sex==1
(545 real changes made)

. replace min_creatinine_outcome = min_creatinine_outcome^-0.329  if sex==0
(595 real changes made)

. replace min_creatinine_outcome = min_creatinine_outcome^-0.411  if sex==1
(545 real changes made)

. replace min_creatinine_outcome = 1 if min_creatinine_outcome<1
(739 real changes made)

. gen max_creatinine_outcome=.
(2,077 missing values generated)

. replace max_creatinine_outcome = mgdl_creatinine_outcome/0.7 if sex==0
(595 real changes made)

. replace max_creatinine_outcome = mgdl_creatinine_outcome/0.9 if sex==1
(545 real changes made)

. replace max_creatinine_outcome = max_creatinine_outcome^-1.209
(1,140 real changes made)

. replace max_creatinine_outcome = 1 if max_creatinine_outcome>1
(1,338 real changes made)

. gen egfr_outcome = min_creatinine_outcome*max_creatinine_outcome*141
(937 missing values generated)

. replace egfr_outcome = egfr_outcome*(0.993^age)
(1,140 real changes made)

. replace egfr_outcome = egfr_outcome*1.018 if sex==0
(595 real changes made)

. drop creatinine_outcome

. drop mgdl_creatinine_outcome

. drop min_creatinine_outcome

. drop max_creatinine_outcome

. egen egfr_end = cut(egfr_outcome), at(0, 30, 60, 5000)
(937 missing values generated)

. recode egfr_end 0=3 30=2 60=1
(egfr_end: 1140 changes made)

. label define egfr_end 1 "≥60" 2 "30-59" 3 "<30"

. label values egfr_end egfr_end

. label var egfr_end "Final eGFR"

. gen ckd_progression = 0

. replace ckd_progression = 1 if egfr_end==2 & ckd_group==1
(179 real changes made)

. replace ckd_progression = 2 if egfr_end==3 & ckd_group==1
(7 real changes made)

. replace ckd_progression = 2 if egfr_end==3 & ckd_group==2
(5 real changes made)

. egen esrd_egfr_end = cut(egfr_outcome), at (0, 15, 5000)
(937 missing values generated)

. recode esrd_egfr_end 0=1 15=0
(esrd_egfr_end: 1140 changes made)

. tab esrd_egfr_end, m

esrd_egfr_e |
         nd |      Freq.     Percent        Cum.
------------+-----------------------------------
          0 |      1,140       54.89       54.89
          . |        937       45.11      100.00
------------+-----------------------------------
      Total |      2,077      100.00

. gen dialysis_outcome = 0

. replace dialysis_outcome = 1 if modality_outcome=="Dialysis"
(116 real changes made)

. replace dialysis_outcome = 1 if modality_outcome=="Modality unclear" & esrd_e
> gfr_end==1
(0 real changes made)

. gen kidney_transplant_outcome = 0

. replace kidney_transplant_outcome = 1 if modality_outcome=="Kidney transplant
> "
(72 real changes made)

. replace kidney_transplant_outcome = 1 if modality_outcome=="Modality unclear"
>  & esrd_egfr_end==0
(7 real changes made)

. replace ckd_progression = 5 if modality_outcome=="Modality unclear"
(13 real changes made)

. replace ckd_progression = 3 if dialysis_outcome==1
(116 real changes made)

. replace ckd_progression = 4 if kidney_transplant_outcome==1
(79 real changes made)

. replace ckd_progression = 6 if modality_outcome=="Deceased"
(216 real changes made)

. label define ckd_progression 0 "No progression" 1 "CKD 3" 2 "CKD 4/5 pre-KRT"
>  3 "Dialysis" 4 "Kidney transplant" 5 "KRT unclear modality" 6 "Deceased"

. label values ckd_progression ckd_progression

. label var ckd_progression "CKD progression"

. tab ckd_progression, m

     CKD progression |      Freq.     Percent        Cum.
---------------------+-----------------------------------
      No progression |      1,505       72.46       72.46
               CKD 3 |        146        7.03       79.49
     CKD 4/5 pre-KRT |          9        0.43       79.92
            Dialysis |        116        5.58       85.51
   Kidney transplant |         79        3.80       89.31
KRT unclear modality |          6        0.29       89.60
            Deceased |        216       10.40      100.00
---------------------+-----------------------------------
               Total |      2,077      100.00

. 
. *eGFR cut-offs to investigate timing of access formation
. egen access_egfr = cut(baseline_egfr), at (0, 15, 5000)
(823 missing values generated)

. recode access_egfr 0=1 15=2
(access_egfr: 1254 changes made)

. replace access_egfr=0 if ckd_group==4
(67 real changes made)

. replace access_egfr=3 if access_egfr==.
(756 real changes made)

. label define access_egfr 0 "Dialysis" 1 "eGFR 0-14" 2 "eGFR >= 15" 3 "Unknown
> "

. label values access_egfr access_egfr

. 
. *Totals for non-binary healthcare resource outcomes (including by month)
. foreach aggregate of varlist hospital_days critical_care_days emergency_days 
> op_appts neph_appts tx_appts gp_interactions icd1_days icd2_days icd3_days ic
> d4_days icd5_days icd6_days icd7_days icd8_days icd9_days icd10_days icd11_da
> ys icd12_days icd13_days icd14_days icd15_days icd16_days icd17_days icd18_da
> ys icd19_days icd20_days icd21_days icd22_days {
  2. bysort ckd_group: egen total_`aggregate' = total(`aggregate')
  3. egen overall_`aggregate' = total(`aggregate')
  4. tab ckd_group, sum(total_`aggregate')
  5. sum overall_`aggregate'
  6. }

            |   Summary of total_hospital_days
  CKD group |        Mean   Std. Dev.       Freq.
------------+------------------------------------
  Albuminur |         376           0       1,289
  CKD stage |          62           0         370
  CKD stage |           7           0          16
   Dialysis |          26           0          67
  Transplan |         107           0         297
  KRT uncle |           3           0          38
------------+------------------------------------
      Total |   260.64083   148.86297       2,077

    Variable |        Obs        Mean    Std. Dev.       Min        Max
-------------+---------------------------------------------------------
overall_ho~s |      2,077         581           0        581        581

            | Summary of total_critical_care_days
  CKD group |        Mean   Std. Dev.       Freq.
------------+------------------------------------
  Albuminur |         367           0       1,289
  CKD stage |          84           0         370
  CKD stage |           6           0          16
   Dialysis |           1           0          67
  Transplan |          80           0         297
  KRT uncle |          14           0          38
------------+------------------------------------
      Total |   254.50072   144.92899       2,077

    Variable |        Obs        Mean    Std. Dev.       Min        Max
-------------+---------------------------------------------------------
overall_cr~s |      2,077         552           0        552        552

            |   Summary of total_emergency_days
  CKD group |        Mean   Std. Dev.       Freq.
------------+------------------------------------
  Albuminur |         352           0       1,289
  CKD stage |          99           0         370
  CKD stage |          13           0          16
   Dialysis |           4           0          67
  Transplan |          85           0         297
  KRT uncle |          16           0          38
------------+------------------------------------
      Total |   248.76601   133.43648       2,077

    Variable |        Obs        Mean    Std. Dev.       Min        Max
-------------+---------------------------------------------------------
overall_em~s |      2,077         569           0        569        569

            |      Summary of total_op_appts
  CKD group |        Mean   Std. Dev.       Freq.
------------+------------------------------------
  Albuminur |         394           0       1,289
  CKD stage |          91           0         370
  CKD stage |          10           0          16
   Dialysis |           5           0          67
  Transplan |          73           0         297
  KRT uncle |          12           0          38
------------+------------------------------------
      Total |   271.62638   157.52132       2,077

    Variable |        Obs        Mean    Std. Dev.       Min        Max
-------------+---------------------------------------------------------
overall_op~s |      2,077         585           0        585        585

            |     Summary of total_neph_appts
  CKD group |        Mean   Std. Dev.       Freq.
------------+------------------------------------
  Albuminur |         302           0       1,289
  CKD stage |          75           0         370
  CKD stage |           5           0          16
   Dialysis |          23           0          67
  Transplan |          93           0         297
  KRT uncle |           2           0          38
------------+------------------------------------
      Total |   214.89937   112.61577       2,077

    Variable |        Obs        Mean    Std. Dev.       Min        Max
-------------+---------------------------------------------------------
overall_ne~s |      2,077         500           0        500        500

            |      Summary of total_tx_appts
  CKD group |        Mean   Std. Dev.       Freq.
------------+------------------------------------
  Albuminur |         316           0       1,289
  CKD stage |         127           0         370
  CKD stage |           3           0          16
   Dialysis |          14           0          67
  Transplan |          52           0         297
  KRT uncle |           8           0          38
------------+------------------------------------
      Total |   226.79249   117.51842       2,077

    Variable |        Obs        Mean    Std. Dev.       Min        Max
-------------+---------------------------------------------------------
overall_tx~s |      2,077         520           0        520        520

            |  Summary of total_gp_interactions
  CKD group |        Mean   Std. Dev.       Freq.
------------+------------------------------------
  Albuminur |         334           0       1,289
  CKD stage |          95           0         370
  CKD stage |           4           0          16
   Dialysis |          19           0          67
  Transplan |          99           0         297
  KRT uncle |           9           0          38
------------+------------------------------------
      Total |   239.17092   122.71669       2,077

    Variable |        Obs        Mean    Std. Dev.       Min        Max
-------------+---------------------------------------------------------
overall_gp~s |      2,077         560           0        560        560

            |     Summary of total_icd1_days
  CKD group |        Mean   Std. Dev.       Freq.
------------+------------------------------------
  Albuminur |         304           0       1,289
  CKD stage |          70           0         370
  CKD stage |           2           0          16
   Dialysis |          22           0          67
  Transplan |          49           0         297
  KRT uncle |           8           0          38
------------+------------------------------------
      Total |   209.01252   122.09819       2,077

    Variable |        Obs        Mean    Std. Dev.       Min        Max
-------------+---------------------------------------------------------
overall_ic~s |      2,077         455           0        455        455

            |     Summary of total_icd2_days
  CKD group |        Mean   Std. Dev.       Freq.
------------+------------------------------------
  Albuminur |         369           0       1,289
  CKD stage |          89           0         370
  CKD stage |           1           0          16
   Dialysis |          19           0          67
  Transplan |          54           0         297
  KRT uncle |           7           0          38
------------+------------------------------------
      Total |   253.32884    148.9234       2,077

    Variable |        Obs        Mean    Std. Dev.       Min        Max
-------------+---------------------------------------------------------
overa~2_days |      2,077         539           0        539        539

            |     Summary of total_icd3_days
  CKD group |        Mean   Std. Dev.       Freq.
------------+------------------------------------
  Albuminur |         312           0       1,289
  CKD stage |          70           0         370
  CKD stage |           5           0          16
   Dialysis |           7           0          67
  Transplan |          88           0         297
  KRT uncle |          20           0          38
------------+------------------------------------
      Total |   219.31295   119.62604       2,077

    Variable |        Obs        Mean    Std. Dev.       Min        Max
-------------+---------------------------------------------------------
overa~3_days |      2,077         502           0        502        502

            |     Summary of total_icd4_days
  CKD group |        Mean   Std. Dev.       Freq.
------------+------------------------------------
  Albuminur |         358           0       1,289
  CKD stage |          73           0         370
  CKD stage |           0           0          16
   Dialysis |          13           0          67
  Transplan |          68           0         297
  KRT uncle |          10           0          38
------------+------------------------------------
      Total |   245.50746   144.54543       2,077

    Variable |        Obs        Mean    Std. Dev.       Min        Max
-------------+---------------------------------------------------------
overa~4_days |      2,077         522           0        522        522

            |     Summary of total_icd5_days
  CKD group |        Mean   Std. Dev.       Freq.
------------+------------------------------------
  Albuminur |         326           0       1,289
  CKD stage |         101           0         370
  CKD stage |           3           0          16
   Dialysis |          20           0          67
  Transplan |          44           0         297
  KRT uncle |           9           0          38
------------+------------------------------------
      Total |   227.43476   127.84915       2,077

    Variable |        Obs        Mean    Std. Dev.       Min        Max
-------------+---------------------------------------------------------
overa~5_days |      2,077         503           0        503        503

            |     Summary of total_icd6_days
  CKD group |        Mean   Std. Dev.       Freq.
------------+------------------------------------
  Albuminur |         351           0       1,289
  CKD stage |          93           0         370
  CKD stage |           4           0          16
   Dialysis |          28           0          67
  Transplan |          60           0         297
  KRT uncle |          12           0          38
------------+------------------------------------
      Total |   244.13337   137.66248       2,077

    Variable |        Obs        Mean    Std. Dev.       Min        Max
-------------+---------------------------------------------------------
overa~6_days |      2,077         548           0        548        548

            |     Summary of total_icd7_days
  CKD group |        Mean   Std. Dev.       Freq.
------------+------------------------------------
  Albuminur |         321           0       1,289
  CKD stage |          94           0         370
  CKD stage |           1           0          16
   Dialysis |           8           0          67
  Transplan |          72           0         297
  KRT uncle |          14           0          38
------------+------------------------------------
      Total |   226.77756   121.85244       2,077

    Variable |        Obs        Mean    Std. Dev.       Min        Max
-------------+---------------------------------------------------------
overa~7_days |      2,077         510           0        510        510

            |     Summary of total_icd8_days
  CKD group |        Mean   Std. Dev.       Freq.
------------+------------------------------------
  Albuminur |         270           0       1,289
  CKD stage |          88           0         370
  CKD stage |           3           0          16
   Dialysis |           9           0          67
  Transplan |          64           0         297
  KRT uncle |           7           0          38
------------+------------------------------------
      Total |   192.83341   100.15559       2,077

    Variable |        Obs        Mean    Std. Dev.       Min        Max
-------------+---------------------------------------------------------
overa~8_days |      2,077         441           0        441        441

            |     Summary of total_icd9_days
  CKD group |        Mean   Std. Dev.       Freq.
------------+------------------------------------
  Albuminur |         274           0       1,289
  CKD stage |          80           0         370
  CKD stage |           0           0          16
   Dialysis |          39           0          67
  Transplan |         118           0         297
  KRT uncle |          22           0          38
------------+------------------------------------
      Total |   202.83149   92.980096       2,077

    Variable |        Obs        Mean    Std. Dev.       Min        Max
-------------+---------------------------------------------------------
overa~9_days |      2,077         533           0        533        533

            |     Summary of total_icd10_days
  CKD group |        Mean   Std. Dev.       Freq.
------------+------------------------------------
  Albuminur |         320           0       1,289
  CKD stage |         113           0         370
  CKD stage |           5           0          16
   Dialysis |          11           0          67
  Transplan |          91           0         297
  KRT uncle |           2           0          38
------------+------------------------------------
      Total |   232.16659   114.53432       2,077

    Variable |        Obs        Mean    Std. Dev.       Min        Max
-------------+---------------------------------------------------------
overa~0_days |      2,077         542           0        542        542

            |     Summary of total_icd11_days
  CKD group |        Mean   Std. Dev.       Freq.
------------+------------------------------------
  Albuminur |         351           0       1,289
  CKD stage |          89           0         370
  CKD stage |           8           0          16
   Dialysis |          11           0          67
  Transplan |          73           0         297
  KRT uncle |           0           0          38
------------+------------------------------------
      Total |   244.54261   137.27643       2,077

    Variable |        Obs        Mean    Std. Dev.       Min        Max
-------------+---------------------------------------------------------
over~11_days |      2,077         532           0        532        532

            |     Summary of total_icd12_days
  CKD group |        Mean   Std. Dev.       Freq.
------------+------------------------------------
  Albuminur |         339           0       1,289
  CKD stage |          81           0         370
  CKD stage |           1           0          16
   Dialysis |          12           0          67
  Transplan |          85           0         297
  KRT uncle |           5           0          38
------------+------------------------------------
      Total |   237.45595   130.96068       2,077

    Variable |        Obs        Mean    Std. Dev.       Min        Max
-------------+---------------------------------------------------------
over~12_days |      2,077         523           0        523        523

            |     Summary of total_icd13_days
  CKD group |        Mean   Std. Dev.       Freq.
------------+------------------------------------
  Albuminur |         377           0       1,289
  CKD stage |          73           0         370
  CKD stage |           0           0          16
   Dialysis |          14           0          67
  Transplan |          79           0         297
  KRT uncle |           5           0          38
------------+------------------------------------
      Total |   258.81271   151.92703       2,077

    Variable |        Obs        Mean    Std. Dev.       Min        Max
-------------+---------------------------------------------------------
over~13_days |      2,077         548           0        548        548

            |     Summary of total_icd14_days
  CKD group |        Mean   Std. Dev.       Freq.
------------+------------------------------------
  Albuminur |         336           0       1,289
  CKD stage |          75           0         370
  CKD stage |           1           0          16
   Dialysis |          14           0          67
  Transplan |          77           0         297
  KRT uncle |           3           0          38
------------+------------------------------------
      Total |   233.40924   132.09425       2,077

    Variable |        Obs        Mean    Std. Dev.       Min        Max
-------------+---------------------------------------------------------
over~14_days |      2,077         506           0        506        506

            |     Summary of total_icd15_days
  CKD group |        Mean   Std. Dev.       Freq.
------------+------------------------------------
  Albuminur |         370           0       1,289
  CKD stage |          93           0         370
  CKD stage |           0           0          16
   Dialysis |          16           0          67
  Transplan |         104           0         297
  KRT uncle |           3           0          38
------------+------------------------------------
      Total |   261.63409   140.04962       2,077

    Variable |        Obs        Mean    Std. Dev.       Min        Max
-------------+---------------------------------------------------------
over~15_days |      2,077         586           0        586        586

            |     Summary of total_icd16_days
  CKD group |        Mean   Std. Dev.       Freq.
------------+------------------------------------
  Albuminur |         333           0       1,289
  CKD stage |          88           0         370
  CKD stage |           3           0          16
   Dialysis |           7           0          67
  Transplan |          74           0         297
  KRT uncle |           5           0          38
------------+------------------------------------
      Total |   233.26047   128.76591       2,077

    Variable |        Obs        Mean    Std. Dev.       Min        Max
-------------+---------------------------------------------------------
over~16_days |      2,077         510           0        510        510

            |     Summary of total_icd17_days
  CKD group |        Mean   Std. Dev.       Freq.
------------+------------------------------------
  Albuminur |         287           0       1,289
  CKD stage |          64           0         370
  CKD stage |           5           0          16
   Dialysis |          19           0          67
  Transplan |          65           0         297
  KRT uncle |          13           0          38
------------+------------------------------------
      Total |   199.69909   112.22227       2,077

    Variable |        Obs        Mean    Std. Dev.       Min        Max
-------------+---------------------------------------------------------
over~17_days |      2,077         453           0        453        453

            |     Summary of total_icd18_days
  CKD group |        Mean   Std. Dev.       Freq.
------------+------------------------------------
  Albuminur |         371           0       1,289
  CKD stage |         115           0         370
  CKD stage |           5           0          16
   Dialysis |          21           0          67
  Transplan |          98           0         297
  KRT uncle |           3           0          38
------------+------------------------------------
      Total |   265.51565   136.65715       2,077

    Variable |        Obs        Mean    Std. Dev.       Min        Max
-------------+---------------------------------------------------------
over~18_days |      2,077         613           0        613        613

            |     Summary of total_icd19_days
  CKD group |        Mean   Std. Dev.       Freq.
------------+------------------------------------
  Albuminur |         318           0       1,289
  CKD stage |         102           0         370
  CKD stage |           3           0          16
   Dialysis |          15           0          67
  Transplan |          59           0         297
  KRT uncle |           2           0          38
------------+------------------------------------
      Total |   224.50361   121.33422       2,077

    Variable |        Obs        Mean    Std. Dev.       Min        Max
-------------+---------------------------------------------------------
over~19_days |      2,077         499           0        499        499

            |     Summary of total_icd20_days
  CKD group |        Mean   Std. Dev.       Freq.
------------+------------------------------------
  Albuminur |         365           0       1,289
  CKD stage |          79           0         370
  CKD stage |          13           0          16
   Dialysis |          17           0          67
  Transplan |          75           0         297
  KRT uncle |          23           0          38
------------+------------------------------------
      Total |   252.38854   144.66115       2,077

    Variable |        Obs        Mean    Std. Dev.       Min        Max
-------------+---------------------------------------------------------
over~20_days |      2,077         572           0        572        572

            |     Summary of total_icd21_days
  CKD group |        Mean   Std. Dev.       Freq.
------------+------------------------------------
  Albuminur |         308           0       1,289
  CKD stage |          87           0         370
  CKD stage |          11           0          16
   Dialysis |          29           0          67
  Transplan |          83           0         297
  KRT uncle |           9           0          38
------------+------------------------------------
      Total |    219.6986    113.9078       2,077

    Variable |        Obs        Mean    Std. Dev.       Min        Max
-------------+---------------------------------------------------------
over~21_days |      2,077         527           0        527        527

            |     Summary of total_icd22_days
  CKD group |        Mean   Std. Dev.       Freq.
------------+------------------------------------
  Albuminur |         359           0       1,289
  CKD stage |         105           0         370
  CKD stage |           0           0          16
   Dialysis |          23           0          67
  Transplan |          84           0         297
  KRT uncle |           0           0          38
------------+------------------------------------
      Total |   254.25614   135.41453       2,077

    Variable |        Obs        Mean    Std. Dev.       Min        Max
-------------+---------------------------------------------------------
over~22_days |      2,077         571           0        571        571

. 
. 
. 
. **Potential effect modifiers
. * Ethnicity
. * 1 = White ethnicities (white British, white Irish, with other)
. * 2 = Mixed ethnicities (white & black Caribbean, white & black African, whit
> e & Asian, other mixed ethnicities)
. * 3 = South Asian ethnicities (Indian, Pakistani, Bangladeshi, other South As
> ian)
. * 4 = Black ethnicities (black Caribbean, black African, other black)
. * 5 = Other ethnicities (Chinese, all other ethnicities)
. * . = Unknown ethnicity
. replace ethnicity = . if ethnicity==.
(0 real changes made)

. replace ethnicity=6 if ethnicity==2
(77 real changes made)

. replace ethnicity=2 if ethnicity==3
(69 real changes made)

. replace ethnicity=3 if ethnicity==4
(72 real changes made)

. replace ethnicity=4 if ethnicity==6
(77 real changes made)

. replace ethnicity=6 if ethnicity==.
(493 real changes made)

. label define ethnicity  1 "White"                                       ///
>                                                 2 "South Asian"              
>            ///                                             
>                                                 3 "Black"                    
>                    ///
>                                                 4 "Mixed"                    
>                    ///
>                                                 5 "Other"                    
>                    ///
>                                                 6 "Unknown"     

. label values ethnicity ethnicity

. 
. * Index of multiple deprivation
. * Ordered 1-5 from most deprived to least deprived
. label define imd 1 "1 Most deprived" 2 "2" 3 "3" 4 "4" 5 "5 Least deprived"

. label values imd imd

. 
. * Region
. rename region region_string

. gen region = 1 if region_string=="East Midlands"
(1,876 missing values generated)

. replace region = 2 if region_string=="East"
(221 real changes made)

. replace region = 3 if region_string=="London"
(411 real changes made)

. replace region = 4 if region_string=="North East"
(227 real changes made)

. replace region = 5 if region_string=="North West"
(202 real changes made)

. replace region = 6 if region_string=="South East"
(195 real changes made)

. replace region = 7 if region_string=="South West"
(222 real changes made)

. replace region = 8 if region_string=="West Midlands"
(218 real changes made)

. replace region = 9 if region_string=="Yorkshire and The Humber"
(180 real changes made)

. label define region     1 "East Midlands"                                    
>    ///
>                                                 2 "East"                     
>                                    ///
>                                                 3 "London"                   
>                                    ///
>                                                 4 "North East"               
>                            ///
>                                                 5 "North West"               
>                            ///
>                                                 6 "South East"               
>                            ///
>                                                 7 "South West"               
>                            ///
>                                                 8 "West Midlands"            
>                            ///
>                                                 9 "Yorkshire and The Humber" 
>            

. label values region region

. label var region "Region"

. 
. * Urban/rural
. replace rural_urban=. if rural_urban<1|rural_urban>8
(0 real changes made)

. label define rural_urban 1 "Urban major conurbation"                         
>                    ///
>                                                  2 "Urban minor conurbation" 
>                                            ///
>                                                  3 "Urban city and town"     
>                                                    ///
>                                                  4 "Urban city and town in a 
> sparse setting"            ///
>                                                  5 "Rural town and fringe"   
>                                                    ///
>                                                  6 "Rural town and fringe in 
> a sparse setting"          ///
>                                                  7 "Rural village and dispers
> ed"                                        ///
>                                                  8 "Rural village and dispers
> ed in a sparse setting"

. label values rural_urban rural_urban

. * Urban (binary)
. * Urban = 1-4 + missing, Rural = 5-8
. generate urban=.
(2,077 missing values generated)

. replace urban=1 if rural_urban<=4|rural_urban==.
(831 real changes made)

. replace urban=0 if rural_urban>4 & rural_urban!=.
(1,246 real changes made)

. label var urban "Urban/rural"

. label define urban 0 "Rural" 1 "Urban"

. label values urban urban

. drop rural_urban

. 
. *Age bands for standardisation
. egen agecat = cut(age), at(0,18,20,25,30,35,40,45,50,55,60,65,70,75,80,85,90,
> 200)

. drop if agecat==0
(0 observations deleted)

. 
. *Age-standardisation weights (European Standard Population 2013)
. gen weight = .
(2,077 missing values generated)

. replace weight = 0.027261 if agecat==18
(65 real changes made)

. replace weight = 0.074349 if agecat==20
(172 real changes made)

. replace weight = 0.074349 if agecat==25
(153 real changes made)

. replace weight = 0.080545 if agecat==30
(176 real changes made)

. replace weight = 0.086741 if agecat==35
(155 real changes made)

. replace weight = 0.086741 if agecat==40
(164 real changes made)

. replace weight = 0.086741 if agecat==45
(198 real changes made)

. replace weight = 0.086741 if agecat==50
(180 real changes made)

. replace weight = 0.080545 if agecat==55
(169 real changes made)

. replace weight = 0.074349 if agecat==60
(151 real changes made)

. replace weight = 0.068154 if agecat==65
(123 real changes made)

. replace weight = 0.061958 if agecat==70
(141 real changes made)

. replace weight = 0.049566 if agecat==75
(104 real changes made)

. replace weight = 0.030979 if agecat==80
(63 real changes made)

. replace weight = 0.018587 if agecat==85
(42 real changes made)

. replace weight = 0.012392 if agecat==90
(21 real changes made)

. 
. 
. *Age standardised counts for each non-binary healthcare resource outcomes
. foreach aggregate of varlist hospital_days critical_care_days emergency_days 
> op_appts neph_appts tx_appts gp_interactions icd1_days icd2_days icd3_days ic
> d4_days icd5_days icd6_days icd7_days icd8_days icd9_days icd10_days icd11_da
> ys icd12_days icd13_days icd14_days icd15_days icd16_days icd17_days icd18_da
> ys icd19_days icd20_days icd21_days icd22_days {
  2. replace `aggregate' = `aggregate' * weight
  3. }
variable hospital_days was byte now float
(189 real changes made)
variable critical_care_days was byte now float
(186 real changes made)
variable emergency_days was byte now float
(191 real changes made)
variable op_appts was byte now float
(196 real changes made)
variable neph_appts was byte now float
(167 real changes made)
variable tx_appts was byte now float
(172 real changes made)
variable gp_interactions was byte now float
(177 real changes made)
variable icd1_days was byte now float
(149 real changes made)
variable icd2_days was byte now float
(196 real changes made)
variable icd3_days was byte now float
(184 real changes made)
variable icd4_days was byte now float
(184 real changes made)
variable icd5_days was byte now float
(165 real changes made)
variable icd6_days was byte now float
(181 real changes made)
variable icd7_days was byte now float
(183 real changes made)
variable icd8_days was byte now float
(151 real changes made)
variable icd9_days was byte now float
(180 real changes made)
variable icd10_days was byte now float
(190 real changes made)
variable icd11_days was byte now float
(177 real changes made)
variable icd12_days was byte now float
(181 real changes made)
variable icd13_days was byte now float
(197 real changes made)
variable icd14_days was byte now float
(178 real changes made)
variable icd15_days was byte now float
(190 real changes made)
variable icd16_days was byte now float
(172 real changes made)
variable icd17_days was byte now float
(157 real changes made)
variable icd18_days was byte now float
(198 real changes made)
variable icd19_days was byte now float
(171 real changes made)
variable icd20_days was byte now float
(195 real changes made)
variable icd21_days was byte now float
(178 real changes made)
variable icd22_days was byte now float
(187 real changes made)

. 
. * Create variable for age-standardised total # of each aggregated outcome
. * `var'_`aggregate' = age-standardised total # of each aggregated outcome ove
> rall stratified by ethnicity/imd/region/urban
. * `var'_`aggregate'_ckd = age-standardised total # of each aggregated outcome
>  in each CKD group stratified by ethnicity/imd/region/urban
. foreach aggregate of varlist hospital_days critical_care_days emergency_days 
> op_appts neph_appts tx_appts gp_interactions icd1_days icd2_days icd3_days ic
> d4_days icd5_days icd6_days icd7_days icd8_days icd9_days icd10_days icd11_da
> ys icd12_days icd13_days icd14_days icd15_days icd16_days icd17_days icd18_da
> ys icd19_days icd20_days icd21_days icd22_days {
  2. egen overall_std_`aggregate' = total(`aggregate')
  3. bysort ckd_group: egen std_`aggregate' = total(`aggregate')
  4. foreach var of varlist ethnicity imd region urban {
  5. bysort `var': egen `var'_`aggregate' = total(`aggregate')
  6. bysort `var' ckd_group: egen `var'_`aggregate'_ckd = total(`aggregate')
  7. }
  8. }

. 
. foreach binary of varlist fistula_formation pd_insertion blood_pressure album
> inuria creatinine icd1 icd2 icd3 icd4 icd5 icd6 icd7 icd8 icd9 icd10 icd11 ic
> d12 icd13 icd14 icd15 icd16 icd17 icd18 icd19 icd20 icd21 icd22 {
  2. gen esp_`binary' = `binary' * weight
  3. egen overall_std_`binary' = total(esp_`binary')
  4. bysort ckd_group: egen std_`binary' = total(esp_`binary')
  5. foreach var of varlist ethnicity imd region urban {
  6. bysort `var': egen `var'_`binary' = total(esp_`binary')
  7. bysort `var' ckd_group: egen `var'_`binary'_ckd = total(esp_`binary')
  8. }
  9. }

. 
. *Merge cost data
. save "./output/`dataset'_ckd_complete.dta", replace
(note: file ./output/2018_ckd_complete.dta not found)
file ./output/2018_ckd_complete.dta saved

. capture noisily import delimited ./output/costs_`dataset'.csv, clear
(7 vars, 500 obs)

. keep patient_id apcs_cost ec_cost opa_cost

. merge 1:1 patient_id using ./output/`dataset'_ckd_complete
(note: variable patient_id was int, now long to accommodate using data's
       values)

    Result                           # of obs.
    -----------------------------------------
    not matched                         2,573
        from master                       498  (_merge==1)
        from using                      2,075  (_merge==2)

    matched                                 2  (_merge==3)
    -----------------------------------------

. drop if _merge==1
(498 observations deleted)

. foreach cost of varlist apcs_cost ec_cost opa_cost {
  2. sum `cost', d
  3. bysort ckd_group: egen total_`cost' = total(`cost')
  4. egen overall_`cost' = total(`cost')
  5. tab ckd_group, sum(total_`cost')
  6. sum overall_`cost'
  7. foreach var of varlist ethnicity imd region urban {
  8. bysort `var': egen `var'_`cost' = total(`cost')
  9. bysort `var' ckd_group: egen `var'_`cost'_ckd = total(`cost')
 10. }
 11. }

                          apcs_cost
-------------------------------------------------------------
no observations

            |     Summary of total_apcs_cost
  CKD group |        Mean   Std. Dev.       Freq.
------------+------------------------------------
  Albuminur |           0           0       1,289
  CKD stage |           0           0         370
  CKD stage |           0           0          16
   Dialysis |           0           0          67
  Transplan |           0           0         297
  KRT uncle |           0           0          38
------------+------------------------------------
      Total |           0           0       2,077

    Variable |        Obs        Mean    Std. Dev.       Min        Max
-------------+---------------------------------------------------------
overall_ap~t |      2,077           0           0          0          0

                           ec_cost
-------------------------------------------------------------
no observations

            |      Summary of total_ec_cost
  CKD group |        Mean   Std. Dev.       Freq.
------------+------------------------------------
  Albuminur |           0           0       1,289
  CKD stage |           0           0         370
  CKD stage |           0           0          16
   Dialysis |           0           0          67
  Transplan |           0           0         297
  KRT uncle |           0           0          38
------------+------------------------------------
      Total |           0           0       2,077

    Variable |        Obs        Mean    Std. Dev.       Min        Max
-------------+---------------------------------------------------------
overall_ec~t |      2,077           0           0          0          0

                          opa_cost
-------------------------------------------------------------
      Percentiles      Smallest
 1%     72.60402       72.60402
 5%     72.60402              .
10%     72.60402              .       Obs                   1
25%     72.60402              .       Sum of Wgt.           1

50%     72.60402                      Mean           72.60402
                        Largest       Std. Dev.             .
75%     72.60402              .
90%     72.60402              .       Variance              .
95%     72.60402              .       Skewness              .
99%     72.60402       72.60402       Kurtosis              .

            |      Summary of total_opa_cost
  CKD group |        Mean   Std. Dev.       Freq.
------------+------------------------------------
  Albuminur |           0           0       1,289
  CKD stage |           0           0         370
  CKD stage |           0           0          16
   Dialysis |           0           0          67
  Transplan |   72.604019           0         297
  KRT uncle |           0           0          38
------------+------------------------------------
      Total |    10.38199   25.422424       2,077

    Variable |        Obs        Mean    Std. Dev.       Min        Max
-------------+---------------------------------------------------------
overall_op~t |      2,077    72.60402           0   72.60402   72.60402

. save "./output/`dataset'_ckd_complete.dta", replace
file ./output/2018_ckd_complete.dta saved

. 
. log close
      name:  <unnamed>
       log:  /workspace/logs/2018_ckd_complete.log
  log type:  text
 closed on:  29 Apr 2024, 13:18:17
-------------------------------------------------------------------------------
