-------------------------------------------------------------------------------
      name:  <unnamed>
       log:  /workspace/logs/2018_ckd_complete.log
  log type:  text
 opened on:   7 Jun 2024, 10:22:06

. clear

. 
. *Merge `dataset'_ckd with `dataset'_ckd_complete
. capture noisily import delimited ./output/`dataset'_ckd.csv, clear
(8 vars, 21,076 obs)

. tempfile `dataset'_ckd

. save ``dataset'_ckd', replace
(note: file /tmp/St00012.000001 not found)
file /tmp/St00012.000001 saved

. capture noisily import delimited ./output/input_`dataset'_ckd_complete.csv, c
> lear
(104 vars, 50,000 obs)

. merge 1:1 patient_id using ``dataset'_ckd'

    Result                           # of obs.
    -----------------------------------------
    not matched                        66,826
        from master                    47,875  (_merge==1)
        from using                     18,951  (_merge==2)

    matched                             2,125  (_merge==3)
    -----------------------------------------

. keep if _merge==3
(66,826 observations deleted)

. drop _merge

. tempfile `dataset'_ckd_complete

. save ``dataset'_ckd_complete', replace
(note: file /tmp/St00012.000002 not found)
file /tmp/St00012.000002 saved

. 
. /*Generate dummy data
> cd ckd-healthcare-use
> capture noisily import delimited ./output/2017_ckd.csv, clear
> tempfile 2017_ckd
> save ./output/2017_ckd, replace
> capture noisily import delimited ./output/input_2017_ckd_complete.csv, clear
> merge 1:1 patient_id using ./output/2017_ckd
> keep if _merge==3
> drop _merge
> tempfile 2017_ckd_complete
> save ./output/2017_ckd_complete, replace
> */
. 
. *CKD stage classification
. foreach var of varlist  dialysis_baseline_primary_care  ///
>                                                 dialysis_baseline_icd_10     
>            ///
>                                                 dialysis_baseline_opcs_4     
>            ///
>                                                 dialysis_baseline_date       
>            ///
>                                                 kt_baseline_primary_care     
>            ///
>                                                 kt_baseline_icd_10           
>                    ///
>                                                 kt_baseline_opcs_4           
>                    {
  2.         drop `var'
  3.         }

. tab modality_baseline, m

modality_baseline |      Freq.     Percent        Cum.
------------------+-----------------------------------
         Dialysis |        184        8.66        8.66
Kidney transplant |        198        9.32       17.98
 Modality unclear |         37        1.74       19.72
          Pre KRT |      1,706       80.28      100.00
------------------+-----------------------------------
            Total |      2,125      100.00

. *To reduce misclassification of dialysis, anyone with eGFR >15 with modality_
> baseline=="Dialysis" will be reclassified as non-dialysis (e.g. they may have
>  received acute dialysis and recovered)
. *For modality_baseline="Modality unclear" (i.e. whose dialysis and kidney tra
> nsplant baseline dates are identical), those with eGFR <15 will be assumed to
>  be on dialysis and those >15 as kidney transplant
. egen esrd_egfr = cut(baseline_egfr), at (0, 15, 5000)
(853 missing values generated)

. recode esrd_egfr 0=1 15=0
(esrd_egfr: 1272 changes made)

. tab esrd_egfr, m

  esrd_egfr |      Freq.     Percent        Cum.
------------+-----------------------------------
          0 |      1,272       59.86       59.86
          . |        853       40.14      100.00
------------+-----------------------------------
      Total |      2,125      100.00

. gen dialysis = 0

. replace dialysis = 1 if modality_baseline=="Dialysis"
(184 real changes made)

. replace dialysis = 1 if modality_baseline=="Modality unclear" & esrd_egfr!=.
(24 real changes made)

. replace dialysis = 0 if esrd_egfr==0
(135 real changes made)

. gen kidney_transplant = 0

. replace kidney_transplant = 1 if kidney_transplant_baseline_date!=""
(309 real changes made)

. replace kidney_transplant = 0 if dialysis==1
(8 real changes made)

. gen modality_unclear = 0

. replace modality_unclear = 1 if modality_baseline=="Modality unclear"
(37 real changes made)

. replace modality_unclear = 0 if dialysis==1
(0 real changes made)

. replace modality_unclear = 0 if kidney_transplant==1
(11 real changes made)

. tab modality_baseline dialysis

                  |       dialysis
modality_baseline |         0          1 |     Total
------------------+----------------------+----------
         Dialysis |       111         73 |       184 
Kidney transplant |       198          0 |       198 
 Modality unclear |        37          0 |        37 
          Pre KRT |     1,706          0 |     1,706 
------------------+----------------------+----------
            Total |     2,052         73 |     2,125 

. tab modality_baseline kidney_transplant

                  |   kidney_transplant
modality_baseline |         0          1 |     Total
------------------+----------------------+----------
         Dialysis |       166         18 |       184 
Kidney transplant |       172         26 |       198 
 Modality unclear |        26         11 |        37 
          Pre KRT |     1,460        246 |     1,706 
------------------+----------------------+----------
            Total |     1,824        301 |     2,125 

. tab modality_baseline modality_unclear

                  |   modality_unclear
modality_baseline |         0          1 |     Total
------------------+----------------------+----------
         Dialysis |       184          0 |       184 
Kidney transplant |       198          0 |       198 
 Modality unclear |        11         26 |        37 
          Pre KRT |     1,706          0 |     1,706 
------------------+----------------------+----------
            Total |     2,099         26 |     2,125 

. tab dialysis kidney_transplant

           |   kidney_transplant
  dialysis |         0          1 |     Total
-----------+----------------------+----------
         0 |     1,751        301 |     2,052 
         1 |        73          0 |        73 
-----------+----------------------+----------
     Total |     1,824        301 |     2,125 

. egen ckd_group = cut(baseline_egfr), at(0, 30, 60, 5000)
(853 missing values generated)

. recode ckd_group 0=3 30=2 60=1
(ckd_group: 1272 changes made)

. replace ckd_group = 4 if dialysis==1
(73 real changes made)

. replace ckd_group = 5 if kidney_transplant==1
(301 real changes made)

. replace ckd_group = 6 if modality_unclear==1
(26 real changes made)

. *ckd_group==. are those with albuminuria without available eGFR measurement o
> r code for KRT
. replace ckd_group = 1 if ckd_group==.
(664 real changes made)

. label define ckd_group 1 "Albuminuria" 2 "CKD stage 3" 3 "CKD stage 4/5" 4 "D
> ialysis" 5 "Transplant" 6 "KRT unclear modality"

. label values ckd_group ckd_group

. label var ckd_group "CKD group"

. tab ckd_group, m

           CKD group |      Freq.     Percent        Cum.
---------------------+-----------------------------------
         Albuminuria |      1,316       61.93       61.93
         CKD stage 3 |        393       18.49       80.42
       CKD stage 4/5 |         16        0.75       81.18
            Dialysis |         73        3.44       84.61
          Transplant |        301       14.16       98.78
KRT unclear modality |         26        1.22      100.00
---------------------+-----------------------------------
               Total |      2,125      100.00

. drop if ckd_group==.
(0 observations deleted)

. tab ckd_group modality_baseline

                     |              modality_baseline
           CKD group |  Dialysis  Kidney ..  Modalit..    Pre KRT |     Total
---------------------+--------------------------------------------+----------
         Albuminuria |        54        139          0      1,123 |     1,316 
         CKD stage 3 |        37         32          0        324 |       393 
       CKD stage 4/5 |         2          1          0         13 |        16 
            Dialysis |        73          0          0          0 |        73 
          Transplant |        18         26         11        246 |       301 
KRT unclear modality |         0          0         26          0 |        26 
---------------------+--------------------------------------------+----------
               Total |       184        198         37      1,706 |     2,125 

. 
. *Dialysis & kidney transplant outcome classification
. foreach var of varlist  dialysis_outcome_primary_care   ///
>                                                 dialysis_outcome_icd_10      
>            ///
>                                                 dialysis_outcome_opcs_4      
>            ///
>                                                 dialysis_outcome_date        
>            ///
>                                                 kt_outcome_primary_care      
>            ///
>                                                 kt_outcome_icd_10            
>                    ///
>                                                 kt_outcome_opcs_4            
>                    ///
>                                                 kidney_transplant_outcome_dat
> e  ///
>                                                 died                         
>                            {
  2.         drop `var'
  3.         }

. tab ckd_group modality_outcome, m

                     |              modality_outcome
           CKD group |  Deceased   Dialysis  Kidney ..  Modalit.. |     Total
---------------------+--------------------------------------------+----------
         Albuminuria |       126         74         60         11 |     1,316 
         CKD stage 3 |        35         22         21          3 |       393 
       CKD stage 4/5 |         4          2          0          0 |        16 
            Dialysis |        13          4          4          0 |        73 
          Transplant |        33         14         10          3 |       301 
KRT unclear modality |         4          0          2          0 |        26 
---------------------+--------------------------------------------+----------
               Total |       215        116         97         17 |     2,125 


                     | modality_o
                     |   utcome
           CKD group | Unchanged |     Total
---------------------+-----------+----------
         Albuminuria |     1,045 |     1,316 
         CKD stage 3 |       312 |       393 
       CKD stage 4/5 |        10 |        16 
            Dialysis |        52 |        73 
          Transplant |       241 |       301 
KRT unclear modality |        20 |        26 
---------------------+-----------+----------
               Total |     1,680 |     2,125 

. 
. *eGFR outcome classification based on updated mean eGFR over previous 18 mont
> hs by the end of year
. gen sex = 1 if male == "Male"
(1,086 missing values generated)

. replace sex = 0 if male == "Female"
(1,086 real changes made)

. label define sex 0"Female" 1"Male"

. label values sex sex

. replace creatinine_outcome = . if !inrange(creatinine_outcome, 20, 3000)
(927 real changes made, 927 to missing)

. gen mgdl_creatinine_outcome = creatinine_outcome/88.4
(927 missing values generated)

. gen min_creatinine_outcome=.
(2,125 missing values generated)

. replace min_creatinine_outcome = mgdl_creatinine_outcome/0.7 if sex==0
(613 real changes made)

. replace min_creatinine_outcome = mgdl_creatinine_outcome/0.9 if sex==1
(585 real changes made)

. replace min_creatinine_outcome = min_creatinine_outcome^-0.329  if sex==0
(613 real changes made)

. replace min_creatinine_outcome = min_creatinine_outcome^-0.411  if sex==1
(585 real changes made)

. replace min_creatinine_outcome = 1 if min_creatinine_outcome<1
(728 real changes made)

. gen max_creatinine_outcome=.
(2,125 missing values generated)

. replace max_creatinine_outcome = mgdl_creatinine_outcome/0.7 if sex==0
(613 real changes made)

. replace max_creatinine_outcome = mgdl_creatinine_outcome/0.9 if sex==1
(585 real changes made)

. replace max_creatinine_outcome = max_creatinine_outcome^-1.209
(1,198 real changes made)

. replace max_creatinine_outcome = 1 if max_creatinine_outcome>1
(1,397 real changes made)

. gen egfr_outcome = min_creatinine_outcome*max_creatinine_outcome*141
(927 missing values generated)

. replace egfr_outcome = egfr_outcome*(0.993^age)
(1,198 real changes made)

. replace egfr_outcome = egfr_outcome*1.018 if sex==0
(613 real changes made)

. drop creatinine_outcome

. drop mgdl_creatinine_outcome

. drop min_creatinine_outcome

. drop max_creatinine_outcome

. egen egfr_end = cut(egfr_outcome), at(0, 30, 60, 5000)
(927 missing values generated)

. recode egfr_end 0=3 30=2 60=1
(egfr_end: 1198 changes made)

. label define egfr_end 1 "≥60" 2 "30-59" 3 "<30"

. label values egfr_end egfr_end

. label var egfr_end "Final eGFR"

. gen ckd_progression = 0

. replace ckd_progression = 1 if egfr_end==2 & ckd_group==1
(162 real changes made)

. replace ckd_progression = 2 if egfr_end==3 & ckd_group==1
(10 real changes made)

. replace ckd_progression = 2 if egfr_end==3 & ckd_group==2
(6 real changes made)

. egen esrd_egfr_end = cut(egfr_outcome), at (0, 15, 5000)
(927 missing values generated)

. recode esrd_egfr_end 0=1 15=0
(esrd_egfr_end: 1198 changes made)

. tab esrd_egfr_end, m

esrd_egfr_e |
         nd |      Freq.     Percent        Cum.
------------+-----------------------------------
          0 |      1,198       56.38       56.38
          . |        927       43.62      100.00
------------+-----------------------------------
      Total |      2,125      100.00

. gen dialysis_outcome = 0

. replace dialysis_outcome = 1 if modality_outcome=="Dialysis"
(116 real changes made)

. replace dialysis_outcome = 1 if modality_outcome=="Modality unclear" & esrd_e
> gfr_end==1
(0 real changes made)

. gen kidney_transplant_outcome = 0

. replace kidney_transplant_outcome = 1 if modality_outcome=="Kidney transplant
> "
(97 real changes made)

. replace kidney_transplant_outcome = 1 if modality_outcome=="Modality unclear"
>  & esrd_egfr_end==0
(10 real changes made)

. replace ckd_progression = 5 if modality_outcome=="Modality unclear"
(17 real changes made)

. replace ckd_progression = 3 if dialysis_outcome==1
(116 real changes made)

. replace ckd_progression = 4 if kidney_transplant_outcome==1
(107 real changes made)

. replace ckd_progression = 6 if modality_outcome=="Deceased"
(215 real changes made)

. label define ckd_progression 0 "No progression" 1 "CKD 3" 2 "CKD 4/5 pre-KRT"
>  3 "Dialysis" 4 "Kidney transplant" 5 "KRT unclear modality" 6 "Deceased"

. label values ckd_progression ckd_progression

. label var ckd_progression "CKD progression"

. tab ckd_progression, m

     CKD progression |      Freq.     Percent        Cum.
---------------------+-----------------------------------
      No progression |      1,533       72.14       72.14
               CKD 3 |        132        6.21       78.35
     CKD 4/5 pre-KRT |         15        0.71       79.06
            Dialysis |        116        5.46       84.52
   Kidney transplant |        107        5.04       89.55
KRT unclear modality |          7        0.33       89.88
            Deceased |        215       10.12      100.00
---------------------+-----------------------------------
               Total |      2,125      100.00

. 
. *eGFR cut-offs to investigate timing of access formation
. egen access_egfr = cut(baseline_egfr), at (0, 15, 5000)
(853 missing values generated)

. recode access_egfr 0=1 15=2
(access_egfr: 1272 changes made)

. replace access_egfr=0 if ckd_group==4
(73 real changes made)

. replace access_egfr=3 if access_egfr==.
(780 real changes made)

. label define access_egfr 0 "Dialysis" 1 "eGFR 0-14" 2 "eGFR >= 15" 3 "Unknown
> "

. label values access_egfr access_egfr

. 
. *Totals for non-binary healthcare resource outcomes (including by month)
. foreach aggregate of varlist hospital_days critical_care_days emergency_days 
> op_appts neph_appts tx_appts gp_interactions icd1_days icd2_days icd3_days ic
> d4_days icd5_days icd6_days icd7_days icd8_days icd9_days icd10_days icd11_da
> ys icd12_days icd13_days icd14_days icd15_days icd16_days icd17_days icd18_da
> ys icd19_days icd20_days icd21_days icd22_days {
  2. bysort ckd_group: egen total_`aggregate' = total(`aggregate')
  3. egen overall_`aggregate' = total(`aggregate')
  4. tab ckd_group, sum(total_`aggregate')
  5. sum overall_`aggregate'
  6. }

            |   Summary of total_hospital_days
  CKD group |        Mean   Std. Dev.       Freq.
------------+------------------------------------
  Albuminur |         339           0       1,316
  CKD stage |          83           0         393
  CKD stage |           8           0          16
   Dialysis |          15           0          73
  Transplan |          60           0         301
  KRT uncle |           4           0          26
------------+------------------------------------
      Total |   234.41412   134.24156       2,125

    Variable |        Obs        Mean    Std. Dev.       Min        Max
-------------+---------------------------------------------------------
overall_ho~s |      2,125         509           0        509        509

            | Summary of total_critical_care_days
  CKD group |        Mean   Std. Dev.       Freq.
------------+------------------------------------
  Albuminur |         305           0       1,316
  CKD stage |          88           0         393
  CKD stage |           3           0          16
   Dialysis |          21           0          73
  Transplan |          66           0         301
  KRT uncle |           2           0          26
------------+------------------------------------
      Total |   215.27671   115.48384       2,125

    Variable |        Obs        Mean    Std. Dev.       Min        Max
-------------+---------------------------------------------------------
overall_cr~s |      2,125         485           0        485        485

            |   Summary of total_emergency_days
  CKD group |        Mean   Std. Dev.       Freq.
------------+------------------------------------
  Albuminur |         340           0       1,316
  CKD stage |          98           0         393
  CKD stage |           0           0          16
   Dialysis |          20           0          73
  Transplan |          76           0         301
  KRT uncle |           7           0          26
------------+------------------------------------
      Total |   240.22212   128.45298       2,125

    Variable |        Obs        Mean    Std. Dev.       Min        Max
-------------+---------------------------------------------------------
overall_em~s |      2,125         541           0        541        541

            |      Summary of total_op_appts
  CKD group |        Mean   Std. Dev.       Freq.
------------+------------------------------------
  Albuminur |         355           0       1,316
  CKD stage |          85           0         393
  CKD stage |          10           0          16
   Dialysis |           5           0          73
  Transplan |          44           0         301
  KRT uncle |           7           0          26
------------+------------------------------------
      Total |   242.13459   145.05145       2,125

    Variable |        Obs        Mean    Std. Dev.       Min        Max
-------------+---------------------------------------------------------
overall_op~s |      2,125         506           0        506        506

            |     Summary of total_neph_appts
  CKD group |        Mean   Std. Dev.       Freq.
------------+------------------------------------
  Albuminur |         274           0       1,316
  CKD stage |          97           0         393
  CKD stage |           7           0          16
   Dialysis |          22           0          73
  Transplan |          95           0         301
  KRT uncle |           6           0          26
------------+------------------------------------
      Total |   201.96424   93.512568       2,125

    Variable |        Obs        Mean    Std. Dev.       Min        Max
-------------+---------------------------------------------------------
overall_ne~s |      2,125         501           0        501        501

            |      Summary of total_tx_appts
  CKD group |        Mean   Std. Dev.       Freq.
------------+------------------------------------
  Albuminur |         287           0       1,316
  CKD stage |         109           0         393
  CKD stage |           4           0          16
   Dialysis |          15           0          73
  Transplan |          84           0         301
  KRT uncle |           3           0          26
------------+------------------------------------
      Total |   210.37647   99.808684       2,125

    Variable |        Obs        Mean    Std. Dev.       Min        Max
-------------+---------------------------------------------------------
overall_tx~s |      2,125         502           0        502        502

            |  Summary of total_gp_interactions
  CKD group |        Mean   Std. Dev.       Freq.
------------+------------------------------------
  Albuminur |         340           0       1,316
  CKD stage |          61           0         393
  CKD stage |           7           0          16
   Dialysis |          20           0          73
  Transplan |          76           0         301
  KRT uncle |           3           0          26
------------+------------------------------------
      Total |   233.38306   136.57256       2,125

    Variable |        Obs        Mean    Std. Dev.       Min        Max
-------------+---------------------------------------------------------
overall_gp~s |      2,125         507           0        507        507

            |     Summary of total_icd1_days
  CKD group |        Mean   Std. Dev.       Freq.
------------+------------------------------------
  Albuminur |         285           0       1,316
  CKD stage |          64           0         393
  CKD stage |           0           0          16
   Dialysis |           5           0          73
  Transplan |          81           0         301
  KRT uncle |          14           0          26
------------+------------------------------------
      Total |   200.15153   109.25781       2,125

    Variable |        Obs        Mean    Std. Dev.       Min        Max
-------------+---------------------------------------------------------
overall_ic~s |      2,125         449           0        449        449

            |     Summary of total_icd2_days
  CKD group |        Mean   Std. Dev.       Freq.
------------+------------------------------------
  Albuminur |         285           0       1,316
  CKD stage |         101           0         393
  CKD stage |           4           0          16
   Dialysis |          16           0          73
  Transplan |          80           0         301
  KRT uncle |          -1           0          26
------------+------------------------------------
      Total |   207.07718   101.13394       2,125

    Variable |        Obs        Mean    Std. Dev.       Min        Max
-------------+---------------------------------------------------------
overa~2_days |      2,125         485           0        485        485

            |     Summary of total_icd3_days
  CKD group |        Mean   Std. Dev.       Freq.
------------+------------------------------------
  Albuminur |         414           0       1,316
  CKD stage |         122           0         393
  CKD stage |           5           0          16
   Dialysis |          25           0          73
  Transplan |          71           0         301
  KRT uncle |          12           0          26
------------+------------------------------------
      Total |   290.05082   159.74101       2,125

    Variable |        Obs        Mean    Std. Dev.       Min        Max
-------------+---------------------------------------------------------
overa~3_days |      2,125         649           0        649        649

            |     Summary of total_icd4_days
  CKD group |        Mean   Std. Dev.       Freq.
------------+------------------------------------
  Albuminur |         301           0       1,316
  CKD stage |         109           0         393
  CKD stage |           5           0          16
   Dialysis |          13           0          73
  Transplan |          89           0         301
  KRT uncle |           4           0          26
------------+------------------------------------
      Total |   219.70588   105.68212       2,125

    Variable |        Obs        Mean    Std. Dev.       Min        Max
-------------+---------------------------------------------------------
overa~4_days |      2,125         521           0        521        521

            |     Summary of total_icd5_days
  CKD group |        Mean   Std. Dev.       Freq.
------------+------------------------------------
  Albuminur |         379           0       1,316
  CKD stage |          92           0         393
  CKD stage |          17           0          16
   Dialysis |          36           0          73
  Transplan |          69           0         301
  KRT uncle |           5           0          26
------------+------------------------------------
      Total |   262.92659   148.73726       2,125

    Variable |        Obs        Mean    Std. Dev.       Min        Max
-------------+---------------------------------------------------------
overa~5_days |      2,125         598           0        598        598

            |     Summary of total_icd6_days
  CKD group |        Mean   Std. Dev.       Freq.
------------+------------------------------------
  Albuminur |         353           0       1,316
  CKD stage |          83           0         393
  CKD stage |           0           0          16
   Dialysis |           9           0          73
  Transplan |         102           0         301
  KRT uncle |          18           0          26
------------+------------------------------------
      Total |   248.93835    134.0234       2,125

    Variable |        Obs        Mean    Std. Dev.       Min        Max
-------------+---------------------------------------------------------
overa~6_days |      2,125         565           0        565        565

            |     Summary of total_icd7_days
  CKD group |        Mean   Std. Dev.       Freq.
------------+------------------------------------
  Albuminur |         382           0       1,316
  CKD stage |          88           0         393
  CKD stage |           7           0          16
   Dialysis |          10           0          73
  Transplan |          84           0         301
  KRT uncle |           5           0          26
------------+------------------------------------
      Total |   265.20094    149.9489       2,125

    Variable |        Obs        Mean    Std. Dev.       Min        Max
-------------+---------------------------------------------------------
overa~7_days |      2,125         576           0        576        576

            |     Summary of total_icd8_days
  CKD group |        Mean   Std. Dev.       Freq.
------------+------------------------------------
  Albuminur |         296           0       1,316
  CKD stage |          81           0         393
  CKD stage |           2           0          16
   Dialysis |          12           0          73
  Transplan |          70           0         301
  KRT uncle |          19           0          26
------------+------------------------------------
      Total |   208.86635   112.06111       2,125

    Variable |        Obs        Mean    Std. Dev.       Min        Max
-------------+---------------------------------------------------------
overa~8_days |      2,125         480           0        480        480

            |     Summary of total_icd9_days
  CKD group |        Mean   Std. Dev.       Freq.
------------+------------------------------------
  Albuminur |         291           0       1,316
  CKD stage |          77           0         393
  CKD stage |           2           0          16
   Dialysis |          20           0          73
  Transplan |          56           0         301
  KRT uncle |           7           0          26
------------+------------------------------------
      Total |   203.17506   112.79814       2,125

    Variable |        Obs        Mean    Std. Dev.       Min        Max
-------------+---------------------------------------------------------
overa~9_days |      2,125         453           0        453        453

            |     Summary of total_icd10_days
  CKD group |        Mean   Std. Dev.       Freq.
------------+------------------------------------
  Albuminur |         359           0       1,316
  CKD stage |          83           0         393
  CKD stage |           4           0          16
   Dialysis |          14           0          73
  Transplan |         105           0         301
  KRT uncle |           2           0          26
------------+------------------------------------
      Total |   253.08518   136.43504       2,125

    Variable |        Obs        Mean    Std. Dev.       Min        Max
-------------+---------------------------------------------------------
overa~0_days |      2,125         567           0        567        567

            |     Summary of total_icd11_days
  CKD group |        Mean   Std. Dev.       Freq.
------------+------------------------------------
  Albuminur |         307           0       1,316
  CKD stage |         117           0         393
  CKD stage |           5           0          16
   Dialysis |          18           0          73
  Transplan |          68           0         301
  KRT uncle |           4           0          26
------------+------------------------------------
      Total |   222.09835   110.65299       2,125

    Variable |        Obs        Mean    Std. Dev.       Min        Max
-------------+---------------------------------------------------------
over~11_days |      2,125         519           0        519        519

            |     Summary of total_icd12_days
  CKD group |        Mean   Std. Dev.       Freq.
------------+------------------------------------
  Albuminur |         309           0       1,316
  CKD stage |          85           0         393
  CKD stage |           5           0          16
   Dialysis |          14           0          73
  Transplan |          67           0         301
  KRT uncle |           9           0          26
------------+------------------------------------
      Total |   217.20094   118.07243       2,125

    Variable |        Obs        Mean    Std. Dev.       Min        Max
-------------+---------------------------------------------------------
over~12_days |      2,125         489           0        489        489

            |     Summary of total_icd13_days
  CKD group |        Mean   Std. Dev.       Freq.
------------+------------------------------------
  Albuminur |         354           0       1,316
  CKD stage |          80           0         393
  CKD stage |           5           0          16
   Dialysis |           8           0          73
  Transplan |          76           0         301
  KRT uncle |          11           0          26
------------+------------------------------------
      Total |   245.23765   139.57353       2,125

    Variable |        Obs        Mean    Std. Dev.       Min        Max
-------------+---------------------------------------------------------
over~13_days |      2,125         534           0        534        534

            |     Summary of total_icd14_days
  CKD group |        Mean   Std. Dev.       Freq.
------------+------------------------------------
  Albuminur |         334           0       1,316
  CKD stage |          66           0         393
  CKD stage |           3           0          16
   Dialysis |          16           0          73
  Transplan |          84           0         301
  KRT uncle |           2           0          26
------------+------------------------------------
      Total |   231.54541   131.50974       2,125

    Variable |        Obs        Mean    Std. Dev.       Min        Max
-------------+---------------------------------------------------------
over~14_days |      2,125         505           0        505        505

            |     Summary of total_icd15_days
  CKD group |        Mean   Std. Dev.       Freq.
------------+------------------------------------
  Albuminur |         300           0       1,316
  CKD stage |         102           0         393
  CKD stage |           4           0          16
   Dialysis |          28           0          73
  Transplan |          94           0         301
  KRT uncle |          10           0          26
------------+------------------------------------
      Total |   219.08141   104.63726       2,125

    Variable |        Obs        Mean    Std. Dev.       Min        Max
-------------+---------------------------------------------------------
over~15_days |      2,125         538           0        538        538

            |     Summary of total_icd16_days
  CKD group |        Mean   Std. Dev.       Freq.
------------+------------------------------------
  Albuminur |         322           0       1,316
  CKD stage |          70           0         393
  CKD stage |           0           0          16
   Dialysis |          22           0          73
  Transplan |          73           0         301
  KRT uncle |          12           0          26
------------+------------------------------------
      Total |   223.60141   126.09607       2,125

    Variable |        Obs        Mean    Std. Dev.       Min        Max
-------------+---------------------------------------------------------
over~16_days |      2,125         499           0        499        499

            |     Summary of total_icd17_days
  CKD group |        Mean   Std. Dev.       Freq.
------------+------------------------------------
  Albuminur |         314           0       1,316
  CKD stage |          88           0         393
  CKD stage |           5           0          16
   Dialysis |          13           0          73
  Transplan |          60           0         301
  KRT uncle |           1           0          26
------------+------------------------------------
      Total |   219.72847   121.38524       2,125

    Variable |        Obs        Mean    Std. Dev.       Min        Max
-------------+---------------------------------------------------------
over~17_days |      2,125         481           0        481        481

            |     Summary of total_icd18_days
  CKD group |        Mean   Std. Dev.       Freq.
------------+------------------------------------
  Albuminur |         386           0       1,316
  CKD stage |         119           0         393
  CKD stage |           4           0          16
   Dialysis |          18           0          73
  Transplan |          98           0         301
  KRT uncle |          19           0          26
------------+------------------------------------
      Total |   275.81788   142.13144       2,125

    Variable |        Obs        Mean    Std. Dev.       Min        Max
-------------+---------------------------------------------------------
over~18_days |      2,125         644           0        644        644

            |     Summary of total_icd19_days
  CKD group |        Mean   Std. Dev.       Freq.
------------+------------------------------------
  Albuminur |         336           0       1,316
  CKD stage |         138           0         393
  CKD stage |           3           0          16
   Dialysis |          32           0          73
  Transplan |          63           0         301
  KRT uncle |          12           0          26
------------+------------------------------------
      Total |   243.79718   120.85886       2,125

    Variable |        Obs        Mean    Std. Dev.       Min        Max
-------------+---------------------------------------------------------
over~19_days |      2,125         584           0        584        584

            |     Summary of total_icd20_days
  CKD group |        Mean   Std. Dev.       Freq.
------------+------------------------------------
  Albuminur |         372           0       1,316
  CKD stage |         121           0         393
  CKD stage |           8           0          16
   Dialysis |          10           0          73
  Transplan |          63           0         301
  KRT uncle |           0           0          26
------------+------------------------------------
      Total |   262.08282   142.46536       2,125

    Variable |        Obs        Mean    Std. Dev.       Min        Max
-------------+---------------------------------------------------------
over~20_days |      2,125         574           0        574        574

            |     Summary of total_icd21_days
  CKD group |        Mean   Std. Dev.       Freq.
------------+------------------------------------
  Albuminur |         347           0       1,316
  CKD stage |          84           0         393
  CKD stage |          12           0          16
   Dialysis |          34           0          73
  Transplan |          71           0         301
  KRT uncle |          12           0          26
------------+------------------------------------
      Total |   241.89224   134.63583       2,125

    Variable |        Obs        Mean    Std. Dev.       Min        Max
-------------+---------------------------------------------------------
over~21_days |      2,125         560           0        560        560

            |     Summary of total_icd22_days
  CKD group |        Mean   Std. Dev.       Freq.
------------+------------------------------------
  Albuminur |         320           0       1,316
  CKD stage |          66           0         393
  CKD stage |           2           0          16
   Dialysis |          10           0          73
  Transplan |          66           0         301
  KRT uncle |          -1           0          26
------------+------------------------------------
      Total |   220.07529   128.12652       2,125

    Variable |        Obs        Mean    Std. Dev.       Min        Max
-------------+---------------------------------------------------------
over~22_days |      2,125         463           0        463        463

. 
. 
. 
. **Potential effect modifiers
. * Ethnicity
. * 1 = White ethnicities (white British, white Irish, with other)
. * 2 = Mixed ethnicities (white & black Caribbean, white & black African, whit
> e & Asian, other mixed ethnicities)
. * 3 = South Asian ethnicities (Indian, Pakistani, Bangladeshi, other South As
> ian)
. * 4 = Black ethnicities (black Caribbean, black African, other black)
. * 5 = Other ethnicities (Chinese, all other ethnicities)
. * . = Unknown ethnicity
. replace ethnicity = . if ethnicity==.
(0 real changes made)

. replace ethnicity=6 if ethnicity==2
(69 real changes made)

. replace ethnicity=2 if ethnicity==3
(79 real changes made)

. replace ethnicity=3 if ethnicity==4
(81 real changes made)

. replace ethnicity=4 if ethnicity==6
(69 real changes made)

. replace ethnicity=6 if ethnicity==.
(562 real changes made)

. label define ethnicity  1 "White"                                       ///
>                                                 2 "South Asian"              
>            ///                                             
>                                                 3 "Black"                    
>                    ///
>                                                 4 "Mixed"                    
>                    ///
>                                                 5 "Other"                    
>                    ///
>                                                 6 "Unknown"     

. label values ethnicity ethnicity

. 
. * Index of multiple deprivation
. * Ordered 1-5 from most deprived to least deprived
. label define imd 1 "1 Most deprived" 2 "2" 3 "3" 4 "4" 5 "5 Least deprived"

. label values imd imd

. 
. * Region
. rename region region_string

. gen region = 1 if region_string=="East Midlands"
(1,891 missing values generated)

. replace region = 2 if region_string=="East"
(200 real changes made)

. replace region = 3 if region_string=="London"
(421 real changes made)

. replace region = 4 if region_string=="North East"
(197 real changes made)

. replace region = 5 if region_string=="North West"
(219 real changes made)

. replace region = 6 if region_string=="South East"
(221 real changes made)

. replace region = 7 if region_string=="South West"
(197 real changes made)

. replace region = 8 if region_string=="West Midlands"
(226 real changes made)

. replace region = 9 if region_string=="Yorkshire and The Humber"
(210 real changes made)

. label define region     1 "East Midlands"                                    
>    ///
>                                                 2 "East"                     
>                                    ///
>                                                 3 "London"                   
>                                    ///
>                                                 4 "North East"               
>                            ///
>                                                 5 "North West"               
>                            ///
>                                                 6 "South East"               
>                            ///
>                                                 7 "South West"               
>                            ///
>                                                 8 "West Midlands"            
>                            ///
>                                                 9 "Yorkshire and The Humber" 
>            

. label values region region

. label var region "Region"

. 
. * Urban/rural
. replace rural_urban=. if rural_urban<1|rural_urban>8
(0 real changes made)

. label define rural_urban 1 "Urban major conurbation"                         
>                    ///
>                                                  2 "Urban minor conurbation" 
>                                            ///
>                                                  3 "Urban city and town"     
>                                                    ///
>                                                  4 "Urban city and town in a 
> sparse setting"            ///
>                                                  5 "Rural town and fringe"   
>                                                    ///
>                                                  6 "Rural town and fringe in 
> a sparse setting"          ///
>                                                  7 "Rural village and dispers
> ed"                                        ///
>                                                  8 "Rural village and dispers
> ed in a sparse setting"

. label values rural_urban rural_urban

. * Urban (binary)
. * Urban = 1-4 + missing, Rural = 5-8
. generate urban=.
(2,125 missing values generated)

. replace urban=1 if rural_urban<=4|rural_urban==.
(850 real changes made)

. replace urban=0 if rural_urban>4 & rural_urban!=.
(1,275 real changes made)

. label var urban "Urban/rural"

. label define urban 0 "Rural" 1 "Urban"

. label values urban urban

. drop rural_urban

. 
. *Age bands for standardisation
. egen agecat = cut(age), at(0,18,20,25,30,35,40,45,50,55,60,65,70,75,80,85,90,
> 200)

. drop if agecat==0
(0 observations deleted)

. 
. *Age-standardisation weights (European Standard Population 2013)
. gen weight = .
(2,125 missing values generated)

. replace weight = 0.027261 if agecat==18
(49 real changes made)

. replace weight = 0.074349 if agecat==20
(181 real changes made)

. replace weight = 0.074349 if agecat==25
(163 real changes made)

. replace weight = 0.080545 if agecat==30
(175 real changes made)

. replace weight = 0.086741 if agecat==35
(162 real changes made)

. replace weight = 0.086741 if agecat==40
(175 real changes made)

. replace weight = 0.086741 if agecat==45
(198 real changes made)

. replace weight = 0.086741 if agecat==50
(172 real changes made)

. replace weight = 0.080545 if agecat==55
(176 real changes made)

. replace weight = 0.074349 if agecat==60
(140 real changes made)

. replace weight = 0.068154 if agecat==65
(145 real changes made)

. replace weight = 0.061958 if agecat==70
(147 real changes made)

. replace weight = 0.049566 if agecat==75
(111 real changes made)

. replace weight = 0.030979 if agecat==80
(67 real changes made)

. replace weight = 0.018587 if agecat==85
(45 real changes made)

. replace weight = 0.012392 if agecat==90
(19 real changes made)

. 
. 
. *Age standardised counts for each non-binary healthcare resource outcomes
. foreach aggregate of varlist hospital_days critical_care_days emergency_days 
> op_appts neph_appts tx_appts gp_interactions icd1_days icd2_days icd3_days ic
> d4_days icd5_days icd6_days icd7_days icd8_days icd9_days icd10_days icd11_da
> ys icd12_days icd13_days icd14_days icd15_days icd16_days icd17_days icd18_da
> ys icd19_days icd20_days icd21_days icd22_days {
  2. replace `aggregate' = `aggregate' * weight
  3. }
variable hospital_days was byte now float
(183 real changes made)
variable critical_care_days was byte now float
(179 real changes made)
variable emergency_days was byte now float
(183 real changes made)
variable op_appts was byte now float
(162 real changes made)
variable neph_appts was byte now float
(171 real changes made)
variable tx_appts was byte now float
(183 real changes made)
variable gp_interactions was byte now float
(179 real changes made)
variable icd1_days was byte now float
(154 real changes made)
variable icd2_days was byte now float
(164 real changes made)
variable icd3_days was byte now float
(220 real changes made)
variable icd4_days was byte now float
(179 real changes made)
variable icd5_days was byte now float
(188 real changes made)
variable icd6_days was byte now float
(178 real changes made)
variable icd7_days was byte now float
(195 real changes made)
variable icd8_days was byte now float
(156 real changes made)
variable icd9_days was byte now float
(158 real changes made)
variable icd10_days was byte now float
(187 real changes made)
variable icd11_days was byte now float
(189 real changes made)
variable icd12_days was byte now float
(174 real changes made)
variable icd13_days was byte now float
(175 real changes made)
variable icd14_days was byte now float
(165 real changes made)
variable icd15_days was byte now float
(179 real changes made)
variable icd16_days was byte now float
(174 real changes made)
variable icd17_days was byte now float
(161 real changes made)
variable icd18_days was byte now float
(202 real changes made)
variable icd19_days was byte now float
(186 real changes made)
variable icd20_days was byte now float
(190 real changes made)
variable icd21_days was byte now float
(192 real changes made)
variable icd22_days was byte now float
(162 real changes made)

. 
. * Create variable for age-standardised total # of each aggregated outcome
. * `var'_`aggregate' = age-standardised total # of each aggregated outcome ove
> rall stratified by ethnicity/imd/region/urban
. * `var'_`aggregate'_ckd = age-standardised total # of each aggregated outcome
>  in each CKD group stratified by ethnicity/imd/region/urban
. foreach aggregate of varlist hospital_days critical_care_days emergency_days 
> op_appts neph_appts tx_appts gp_interactions icd1_days icd2_days icd3_days ic
> d4_days icd5_days icd6_days icd7_days icd8_days icd9_days icd10_days icd11_da
> ys icd12_days icd13_days icd14_days icd15_days icd16_days icd17_days icd18_da
> ys icd19_days icd20_days icd21_days icd22_days {
  2. egen overall_std_`aggregate' = total(`aggregate')
  3. bysort ckd_group: egen std_`aggregate' = total(`aggregate')
  4. foreach var of varlist ethnicity imd region urban {
  5. bysort `var': egen `var'_`aggregate' = total(`aggregate')
  6. bysort `var' ckd_group: egen `var'_`aggregate'_ckd = total(`aggregate')
  7. }
  8. }

. 
. foreach binary of varlist fistula_formation pd_insertion blood_pressure album
> inuria creatinine icd1 icd2 icd3 icd4 icd5 icd6 icd7 icd8 icd9 icd10 icd11 ic
> d12 icd13 icd14 icd15 icd16 icd17 icd18 icd19 icd20 icd21 icd22 {
  2. gen esp_`binary' = `binary' * weight
  3. egen overall_std_`binary' = total(esp_`binary')
  4. bysort ckd_group: egen std_`binary' = total(esp_`binary')
  5. foreach var of varlist ethnicity imd region urban {
  6. bysort `var': egen `var'_`binary' = total(esp_`binary')
  7. bysort `var' ckd_group: egen `var'_`binary'_ckd = total(esp_`binary')
  8. }
  9. }

. 
. *Merge cost data
. save "./output/`dataset'_ckd_complete.dta", replace
(note: file ./output/2018_ckd_complete.dta not found)
file ./output/2018_ckd_complete.dta saved

. capture noisily import delimited ./output/costs_`dataset'.csv, clear
(7 vars, 500 obs)

. keep patient_id apcs_cost ec_cost opa_cost

. merge 1:1 patient_id using ./output/`dataset'_ckd_complete
(note: variable patient_id was int, now long to accommodate using data's
       values)

    Result                           # of obs.
    -----------------------------------------
    not matched                         2,615
        from master                       495  (_merge==1)
        from using                      2,120  (_merge==2)

    matched                                 5  (_merge==3)
    -----------------------------------------

. drop if _merge==1
(495 observations deleted)

. foreach cost of varlist apcs_cost ec_cost opa_cost {
  2. sum `cost', d
  3. bysort ckd_group: egen total_`cost' = total(`cost')
  4. egen overall_`cost' = total(`cost')
  5. tab ckd_group, sum(total_`cost')
  6. sum overall_`cost'
  7. foreach var of varlist ethnicity imd region urban {
  8. bysort `var': egen `var'_`cost' = total(`cost')
  9. bysort `var' ckd_group: egen `var'_`cost'_ckd = total(`cost')
 10. }
 11. }

                          apcs_cost
-------------------------------------------------------------
      Percentiles      Smallest
 1%     26.22014       26.22014
 5%     26.22014              .
10%     26.22014              .       Obs                   1
25%     26.22014              .       Sum of Wgt.           1

50%     26.22014                      Mean           26.22014
                        Largest       Std. Dev.             .
75%     26.22014              .
90%     26.22014              .       Variance              .
95%     26.22014              .       Skewness              .
99%     26.22014       26.22014       Kurtosis              .

            |     Summary of total_apcs_cost
  CKD group |        Mean   Std. Dev.       Freq.
------------+------------------------------------
  Albuminur |           0           0       1,316
  CKD stage |           0           0         393
  CKD stage |           0           0          16
   Dialysis |           0           0          73
  Transplan |   26.220139           0         301
  KRT uncle |           0           0          26
------------+------------------------------------
      Total |   3.7140055   9.1447939       2,125

    Variable |        Obs        Mean    Std. Dev.       Min        Max
-------------+---------------------------------------------------------
overall_ap~t |      2,125    26.22014           0   26.22014   26.22014

                           ec_cost
-------------------------------------------------------------
no observations

            |      Summary of total_ec_cost
  CKD group |        Mean   Std. Dev.       Freq.
------------+------------------------------------
  Albuminur |           0           0       1,316
  CKD stage |           0           0         393
  CKD stage |           0           0          16
   Dialysis |           0           0          73
  Transplan |           0           0         301
  KRT uncle |           0           0          26
------------+------------------------------------
      Total |           0           0       2,125

    Variable |        Obs        Mean    Std. Dev.       Min        Max
-------------+---------------------------------------------------------
overall_ec~t |      2,125           0           0          0          0

                          opa_cost
-------------------------------------------------------------
no observations

            |      Summary of total_opa_cost
  CKD group |        Mean   Std. Dev.       Freq.
------------+------------------------------------
  Albuminur |           0           0       1,316
  CKD stage |           0           0         393
  CKD stage |           0           0          16
   Dialysis |           0           0          73
  Transplan |           0           0         301
  KRT uncle |           0           0          26
------------+------------------------------------
      Total |           0           0       2,125

    Variable |        Obs        Mean    Std. Dev.       Min        Max
-------------+---------------------------------------------------------
overall_op~t |      2,125           0           0          0          0

. save "./output/`dataset'_ckd_complete.dta", replace
file ./output/2018_ckd_complete.dta saved

. 
. log close
      name:  <unnamed>
       log:  /workspace/logs/2018_ckd_complete.log
  log type:  text
 closed on:   7 Jun 2024, 10:22:10
-------------------------------------------------------------------------------
