-------------------------------------------------------------------------------
      name:  <unnamed>
       log:  /workspace/logs/2019_ckd_complete.log
  log type:  text
 opened on:  29 Apr 2024, 13:22:15

. clear

. 
. *Merge `dataset'_ckd with `dataset'_ckd_complete
. capture noisily import delimited ./output/`dataset'_ckd.csv, clear
(7 vars, 21,041 obs)

. tempfile `dataset'_ckd

. save ``dataset'_ckd', replace
(note: file /tmp/St00015.000001 not found)
file /tmp/St00015.000001 saved

. capture noisily import delimited ./output/input_`dataset'_ckd_complete.csv, c
> lear
(104 vars, 50,000 obs)

. merge 1:1 patient_id using ``dataset'_ckd'

    Result                           # of obs.
    -----------------------------------------
    not matched                        66,765
        from master                    47,862  (_merge==1)
        from using                     18,903  (_merge==2)

    matched                             2,138  (_merge==3)
    -----------------------------------------

. keep if _merge==3
(66,765 observations deleted)

. drop _merge

. tempfile `dataset'_ckd_complete

. save ``dataset'_ckd_complete', replace
(note: file /tmp/St00015.000002 not found)
file /tmp/St00015.000002 saved

. 
. /*Generate dummy data
> cd ckd-healthcare-use
> capture noisily import delimited ./output/2017_ckd.csv, clear
> tempfile 2017_ckd
> save ./output/2017_ckd, replace
> capture noisily import delimited ./output/input_2017_ckd_complete.csv, clear
> merge 1:1 patient_id using ./output/2017_ckd
> keep if _merge==3
> drop _merge
> tempfile 2017_ckd_complete
> save ./output/2017_ckd_complete, replace
> */
. 
. *CKD stage classification
. foreach var of varlist  dialysis_baseline_primary_care  ///
>                                                 dialysis_baseline_icd_10     
>            ///
>                                                 dialysis_baseline_opcs_4     
>            ///
>                                                 dialysis_baseline_date       
>            ///
>                                                 kt_baseline_primary_care     
>            ///
>                                                 kt_baseline_icd_10           
>                    ///
>                                                 kt_baseline_opcs_4           
>                    {
  2.         drop `var'
  3.         }

. tab modality_baseline, m

modality_baseline |      Freq.     Percent        Cum.
------------------+-----------------------------------
         Dialysis |        191        8.93        8.93
Kidney transplant |        180        8.42       17.35
 Modality unclear |         41        1.92       19.27
          Pre KRT |      1,726       80.73      100.00
------------------+-----------------------------------
            Total |      2,138      100.00

. *To reduce misclassification of dialysis, anyone with eGFR >15 with modality_
> baseline=="Dialysis" will be reclassified as non-dialysis (e.g. they may have
>  received acute dialysis and recovered)
. *For modality_baseline="Modality unclear" (i.e. whose dialysis and kidney tra
> nsplant baseline dates are identical), those with eGFR <15 will be assumed to
>  be on dialysis and those >15 as kidney transplant
. egen esrd_egfr = cut(baseline_egfr), at (0, 15, 5000)
(839 missing values generated)

. recode esrd_egfr 0=1 15=0
(esrd_egfr: 1299 changes made)

. tab esrd_egfr, m

  esrd_egfr |      Freq.     Percent        Cum.
------------+-----------------------------------
          0 |      1,299       60.76       60.76
          . |        839       39.24      100.00
------------+-----------------------------------
      Total |      2,138      100.00

. gen dialysis = 0

. replace dialysis = 1 if modality_baseline=="Dialysis"
(191 real changes made)

. replace dialysis = 1 if modality_baseline=="Modality unclear" & esrd_egfr!=.
(26 real changes made)

. replace dialysis = 0 if esrd_egfr==0
(145 real changes made)

. gen kidney_transplant = 0

. replace kidney_transplant = 1 if kidney_transplant_baseline_date!=""
(286 real changes made)

. replace kidney_transplant = 0 if dialysis==1
(16 real changes made)

. gen modality_unclear = 0

. replace modality_unclear = 1 if modality_baseline=="Modality unclear"
(41 real changes made)

. replace modality_unclear = 0 if dialysis==1
(0 real changes made)

. replace modality_unclear = 0 if kidney_transplant==1
(2 real changes made)

. tab modality_baseline dialysis

                  |       dialysis
modality_baseline |         0          1 |     Total
------------------+----------------------+----------
         Dialysis |       119         72 |       191 
Kidney transplant |       180          0 |       180 
 Modality unclear |        41          0 |        41 
          Pre KRT |     1,726          0 |     1,726 
------------------+----------------------+----------
            Total |     2,066         72 |     2,138 

. tab modality_baseline kidney_transplant

                  |   kidney_transplant
modality_baseline |         0          1 |     Total
------------------+----------------------+----------
         Dialysis |       170         21 |       191 
Kidney transplant |       146         34 |       180 
 Modality unclear |        39          2 |        41 
          Pre KRT |     1,513        213 |     1,726 
------------------+----------------------+----------
            Total |     1,868        270 |     2,138 

. tab modality_baseline modality_unclear

                  |   modality_unclear
modality_baseline |         0          1 |     Total
------------------+----------------------+----------
         Dialysis |       191          0 |       191 
Kidney transplant |       180          0 |       180 
 Modality unclear |         2         39 |        41 
          Pre KRT |     1,726          0 |     1,726 
------------------+----------------------+----------
            Total |     2,099         39 |     2,138 

. tab dialysis kidney_transplant

           |   kidney_transplant
  dialysis |         0          1 |     Total
-----------+----------------------+----------
         0 |     1,796        270 |     2,066 
         1 |        72          0 |        72 
-----------+----------------------+----------
     Total |     1,868        270 |     2,138 

. egen ckd_group = cut(baseline_egfr), at(0, 30, 60, 5000)
(839 missing values generated)

. recode ckd_group 0=3 30=2 60=1
(ckd_group: 1299 changes made)

. replace ckd_group = 4 if dialysis==1
(72 real changes made)

. replace ckd_group = 5 if kidney_transplant==1
(270 real changes made)

. replace ckd_group = 6 if modality_unclear==1
(39 real changes made)

. *ckd_group==. are those with albuminuria without available eGFR measurement o
> r code for KRT
. replace ckd_group = 1 if ckd_group==.
(649 real changes made)

. label define ckd_group 1 "Albuminuria" 2 "CKD stage 3" 3 "CKD stage 4/5" 4 "D
> ialysis" 5 "Transplant" 6 "KRT unclear modality"

. label values ckd_group ckd_group

. label var ckd_group "CKD group"

. tab ckd_group, m

           CKD group |      Freq.     Percent        Cum.
---------------------+-----------------------------------
         Albuminuria |      1,316       61.55       61.55
         CKD stage 3 |        430       20.11       81.67
       CKD stage 4/5 |         11        0.51       82.18
            Dialysis |         72        3.37       85.55
          Transplant |        270       12.63       98.18
KRT unclear modality |         39        1.82      100.00
---------------------+-----------------------------------
               Total |      2,138      100.00

. drop if ckd_group==.
(0 observations deleted)

. tab ckd_group modality_baseline

                     |              modality_baseline
           CKD group |  Dialysis  Kidney ..  Modalit..    Pre KRT |     Total
---------------------+--------------------------------------------+----------
         Albuminuria |        59        113          0      1,144 |     1,316 
         CKD stage 3 |        39         32          0        359 |       430 
       CKD stage 4/5 |         0          1          0         10 |        11 
            Dialysis |        72          0          0          0 |        72 
          Transplant |        21         34          2        213 |       270 
KRT unclear modality |         0          0         39          0 |        39 
---------------------+--------------------------------------------+----------
               Total |       191        180         41      1,726 |     2,138 

. 
. *Dialysis & kidney transplant outcome classification
. foreach var of varlist  dialysis_outcome_primary_care   ///
>                                                 dialysis_outcome_icd_10      
>            ///
>                                                 dialysis_outcome_opcs_4      
>            ///
>                                                 dialysis_outcome_date        
>            ///
>                                                 kt_outcome_primary_care      
>            ///
>                                                 kt_outcome_icd_10            
>                    ///
>                                                 kt_outcome_opcs_4            
>                    ///
>                                                 kidney_transplant_outcome_dat
> e  ///
>                                                 died                         
>                            {
  2.         drop `var'
  3.         }

. tab ckd_group modality_outcome, m

                     |              modality_outcome
           CKD group |  Deceased   Dialysis  Kidney ..  Modalit.. |     Total
---------------------+--------------------------------------------+----------
         Albuminuria |       146         91         43          9 |     1,316 
         CKD stage 3 |        38         20         22          5 |       430 
       CKD stage 4/5 |         2          1          0          0 |        11 
            Dialysis |         8          6          1          0 |        72 
          Transplant |        23          9         13          2 |       270 
KRT unclear modality |         4          2          2          0 |        39 
---------------------+--------------------------------------------+----------
               Total |       221        129         81         16 |     2,138 


                     | modality_o
                     |   utcome
           CKD group | Unchanged |     Total
---------------------+-----------+----------
         Albuminuria |     1,027 |     1,316 
         CKD stage 3 |       345 |       430 
       CKD stage 4/5 |         8 |        11 
            Dialysis |        57 |        72 
          Transplant |       223 |       270 
KRT unclear modality |        31 |        39 
---------------------+-----------+----------
               Total |     1,691 |     2,138 

. 
. *eGFR outcome classification based on updated mean eGFR over previous 18 mont
> hs by the end of year
. gen sex = 1 if male == "Male"
(1,110 missing values generated)

. replace sex = 0 if male == "Female"
(1,110 real changes made)

. label define sex 0"Female" 1"Male"

. label values sex sex

. replace creatinine_outcome = . if !inrange(creatinine_outcome, 20, 3000)
(950 real changes made, 950 to missing)

. gen mgdl_creatinine_outcome = creatinine_outcome/88.4
(950 missing values generated)

. gen min_creatinine_outcome=.
(2,138 missing values generated)

. replace min_creatinine_outcome = mgdl_creatinine_outcome/0.7 if sex==0
(631 real changes made)

. replace min_creatinine_outcome = mgdl_creatinine_outcome/0.9 if sex==1
(557 real changes made)

. replace min_creatinine_outcome = min_creatinine_outcome^-0.329  if sex==0
(631 real changes made)

. replace min_creatinine_outcome = min_creatinine_outcome^-0.411  if sex==1
(557 real changes made)

. replace min_creatinine_outcome = 1 if min_creatinine_outcome<1
(768 real changes made)

. gen max_creatinine_outcome=.
(2,138 missing values generated)

. replace max_creatinine_outcome = mgdl_creatinine_outcome/0.7 if sex==0
(631 real changes made)

. replace max_creatinine_outcome = mgdl_creatinine_outcome/0.9 if sex==1
(557 real changes made)

. replace max_creatinine_outcome = max_creatinine_outcome^-1.209
(1,188 real changes made)

. replace max_creatinine_outcome = 1 if max_creatinine_outcome>1
(1,370 real changes made)

. gen egfr_outcome = min_creatinine_outcome*max_creatinine_outcome*141
(950 missing values generated)

. replace egfr_outcome = egfr_outcome*(0.993^age)
(1,188 real changes made)

. replace egfr_outcome = egfr_outcome*1.018 if sex==0
(631 real changes made)

. drop creatinine_outcome

. drop mgdl_creatinine_outcome

. drop min_creatinine_outcome

. drop max_creatinine_outcome

. egen egfr_end = cut(egfr_outcome), at(0, 30, 60, 5000)
(950 missing values generated)

. recode egfr_end 0=3 30=2 60=1
(egfr_end: 1188 changes made)

. label define egfr_end 1 "≥60" 2 "30-59" 3 "<30"

. label values egfr_end egfr_end

. label var egfr_end "Final eGFR"

. gen ckd_progression = 0

. replace ckd_progression = 1 if egfr_end==2 & ckd_group==1
(165 real changes made)

. replace ckd_progression = 2 if egfr_end==3 & ckd_group==1
(5 real changes made)

. replace ckd_progression = 2 if egfr_end==3 & ckd_group==2
(4 real changes made)

. egen esrd_egfr_end = cut(egfr_outcome), at (0, 15, 5000)
(950 missing values generated)

. recode esrd_egfr_end 0=1 15=0
(esrd_egfr_end: 1188 changes made)

. tab esrd_egfr_end, m

esrd_egfr_e |
         nd |      Freq.     Percent        Cum.
------------+-----------------------------------
          0 |      1,188       55.57       55.57
          . |        950       44.43      100.00
------------+-----------------------------------
      Total |      2,138      100.00

. gen dialysis_outcome = 0

. replace dialysis_outcome = 1 if modality_outcome=="Dialysis"
(129 real changes made)

. replace dialysis_outcome = 1 if modality_outcome=="Modality unclear" & esrd_e
> gfr_end==1
(0 real changes made)

. gen kidney_transplant_outcome = 0

. replace kidney_transplant_outcome = 1 if modality_outcome=="Kidney transplant
> "
(81 real changes made)

. replace kidney_transplant_outcome = 1 if modality_outcome=="Modality unclear"
>  & esrd_egfr_end==0
(10 real changes made)

. replace ckd_progression = 5 if modality_outcome=="Modality unclear"
(16 real changes made)

. replace ckd_progression = 3 if dialysis_outcome==1
(129 real changes made)

. replace ckd_progression = 4 if kidney_transplant_outcome==1
(91 real changes made)

. replace ckd_progression = 6 if modality_outcome=="Deceased"
(221 real changes made)

. label define ckd_progression 0 "No progression" 1 "CKD 3" 2 "CKD 4/5 pre-KRT"
>  3 "Dialysis" 4 "Kidney transplant" 5 "KRT unclear modality" 6 "Deceased"

. label values ckd_progression ckd_progression

. label var ckd_progression "CKD progression"

. tab ckd_progression, m

     CKD progression |      Freq.     Percent        Cum.
---------------------+-----------------------------------
      No progression |      1,549       72.45       72.45
               CKD 3 |        133        6.22       78.67
     CKD 4/5 pre-KRT |          9        0.42       79.09
            Dialysis |        129        6.03       85.13
   Kidney transplant |         91        4.26       89.38
KRT unclear modality |          6        0.28       89.66
            Deceased |        221       10.34      100.00
---------------------+-----------------------------------
               Total |      2,138      100.00

. 
. *eGFR cut-offs to investigate timing of access formation
. egen access_egfr = cut(baseline_egfr), at (0, 15, 5000)
(839 missing values generated)

. recode access_egfr 0=1 15=2
(access_egfr: 1299 changes made)

. replace access_egfr=0 if ckd_group==4
(72 real changes made)

. replace access_egfr=3 if access_egfr==.
(767 real changes made)

. label define access_egfr 0 "Dialysis" 1 "eGFR 0-14" 2 "eGFR >= 15" 3 "Unknown
> "

. label values access_egfr access_egfr

. 
. *Totals for non-binary healthcare resource outcomes (including by month)
. foreach aggregate of varlist hospital_days critical_care_days emergency_days 
> op_appts neph_appts tx_appts gp_interactions icd1_days icd2_days icd3_days ic
> d4_days icd5_days icd6_days icd7_days icd8_days icd9_days icd10_days icd11_da
> ys icd12_days icd13_days icd14_days icd15_days icd16_days icd17_days icd18_da
> ys icd19_days icd20_days icd21_days icd22_days {
  2. bysort ckd_group: egen total_`aggregate' = total(`aggregate')
  3. egen overall_`aggregate' = total(`aggregate')
  4. tab ckd_group, sum(total_`aggregate')
  5. sum overall_`aggregate'
  6. }

            |   Summary of total_hospital_days
  CKD group |        Mean   Std. Dev.       Freq.
------------+------------------------------------
  Albuminur |         272           0       1,316
  CKD stage |         128           0         430
  CKD stage |           9           0          11
   Dialysis |          19           0          72
  Transplan |          66           0         270
  KRT uncle |           2           0          39
------------+------------------------------------
      Total |   202.22498   92.229289       2,138

    Variable |        Obs        Mean    Std. Dev.       Min        Max
-------------+---------------------------------------------------------
overall_ho~s |      2,138         496           0        496        496

            | Summary of total_critical_care_days
  CKD group |        Mean   Std. Dev.       Freq.
------------+------------------------------------
  Albuminur |         346           0       1,316
  CKD stage |         122           0         430
  CKD stage |           1           0          11
   Dialysis |          13           0          72
  Transplan |          95           0         270
  KRT uncle |           9           0          39
------------+------------------------------------
      Total |   250.11413   123.60866       2,138

    Variable |        Obs        Mean    Std. Dev.       Min        Max
-------------+---------------------------------------------------------
overall_cr~s |      2,138         586           0        586        586

            |   Summary of total_emergency_days
  CKD group |        Mean   Std. Dev.       Freq.
------------+------------------------------------
  Albuminur |         349           0       1,316
  CKD stage |         118           0         430
  CKD stage |          -1           0          11
   Dialysis |          32           0          72
  Transplan |          73           0         270
  KRT uncle |           9           0          39
------------+------------------------------------
      Total |   249.00748    128.3914       2,138

    Variable |        Obs        Mean    Std. Dev.       Min        Max
-------------+---------------------------------------------------------
overall_em~s |      2,138         580           0        580        580

            |      Summary of total_op_appts
  CKD group |        Mean   Std. Dev.       Freq.
------------+------------------------------------
  Albuminur |         298           0       1,316
  CKD stage |         101           0         430
  CKD stage |          12           0          11
   Dialysis |          27           0          72
  Transplan |          88           0         270
  KRT uncle |           9           0          39
------------+------------------------------------
      Total |   215.98924   105.22168       2,138

    Variable |        Obs        Mean    Std. Dev.       Min        Max
-------------+---------------------------------------------------------
overall_op~s |      2,138         535           0        535        535

            |     Summary of total_neph_appts
  CKD group |        Mean   Std. Dev.       Freq.
------------+------------------------------------
  Albuminur |         409           0       1,316
  CKD stage |         101           0         430
  CKD stage |           2           0          11
   Dialysis |          24           0          72
  Transplan |          59           0         270
  KRT uncle |           5           0          39
------------+------------------------------------
      Total |   280.42516   163.86471       2,138

    Variable |        Obs        Mean    Std. Dev.       Min        Max
-------------+---------------------------------------------------------
overall_ne~s |      2,138         600           0        600        600

            |      Summary of total_tx_appts
  CKD group |        Mean   Std. Dev.       Freq.
------------+------------------------------------
  Albuminur |         424           0       1,316
  CKD stage |         116           0         430
  CKD stage |           0           0          11
   Dialysis |          19           0          72
  Transplan |          71           0         270
  KRT uncle |           8           0          39
------------+------------------------------------
      Total |   294.06642   165.98592       2,138

    Variable |        Obs        Mean    Std. Dev.       Min        Max
-------------+---------------------------------------------------------
overall_tx~s |      2,138         638           0        638        638

            |  Summary of total_gp_interactions
  CKD group |        Mean   Std. Dev.       Freq.
------------+------------------------------------
  Albuminur |         309           0       1,316
  CKD stage |         139           0         430
  CKD stage |          14           0          11
   Dialysis |          21           0          72
  Transplan |          86           0         270
  KRT uncle |           5           0          39
------------+------------------------------------
      Total |   229.88541   103.75564       2,138

    Variable |        Obs        Mean    Std. Dev.       Min        Max
-------------+---------------------------------------------------------
overall_gp~s |      2,138         574           0        574        574

            |     Summary of total_icd1_days
  CKD group |        Mean   Std. Dev.       Freq.
------------+------------------------------------
  Albuminur |         351           0       1,316
  CKD stage |          64           0         430
  CKD stage |           4           0          11
   Dialysis |          27           0          72
  Transplan |          63           0         270
  KRT uncle |          12           0          39
------------+------------------------------------
      Total |   238.02713   143.31333       2,138

    Variable |        Obs        Mean    Std. Dev.       Min        Max
-------------+---------------------------------------------------------
overall_ic~s |      2,138         521           0        521        521

            |     Summary of total_icd2_days
  CKD group |        Mean   Std. Dev.       Freq.
------------+------------------------------------
  Albuminur |         403           0       1,316
  CKD stage |          97           0         430
  CKD stage |           4           0          11
   Dialysis |           9           0          72
  Transplan |          58           0         270
  KRT uncle |          19           0          39
------------+------------------------------------
      Total |   275.56174   162.39464       2,138

    Variable |        Obs        Mean    Std. Dev.       Min        Max
-------------+---------------------------------------------------------
overa~2_days |      2,138         590           0        590        590

            |     Summary of total_icd3_days
  CKD group |        Mean   Std. Dev.       Freq.
------------+------------------------------------
  Albuminur |         303           0       1,316
  CKD stage |          87           0         430
  CKD stage |           4           0          11
   Dialysis |          17           0          72
  Transplan |          64           0         270
  KRT uncle |           9           0          39
------------+------------------------------------
      Total |   212.84238   115.17918       2,138

    Variable |        Obs        Mean    Std. Dev.       Min        Max
-------------+---------------------------------------------------------
overa~3_days |      2,138         484           0        484        484

            |     Summary of total_icd4_days
  CKD group |        Mean   Std. Dev.       Freq.
------------+------------------------------------
  Albuminur |         363           0       1,316
  CKD stage |         133           0         430
  CKD stage |           2           0          11
   Dialysis |          23           0          72
  Transplan |         107           0         270
  KRT uncle |          23           0          39
------------+------------------------------------
      Total |   264.90318   126.38175       2,138

    Variable |        Obs        Mean    Std. Dev.       Min        Max
-------------+---------------------------------------------------------
overa~4_days |      2,138         651           0        651        651

            |     Summary of total_icd5_days
  CKD group |        Mean   Std. Dev.       Freq.
------------+------------------------------------
  Albuminur |         306           0       1,316
  CKD stage |          93           0         430
  CKD stage |           0           0          11
   Dialysis |          10           0          72
  Transplan |          64           0         270
  KRT uncle |          17           0          39
------------+------------------------------------
      Total |   215.78531   115.51617       2,138

    Variable |        Obs        Mean    Std. Dev.       Min        Max
-------------+---------------------------------------------------------
overa~5_days |      2,138         490           0        490        490

            |     Summary of total_icd6_days
  CKD group |        Mean   Std. Dev.       Freq.
------------+------------------------------------
  Albuminur |         320           0       1,316
  CKD stage |         119           0         430
  CKD stage |           0           0          11
   Dialysis |          14           0          72
  Transplan |          67           0         270
  KRT uncle |          18           0          39
------------+------------------------------------
      Total |    230.1637   116.14046       2,138

    Variable |        Obs        Mean    Std. Dev.       Min        Max
-------------+---------------------------------------------------------
overa~6_days |      2,138         538           0        538        538

            |     Summary of total_icd7_days
  CKD group |        Mean   Std. Dev.       Freq.
------------+------------------------------------
  Albuminur |         322           0       1,316
  CKD stage |         106           0         430
  CKD stage |           0           0          11
   Dialysis |          28           0          72
  Transplan |          62           0         270
  KRT uncle |          11           0          39
------------+------------------------------------
      Total |   228.49252   119.96761       2,138

    Variable |        Obs        Mean    Std. Dev.       Min        Max
-------------+---------------------------------------------------------
overa~7_days |      2,138         529           0        529        529

            |     Summary of total_icd8_days
  CKD group |        Mean   Std. Dev.       Freq.
------------+------------------------------------
  Albuminur |         341           0       1,316
  CKD stage |         123           0         430
  CKD stage |           0           0          11
   Dialysis |          10           0          72
  Transplan |          77           0         270
  KRT uncle |          11           0          39
------------+------------------------------------
      Total |   244.89476   124.11746       2,138

    Variable |        Obs        Mean    Std. Dev.       Min        Max
-------------+---------------------------------------------------------
overa~8_days |      2,138         562           0        562        562

            |     Summary of total_icd9_days
  CKD group |        Mean   Std. Dev.       Freq.
------------+------------------------------------
  Albuminur |         382           0       1,316
  CKD stage |         117           0         430
  CKD stage |           3           0          11
   Dialysis |           8           0          72
  Transplan |          71           0         270
  KRT uncle |          13           0          39
------------+------------------------------------
      Total |   268.15154   146.01427       2,138

    Variable |        Obs        Mean    Std. Dev.       Min        Max
-------------+---------------------------------------------------------
overa~9_days |      2,138         594           0        594        594

            |     Summary of total_icd10_days
  CKD group |        Mean   Std. Dev.       Freq.
------------+------------------------------------
  Albuminur |         322           0       1,316
  CKD stage |         141           0         430
  CKD stage |           2           0          11
   Dialysis |          12           0          72
  Transplan |          85           0         270
  KRT uncle |           4           0          39
------------+------------------------------------
      Total |   237.78017   110.46654       2,138

    Variable |        Obs        Mean    Std. Dev.       Min        Max
-------------+---------------------------------------------------------
overa~0_days |      2,138         566           0        566        566

            |     Summary of total_icd11_days
  CKD group |        Mean   Std. Dev.       Freq.
------------+------------------------------------
  Albuminur |         351           0       1,316
  CKD stage |         100           0         430
  CKD stage |           0           0          11
   Dialysis |          23           0          72
  Transplan |          78           0         270
  KRT uncle |           6           0          39
------------+------------------------------------
      Total |    246.8971    132.9731       2,138

    Variable |        Obs        Mean    Std. Dev.       Min        Max
-------------+---------------------------------------------------------
over~11_days |      2,138         558           0        558        558

            |     Summary of total_icd12_days
  CKD group |        Mean   Std. Dev.       Freq.
------------+------------------------------------
  Albuminur |         335           0       1,316
  CKD stage |         107           0         430
  CKD stage |           8           0          11
   Dialysis |          30           0          72
  Transplan |          55           0         270
  KRT uncle |          12           0          39
------------+------------------------------------
      Total |   235.93826   127.02876       2,138

    Variable |        Obs        Mean    Std. Dev.       Min        Max
-------------+---------------------------------------------------------
over~12_days |      2,138         547           0        547        547

            |     Summary of total_icd13_days
  CKD group |        Mean   Std. Dev.       Freq.
------------+------------------------------------
  Albuminur |         370           0       1,316
  CKD stage |          74           0         430
  CKD stage |           3           0          11
   Dialysis |           9           0          72
  Transplan |          88           0         270
  KRT uncle |          12           0          39
------------+------------------------------------
      Total |   254.27923   147.31866       2,138

    Variable |        Obs        Mean    Std. Dev.       Min        Max
-------------+---------------------------------------------------------
over~13_days |      2,138         556           0        556        556

            |     Summary of total_icd14_days
  CKD group |        Mean   Std. Dev.       Freq.
------------+------------------------------------
  Albuminur |         316           0       1,316
  CKD stage |         132           0         430
  CKD stage |           7           0          11
   Dialysis |          18           0          72
  Transplan |          59           0         270
  KRT uncle |          18           0          39
------------+------------------------------------
      Total |   229.47661   113.01199       2,138

    Variable |        Obs        Mean    Std. Dev.       Min        Max
-------------+---------------------------------------------------------
over~14_days |      2,138         550           0        550        550

            |     Summary of total_icd15_days
  CKD group |        Mean   Std. Dev.       Freq.
------------+------------------------------------
  Albuminur |         345           0       1,316
  CKD stage |          87           0         430
  CKD stage |          -1           0          11
   Dialysis |           5           0          72
  Transplan |          72           0         270
  KRT uncle |           2           0          39
------------+------------------------------------
      Total |   239.14733   135.12313       2,138

    Variable |        Obs        Mean    Std. Dev.       Min        Max
-------------+---------------------------------------------------------
over~15_days |      2,138         510           0        510        510

            |     Summary of total_icd16_days
  CKD group |        Mean   Std. Dev.       Freq.
------------+------------------------------------
  Albuminur |         361           0       1,316
  CKD stage |         106           0         430
  CKD stage |           3           0          11
   Dialysis |           2           0          72
  Transplan |         104           0         270
  KRT uncle |          22           0          39
------------+------------------------------------
      Total |   257.14266   133.18025       2,138

    Variable |        Obs        Mean    Std. Dev.       Min        Max
-------------+---------------------------------------------------------
over~16_days |      2,138         598           0        598        598

            |     Summary of total_icd17_days
  CKD group |        Mean   Std. Dev.       Freq.
------------+------------------------------------
  Albuminur |         362           0       1,316
  CKD stage |          95           0         430
  CKD stage |           3           0          11
   Dialysis |          16           0          72
  Transplan |          80           0         270
  KRT uncle |           7           0          39
------------+------------------------------------
      Total |   252.71282   139.42586       2,138

    Variable |        Obs        Mean    Std. Dev.       Min        Max
-------------+---------------------------------------------------------
over~17_days |      2,138         563           0        563        563

            |     Summary of total_icd18_days
  CKD group |        Mean   Std. Dev.       Freq.
------------+------------------------------------
  Albuminur |         303           0       1,316
  CKD stage |          72           0         430
  CKD stage |           0           0          11
   Dialysis |          22           0          72
  Transplan |          63           0         270
  KRT uncle |          13           0          39
------------+------------------------------------
      Total |   209.92002   118.38256       2,138

    Variable |        Obs        Mean    Std. Dev.       Min        Max
-------------+---------------------------------------------------------
over~18_days |      2,138         473           0        473        473

            |     Summary of total_icd19_days
  CKD group |        Mean   Std. Dev.       Freq.
------------+------------------------------------
  Albuminur |         306           0       1,316
  CKD stage |         110           0         430
  CKD stage |           0           0          11
   Dialysis |          19           0          72
  Transplan |          77           0         270
  KRT uncle |          15           0          39
------------+------------------------------------
      Total |   221.11272   109.31138       2,138

    Variable |        Obs        Mean    Std. Dev.       Min        Max
-------------+---------------------------------------------------------
over~19_days |      2,138         527           0        527        527

            |     Summary of total_icd20_days
  CKD group |        Mean   Std. Dev.       Freq.
------------+------------------------------------
  Albuminur |         273           0       1,316
  CKD stage |         115           0         430
  CKD stage |           5           0          11
   Dialysis |          10           0          72
  Transplan |          54           0         270
  KRT uncle |           2           0          39
------------+------------------------------------
      Total |   198.38681   97.742179       2,138

    Variable |        Obs        Mean    Std. Dev.       Min        Max
-------------+---------------------------------------------------------
over~20_days |      2,138         459           0        459        459

            |     Summary of total_icd21_days
  CKD group |        Mean   Std. Dev.       Freq.
------------+------------------------------------
  Albuminur |         337           0       1,316
  CKD stage |         135           0         430
  CKD stage |           5           0          11
   Dialysis |          21           0          72
  Transplan |          37           0         270
  KRT uncle |          13           0          39
------------+------------------------------------
      Total |   240.22732   126.72693       2,138

    Variable |        Obs        Mean    Std. Dev.       Min        Max
-------------+---------------------------------------------------------
over~21_days |      2,138         548           0        548        548

            |     Summary of total_icd22_days
  CKD group |        Mean   Std. Dev.       Freq.
------------+------------------------------------
  Albuminur |         305           0       1,316
  CKD stage |         143           0         430
  CKD stage |           1           0          11
   Dialysis |          20           0          72
  Transplan |          82           0         270
  KRT uncle |          11           0          39
------------+------------------------------------
      Total |   227.73152   101.88393       2,138

    Variable |        Obs        Mean    Std. Dev.       Min        Max
-------------+---------------------------------------------------------
over~22_days |      2,138         562           0        562        562

. 
. 
. 
. **Potential effect modifiers
. * Ethnicity
. * 1 = White ethnicities (white British, white Irish, with other)
. * 2 = Mixed ethnicities (white & black Caribbean, white & black African, whit
> e & Asian, other mixed ethnicities)
. * 3 = South Asian ethnicities (Indian, Pakistani, Bangladeshi, other South As
> ian)
. * 4 = Black ethnicities (black Caribbean, black African, other black)
. * 5 = Other ethnicities (Chinese, all other ethnicities)
. * . = Unknown ethnicity
. replace ethnicity = . if ethnicity==.
(0 real changes made)

. replace ethnicity=6 if ethnicity==2
(87 real changes made)

. replace ethnicity=2 if ethnicity==3
(97 real changes made)

. replace ethnicity=3 if ethnicity==4
(71 real changes made)

. replace ethnicity=4 if ethnicity==6
(87 real changes made)

. replace ethnicity=6 if ethnicity==.
(535 real changes made)

. label define ethnicity  1 "White"                                       ///
>                                                 2 "South Asian"              
>            ///                                             
>                                                 3 "Black"                    
>                    ///
>                                                 4 "Mixed"                    
>                    ///
>                                                 5 "Other"                    
>                    ///
>                                                 6 "Unknown"     

. label values ethnicity ethnicity

. 
. * Index of multiple deprivation
. * Ordered 1-5 from most deprived to least deprived
. label define imd 1 "1 Most deprived" 2 "2" 3 "3" 4 "4" 5 "5 Least deprived"

. label values imd imd

. 
. * Region
. rename region region_string

. gen region = 1 if region_string=="East Midlands"
(1,913 missing values generated)

. replace region = 2 if region_string=="East"
(213 real changes made)

. replace region = 3 if region_string=="London"
(427 real changes made)

. replace region = 4 if region_string=="North East"
(210 real changes made)

. replace region = 5 if region_string=="North West"
(224 real changes made)

. replace region = 6 if region_string=="South East"
(208 real changes made)

. replace region = 7 if region_string=="South West"
(207 real changes made)

. replace region = 8 if region_string=="West Midlands"
(241 real changes made)

. replace region = 9 if region_string=="Yorkshire and The Humber"
(183 real changes made)

. label define region     1 "East Midlands"                                    
>    ///
>                                                 2 "East"                     
>                                    ///
>                                                 3 "London"                   
>                                    ///
>                                                 4 "North East"               
>                            ///
>                                                 5 "North West"               
>                            ///
>                                                 6 "South East"               
>                            ///
>                                                 7 "South West"               
>                            ///
>                                                 8 "West Midlands"            
>                            ///
>                                                 9 "Yorkshire and The Humber" 
>            

. label values region region

. label var region "Region"

. 
. * Urban/rural
. replace rural_urban=. if rural_urban<1|rural_urban>8
(0 real changes made)

. label define rural_urban 1 "Urban major conurbation"                         
>                    ///
>                                                  2 "Urban minor conurbation" 
>                                            ///
>                                                  3 "Urban city and town"     
>                                                    ///
>                                                  4 "Urban city and town in a 
> sparse setting"            ///
>                                                  5 "Rural town and fringe"   
>                                                    ///
>                                                  6 "Rural town and fringe in 
> a sparse setting"          ///
>                                                  7 "Rural village and dispers
> ed"                                        ///
>                                                  8 "Rural village and dispers
> ed in a sparse setting"

. label values rural_urban rural_urban

. * Urban (binary)
. * Urban = 1-4 + missing, Rural = 5-8
. generate urban=.
(2,138 missing values generated)

. replace urban=1 if rural_urban<=4|rural_urban==.
(884 real changes made)

. replace urban=0 if rural_urban>4 & rural_urban!=.
(1,254 real changes made)

. label var urban "Urban/rural"

. label define urban 0 "Rural" 1 "Urban"

. label values urban urban

. drop rural_urban

. 
. *Age bands for standardisation
. egen agecat = cut(age), at(0,18,20,25,30,35,40,45,50,55,60,65,70,75,80,85,90,
> 200)

. drop if agecat==0
(0 observations deleted)

. 
. *Age-standardisation weights (European Standard Population 2013)
. gen weight = .
(2,138 missing values generated)

. replace weight = 0.027261 if agecat==18
(45 real changes made)

. replace weight = 0.074349 if agecat==20
(183 real changes made)

. replace weight = 0.074349 if agecat==25
(190 real changes made)

. replace weight = 0.080545 if agecat==30
(191 real changes made)

. replace weight = 0.086741 if agecat==35
(165 real changes made)

. replace weight = 0.086741 if agecat==40
(160 real changes made)

. replace weight = 0.086741 if agecat==45
(173 real changes made)

. replace weight = 0.086741 if agecat==50
(188 real changes made)

. replace weight = 0.080545 if agecat==55
(168 real changes made)

. replace weight = 0.074349 if agecat==60
(162 real changes made)

. replace weight = 0.068154 if agecat==65
(142 real changes made)

. replace weight = 0.061958 if agecat==70
(120 real changes made)

. replace weight = 0.049566 if agecat==75
(98 real changes made)

. replace weight = 0.030979 if agecat==80
(83 real changes made)

. replace weight = 0.018587 if agecat==85
(42 real changes made)

. replace weight = 0.012392 if agecat==90
(28 real changes made)

. 
. 
. *Age standardised counts for each non-binary healthcare resource outcomes
. foreach aggregate of varlist hospital_days critical_care_days emergency_days 
> op_appts neph_appts tx_appts gp_interactions icd1_days icd2_days icd3_days ic
> d4_days icd5_days icd6_days icd7_days icd8_days icd9_days icd10_days icd11_da
> ys icd12_days icd13_days icd14_days icd15_days icd16_days icd17_days icd18_da
> ys icd19_days icd20_days icd21_days icd22_days {
  2. replace `aggregate' = `aggregate' * weight
  3. }
variable hospital_days was byte now float
(161 real changes made)
variable critical_care_days was byte now float
(202 real changes made)
variable emergency_days was byte now float
(195 real changes made)
variable op_appts was byte now float
(178 real changes made)
variable neph_appts was byte now float
(193 real changes made)
variable tx_appts was byte now float
(213 real changes made)
variable gp_interactions was byte now float
(194 real changes made)
variable icd1_days was byte now float
(178 real changes made)
variable icd2_days was byte now float
(191 real changes made)
variable icd3_days was byte now float
(160 real changes made)
variable icd4_days was byte now float
(219 real changes made)
variable icd5_days was byte now float
(175 real changes made)
variable icd6_days was byte now float
(188 real changes made)
variable icd7_days was byte now float
(178 real changes made)
variable icd8_days was byte now float
(184 real changes made)
variable icd9_days was byte now float
(211 real changes made)
variable icd10_days was byte now float
(196 real changes made)
variable icd11_days was byte now float
(193 real changes made)
variable icd12_days was byte now float
(189 real changes made)
variable icd13_days was byte now float
(192 real changes made)
variable icd14_days was byte now float
(178 real changes made)
variable icd15_days was byte now float
(182 real changes made)
variable icd16_days was byte now float
(190 real changes made)
variable icd17_days was byte now float
(190 real changes made)
variable icd18_days was byte now float
(174 real changes made)
variable icd19_days was byte now float
(182 real changes made)
variable icd20_days was byte now float
(152 real changes made)
variable icd21_days was byte now float
(200 real changes made)
variable icd22_days was byte now float
(195 real changes made)

. 
. * Create variable for age-standardised total # of each aggregated outcome
. * `var'_`aggregate' = age-standardised total # of each aggregated outcome ove
> rall stratified by ethnicity/imd/region/urban
. * `var'_`aggregate'_ckd = age-standardised total # of each aggregated outcome
>  in each CKD group stratified by ethnicity/imd/region/urban
. foreach aggregate of varlist hospital_days critical_care_days emergency_days 
> op_appts neph_appts tx_appts gp_interactions icd1_days icd2_days icd3_days ic
> d4_days icd5_days icd6_days icd7_days icd8_days icd9_days icd10_days icd11_da
> ys icd12_days icd13_days icd14_days icd15_days icd16_days icd17_days icd18_da
> ys icd19_days icd20_days icd21_days icd22_days {
  2. egen overall_std_`aggregate' = total(`aggregate')
  3. bysort ckd_group: egen std_`aggregate' = total(`aggregate')
  4. foreach var of varlist ethnicity imd region urban {
  5. bysort `var': egen `var'_`aggregate' = total(`aggregate')
  6. bysort `var' ckd_group: egen `var'_`aggregate'_ckd = total(`aggregate')
  7. }
  8. }

. 
. foreach binary of varlist fistula_formation pd_insertion blood_pressure album
> inuria creatinine icd1 icd2 icd3 icd4 icd5 icd6 icd7 icd8 icd9 icd10 icd11 ic
> d12 icd13 icd14 icd15 icd16 icd17 icd18 icd19 icd20 icd21 icd22 {
  2. gen esp_`binary' = `binary' * weight
  3. egen overall_std_`binary' = total(esp_`binary')
  4. bysort ckd_group: egen std_`binary' = total(esp_`binary')
  5. foreach var of varlist ethnicity imd region urban {
  6. bysort `var': egen `var'_`binary' = total(esp_`binary')
  7. bysort `var' ckd_group: egen `var'_`binary'_ckd = total(esp_`binary')
  8. }
  9. }

. 
. *Merge cost data
. save "./output/`dataset'_ckd_complete.dta", replace
(note: file ./output/2019_ckd_complete.dta not found)
file ./output/2019_ckd_complete.dta saved

. capture noisily import delimited ./output/costs_`dataset'.csv, clear
(7 vars, 500 obs)

. keep patient_id apcs_cost ec_cost opa_cost

. merge 1:1 patient_id using ./output/`dataset'_ckd_complete
(note: variable patient_id was int, now long to accommodate using data's
       values)

    Result                           # of obs.
    -----------------------------------------
    not matched                         2,634
        from master                       498  (_merge==1)
        from using                      2,136  (_merge==2)

    matched                                 2  (_merge==3)
    -----------------------------------------

. drop if _merge==1
(498 observations deleted)

. foreach cost of varlist apcs_cost ec_cost opa_cost {
  2. sum `cost', d
  3. bysort ckd_group: egen total_`cost' = total(`cost')
  4. egen overall_`cost' = total(`cost')
  5. tab ckd_group, sum(total_`cost')
  6. sum overall_`cost'
  7. foreach var of varlist ethnicity imd region urban {
  8. bysort `var': egen `var'_`cost' = total(`cost')
  9. bysort `var' ckd_group: egen `var'_`cost'_ckd = total(`cost')
 10. }
 11. }

                          apcs_cost
-------------------------------------------------------------
no observations

            |     Summary of total_apcs_cost
  CKD group |        Mean   Std. Dev.       Freq.
------------+------------------------------------
  Albuminur |           0           0       1,316
  CKD stage |           0           0         430
  CKD stage |           0           0          11
   Dialysis |           0           0          72
  Transplan |           0           0         270
  KRT uncle |           0           0          39
------------+------------------------------------
      Total |           0           0       2,138

    Variable |        Obs        Mean    Std. Dev.       Min        Max
-------------+---------------------------------------------------------
overall_ap~t |      2,138           0           0          0          0

                           ec_cost
-------------------------------------------------------------
no observations

            |      Summary of total_ec_cost
  CKD group |        Mean   Std. Dev.       Freq.
------------+------------------------------------
  Albuminur |           0           0       1,316
  CKD stage |           0           0         430
  CKD stage |           0           0          11
   Dialysis |           0           0          72
  Transplan |           0           0         270
  KRT uncle |           0           0          39
------------+------------------------------------
      Total |           0           0       2,138

    Variable |        Obs        Mean    Std. Dev.       Min        Max
-------------+---------------------------------------------------------
overall_ec~t |      2,138           0           0          0          0

                          opa_cost
-------------------------------------------------------------
no observations

            |      Summary of total_opa_cost
  CKD group |        Mean   Std. Dev.       Freq.
------------+------------------------------------
  Albuminur |           0           0       1,316
  CKD stage |           0           0         430
  CKD stage |           0           0          11
   Dialysis |           0           0          72
  Transplan |           0           0         270
  KRT uncle |           0           0          39
------------+------------------------------------
      Total |           0           0       2,138

    Variable |        Obs        Mean    Std. Dev.       Min        Max
-------------+---------------------------------------------------------
overall_op~t |      2,138           0           0          0          0

. save "./output/`dataset'_ckd_complete.dta", replace
file ./output/2019_ckd_complete.dta saved

. 
. log close
      name:  <unnamed>
       log:  /workspace/logs/2019_ckd_complete.log
  log type:  text
 closed on:  29 Apr 2024, 13:22:25
-------------------------------------------------------------------------------
