-------------------------------------------------------------------------------
      name:  <unnamed>
       log:  /workspace/logs/2019_ckd_complete.log
  log type:  text
 opened on:   7 Jun 2024, 10:22:11

. clear

. 
. *Merge `dataset'_ckd with `dataset'_ckd_complete
. capture noisily import delimited ./output/`dataset'_ckd.csv, clear
(8 vars, 21,196 obs)

. tempfile `dataset'_ckd

. save ``dataset'_ckd', replace
(note: file /tmp/St00012.000001 not found)
file /tmp/St00012.000001 saved

. capture noisily import delimited ./output/input_`dataset'_ckd_complete.csv, c
> lear
(104 vars, 50,000 obs)

. merge 1:1 patient_id using ``dataset'_ckd'

    Result                           # of obs.
    -----------------------------------------
    not matched                        67,126
        from master                    47,965  (_merge==1)
        from using                     19,161  (_merge==2)

    matched                             2,035  (_merge==3)
    -----------------------------------------

. keep if _merge==3
(67,126 observations deleted)

. drop _merge

. tempfile `dataset'_ckd_complete

. save ``dataset'_ckd_complete', replace
(note: file /tmp/St00012.000002 not found)
file /tmp/St00012.000002 saved

. 
. /*Generate dummy data
> cd ckd-healthcare-use
> capture noisily import delimited ./output/2017_ckd.csv, clear
> tempfile 2017_ckd
> save ./output/2017_ckd, replace
> capture noisily import delimited ./output/input_2017_ckd_complete.csv, clear
> merge 1:1 patient_id using ./output/2017_ckd
> keep if _merge==3
> drop _merge
> tempfile 2017_ckd_complete
> save ./output/2017_ckd_complete, replace
> */
. 
. *CKD stage classification
. foreach var of varlist  dialysis_baseline_primary_care  ///
>                                                 dialysis_baseline_icd_10     
>            ///
>                                                 dialysis_baseline_opcs_4     
>            ///
>                                                 dialysis_baseline_date       
>            ///
>                                                 kt_baseline_primary_care     
>            ///
>                                                 kt_baseline_icd_10           
>                    ///
>                                                 kt_baseline_opcs_4           
>                    {
  2.         drop `var'
  3.         }

. tab modality_baseline, m

modality_baseline |      Freq.     Percent        Cum.
------------------+-----------------------------------
         Dialysis |        198        9.73        9.73
Kidney transplant |        194        9.53       19.26
 Modality unclear |         32        1.57       20.84
          Pre KRT |      1,611       79.16      100.00
------------------+-----------------------------------
            Total |      2,035      100.00

. *To reduce misclassification of dialysis, anyone with eGFR >15 with modality_
> baseline=="Dialysis" will be reclassified as non-dialysis (e.g. they may have
>  received acute dialysis and recovered)
. *For modality_baseline="Modality unclear" (i.e. whose dialysis and kidney tra
> nsplant baseline dates are identical), those with eGFR <15 will be assumed to
>  be on dialysis and those >15 as kidney transplant
. egen esrd_egfr = cut(baseline_egfr), at (0, 15, 5000)
(845 missing values generated)

. recode esrd_egfr 0=1 15=0
(esrd_egfr: 1190 changes made)

. tab esrd_egfr, m

  esrd_egfr |      Freq.     Percent        Cum.
------------+-----------------------------------
          0 |      1,190       58.48       58.48
          . |        845       41.52      100.00
------------+-----------------------------------
      Total |      2,035      100.00

. gen dialysis = 0

. replace dialysis = 1 if modality_baseline=="Dialysis"
(198 real changes made)

. replace dialysis = 1 if modality_baseline=="Modality unclear" & esrd_egfr!=.
(20 real changes made)

. replace dialysis = 0 if esrd_egfr==0
(146 real changes made)

. gen kidney_transplant = 0

. replace kidney_transplant = 1 if kidney_transplant_baseline_date!=""
(293 real changes made)

. replace kidney_transplant = 0 if dialysis==1
(7 real changes made)

. gen modality_unclear = 0

. replace modality_unclear = 1 if modality_baseline=="Modality unclear"
(32 real changes made)

. replace modality_unclear = 0 if dialysis==1
(0 real changes made)

. replace modality_unclear = 0 if kidney_transplant==1
(6 real changes made)

. tab modality_baseline dialysis

                  |       dialysis
modality_baseline |         0          1 |     Total
------------------+----------------------+----------
         Dialysis |       126         72 |       198 
Kidney transplant |       194          0 |       194 
 Modality unclear |        32          0 |        32 
          Pre KRT |     1,611          0 |     1,611 
------------------+----------------------+----------
            Total |     1,963         72 |     2,035 

. tab modality_baseline kidney_transplant

                  |   kidney_transplant
modality_baseline |         0          1 |     Total
------------------+----------------------+----------
         Dialysis |       173         25 |       198 
Kidney transplant |       162         32 |       194 
 Modality unclear |        26          6 |        32 
          Pre KRT |     1,388        223 |     1,611 
------------------+----------------------+----------
            Total |     1,749        286 |     2,035 

. tab modality_baseline modality_unclear

                  |   modality_unclear
modality_baseline |         0          1 |     Total
------------------+----------------------+----------
         Dialysis |       198          0 |       198 
Kidney transplant |       194          0 |       194 
 Modality unclear |         6         26 |        32 
          Pre KRT |     1,611          0 |     1,611 
------------------+----------------------+----------
            Total |     2,009         26 |     2,035 

. tab dialysis kidney_transplant

           |   kidney_transplant
  dialysis |         0          1 |     Total
-----------+----------------------+----------
         0 |     1,677        286 |     1,963 
         1 |        72          0 |        72 
-----------+----------------------+----------
     Total |     1,749        286 |     2,035 

. egen ckd_group = cut(baseline_egfr), at(0, 30, 60, 5000)
(845 missing values generated)

. recode ckd_group 0=3 30=2 60=1
(ckd_group: 1190 changes made)

. replace ckd_group = 4 if dialysis==1
(72 real changes made)

. replace ckd_group = 5 if kidney_transplant==1
(286 real changes made)

. replace ckd_group = 6 if modality_unclear==1
(26 real changes made)

. *ckd_group==. are those with albuminuria without available eGFR measurement o
> r code for KRT
. replace ckd_group = 1 if ckd_group==.
(645 real changes made)

. label define ckd_group 1 "Albuminuria" 2 "CKD stage 3" 3 "CKD stage 4/5" 4 "D
> ialysis" 5 "Transplant" 6 "KRT unclear modality"

. label values ckd_group ckd_group

. label var ckd_group "CKD group"

. tab ckd_group, m

           CKD group |      Freq.     Percent        Cum.
---------------------+-----------------------------------
         Albuminuria |      1,272       62.51       62.51
         CKD stage 3 |        373       18.33       80.84
       CKD stage 4/5 |          6        0.29       81.13
            Dialysis |         72        3.54       84.67
          Transplant |        286       14.05       98.72
KRT unclear modality |         26        1.28      100.00
---------------------+-----------------------------------
               Total |      2,035      100.00

. drop if ckd_group==.
(0 observations deleted)

. tab ckd_group modality_baseline

                     |              modality_baseline
           CKD group |  Dialysis  Kidney ..  Modalit..    Pre KRT |     Total
---------------------+--------------------------------------------+----------
         Albuminuria |        69        136          0      1,067 |     1,272 
         CKD stage 3 |        29         26          0        318 |       373 
       CKD stage 4/5 |         3          0          0          3 |         6 
            Dialysis |        72          0          0          0 |        72 
          Transplant |        25         32          6        223 |       286 
KRT unclear modality |         0          0         26          0 |        26 
---------------------+--------------------------------------------+----------
               Total |       198        194         32      1,611 |     2,035 

. 
. *Dialysis & kidney transplant outcome classification
. foreach var of varlist  dialysis_outcome_primary_care   ///
>                                                 dialysis_outcome_icd_10      
>            ///
>                                                 dialysis_outcome_opcs_4      
>            ///
>                                                 dialysis_outcome_date        
>            ///
>                                                 kt_outcome_primary_care      
>            ///
>                                                 kt_outcome_icd_10            
>                    ///
>                                                 kt_outcome_opcs_4            
>                    ///
>                                                 kidney_transplant_outcome_dat
> e  ///
>                                                 died                         
>                            {
  2.         drop `var'
  3.         }

. tab ckd_group modality_outcome, m

                     |              modality_outcome
           CKD group |  Deceased   Dialysis  Kidney ..  Modalit.. |     Total
---------------------+--------------------------------------------+----------
         Albuminuria |       142         57         46         12 |     1,272 
         CKD stage 3 |        45         16         18          3 |       373 
       CKD stage 4/5 |         1          0          0          0 |         6 
            Dialysis |         6          3          1          3 |        72 
          Transplant |        32         14         12          3 |       286 
KRT unclear modality |         2          2          0          0 |        26 
---------------------+--------------------------------------------+----------
               Total |       228         92         77         21 |     2,035 


                     | modality_o
                     |   utcome
           CKD group | Unchanged |     Total
---------------------+-----------+----------
         Albuminuria |     1,015 |     1,272 
         CKD stage 3 |       291 |       373 
       CKD stage 4/5 |         5 |         6 
            Dialysis |        59 |        72 
          Transplant |       225 |       286 
KRT unclear modality |        22 |        26 
---------------------+-----------+----------
               Total |     1,617 |     2,035 

. 
. *eGFR outcome classification based on updated mean eGFR over previous 18 mont
> hs by the end of year
. gen sex = 1 if male == "Male"
(1,081 missing values generated)

. replace sex = 0 if male == "Female"
(1,081 real changes made)

. label define sex 0"Female" 1"Male"

. label values sex sex

. replace creatinine_outcome = . if !inrange(creatinine_outcome, 20, 3000)
(883 real changes made, 883 to missing)

. gen mgdl_creatinine_outcome = creatinine_outcome/88.4
(883 missing values generated)

. gen min_creatinine_outcome=.
(2,035 missing values generated)

. replace min_creatinine_outcome = mgdl_creatinine_outcome/0.7 if sex==0
(612 real changes made)

. replace min_creatinine_outcome = mgdl_creatinine_outcome/0.9 if sex==1
(540 real changes made)

. replace min_creatinine_outcome = min_creatinine_outcome^-0.329  if sex==0
(612 real changes made)

. replace min_creatinine_outcome = min_creatinine_outcome^-0.411  if sex==1
(540 real changes made)

. replace min_creatinine_outcome = 1 if min_creatinine_outcome<1
(745 real changes made)

. gen max_creatinine_outcome=.
(2,035 missing values generated)

. replace max_creatinine_outcome = mgdl_creatinine_outcome/0.7 if sex==0
(612 real changes made)

. replace max_creatinine_outcome = mgdl_creatinine_outcome/0.9 if sex==1
(540 real changes made)

. replace max_creatinine_outcome = max_creatinine_outcome^-1.209
(1,152 real changes made)

. replace max_creatinine_outcome = 1 if max_creatinine_outcome>1
(1,290 real changes made)

. gen egfr_outcome = min_creatinine_outcome*max_creatinine_outcome*141
(883 missing values generated)

. replace egfr_outcome = egfr_outcome*(0.993^age)
(1,152 real changes made)

. replace egfr_outcome = egfr_outcome*1.018 if sex==0
(612 real changes made)

. drop creatinine_outcome

. drop mgdl_creatinine_outcome

. drop min_creatinine_outcome

. drop max_creatinine_outcome

. egen egfr_end = cut(egfr_outcome), at(0, 30, 60, 5000)
(883 missing values generated)

. recode egfr_end 0=3 30=2 60=1
(egfr_end: 1152 changes made)

. label define egfr_end 1 "≥60" 2 "30-59" 3 "<30"

. label values egfr_end egfr_end

. label var egfr_end "Final eGFR"

. gen ckd_progression = 0

. replace ckd_progression = 1 if egfr_end==2 & ckd_group==1
(182 real changes made)

. replace ckd_progression = 2 if egfr_end==3 & ckd_group==1
(7 real changes made)

. replace ckd_progression = 2 if egfr_end==3 & ckd_group==2
(2 real changes made)

. egen esrd_egfr_end = cut(egfr_outcome), at (0, 15, 5000)
(883 missing values generated)

. recode esrd_egfr_end 0=1 15=0
(esrd_egfr_end: 1152 changes made)

. tab esrd_egfr_end, m

esrd_egfr_e |
         nd |      Freq.     Percent        Cum.
------------+-----------------------------------
          0 |      1,152       56.61       56.61
          . |        883       43.39      100.00
------------+-----------------------------------
      Total |      2,035      100.00

. gen dialysis_outcome = 0

. replace dialysis_outcome = 1 if modality_outcome=="Dialysis"
(92 real changes made)

. replace dialysis_outcome = 1 if modality_outcome=="Modality unclear" & esrd_e
> gfr_end==1
(0 real changes made)

. gen kidney_transplant_outcome = 0

. replace kidney_transplant_outcome = 1 if modality_outcome=="Kidney transplant
> "
(77 real changes made)

. replace kidney_transplant_outcome = 1 if modality_outcome=="Modality unclear"
>  & esrd_egfr_end==0
(16 real changes made)

. replace ckd_progression = 5 if modality_outcome=="Modality unclear"
(21 real changes made)

. replace ckd_progression = 3 if dialysis_outcome==1
(92 real changes made)

. replace ckd_progression = 4 if kidney_transplant_outcome==1
(93 real changes made)

. replace ckd_progression = 6 if modality_outcome=="Deceased"
(228 real changes made)

. label define ckd_progression 0 "No progression" 1 "CKD 3" 2 "CKD 4/5 pre-KRT"
>  3 "Dialysis" 4 "Kidney transplant" 5 "KRT unclear modality" 6 "Deceased"

. label values ckd_progression ckd_progression

. label var ckd_progression "CKD progression"

. tab ckd_progression, m

     CKD progression |      Freq.     Percent        Cum.
---------------------+-----------------------------------
      No progression |      1,465       71.99       71.99
               CKD 3 |        144        7.08       79.07
     CKD 4/5 pre-KRT |          8        0.39       79.46
            Dialysis |         92        4.52       83.98
   Kidney transplant |         93        4.57       88.55
KRT unclear modality |          5        0.25       88.80
            Deceased |        228       11.20      100.00
---------------------+-----------------------------------
               Total |      2,035      100.00

. 
. *eGFR cut-offs to investigate timing of access formation
. egen access_egfr = cut(baseline_egfr), at (0, 15, 5000)
(845 missing values generated)

. recode access_egfr 0=1 15=2
(access_egfr: 1190 changes made)

. replace access_egfr=0 if ckd_group==4
(72 real changes made)

. replace access_egfr=3 if access_egfr==.
(773 real changes made)

. label define access_egfr 0 "Dialysis" 1 "eGFR 0-14" 2 "eGFR >= 15" 3 "Unknown
> "

. label values access_egfr access_egfr

. 
. *Totals for non-binary healthcare resource outcomes (including by month)
. foreach aggregate of varlist hospital_days critical_care_days emergency_days 
> op_appts neph_appts tx_appts gp_interactions icd1_days icd2_days icd3_days ic
> d4_days icd5_days icd6_days icd7_days icd8_days icd9_days icd10_days icd11_da
> ys icd12_days icd13_days icd14_days icd15_days icd16_days icd17_days icd18_da
> ys icd19_days icd20_days icd21_days icd22_days {
  2. bysort ckd_group: egen total_`aggregate' = total(`aggregate')
  3. egen overall_`aggregate' = total(`aggregate')
  4. tab ckd_group, sum(total_`aggregate')
  5. sum overall_`aggregate'
  6. }

            |   Summary of total_hospital_days
  CKD group |        Mean   Std. Dev.       Freq.
------------+------------------------------------
  Albuminur |         300           0       1,272
  CKD stage |         106           0         373
  CKD stage |           0           0           6
   Dialysis |          16           0          72
  Transplan |          87           0         286
  KRT uncle |          12           0          26
------------+------------------------------------
      Total |   219.89386   105.07981       2,035

    Variable |        Obs        Mean    Std. Dev.       Min        Max
-------------+---------------------------------------------------------
overall_ho~s |      2,035         521           0        521        521

            | Summary of total_critical_care_days
  CKD group |        Mean   Std. Dev.       Freq.
------------+------------------------------------
  Albuminur |         298           0       1,272
  CKD stage |          73           0         373
  CKD stage |           0           0           6
   Dialysis |          27           0          72
  Transplan |          65           0         286
  KRT uncle |           9           0          26
------------+------------------------------------
      Total |   209.85405   114.33736       2,035

    Variable |        Obs        Mean    Std. Dev.       Min        Max
-------------+---------------------------------------------------------
overall_cr~s |      2,035         472           0        472        472

            |   Summary of total_emergency_days
  CKD group |        Mean   Std. Dev.       Freq.
------------+------------------------------------
  Albuminur |         302           0       1,272
  CKD stage |         104           0         373
  CKD stage |           0           0           6
   Dialysis |          11           0          72
  Transplan |          64           0         286
  KRT uncle |          15           0          26
------------+------------------------------------
      Total |   217.40639   110.96808       2,035

    Variable |        Obs        Mean    Std. Dev.       Min        Max
-------------+---------------------------------------------------------
overall_em~s |      2,035         496           0        496        496

            |      Summary of total_op_appts
  CKD group |        Mean   Std. Dev.       Freq.
------------+------------------------------------
  Albuminur |         321           0       1,272
  CKD stage |          72           0         373
  CKD stage |           0           0           6
   Dialysis |           4           0          72
  Transplan |          66           0         286
  KRT uncle |           9           0          26
------------+------------------------------------
      Total |   223.37396   126.81844       2,035

    Variable |        Obs        Mean    Std. Dev.       Min        Max
-------------+---------------------------------------------------------
overall_op~s |      2,035         472           0        472        472

            |     Summary of total_neph_appts
  CKD group |        Mean   Std. Dev.       Freq.
------------+------------------------------------
  Albuminur |         384           0       1,272
  CKD stage |         125           0         373
  CKD stage |           0           0           6
   Dialysis |          12           0          72
  Transplan |          68           0         286
  KRT uncle |          -2           0          26
------------+------------------------------------
      Total |   272.89091   145.70172       2,035

    Variable |        Obs        Mean    Std. Dev.       Min        Max
-------------+---------------------------------------------------------
overall_ne~s |      2,035         587           0        587        587

            |      Summary of total_tx_appts
  CKD group |        Mean   Std. Dev.       Freq.
------------+------------------------------------
  Albuminur |         318           0       1,272
  CKD stage |         121           0         373
  CKD stage |           3           0           6
   Dialysis |          13           0          72
  Transplan |          66           0         286
  KRT uncle |           4           0          26
------------+------------------------------------
      Total |   230.74349   115.21574       2,035

    Variable |        Obs        Mean    Std. Dev.       Min        Max
-------------+---------------------------------------------------------
overall_tx~s |      2,035         525           0        525        525

            |  Summary of total_gp_interactions
  CKD group |        Mean   Std. Dev.       Freq.
------------+------------------------------------
  Albuminur |         340           0       1,272
  CKD stage |         105           0         373
  CKD stage |           0           0           6
   Dialysis |          31           0          72
  Transplan |          74           0         286
  KRT uncle |           0           0          26
------------+------------------------------------
      Total |   243.26339   126.14374       2,035

    Variable |        Obs        Mean    Std. Dev.       Min        Max
-------------+---------------------------------------------------------
overall_gp~s |      2,035         550           0        550        550

            |     Summary of total_icd1_days
  CKD group |        Mean   Std. Dev.       Freq.
------------+------------------------------------
  Albuminur |         255           0       1,272
  CKD stage |         101           0         373
  CKD stage |           0           0           6
   Dialysis |          31           0          72
  Transplan |          65           0         286
  KRT uncle |           8           0          26
------------+------------------------------------
      Total |   188.23735   87.826414       2,035

    Variable |        Obs        Mean    Std. Dev.       Min        Max
-------------+---------------------------------------------------------
overall_ic~s |      2,035         460           0        460        460

            |     Summary of total_icd2_days
  CKD group |        Mean   Std. Dev.       Freq.
------------+------------------------------------
  Albuminur |         319           0       1,272
  CKD stage |          97           0         373
  CKD stage |          -1           0           6
   Dialysis |          24           0          72
  Transplan |          71           0         286
  KRT uncle |           0           0          26
------------+------------------------------------
      Total |   227.99853   118.67567       2,035

    Variable |        Obs        Mean    Std. Dev.       Min        Max
-------------+---------------------------------------------------------
overa~2_days |      2,035         510           0        510        510

            |     Summary of total_icd3_days
  CKD group |        Mean   Std. Dev.       Freq.
------------+------------------------------------
  Albuminur |         349           0       1,272
  CKD stage |         101           0         373
  CKD stage |           3           0           6
   Dialysis |          19           0          72
  Transplan |          92           0         286
  KRT uncle |          11           0          26
------------+------------------------------------
      Total |   250.41032   128.48944       2,035

    Variable |        Obs        Mean    Std. Dev.       Min        Max
-------------+---------------------------------------------------------
overa~3_days |      2,035         575           0        575        575

            |     Summary of total_icd4_days
  CKD group |        Mean   Std. Dev.       Freq.
------------+------------------------------------
  Albuminur |         311           0       1,272
  CKD stage |          90           0         373
  CKD stage |           0           0           6
   Dialysis |           7           0          72
  Transplan |          54           0         286
  KRT uncle |          11           0          26
------------+------------------------------------
      Total |   218.86781   120.24274       2,035

    Variable |        Obs        Mean    Std. Dev.       Min        Max
-------------+---------------------------------------------------------
overa~4_days |      2,035         473           0        473        473

            |     Summary of total_icd5_days
  CKD group |        Mean   Std. Dev.       Freq.
------------+------------------------------------
  Albuminur |         323           0       1,272
  CKD stage |         135           0         373
  CKD stage |           6           0           6
   Dialysis |          15           0          72
  Transplan |          90           0         286
  KRT uncle |           4           0          26
------------+------------------------------------
      Total |   239.88747    110.2686       2,035

    Variable |        Obs        Mean    Std. Dev.       Min        Max
-------------+---------------------------------------------------------
overa~5_days |      2,035         573           0        573        573

            |     Summary of total_icd6_days
  CKD group |        Mean   Std. Dev.       Freq.
------------+------------------------------------
  Albuminur |         294           0       1,272
  CKD stage |          97           0         373
  CKD stage |           0           0           6
   Dialysis |          36           0          72
  Transplan |         102           0         286
  KRT uncle |           8           0          26
------------+------------------------------------
      Total |   217.25848   100.32429       2,035

    Variable |        Obs        Mean    Std. Dev.       Min        Max
-------------+---------------------------------------------------------
overa~6_days |      2,035         537           0        537        537

            |     Summary of total_icd7_days
  CKD group |        Mean   Std. Dev.       Freq.
------------+------------------------------------
  Albuminur |         289           0       1,272
  CKD stage |          64           0         373
  CKD stage |           0           0           6
   Dialysis |          19           0          72
  Transplan |         105           0         286
  KRT uncle |           0           0          26
------------+------------------------------------
      Total |   207.80246   106.50101       2,035

    Variable |        Obs        Mean    Std. Dev.       Min        Max
-------------+---------------------------------------------------------
overa~7_days |      2,035         477           0        477        477

            |     Summary of total_icd8_days
  CKD group |        Mean   Std. Dev.       Freq.
------------+------------------------------------
  Albuminur |         311           0       1,272
  CKD stage |          74           0         373
  CKD stage |           0           0           6
   Dialysis |          31           0          72
  Transplan |          95           0         286
  KRT uncle |          16           0          26
------------+------------------------------------
      Total |   222.61032    114.9655       2,035

    Variable |        Obs        Mean    Std. Dev.       Min        Max
-------------+---------------------------------------------------------
overa~8_days |      2,035         527           0        527        527

            |     Summary of total_icd9_days
  CKD group |        Mean   Std. Dev.       Freq.
------------+------------------------------------
  Albuminur |         294           0       1,272
  CKD stage |          87           0         373
  CKD stage |           1           0           6
   Dialysis |           9           0          72
  Transplan |          55           0         286
  KRT uncle |          14           0          26
------------+------------------------------------
      Total |   207.94447   112.29849       2,035

    Variable |        Obs        Mean    Std. Dev.       Min        Max
-------------+---------------------------------------------------------
overa~9_days |      2,035         460           0        460        460

            |     Summary of total_icd10_days
  CKD group |        Mean   Std. Dev.       Freq.
------------+------------------------------------
  Albuminur |         304           0       1,272
  CKD stage |          95           0         373
  CKD stage |           0           0           6
   Dialysis |          20           0          72
  Transplan |          50           0         286
  KRT uncle |          12           0          26
------------+------------------------------------
      Total |   215.31941   115.89386       2,035

    Variable |        Obs        Mean    Std. Dev.       Min        Max
-------------+---------------------------------------------------------
overa~0_days |      2,035         481           0        481        481

            |     Summary of total_icd11_days
  CKD group |        Mean   Std. Dev.       Freq.
------------+------------------------------------
  Albuminur |         325           0       1,272
  CKD stage |         128           0         373
  CKD stage |           3           0           6
   Dialysis |          21           0          72
  Transplan |          74           0         286
  KRT uncle |           7           0          26
------------+------------------------------------
      Total |   237.84767   115.09139       2,035

    Variable |        Obs        Mean    Std. Dev.       Min        Max
-------------+---------------------------------------------------------
over~11_days |      2,035         558           0        558        558

            |     Summary of total_icd12_days
  CKD group |        Mean   Std. Dev.       Freq.
------------+------------------------------------
  Albuminur |         315           0       1,272
  CKD stage |         128           0         373
  CKD stage |           0           0           6
   Dialysis |          12           0          72
  Transplan |          90           0         286
  KRT uncle |          13           0          26
------------+------------------------------------
      Total |   233.59509   107.74718       2,035

    Variable |        Obs        Mean    Std. Dev.       Min        Max
-------------+---------------------------------------------------------
over~12_days |      2,035         558           0        558        558

            |     Summary of total_icd13_days
  CKD group |        Mean   Std. Dev.       Freq.
------------+------------------------------------
  Albuminur |         390           0       1,272
  CKD stage |          74           0         373
  CKD stage |           0           0           6
   Dialysis |           9           0          72
  Transplan |          44           0         286
  KRT uncle |           4           0          26
------------+------------------------------------
      Total |   263.89091   163.47914       2,035

    Variable |        Obs        Mean    Std. Dev.       Min        Max
-------------+---------------------------------------------------------
over~13_days |      2,035         521           0        521        521

            |     Summary of total_icd14_days
  CKD group |        Mean   Std. Dev.       Freq.
------------+------------------------------------
  Albuminur |         302           0       1,272
  CKD stage |         112           0         373
  CKD stage |           0           0           6
   Dialysis |           8           0          72
  Transplan |          67           0         286
  KRT uncle |           1           0          26
------------+------------------------------------
      Total |   219.00934   109.45905       2,035

    Variable |        Obs        Mean    Std. Dev.       Min        Max
-------------+---------------------------------------------------------
over~14_days |      2,035         490           0        490        490

            |     Summary of total_icd15_days
  CKD group |        Mean   Std. Dev.       Freq.
------------+------------------------------------
  Albuminur |         271           0       1,272
  CKD stage |          68           0         373
  CKD stage |           3           0           6
   Dialysis |          15           0          72
  Transplan |          91           0         286
  KRT uncle |           7           0          26
------------+------------------------------------
      Total |   195.27371   98.985365       2,035

    Variable |        Obs        Mean    Std. Dev.       Min        Max
-------------+---------------------------------------------------------
over~15_days |      2,035         455           0        455        455

            |     Summary of total_icd16_days
  CKD group |        Mean   Std. Dev.       Freq.
------------+------------------------------------
  Albuminur |         271           0       1,272
  CKD stage |         109           0         373
  CKD stage |           4           0           6
   Dialysis |          12           0          72
  Transplan |          78           0         286
  KRT uncle |          12           0          26
------------+------------------------------------
      Total |   200.92236    92.62443       2,035

    Variable |        Obs        Mean    Std. Dev.       Min        Max
-------------+---------------------------------------------------------
over~16_days |      2,035         486           0        486        486

            |     Summary of total_icd17_days
  CKD group |        Mean   Std. Dev.       Freq.
------------+------------------------------------
  Albuminur |         286           0       1,272
  CKD stage |          67           0         373
  CKD stage |           4           0           6
   Dialysis |          20           0          72
  Transplan |          75           0         286
  KRT uncle |           2           0          26
------------+------------------------------------
      Total |   202.33366   108.72909       2,035

    Variable |        Obs        Mean    Std. Dev.       Min        Max
-------------+---------------------------------------------------------
over~17_days |      2,035         454           0        454        454

            |     Summary of total_icd18_days
  CKD group |        Mean   Std. Dev.       Freq.
------------+------------------------------------
  Albuminur |         321           0       1,272
  CKD stage |          77           0         373
  CKD stage |           8           0           6
   Dialysis |           2           0          72
  Transplan |          74           0         286
  KRT uncle |           0           0          26
------------+------------------------------------
      Total |   225.25258   124.62958       2,035

    Variable |        Obs        Mean    Std. Dev.       Min        Max
-------------+---------------------------------------------------------
over~18_days |      2,035         482           0        482        482

            |     Summary of total_icd19_days
  CKD group |        Mean   Std. Dev.       Freq.
------------+------------------------------------
  Albuminur |         295           0       1,272
  CKD stage |          90           0         373
  CKD stage |           0           0           6
   Dialysis |          10           0          72
  Transplan |          64           0         286
  KRT uncle |          -1           0          26
------------+------------------------------------
      Total |   210.22506   110.77589       2,035

    Variable |        Obs        Mean    Std. Dev.       Min        Max
-------------+---------------------------------------------------------
over~19_days |      2,035         458           0        458        458

            |     Summary of total_icd20_days
  CKD group |        Mean   Std. Dev.       Freq.
------------+------------------------------------
  Albuminur |         350           0       1,272
  CKD stage |          84           0         373
  CKD stage |           0           0           6
   Dialysis |           4           0          72
  Transplan |          52           0         286
  KRT uncle |           4           0          26
------------+------------------------------------
      Total |    241.6688   140.89029       2,035

    Variable |        Obs        Mean    Std. Dev.       Min        Max
-------------+---------------------------------------------------------
over~20_days |      2,035         494           0        494        494

            |     Summary of total_icd21_days
  CKD group |        Mean   Std. Dev.       Freq.
------------+------------------------------------
  Albuminur |         322           0       1,272
  CKD stage |         120           0         373
  CKD stage |           5           0           6
   Dialysis |          52           0          72
  Transplan |         100           0         286
  KRT uncle |          10           0          26
------------+------------------------------------
      Total |   239.30123   108.12665       2,035

    Variable |        Obs        Mean    Std. Dev.       Min        Max
-------------+---------------------------------------------------------
over~21_days |      2,035         609           0        609        609

            |     Summary of total_icd22_days
  CKD group |        Mean   Std. Dev.       Freq.
------------+------------------------------------
  Albuminur |         284           0       1,272
  CKD stage |          95           0         373
  CKD stage |           0           0           6
   Dialysis |          42           0          72
  Transplan |          62           0         286
  KRT uncle |           6           0          26
------------+------------------------------------
      Total |   205.20639   102.79985       2,035

    Variable |        Obs        Mean    Std. Dev.       Min        Max
-------------+---------------------------------------------------------
over~22_days |      2,035         489           0        489        489

. 
. 
. 
. **Potential effect modifiers
. * Ethnicity
. * 1 = White ethnicities (white British, white Irish, with other)
. * 2 = Mixed ethnicities (white & black Caribbean, white & black African, whit
> e & Asian, other mixed ethnicities)
. * 3 = South Asian ethnicities (Indian, Pakistani, Bangladeshi, other South As
> ian)
. * 4 = Black ethnicities (black Caribbean, black African, other black)
. * 5 = Other ethnicities (Chinese, all other ethnicities)
. * . = Unknown ethnicity
. replace ethnicity = . if ethnicity==.
(0 real changes made)

. replace ethnicity=6 if ethnicity==2
(51 real changes made)

. replace ethnicity=2 if ethnicity==3
(75 real changes made)

. replace ethnicity=3 if ethnicity==4
(72 real changes made)

. replace ethnicity=4 if ethnicity==6
(51 real changes made)

. replace ethnicity=6 if ethnicity==.
(508 real changes made)

. label define ethnicity  1 "White"                                       ///
>                                                 2 "South Asian"              
>            ///                                             
>                                                 3 "Black"                    
>                    ///
>                                                 4 "Mixed"                    
>                    ///
>                                                 5 "Other"                    
>                    ///
>                                                 6 "Unknown"     

. label values ethnicity ethnicity

. 
. * Index of multiple deprivation
. * Ordered 1-5 from most deprived to least deprived
. label define imd 1 "1 Most deprived" 2 "2" 3 "3" 4 "4" 5 "5 Least deprived"

. label values imd imd

. 
. * Region
. rename region region_string

. gen region = 1 if region_string=="East Midlands"
(1,818 missing values generated)

. replace region = 2 if region_string=="East"
(213 real changes made)

. replace region = 3 if region_string=="London"
(401 real changes made)

. replace region = 4 if region_string=="North East"
(200 real changes made)

. replace region = 5 if region_string=="North West"
(227 real changes made)

. replace region = 6 if region_string=="South East"
(180 real changes made)

. replace region = 7 if region_string=="South West"
(176 real changes made)

. replace region = 8 if region_string=="West Midlands"
(210 real changes made)

. replace region = 9 if region_string=="Yorkshire and The Humber"
(211 real changes made)

. label define region     1 "East Midlands"                                    
>    ///
>                                                 2 "East"                     
>                                    ///
>                                                 3 "London"                   
>                                    ///
>                                                 4 "North East"               
>                            ///
>                                                 5 "North West"               
>                            ///
>                                                 6 "South East"               
>                            ///
>                                                 7 "South West"               
>                            ///
>                                                 8 "West Midlands"            
>                            ///
>                                                 9 "Yorkshire and The Humber" 
>            

. label values region region

. label var region "Region"

. 
. * Urban/rural
. replace rural_urban=. if rural_urban<1|rural_urban>8
(0 real changes made)

. label define rural_urban 1 "Urban major conurbation"                         
>                    ///
>                                                  2 "Urban minor conurbation" 
>                                            ///
>                                                  3 "Urban city and town"     
>                                                    ///
>                                                  4 "Urban city and town in a 
> sparse setting"            ///
>                                                  5 "Rural town and fringe"   
>                                                    ///
>                                                  6 "Rural town and fringe in 
> a sparse setting"          ///
>                                                  7 "Rural village and dispers
> ed"                                        ///
>                                                  8 "Rural village and dispers
> ed in a sparse setting"

. label values rural_urban rural_urban

. * Urban (binary)
. * Urban = 1-4 + missing, Rural = 5-8
. generate urban=.
(2,035 missing values generated)

. replace urban=1 if rural_urban<=4|rural_urban==.
(794 real changes made)

. replace urban=0 if rural_urban>4 & rural_urban!=.
(1,241 real changes made)

. label var urban "Urban/rural"

. label define urban 0 "Rural" 1 "Urban"

. label values urban urban

. drop rural_urban

. 
. *Age bands for standardisation
. egen agecat = cut(age), at(0,18,20,25,30,35,40,45,50,55,60,65,70,75,80,85,90,
> 200)

. drop if agecat==0
(0 observations deleted)

. 
. *Age-standardisation weights (European Standard Population 2013)
. gen weight = .
(2,035 missing values generated)

. replace weight = 0.027261 if agecat==18
(60 real changes made)

. replace weight = 0.074349 if agecat==20
(155 real changes made)

. replace weight = 0.074349 if agecat==25
(181 real changes made)

. replace weight = 0.080545 if agecat==30
(148 real changes made)

. replace weight = 0.086741 if agecat==35
(182 real changes made)

. replace weight = 0.086741 if agecat==40
(166 real changes made)

. replace weight = 0.086741 if agecat==45
(169 real changes made)

. replace weight = 0.086741 if agecat==50
(190 real changes made)

. replace weight = 0.080545 if agecat==55
(161 real changes made)

. replace weight = 0.074349 if agecat==60
(146 real changes made)

. replace weight = 0.068154 if agecat==65
(141 real changes made)

. replace weight = 0.061958 if agecat==70
(123 real changes made)

. replace weight = 0.049566 if agecat==75
(91 real changes made)

. replace weight = 0.030979 if agecat==80
(67 real changes made)

. replace weight = 0.018587 if agecat==85
(35 real changes made)

. replace weight = 0.012392 if agecat==90
(20 real changes made)

. 
. 
. *Age standardised counts for each non-binary healthcare resource outcomes
. foreach aggregate of varlist hospital_days critical_care_days emergency_days 
> op_appts neph_appts tx_appts gp_interactions icd1_days icd2_days icd3_days ic
> d4_days icd5_days icd6_days icd7_days icd8_days icd9_days icd10_days icd11_da
> ys icd12_days icd13_days icd14_days icd15_days icd16_days icd17_days icd18_da
> ys icd19_days icd20_days icd21_days icd22_days {
  2. replace `aggregate' = `aggregate' * weight
  3. }
variable hospital_days was byte now float
(195 real changes made)
variable critical_care_days was byte now float
(147 real changes made)
variable emergency_days was byte now float
(173 real changes made)
variable op_appts was byte now float
(157 real changes made)
variable neph_appts was byte now float
(197 real changes made)
variable tx_appts was byte now float
(179 real changes made)
variable gp_interactions was byte now float
(189 real changes made)
variable icd1_days was byte now float
(160 real changes made)
variable icd2_days was byte now float
(184 real changes made)
variable icd3_days was byte now float
(185 real changes made)
variable icd4_days was byte now float
(168 real changes made)
variable icd5_days was byte now float
(188 real changes made)
variable icd6_days was byte now float
(169 real changes made)
variable icd7_days was byte now float
(161 real changes made)
variable icd8_days was byte now float
(177 real changes made)
variable icd9_days was byte now float
(148 real changes made)
variable icd10_days was byte now float
(167 real changes made)
variable icd11_days was byte now float
(191 real changes made)
variable icd12_days was byte now float
(187 real changes made)
variable icd13_days was byte now float
(176 real changes made)
variable icd14_days was byte now float
(167 real changes made)
variable icd15_days was byte now float
(171 real changes made)
variable icd16_days was byte now float
(164 real changes made)
variable icd17_days was byte now float
(155 real changes made)
variable icd18_days was byte now float
(156 real changes made)
variable icd19_days was byte now float
(158 real changes made)
variable icd20_days was byte now float
(182 real changes made)
variable icd21_days was byte now float
(211 real changes made)
variable icd22_days was byte now float
(182 real changes made)

. 
. * Create variable for age-standardised total # of each aggregated outcome
. * `var'_`aggregate' = age-standardised total # of each aggregated outcome ove
> rall stratified by ethnicity/imd/region/urban
. * `var'_`aggregate'_ckd = age-standardised total # of each aggregated outcome
>  in each CKD group stratified by ethnicity/imd/region/urban
. foreach aggregate of varlist hospital_days critical_care_days emergency_days 
> op_appts neph_appts tx_appts gp_interactions icd1_days icd2_days icd3_days ic
> d4_days icd5_days icd6_days icd7_days icd8_days icd9_days icd10_days icd11_da
> ys icd12_days icd13_days icd14_days icd15_days icd16_days icd17_days icd18_da
> ys icd19_days icd20_days icd21_days icd22_days {
  2. egen overall_std_`aggregate' = total(`aggregate')
  3. bysort ckd_group: egen std_`aggregate' = total(`aggregate')
  4. foreach var of varlist ethnicity imd region urban {
  5. bysort `var': egen `var'_`aggregate' = total(`aggregate')
  6. bysort `var' ckd_group: egen `var'_`aggregate'_ckd = total(`aggregate')
  7. }
  8. }

. 
. foreach binary of varlist fistula_formation pd_insertion blood_pressure album
> inuria creatinine icd1 icd2 icd3 icd4 icd5 icd6 icd7 icd8 icd9 icd10 icd11 ic
> d12 icd13 icd14 icd15 icd16 icd17 icd18 icd19 icd20 icd21 icd22 {
  2. gen esp_`binary' = `binary' * weight
  3. egen overall_std_`binary' = total(esp_`binary')
  4. bysort ckd_group: egen std_`binary' = total(esp_`binary')
  5. foreach var of varlist ethnicity imd region urban {
  6. bysort `var': egen `var'_`binary' = total(esp_`binary')
  7. bysort `var' ckd_group: egen `var'_`binary'_ckd = total(esp_`binary')
  8. }
  9. }

. 
. *Merge cost data
. save "./output/`dataset'_ckd_complete.dta", replace
(note: file ./output/2019_ckd_complete.dta not found)
file ./output/2019_ckd_complete.dta saved

. capture noisily import delimited ./output/costs_`dataset'.csv, clear
(7 vars, 500 obs)

. keep patient_id apcs_cost ec_cost opa_cost

. merge 1:1 patient_id using ./output/`dataset'_ckd_complete
(note: variable patient_id was int, now long to accommodate using data's
       values)

    Result                           # of obs.
    -----------------------------------------
    not matched                         2,523
        from master                       494  (_merge==1)
        from using                      2,029  (_merge==2)

    matched                                 6  (_merge==3)
    -----------------------------------------

. drop if _merge==1
(494 observations deleted)

. foreach cost of varlist apcs_cost ec_cost opa_cost {
  2. sum `cost', d
  3. bysort ckd_group: egen total_`cost' = total(`cost')
  4. egen overall_`cost' = total(`cost')
  5. tab ckd_group, sum(total_`cost')
  6. sum overall_`cost'
  7. foreach var of varlist ethnicity imd region urban {
  8. bysort `var': egen `var'_`cost' = total(`cost')
  9. bysort `var' ckd_group: egen `var'_`cost'_ckd = total(`cost')
 10. }
 11. }

                          apcs_cost
-------------------------------------------------------------
no observations

            |     Summary of total_apcs_cost
  CKD group |        Mean   Std. Dev.       Freq.
------------+------------------------------------
  Albuminur |           0           0       1,272
  CKD stage |           0           0         373
  CKD stage |           0           0           6
   Dialysis |           0           0          72
  Transplan |           0           0         286
  KRT uncle |           0           0          26
------------+------------------------------------
      Total |           0           0       2,035

    Variable |        Obs        Mean    Std. Dev.       Min        Max
-------------+---------------------------------------------------------
overall_ap~t |      2,035           0           0          0          0

                           ec_cost
-------------------------------------------------------------
no observations

            |      Summary of total_ec_cost
  CKD group |        Mean   Std. Dev.       Freq.
------------+------------------------------------
  Albuminur |           0           0       1,272
  CKD stage |           0           0         373
  CKD stage |           0           0           6
   Dialysis |           0           0          72
  Transplan |           0           0         286
  KRT uncle |           0           0          26
------------+------------------------------------
      Total |           0           0       2,035

    Variable |        Obs        Mean    Std. Dev.       Min        Max
-------------+---------------------------------------------------------
overall_ec~t |      2,035           0           0          0          0

                          opa_cost
-------------------------------------------------------------
no observations

            |      Summary of total_opa_cost
  CKD group |        Mean   Std. Dev.       Freq.
------------+------------------------------------
  Albuminur |           0           0       1,272
  CKD stage |           0           0         373
  CKD stage |           0           0           6
   Dialysis |           0           0          72
  Transplan |           0           0         286
  KRT uncle |           0           0          26
------------+------------------------------------
      Total |           0           0       2,035

    Variable |        Obs        Mean    Std. Dev.       Min        Max
-------------+---------------------------------------------------------
overall_op~t |      2,035           0           0          0          0

. save "./output/`dataset'_ckd_complete.dta", replace
file ./output/2019_ckd_complete.dta saved

. 
. log close
      name:  <unnamed>
       log:  /workspace/logs/2019_ckd_complete.log
  log type:  text
 closed on:   7 Jun 2024, 10:22:15
-------------------------------------------------------------------------------
