-------------------------------------------------------------------------------
      name:  <unnamed>
       log:  /workspace/logs/2020_ckd_complete.log
  log type:  text
 opened on:  29 Apr 2024, 13:26:26

. clear

. 
. *Merge `dataset'_ckd with `dataset'_ckd_complete
. capture noisily import delimited ./output/`dataset'_ckd.csv, clear
(9 vars, 21,025 obs)

. tempfile `dataset'_ckd

. save ``dataset'_ckd', replace
(note: file /tmp/St00015.000001 not found)
file /tmp/St00015.000001 saved

. capture noisily import delimited ./output/input_`dataset'_ckd_complete.csv, c
> lear
(104 vars, 50,000 obs)

. merge 1:1 patient_id using ``dataset'_ckd'

    Result                           # of obs.
    -----------------------------------------
    not matched                        66,853
        from master                    47,914  (_merge==1)
        from using                     18,939  (_merge==2)

    matched                             2,086  (_merge==3)
    -----------------------------------------

. keep if _merge==3
(66,853 observations deleted)

. drop _merge

. tempfile `dataset'_ckd_complete

. save ``dataset'_ckd_complete', replace
(note: file /tmp/St00015.000002 not found)
file /tmp/St00015.000002 saved

. 
. /*Generate dummy data
> cd ckd-healthcare-use
> capture noisily import delimited ./output/2017_ckd.csv, clear
> tempfile 2017_ckd
> save ./output/2017_ckd, replace
> capture noisily import delimited ./output/input_2017_ckd_complete.csv, clear
> merge 1:1 patient_id using ./output/2017_ckd
> keep if _merge==3
> drop _merge
> tempfile 2017_ckd_complete
> save ./output/2017_ckd_complete, replace
> */
. 
. *CKD stage classification
. foreach var of varlist  dialysis_baseline_primary_care  ///
>                                                 dialysis_baseline_icd_10     
>            ///
>                                                 dialysis_baseline_opcs_4     
>            ///
>                                                 dialysis_baseline_date       
>            ///
>                                                 kt_baseline_primary_care     
>            ///
>                                                 kt_baseline_icd_10           
>                    ///
>                                                 kt_baseline_opcs_4           
>                    {
  2.         drop `var'
  3.         }

. tab modality_baseline, m

modality_baseline |      Freq.     Percent        Cum.
------------------+-----------------------------------
         Dialysis |        187        8.96        8.96
Kidney transplant |        191        9.16       18.12
 Modality unclear |         36        1.73       19.85
          Pre KRT |      1,672       80.15      100.00
------------------+-----------------------------------
            Total |      2,086      100.00

. *To reduce misclassification of dialysis, anyone with eGFR >15 with modality_
> baseline=="Dialysis" will be reclassified as non-dialysis (e.g. they may have
>  received acute dialysis and recovered)
. *For modality_baseline="Modality unclear" (i.e. whose dialysis and kidney tra
> nsplant baseline dates are identical), those with eGFR <15 will be assumed to
>  be on dialysis and those >15 as kidney transplant
. egen esrd_egfr = cut(baseline_egfr), at (0, 15, 5000)
(840 missing values generated)

. recode esrd_egfr 0=1 15=0
(esrd_egfr: 1246 changes made)

. tab esrd_egfr, m

  esrd_egfr |      Freq.     Percent        Cum.
------------+-----------------------------------
          0 |      1,246       59.73       59.73
          . |        840       40.27      100.00
------------+-----------------------------------
      Total |      2,086      100.00

. gen dialysis = 0

. replace dialysis = 1 if modality_baseline=="Dialysis"
(187 real changes made)

. replace dialysis = 1 if modality_baseline=="Modality unclear" & esrd_egfr!=.
(22 real changes made)

. replace dialysis = 0 if esrd_egfr==0
(131 real changes made)

. gen kidney_transplant = 0

. replace kidney_transplant = 1 if kidney_transplant_baseline_date!=""
(312 real changes made)

. replace kidney_transplant = 0 if dialysis==1
(15 real changes made)

. gen modality_unclear = 0

. replace modality_unclear = 1 if modality_baseline=="Modality unclear"
(36 real changes made)

. replace modality_unclear = 0 if dialysis==1
(0 real changes made)

. replace modality_unclear = 0 if kidney_transplant==1
(1 real change made)

. tab modality_baseline dialysis

                  |       dialysis
modality_baseline |         0          1 |     Total
------------------+----------------------+----------
         Dialysis |       109         78 |       187 
Kidney transplant |       191          0 |       191 
 Modality unclear |        36          0 |        36 
          Pre KRT |     1,672          0 |     1,672 
------------------+----------------------+----------
            Total |     2,008         78 |     2,086 

. tab modality_baseline kidney_transplant

                  |   kidney_transplant
modality_baseline |         0          1 |     Total
------------------+----------------------+----------
         Dialysis |       174         13 |       187 
Kidney transplant |       155         36 |       191 
 Modality unclear |        35          1 |        36 
          Pre KRT |     1,425        247 |     1,672 
------------------+----------------------+----------
            Total |     1,789        297 |     2,086 

. tab modality_baseline modality_unclear

                  |   modality_unclear
modality_baseline |         0          1 |     Total
------------------+----------------------+----------
         Dialysis |       187          0 |       187 
Kidney transplant |       191          0 |       191 
 Modality unclear |         1         35 |        36 
          Pre KRT |     1,672          0 |     1,672 
------------------+----------------------+----------
            Total |     2,051         35 |     2,086 

. tab dialysis kidney_transplant

           |   kidney_transplant
  dialysis |         0          1 |     Total
-----------+----------------------+----------
         0 |     1,711        297 |     2,008 
         1 |        78          0 |        78 
-----------+----------------------+----------
     Total |     1,789        297 |     2,086 

. egen ckd_group = cut(baseline_egfr), at(0, 30, 60, 5000)
(840 missing values generated)

. recode ckd_group 0=3 30=2 60=1
(ckd_group: 1246 changes made)

. replace ckd_group = 4 if dialysis==1
(78 real changes made)

. replace ckd_group = 5 if kidney_transplant==1
(297 real changes made)

. replace ckd_group = 6 if modality_unclear==1
(35 real changes made)

. *ckd_group==. are those with albuminuria without available eGFR measurement o
> r code for KRT
. replace ckd_group = 1 if ckd_group==.
(640 real changes made)

. label define ckd_group 1 "Albuminuria" 2 "CKD stage 3" 3 "CKD stage 4/5" 4 "D
> ialysis" 5 "Transplant" 6 "KRT unclear modality"

. label values ckd_group ckd_group

. label var ckd_group "CKD group"

. tab ckd_group, m

           CKD group |      Freq.     Percent        Cum.
---------------------+-----------------------------------
         Albuminuria |      1,253       60.07       60.07
         CKD stage 3 |        407       19.51       79.58
       CKD stage 4/5 |         16        0.77       80.35
            Dialysis |         78        3.74       84.08
          Transplant |        297       14.24       98.32
KRT unclear modality |         35        1.68      100.00
---------------------+-----------------------------------
               Total |      2,086      100.00

. drop if ckd_group==.
(0 observations deleted)

. tab ckd_group modality_baseline

                     |              modality_baseline
           CKD group |  Dialysis  Kidney ..  Modalit..    Pre KRT |     Total
---------------------+--------------------------------------------+----------
         Albuminuria |        58        113          0      1,082 |     1,253 
         CKD stage 3 |        38         41          0        328 |       407 
       CKD stage 4/5 |         0          1          0         15 |        16 
            Dialysis |        78          0          0          0 |        78 
          Transplant |        13         36          1        247 |       297 
KRT unclear modality |         0          0         35          0 |        35 
---------------------+--------------------------------------------+----------
               Total |       187        191         36      1,672 |     2,086 

. 
. *Dialysis & kidney transplant outcome classification
. foreach var of varlist  dialysis_outcome_primary_care   ///
>                                                 dialysis_outcome_icd_10      
>            ///
>                                                 dialysis_outcome_opcs_4      
>            ///
>                                                 dialysis_outcome_date        
>            ///
>                                                 kt_outcome_primary_care      
>            ///
>                                                 kt_outcome_icd_10            
>                    ///
>                                                 kt_outcome_opcs_4            
>                    ///
>                                                 kidney_transplant_outcome_dat
> e  ///
>                                                 died                         
>                            {
  2.         drop `var'
  3.         }

. tab ckd_group modality_outcome, m

                     |              modality_outcome
           CKD group |  Deceased   Dialysis  Kidney ..  Modalit.. |     Total
---------------------+--------------------------------------------+----------
         Albuminuria |       118         61         55          8 |     1,253 
         CKD stage 3 |        39         20         10          2 |       407 
       CKD stage 4/5 |         2          2          0          0 |        16 
            Dialysis |         7          6          2          3 |        78 
          Transplant |        32         17          6          3 |       297 
KRT unclear modality |         1          1          0          0 |        35 
---------------------+--------------------------------------------+----------
               Total |       199        107         73         16 |     2,086 


                     | modality_o
                     |   utcome
           CKD group | Unchanged |     Total
---------------------+-----------+----------
         Albuminuria |     1,011 |     1,253 
         CKD stage 3 |       336 |       407 
       CKD stage 4/5 |        12 |        16 
            Dialysis |        60 |        78 
          Transplant |       239 |       297 
KRT unclear modality |        33 |        35 
---------------------+-----------+----------
               Total |     1,691 |     2,086 

. 
. *eGFR outcome classification based on updated mean eGFR over previous 18 mont
> hs by the end of year
. gen sex = 1 if male == "Male"
(1,123 missing values generated)

. replace sex = 0 if male == "Female"
(1,123 real changes made)

. label define sex 0"Female" 1"Male"

. label values sex sex

. replace creatinine_outcome = . if !inrange(creatinine_outcome, 20, 3000)
(940 real changes made, 940 to missing)

. gen mgdl_creatinine_outcome = creatinine_outcome/88.4
(940 missing values generated)

. gen min_creatinine_outcome=.
(2,086 missing values generated)

. replace min_creatinine_outcome = mgdl_creatinine_outcome/0.7 if sex==0
(618 real changes made)

. replace min_creatinine_outcome = mgdl_creatinine_outcome/0.9 if sex==1
(528 real changes made)

. replace min_creatinine_outcome = min_creatinine_outcome^-0.329  if sex==0
(618 real changes made)

. replace min_creatinine_outcome = min_creatinine_outcome^-0.411  if sex==1
(528 real changes made)

. replace min_creatinine_outcome = 1 if min_creatinine_outcome<1
(759 real changes made)

. gen max_creatinine_outcome=.
(2,086 missing values generated)

. replace max_creatinine_outcome = mgdl_creatinine_outcome/0.7 if sex==0
(618 real changes made)

. replace max_creatinine_outcome = mgdl_creatinine_outcome/0.9 if sex==1
(528 real changes made)

. replace max_creatinine_outcome = max_creatinine_outcome^-1.209
(1,146 real changes made)

. replace max_creatinine_outcome = 1 if max_creatinine_outcome>1
(1,327 real changes made)

. gen egfr_outcome = min_creatinine_outcome*max_creatinine_outcome*141
(940 missing values generated)

. replace egfr_outcome = egfr_outcome*(0.993^age)
(1,146 real changes made)

. replace egfr_outcome = egfr_outcome*1.018 if sex==0
(618 real changes made)

. drop creatinine_outcome

. drop mgdl_creatinine_outcome

. drop min_creatinine_outcome

. drop max_creatinine_outcome

. egen egfr_end = cut(egfr_outcome), at(0, 30, 60, 5000)
(940 missing values generated)

. recode egfr_end 0=3 30=2 60=1
(egfr_end: 1146 changes made)

. label define egfr_end 1 "≥60" 2 "30-59" 3 "<30"

. label values egfr_end egfr_end

. label var egfr_end "Final eGFR"

. gen ckd_progression = 0

. replace ckd_progression = 1 if egfr_end==2 & ckd_group==1
(183 real changes made)

. replace ckd_progression = 2 if egfr_end==3 & ckd_group==1
(5 real changes made)

. replace ckd_progression = 2 if egfr_end==3 & ckd_group==2
(4 real changes made)

. egen esrd_egfr_end = cut(egfr_outcome), at (0, 15, 5000)
(940 missing values generated)

. recode esrd_egfr_end 0=1 15=0
(esrd_egfr_end: 1146 changes made)

. tab esrd_egfr_end, m

esrd_egfr_e |
         nd |      Freq.     Percent        Cum.
------------+-----------------------------------
          0 |      1,146       54.94       54.94
          . |        940       45.06      100.00
------------+-----------------------------------
      Total |      2,086      100.00

. gen dialysis_outcome = 0

. replace dialysis_outcome = 1 if modality_outcome=="Dialysis"
(107 real changes made)

. replace dialysis_outcome = 1 if modality_outcome=="Modality unclear" & esrd_e
> gfr_end==1
(0 real changes made)

. gen kidney_transplant_outcome = 0

. replace kidney_transplant_outcome = 1 if modality_outcome=="Kidney transplant
> "
(73 real changes made)

. replace kidney_transplant_outcome = 1 if modality_outcome=="Modality unclear"
>  & esrd_egfr_end==0
(10 real changes made)

. replace ckd_progression = 5 if modality_outcome=="Modality unclear"
(16 real changes made)

. replace ckd_progression = 3 if dialysis_outcome==1
(107 real changes made)

. replace ckd_progression = 4 if kidney_transplant_outcome==1
(83 real changes made)

. replace ckd_progression = 6 if modality_outcome=="Deceased"
(199 real changes made)

. label define ckd_progression 0 "No progression" 1 "CKD 3" 2 "CKD 4/5 pre-KRT"
>  3 "Dialysis" 4 "Kidney transplant" 5 "KRT unclear modality" 6 "Deceased"

. label values ckd_progression ckd_progression

. label var ckd_progression "CKD progression"

. tab ckd_progression, m

     CKD progression |      Freq.     Percent        Cum.
---------------------+-----------------------------------
      No progression |      1,544       74.02       74.02
               CKD 3 |        139        6.66       80.68
     CKD 4/5 pre-KRT |          8        0.38       81.06
            Dialysis |        107        5.13       86.19
   Kidney transplant |         83        3.98       90.17
KRT unclear modality |          6        0.29       90.46
            Deceased |        199        9.54      100.00
---------------------+-----------------------------------
               Total |      2,086      100.00

. 
. *eGFR cut-offs to investigate timing of access formation
. egen access_egfr = cut(baseline_egfr), at (0, 15, 5000)
(840 missing values generated)

. recode access_egfr 0=1 15=2
(access_egfr: 1246 changes made)

. replace access_egfr=0 if ckd_group==4
(78 real changes made)

. replace access_egfr=3 if access_egfr==.
(762 real changes made)

. label define access_egfr 0 "Dialysis" 1 "eGFR 0-14" 2 "eGFR >= 15" 3 "Unknown
> "

. label values access_egfr access_egfr

. 
. *Totals for non-binary healthcare resource outcomes (including by month)
. foreach aggregate of varlist hospital_days critical_care_days emergency_days 
> op_appts neph_appts tx_appts gp_interactions icd1_days icd2_days icd3_days ic
> d4_days icd5_days icd6_days icd7_days icd8_days icd9_days icd10_days icd11_da
> ys icd12_days icd13_days icd14_days icd15_days icd16_days icd17_days icd18_da
> ys icd19_days icd20_days icd21_days icd22_days {
  2. bysort ckd_group: egen total_`aggregate' = total(`aggregate')
  3. egen overall_`aggregate' = total(`aggregate')
  4. tab ckd_group, sum(total_`aggregate')
  5. sum overall_`aggregate'
  6. }

            |   Summary of total_hospital_days
  CKD group |        Mean   Std. Dev.       Freq.
------------+------------------------------------
  Albuminur |         306           0       1,253
  CKD stage |         118           0         407
  CKD stage |           0           0          16
   Dialysis |           8           0          78
  Transplan |          84           0         297
  KRT uncle |           7           0          35
------------+------------------------------------
      Total |    219.2047    109.1971       2,086

    Variable |        Obs        Mean    Std. Dev.       Min        Max
-------------+---------------------------------------------------------
overall_ho~s |      2,086         523           0        523        523

            | Summary of total_critical_care_days
  CKD group |        Mean   Std. Dev.       Freq.
------------+------------------------------------
  Albuminur |         368           0       1,253
  CKD stage |          80           0         407
  CKD stage |           5           0          16
   Dialysis |          29           0          78
  Transplan |          90           0         297
  KRT uncle |           4           0          35
------------+------------------------------------
      Total |   250.65964   144.77208       2,086

    Variable |        Obs        Mean    Std. Dev.       Min        Max
-------------+---------------------------------------------------------
overall_cr~s |      2,086         576           0        576        576

            |   Summary of total_emergency_days
  CKD group |        Mean   Std. Dev.       Freq.
------------+------------------------------------
  Albuminur |         299           0       1,253
  CKD stage |         115           0         407
  CKD stage |           0           0          16
   Dialysis |          16           0          78
  Transplan |          60           0         297
  KRT uncle |           8           0          35
------------+------------------------------------
      Total |   211.31352   110.25681       2,086

    Variable |        Obs        Mean    Std. Dev.       Min        Max
-------------+---------------------------------------------------------
overall_em~s |      2,086         498           0        498        498

            |      Summary of total_op_appts
  CKD group |        Mean   Std. Dev.       Freq.
------------+------------------------------------
  Albuminur |         316           0       1,253
  CKD stage |         111           0         407
  CKD stage |           3           0          16
   Dialysis |          23           0          78
  Transplan |          64           0         297
  KRT uncle |           0           0          35
------------+------------------------------------
      Total |   221.46453   118.10059       2,086

    Variable |        Obs        Mean    Std. Dev.       Min        Max
-------------+---------------------------------------------------------
overall_op~s |      2,086         517           0        517        517

            |     Summary of total_neph_appts
  CKD group |        Mean   Std. Dev.       Freq.
------------+------------------------------------
  Albuminur |         368           0       1,253
  CKD stage |         100           0         407
  CKD stage |           6           0          16
   Dialysis |          25           0          78
  Transplan |          78           0         297
  KRT uncle |           1           0          35
------------+------------------------------------
      Total |   252.66107   142.68294       2,086

    Variable |        Obs        Mean    Std. Dev.       Min        Max
-------------+---------------------------------------------------------
overall_ne~s |      2,086         578           0        578        578

            |      Summary of total_tx_appts
  CKD group |        Mean   Std. Dev.       Freq.
------------+------------------------------------
  Albuminur |         401           0       1,253
  CKD stage |         106           0         407
  CKD stage |           0           0          16
   Dialysis |          22           0          78
  Transplan |          85           0         297
  KRT uncle |          10           0          35
------------+------------------------------------
      Total |   274.64334   156.24332       2,086

    Variable |        Obs        Mean    Std. Dev.       Min        Max
-------------+---------------------------------------------------------
overall_tx~s |      2,086         624           0        624        624

            |  Summary of total_gp_interactions
  CKD group |        Mean   Std. Dev.       Freq.
------------+------------------------------------
  Albuminur |         322           0       1,253
  CKD stage |         101           0         407
  CKD stage |           4           0          16
   Dialysis |          35           0          78
  Transplan |         121           0         297
  KRT uncle |           7           0          35
------------+------------------------------------
      Total |   231.80681    112.5757       2,086

    Variable |        Obs        Mean    Std. Dev.       Min        Max
-------------+---------------------------------------------------------
overall_gp~s |      2,086         590           0        590        590

            |     Summary of total_icd1_days
  CKD group |        Mean   Std. Dev.       Freq.
------------+------------------------------------
  Albuminur |         366           0       1,253
  CKD stage |          99           0         407
  CKD stage |           1           0          16
   Dialysis |          20           0          78
  Transplan |          63           0         297
  KRT uncle |          11           0          35
------------+------------------------------------
      Total |   249.07143   144.67663       2,086

    Variable |        Obs        Mean    Std. Dev.       Min        Max
-------------+---------------------------------------------------------
overall_ic~s |      2,086         560           0        560        560

            |     Summary of total_icd2_days
  CKD group |        Mean   Std. Dev.       Freq.
------------+------------------------------------
  Albuminur |         289           0       1,253
  CKD stage |         155           0         407
  CKD stage |          11           0          16
   Dialysis |          18           0          78
  Transplan |          62           0         297
  KRT uncle |          15           0          35
------------+------------------------------------
      Total |   213.67258   98.838296       2,086

    Variable |        Obs        Mean    Std. Dev.       Min        Max
-------------+---------------------------------------------------------
overa~2_days |      2,086         550           0        550        550

            |     Summary of total_icd3_days
  CKD group |        Mean   Std. Dev.       Freq.
------------+------------------------------------
  Albuminur |         306           0       1,253
  CKD stage |         103           0         407
  CKD stage |           2           0          16
   Dialysis |          19           0          78
  Transplan |          80           0         297
  KRT uncle |           6           0          35
------------+------------------------------------
      Total |   216.11841   111.97572       2,086

    Variable |        Obs        Mean    Std. Dev.       Min        Max
-------------+---------------------------------------------------------
overa~3_days |      2,086         516           0        516        516

            |     Summary of total_icd4_days
  CKD group |        Mean   Std. Dev.       Freq.
------------+------------------------------------
  Albuminur |         346           0       1,253
  CKD stage |          84           0         407
  CKD stage |           0           0          16
   Dialysis |          15           0          78
  Transplan |          62           0         297
  KRT uncle |           7           0          35
------------+------------------------------------
      Total |   233.72723   138.65056       2,086

    Variable |        Obs        Mean    Std. Dev.       Min        Max
-------------+---------------------------------------------------------
overa~4_days |      2,086         514           0        514        514

            |     Summary of total_icd5_days
  CKD group |        Mean   Std. Dev.       Freq.
------------+------------------------------------
  Albuminur |         297           0       1,253
  CKD stage |          70           0         407
  CKD stage |           7           0          16
   Dialysis |          24           0          78
  Transplan |          83           0         297
  KRT uncle |           8           0          35
------------+------------------------------------
      Total |   204.95973   113.76371       2,086

    Variable |        Obs        Mean    Std. Dev.       Min        Max
-------------+---------------------------------------------------------
overa~5_days |      2,086         489           0        489        489

            |     Summary of total_icd6_days
  CKD group |        Mean   Std. Dev.       Freq.
------------+------------------------------------
  Albuminur |         367           0       1,253
  CKD stage |          66           0         407
  CKD stage |           0           0          16
   Dialysis |          35           0          78
  Transplan |          47           0         297
  KRT uncle |           7           0          35
------------+------------------------------------
      Total |   241.44151   154.37699       2,086

    Variable |        Obs        Mean    Std. Dev.       Min        Max
-------------+---------------------------------------------------------
overa~6_days |      2,086         522           0        522        522

            |     Summary of total_icd7_days
  CKD group |        Mean   Std. Dev.       Freq.
------------+------------------------------------
  Albuminur |         293           0       1,253
  CKD stage |         121           0         407
  CKD stage |          11           0          16
   Dialysis |          22           0          78
  Transplan |          96           0         297
  KRT uncle |          10           0          35
------------+------------------------------------
      Total |   214.34803   99.076279       2,086

    Variable |        Obs        Mean    Std. Dev.       Min        Max
-------------+---------------------------------------------------------
overa~7_days |      2,086         553           0        553        553

            |     Summary of total_icd8_days
  CKD group |        Mean   Std. Dev.       Freq.
------------+------------------------------------
  Albuminur |         309           0       1,253
  CKD stage |          92           0         407
  CKD stage |           5           0          16
   Dialysis |          22           0          78
  Transplan |          82           0         297
  KRT uncle |          16           0          35
------------+------------------------------------
      Total |   216.36194   114.79485       2,086

    Variable |        Obs        Mean    Std. Dev.       Min        Max
-------------+---------------------------------------------------------
overa~8_days |      2,086         526           0        526        526

            |     Summary of total_icd9_days
  CKD group |        Mean   Std. Dev.       Freq.
------------+------------------------------------
  Albuminur |         355           0       1,253
  CKD stage |         106           0         407
  CKD stage |           0           0          16
   Dialysis |          20           0          78
  Transplan |          91           0         297
  KRT uncle |           0           0          35
------------+------------------------------------
      Total |   247.62416     133.329       2,086

    Variable |        Obs        Mean    Std. Dev.       Min        Max
-------------+---------------------------------------------------------
overa~9_days |      2,086         572           0        572        572

            |     Summary of total_icd10_days
  CKD group |        Mean   Std. Dev.       Freq.
------------+------------------------------------
  Albuminur |         248           0       1,253
  CKD stage |          60           0         407
  CKD stage |           0           0          16
   Dialysis |          25           0          78
  Transplan |          63           0         297
  KRT uncle |           5           0          35
------------+------------------------------------
      Total |   170.66155   95.467089       2,086

    Variable |        Obs        Mean    Std. Dev.       Min        Max
-------------+---------------------------------------------------------
overa~0_days |      2,086         401           0        401        401

            |     Summary of total_icd11_days
  CKD group |        Mean   Std. Dev.       Freq.
------------+------------------------------------
  Albuminur |         318           0       1,253
  CKD stage |         109           0         407
  CKD stage |           7           0          16
   Dialysis |          23           0          78
  Transplan |          77           0         297
  KRT uncle |           2           0          35
------------+------------------------------------
      Total |    224.1908    116.9179       2,086

    Variable |        Obs        Mean    Std. Dev.       Min        Max
-------------+---------------------------------------------------------
over~11_days |      2,086         536           0        536        536

            |     Summary of total_icd12_days
  CKD group |        Mean   Std. Dev.       Freq.
------------+------------------------------------
  Albuminur |         313           0       1,253
  CKD stage |          96           0         407
  CKD stage |           1           0          16
   Dialysis |           7           0          78
  Transplan |          72           0         297
  KRT uncle |           5           0          35
------------+------------------------------------
      Total |   217.34516   118.96848       2,086

    Variable |        Obs        Mean    Std. Dev.       Min        Max
-------------+---------------------------------------------------------
over~12_days |      2,086         494           0        494        494

            |     Summary of total_icd13_days
  CKD group |        Mean   Std. Dev.       Freq.
------------+------------------------------------
  Albuminur |         276           0       1,253
  CKD stage |         116           0         407
  CKD stage |           3           0          16
   Dialysis |          18           0          78
  Transplan |          70           0         297
  KRT uncle |          21           0          35
------------+------------------------------------
      Total |   199.43289   96.593787       2,086

    Variable |        Obs        Mean    Std. Dev.       Min        Max
-------------+---------------------------------------------------------
over~13_days |      2,086         504           0        504        504

            |     Summary of total_icd14_days
  CKD group |        Mean   Std. Dev.       Freq.
------------+------------------------------------
  Albuminur |         342           0       1,253
  CKD stage |         138           0         407
  CKD stage |           2           0          16
   Dialysis |          17           0          78
  Transplan |          66           0         297
  KRT uncle |           6           0          35
------------+------------------------------------
      Total |   242.50336   125.71363       2,086

    Variable |        Obs        Mean    Std. Dev.       Min        Max
-------------+---------------------------------------------------------
over~14_days |      2,086         571           0        571        571

            |     Summary of total_icd15_days
  CKD group |        Mean   Std. Dev.       Freq.
------------+------------------------------------
  Albuminur |         318           0       1,253
  CKD stage |         112           0         407
  CKD stage |           1           0          16
   Dialysis |          37           0          78
  Transplan |          86           0         297
  KRT uncle |          12           0          35
------------+------------------------------------
      Total |   226.70278   113.61518       2,086

    Variable |        Obs        Mean    Std. Dev.       Min        Max
-------------+---------------------------------------------------------
over~15_days |      2,086         566           0        566        566

            |     Summary of total_icd16_days
  CKD group |        Mean   Std. Dev.       Freq.
------------+------------------------------------
  Albuminur |         382           0       1,253
  CKD stage |         106           0         407
  CKD stage |           5           0          16
   Dialysis |          12           0          78
  Transplan |          82           0         297
  KRT uncle |           4           0          35
------------+------------------------------------
      Total |   262.36721   148.26251       2,086

    Variable |        Obs        Mean    Std. Dev.       Min        Max
-------------+---------------------------------------------------------
over~16_days |      2,086         591           0        591        591

            |     Summary of total_icd17_days
  CKD group |        Mean   Std. Dev.       Freq.
------------+------------------------------------
  Albuminur |         362           0       1,253
  CKD stage |          97           0         407
  CKD stage |           2           0          16
   Dialysis |          10           0          78
  Transplan |          44           0         297
  KRT uncle |          13           0          35
------------+------------------------------------
      Total |   243.24065   147.23032       2,086

    Variable |        Obs        Mean    Std. Dev.       Min        Max
-------------+---------------------------------------------------------
over~17_days |      2,086         528           0        528        528

            |     Summary of total_icd18_days
  CKD group |        Mean   Std. Dev.       Freq.
------------+------------------------------------
  Albuminur |         296           0       1,253
  CKD stage |         137           0         407
  CKD stage |           6           0          16
   Dialysis |          12           0          78
  Transplan |          74           0         297
  KRT uncle |          11           0          35
------------+------------------------------------
      Total |   215.74401   102.65161       2,086

    Variable |        Obs        Mean    Std. Dev.       Min        Max
-------------+---------------------------------------------------------
over~18_days |      2,086         536           0        536        536

            |     Summary of total_icd19_days
  CKD group |        Mean   Std. Dev.       Freq.
------------+------------------------------------
  Albuminur |         345           0       1,253
  CKD stage |         112           0         407
  CKD stage |           4           0          16
   Dialysis |          16           0          78
  Transplan |          63           0         297
  KRT uncle |          12           0          35
------------+------------------------------------
      Total |   238.88399   132.14524       2,086

    Variable |        Obs        Mean    Std. Dev.       Min        Max
-------------+---------------------------------------------------------
over~19_days |      2,086         552           0        552        552

            |     Summary of total_icd20_days
  CKD group |        Mean   Std. Dev.       Freq.
------------+------------------------------------
  Albuminur |         323           0       1,253
  CKD stage |          82           0         407
  CKD stage |           5           0          16
   Dialysis |          17           0          78
  Transplan |          82           0         297
  KRT uncle |           7           0          35
------------+------------------------------------
      Total |   222.48226   124.32844       2,086

    Variable |        Obs        Mean    Std. Dev.       Min        Max
-------------+---------------------------------------------------------
over~20_days |      2,086         516           0        516        516

            |     Summary of total_icd21_days
  CKD group |        Mean   Std. Dev.       Freq.
------------+------------------------------------
  Albuminur |         290           0       1,253
  CKD stage |         104           0         407
  CKD stage |          14           0          16
   Dialysis |          23           0          78
  Transplan |          90           0         297
  KRT uncle |          10           0          35
------------+------------------------------------
      Total |   208.43528   101.79724       2,086

    Variable |        Obs        Mean    Std. Dev.       Min        Max
-------------+---------------------------------------------------------
over~21_days |      2,086         531           0        531        531

            |     Summary of total_icd22_days
  CKD group |        Mean   Std. Dev.       Freq.
------------+------------------------------------
  Albuminur |         280           0       1,253
  CKD stage |         116           0         407
  CKD stage |           4           0          16
   Dialysis |          22           0          78
  Transplan |          65           0         297
  KRT uncle |           9           0          35
------------+------------------------------------
      Total |   201.07958   99.553509       2,086

    Variable |        Obs        Mean    Std. Dev.       Min        Max
-------------+---------------------------------------------------------
over~22_days |      2,086         496           0        496        496

. 
. 
. 
. **Potential effect modifiers
. * Ethnicity
. * 1 = White ethnicities (white British, white Irish, with other)
. * 2 = Mixed ethnicities (white & black Caribbean, white & black African, whit
> e & Asian, other mixed ethnicities)
. * 3 = South Asian ethnicities (Indian, Pakistani, Bangladeshi, other South As
> ian)
. * 4 = Black ethnicities (black Caribbean, black African, other black)
. * 5 = Other ethnicities (Chinese, all other ethnicities)
. * . = Unknown ethnicity
. replace ethnicity = . if ethnicity==.
(0 real changes made)

. replace ethnicity=6 if ethnicity==2
(83 real changes made)

. replace ethnicity=2 if ethnicity==3
(82 real changes made)

. replace ethnicity=3 if ethnicity==4
(75 real changes made)

. replace ethnicity=4 if ethnicity==6
(83 real changes made)

. replace ethnicity=6 if ethnicity==.
(512 real changes made)

. label define ethnicity  1 "White"                                       ///
>                                                 2 "South Asian"              
>            ///                                             
>                                                 3 "Black"                    
>                    ///
>                                                 4 "Mixed"                    
>                    ///
>                                                 5 "Other"                    
>                    ///
>                                                 6 "Unknown"     

. label values ethnicity ethnicity

. 
. * Index of multiple deprivation
. * Ordered 1-5 from most deprived to least deprived
. label define imd 1 "1 Most deprived" 2 "2" 3 "3" 4 "4" 5 "5 Least deprived"

. label values imd imd

. 
. * Region
. rename region region_string

. gen region = 1 if region_string=="East Midlands"
(1,866 missing values generated)

. replace region = 2 if region_string=="East"
(198 real changes made)

. replace region = 3 if region_string=="London"
(405 real changes made)

. replace region = 4 if region_string=="North East"
(199 real changes made)

. replace region = 5 if region_string=="North West"
(213 real changes made)

. replace region = 6 if region_string=="South East"
(213 real changes made)

. replace region = 7 if region_string=="South West"
(199 real changes made)

. replace region = 8 if region_string=="West Midlands"
(241 real changes made)

. replace region = 9 if region_string=="Yorkshire and The Humber"
(198 real changes made)

. label define region     1 "East Midlands"                                    
>    ///
>                                                 2 "East"                     
>                                    ///
>                                                 3 "London"                   
>                                    ///
>                                                 4 "North East"               
>                            ///
>                                                 5 "North West"               
>                            ///
>                                                 6 "South East"               
>                            ///
>                                                 7 "South West"               
>                            ///
>                                                 8 "West Midlands"            
>                            ///
>                                                 9 "Yorkshire and The Humber" 
>            

. label values region region

. label var region "Region"

. 
. * Urban/rural
. replace rural_urban=. if rural_urban<1|rural_urban>8
(0 real changes made)

. label define rural_urban 1 "Urban major conurbation"                         
>                    ///
>                                                  2 "Urban minor conurbation" 
>                                            ///
>                                                  3 "Urban city and town"     
>                                                    ///
>                                                  4 "Urban city and town in a 
> sparse setting"            ///
>                                                  5 "Rural town and fringe"   
>                                                    ///
>                                                  6 "Rural town and fringe in 
> a sparse setting"          ///
>                                                  7 "Rural village and dispers
> ed"                                        ///
>                                                  8 "Rural village and dispers
> ed in a sparse setting"

. label values rural_urban rural_urban

. * Urban (binary)
. * Urban = 1-4 + missing, Rural = 5-8
. generate urban=.
(2,086 missing values generated)

. replace urban=1 if rural_urban<=4|rural_urban==.
(810 real changes made)

. replace urban=0 if rural_urban>4 & rural_urban!=.
(1,276 real changes made)

. label var urban "Urban/rural"

. label define urban 0 "Rural" 1 "Urban"

. label values urban urban

. drop rural_urban

. 
. *Age bands for standardisation
. egen agecat = cut(age), at(0,18,20,25,30,35,40,45,50,55,60,65,70,75,80,85,90,
> 200)

. drop if agecat==0
(0 observations deleted)

. 
. *Age-standardisation weights (European Standard Population 2013)
. gen weight = .
(2,086 missing values generated)

. replace weight = 0.027261 if agecat==18
(44 real changes made)

. replace weight = 0.074349 if agecat==20
(138 real changes made)

. replace weight = 0.074349 if agecat==25
(148 real changes made)

. replace weight = 0.080545 if agecat==30
(160 real changes made)

. replace weight = 0.086741 if agecat==35
(176 real changes made)

. replace weight = 0.086741 if agecat==40
(165 real changes made)

. replace weight = 0.086741 if agecat==45
(182 real changes made)

. replace weight = 0.086741 if agecat==50
(192 real changes made)

. replace weight = 0.080545 if agecat==55
(174 real changes made)

. replace weight = 0.074349 if agecat==60
(153 real changes made)

. replace weight = 0.068154 if agecat==65
(168 real changes made)

. replace weight = 0.061958 if agecat==70
(126 real changes made)

. replace weight = 0.049566 if agecat==75
(104 real changes made)

. replace weight = 0.030979 if agecat==80
(85 real changes made)

. replace weight = 0.018587 if agecat==85
(48 real changes made)

. replace weight = 0.012392 if agecat==90
(23 real changes made)

. 
. 
. *Age standardised counts for each non-binary healthcare resource outcomes
. foreach aggregate of varlist hospital_days critical_care_days emergency_days 
> op_appts neph_appts tx_appts gp_interactions icd1_days icd2_days icd3_days ic
> d4_days icd5_days icd6_days icd7_days icd8_days icd9_days icd10_days icd11_da
> ys icd12_days icd13_days icd14_days icd15_days icd16_days icd17_days icd18_da
> ys icd19_days icd20_days icd21_days icd22_days {
  2. replace `aggregate' = `aggregate' * weight
  3. }
variable hospital_days was byte now float
(185 real changes made)
variable critical_care_days was byte now float
(175 real changes made)
variable emergency_days was byte now float
(173 real changes made)
variable op_appts was byte now float
(178 real changes made)
variable neph_appts was byte now float
(200 real changes made)
variable tx_appts was byte now float
(199 real changes made)
variable gp_interactions was byte now float
(179 real changes made)
variable icd1_days was byte now float
(191 real changes made)
variable icd2_days was byte now float
(189 real changes made)
variable icd3_days was byte now float
(178 real changes made)
variable icd4_days was byte now float
(176 real changes made)
variable icd5_days was byte now float
(179 real changes made)
variable icd6_days was byte now float
(174 real changes made)
variable icd7_days was byte now float
(185 real changes made)
variable icd8_days was byte now float
(175 real changes made)
variable icd9_days was byte now float
(182 real changes made)
variable icd10_days was byte now float
(152 real changes made)
variable icd11_days was byte now float
(174 real changes made)
variable icd12_days was byte now float
(169 real changes made)
variable icd13_days was byte now float
(169 real changes made)
variable icd14_days was byte now float
(193 real changes made)
variable icd15_days was byte now float
(194 real changes made)
variable icd16_days was byte now float
(180 real changes made)
variable icd17_days was byte now float
(178 real changes made)
variable icd18_days was byte now float
(178 real changes made)
variable icd19_days was byte now float
(177 real changes made)
variable icd20_days was byte now float
(169 real changes made)
variable icd21_days was byte now float
(175 real changes made)
variable icd22_days was byte now float
(162 real changes made)

. 
. * Create variable for age-standardised total # of each aggregated outcome
. * `var'_`aggregate' = age-standardised total # of each aggregated outcome ove
> rall stratified by ethnicity/imd/region/urban
. * `var'_`aggregate'_ckd = age-standardised total # of each aggregated outcome
>  in each CKD group stratified by ethnicity/imd/region/urban
. foreach aggregate of varlist hospital_days critical_care_days emergency_days 
> op_appts neph_appts tx_appts gp_interactions icd1_days icd2_days icd3_days ic
> d4_days icd5_days icd6_days icd7_days icd8_days icd9_days icd10_days icd11_da
> ys icd12_days icd13_days icd14_days icd15_days icd16_days icd17_days icd18_da
> ys icd19_days icd20_days icd21_days icd22_days {
  2. egen overall_std_`aggregate' = total(`aggregate')
  3. bysort ckd_group: egen std_`aggregate' = total(`aggregate')
  4. foreach var of varlist ethnicity imd region urban {
  5. bysort `var': egen `var'_`aggregate' = total(`aggregate')
  6. bysort `var' ckd_group: egen `var'_`aggregate'_ckd = total(`aggregate')
  7. }
  8. }

. 
. foreach binary of varlist fistula_formation pd_insertion blood_pressure album
> inuria creatinine icd1 icd2 icd3 icd4 icd5 icd6 icd7 icd8 icd9 icd10 icd11 ic
> d12 icd13 icd14 icd15 icd16 icd17 icd18 icd19 icd20 icd21 icd22 {
  2. gen esp_`binary' = `binary' * weight
  3. egen overall_std_`binary' = total(esp_`binary')
  4. bysort ckd_group: egen std_`binary' = total(esp_`binary')
  5. foreach var of varlist ethnicity imd region urban {
  6. bysort `var': egen `var'_`binary' = total(esp_`binary')
  7. bysort `var' ckd_group: egen `var'_`binary'_ckd = total(esp_`binary')
  8. }
  9. }

. 
. *Merge cost data
. save "./output/`dataset'_ckd_complete.dta", replace
(note: file ./output/2020_ckd_complete.dta not found)
file ./output/2020_ckd_complete.dta saved

. capture noisily import delimited ./output/costs_`dataset'.csv, clear
(7 vars, 500 obs)

. keep patient_id apcs_cost ec_cost opa_cost

. merge 1:1 patient_id using ./output/`dataset'_ckd_complete
(note: variable patient_id was int, now long to accommodate using data's
       values)

    Result                           # of obs.
    -----------------------------------------
    not matched                         2,584
        from master                       499  (_merge==1)
        from using                      2,085  (_merge==2)

    matched                                 1  (_merge==3)
    -----------------------------------------

. drop if _merge==1
(499 observations deleted)

. foreach cost of varlist apcs_cost ec_cost opa_cost {
  2. sum `cost', d
  3. bysort ckd_group: egen total_`cost' = total(`cost')
  4. egen overall_`cost' = total(`cost')
  5. tab ckd_group, sum(total_`cost')
  6. sum overall_`cost'
  7. foreach var of varlist ethnicity imd region urban {
  8. bysort `var': egen `var'_`cost' = total(`cost')
  9. bysort `var' ckd_group: egen `var'_`cost'_ckd = total(`cost')
 10. }
 11. }

                          apcs_cost
-------------------------------------------------------------
no observations

            |     Summary of total_apcs_cost
  CKD group |        Mean   Std. Dev.       Freq.
------------+------------------------------------
  Albuminur |           0           0       1,253
  CKD stage |           0           0         407
  CKD stage |           0           0          16
   Dialysis |           0           0          78
  Transplan |           0           0         297
  KRT uncle |           0           0          35
------------+------------------------------------
      Total |           0           0       2,086

    Variable |        Obs        Mean    Std. Dev.       Min        Max
-------------+---------------------------------------------------------
overall_ap~t |      2,086           0           0          0          0

                           ec_cost
-------------------------------------------------------------
      Percentiles      Smallest
 1%     41.01869       41.01869
 5%     41.01869              .
10%     41.01869              .       Obs                   1
25%     41.01869              .       Sum of Wgt.           1

50%     41.01869                      Mean           41.01869
                        Largest       Std. Dev.             .
75%     41.01869              .
90%     41.01869              .       Variance              .
95%     41.01869              .       Skewness              .
99%     41.01869       41.01869       Kurtosis              .

            |      Summary of total_ec_cost
  CKD group |        Mean   Std. Dev.       Freq.
------------+------------------------------------
  Albuminur |   41.018692           0       1,253
  CKD stage |           0           0         407
  CKD stage |           0           0          16
   Dialysis |           0           0          78
  Transplan |           0           0         297
  KRT uncle |           0           0          35
------------+------------------------------------
      Total |   24.638745   20.094151       2,086

    Variable |        Obs        Mean    Std. Dev.       Min        Max
-------------+---------------------------------------------------------
overall_ec~t |      2,086    41.01869           0   41.01869   41.01869

                          opa_cost
-------------------------------------------------------------
no observations

            |      Summary of total_opa_cost
  CKD group |        Mean   Std. Dev.       Freq.
------------+------------------------------------
  Albuminur |           0           0       1,253
  CKD stage |           0           0         407
  CKD stage |           0           0          16
   Dialysis |           0           0          78
  Transplan |           0           0         297
  KRT uncle |           0           0          35
------------+------------------------------------
      Total |           0           0       2,086

    Variable |        Obs        Mean    Std. Dev.       Min        Max
-------------+---------------------------------------------------------
overall_op~t |      2,086           0           0          0          0

. save "./output/`dataset'_ckd_complete.dta", replace
file ./output/2020_ckd_complete.dta saved

. 
. log close
      name:  <unnamed>
       log:  /workspace/logs/2020_ckd_complete.log
  log type:  text
 closed on:  29 Apr 2024, 13:26:46
-------------------------------------------------------------------------------
