-------------------------------------------------------------------------------
      name:  <unnamed>
       log:  /workspace/logs/2020_ckd_complete.log
  log type:  text
 opened on:   7 Jun 2024, 10:22:17

. clear

. 
. *Merge `dataset'_ckd with `dataset'_ckd_complete
. capture noisily import delimited ./output/`dataset'_ckd.csv, clear
(9 vars, 21,089 obs)

. tempfile `dataset'_ckd

. save ``dataset'_ckd', replace
(note: file /tmp/St00012.000001 not found)
file /tmp/St00012.000001 saved

. capture noisily import delimited ./output/input_`dataset'_ckd_complete.csv, c
> lear
(104 vars, 50,000 obs)

. merge 1:1 patient_id using ``dataset'_ckd'

    Result                           # of obs.
    -----------------------------------------
    not matched                        66,771
        from master                    47,841  (_merge==1)
        from using                     18,930  (_merge==2)

    matched                             2,159  (_merge==3)
    -----------------------------------------

. keep if _merge==3
(66,771 observations deleted)

. drop _merge

. tempfile `dataset'_ckd_complete

. save ``dataset'_ckd_complete', replace
(note: file /tmp/St00012.000002 not found)
file /tmp/St00012.000002 saved

. 
. /*Generate dummy data
> cd ckd-healthcare-use
> capture noisily import delimited ./output/2017_ckd.csv, clear
> tempfile 2017_ckd
> save ./output/2017_ckd, replace
> capture noisily import delimited ./output/input_2017_ckd_complete.csv, clear
> merge 1:1 patient_id using ./output/2017_ckd
> keep if _merge==3
> drop _merge
> tempfile 2017_ckd_complete
> save ./output/2017_ckd_complete, replace
> */
. 
. *CKD stage classification
. foreach var of varlist  dialysis_baseline_primary_care  ///
>                                                 dialysis_baseline_icd_10     
>            ///
>                                                 dialysis_baseline_opcs_4     
>            ///
>                                                 dialysis_baseline_date       
>            ///
>                                                 kt_baseline_primary_care     
>            ///
>                                                 kt_baseline_icd_10           
>                    ///
>                                                 kt_baseline_opcs_4           
>                    {
  2.         drop `var'
  3.         }

. tab modality_baseline, m

modality_baseline |      Freq.     Percent        Cum.
------------------+-----------------------------------
         Dialysis |        203        9.40        9.40
Kidney transplant |        219       10.14       19.55
 Modality unclear |         41        1.90       21.45
          Pre KRT |      1,696       78.55      100.00
------------------+-----------------------------------
            Total |      2,159      100.00

. *To reduce misclassification of dialysis, anyone with eGFR >15 with modality_
> baseline=="Dialysis" will be reclassified as non-dialysis (e.g. they may have
>  received acute dialysis and recovered)
. *For modality_baseline="Modality unclear" (i.e. whose dialysis and kidney tra
> nsplant baseline dates are identical), those with eGFR <15 will be assumed to
>  be on dialysis and those >15 as kidney transplant
. egen esrd_egfr = cut(baseline_egfr), at (0, 15, 5000)
(860 missing values generated)

. recode esrd_egfr 0=1 15=0
(esrd_egfr: 1299 changes made)

. tab esrd_egfr, m

  esrd_egfr |      Freq.     Percent        Cum.
------------+-----------------------------------
          0 |      1,299       60.17       60.17
          . |        860       39.83      100.00
------------+-----------------------------------
      Total |      2,159      100.00

. gen dialysis = 0

. replace dialysis = 1 if modality_baseline=="Dialysis"
(203 real changes made)

. replace dialysis = 1 if modality_baseline=="Modality unclear" & esrd_egfr!=.
(24 real changes made)

. replace dialysis = 0 if esrd_egfr==0
(151 real changes made)

. gen kidney_transplant = 0

. replace kidney_transplant = 1 if kidney_transplant_baseline_date!=""
(295 real changes made)

. replace kidney_transplant = 0 if dialysis==1
(10 real changes made)

. gen modality_unclear = 0

. replace modality_unclear = 1 if modality_baseline=="Modality unclear"
(41 real changes made)

. replace modality_unclear = 0 if dialysis==1
(0 real changes made)

. replace modality_unclear = 0 if kidney_transplant==1
(5 real changes made)

. tab modality_baseline dialysis

                  |       dialysis
modality_baseline |         0          1 |     Total
------------------+----------------------+----------
         Dialysis |       127         76 |       203 
Kidney transplant |       219          0 |       219 
 Modality unclear |        41          0 |        41 
          Pre KRT |     1,696          0 |     1,696 
------------------+----------------------+----------
            Total |     2,083         76 |     2,159 

. tab modality_baseline kidney_transplant

                  |   kidney_transplant
modality_baseline |         0          1 |     Total
------------------+----------------------+----------
         Dialysis |       186         17 |       203 
Kidney transplant |       198         21 |       219 
 Modality unclear |        36          5 |        41 
          Pre KRT |     1,454        242 |     1,696 
------------------+----------------------+----------
            Total |     1,874        285 |     2,159 

. tab modality_baseline modality_unclear

                  |   modality_unclear
modality_baseline |         0          1 |     Total
------------------+----------------------+----------
         Dialysis |       203          0 |       203 
Kidney transplant |       219          0 |       219 
 Modality unclear |         5         36 |        41 
          Pre KRT |     1,696          0 |     1,696 
------------------+----------------------+----------
            Total |     2,123         36 |     2,159 

. tab dialysis kidney_transplant

           |   kidney_transplant
  dialysis |         0          1 |     Total
-----------+----------------------+----------
         0 |     1,798        285 |     2,083 
         1 |        76          0 |        76 
-----------+----------------------+----------
     Total |     1,874        285 |     2,159 

. egen ckd_group = cut(baseline_egfr), at(0, 30, 60, 5000)
(860 missing values generated)

. recode ckd_group 0=3 30=2 60=1
(ckd_group: 1299 changes made)

. replace ckd_group = 4 if dialysis==1
(76 real changes made)

. replace ckd_group = 5 if kidney_transplant==1
(285 real changes made)

. replace ckd_group = 6 if modality_unclear==1
(36 real changes made)

. *ckd_group==. are those with albuminuria without available eGFR measurement o
> r code for KRT
. replace ckd_group = 1 if ckd_group==.
(673 real changes made)

. label define ckd_group 1 "Albuminuria" 2 "CKD stage 3" 3 "CKD stage 4/5" 4 "D
> ialysis" 5 "Transplant" 6 "KRT unclear modality"

. label values ckd_group ckd_group

. label var ckd_group "CKD group"

. tab ckd_group, m

           CKD group |      Freq.     Percent        Cum.
---------------------+-----------------------------------
         Albuminuria |      1,341       62.11       62.11
         CKD stage 3 |        401       18.57       80.69
       CKD stage 4/5 |         20        0.93       81.61
            Dialysis |         76        3.52       85.13
          Transplant |        285       13.20       98.33
KRT unclear modality |         36        1.67      100.00
---------------------+-----------------------------------
               Total |      2,159      100.00

. drop if ckd_group==.
(0 observations deleted)

. tab ckd_group modality_baseline

                     |              modality_baseline
           CKD group |  Dialysis  Kidney ..  Modalit..    Pre KRT |     Total
---------------------+--------------------------------------------+----------
         Albuminuria |        61        163          0      1,117 |     1,341 
         CKD stage 3 |        44         32          0        325 |       401 
       CKD stage 4/5 |         5          3          0         12 |        20 
            Dialysis |        76          0          0          0 |        76 
          Transplant |        17         21          5        242 |       285 
KRT unclear modality |         0          0         36          0 |        36 
---------------------+--------------------------------------------+----------
               Total |       203        219         41      1,696 |     2,159 

. 
. *Dialysis & kidney transplant outcome classification
. foreach var of varlist  dialysis_outcome_primary_care   ///
>                                                 dialysis_outcome_icd_10      
>            ///
>                                                 dialysis_outcome_opcs_4      
>            ///
>                                                 dialysis_outcome_date        
>            ///
>                                                 kt_outcome_primary_care      
>            ///
>                                                 kt_outcome_icd_10            
>                    ///
>                                                 kt_outcome_opcs_4            
>                    ///
>                                                 kidney_transplant_outcome_dat
> e  ///
>                                                 died                         
>                            {
  2.         drop `var'
  3.         }

. tab ckd_group modality_outcome, m

                     |              modality_outcome
           CKD group |  Deceased   Dialysis  Kidney ..  Modalit.. |     Total
---------------------+--------------------------------------------+----------
         Albuminuria |       121         59         55         22 |     1,341 
         CKD stage 3 |        42         23         16          3 |       401 
       CKD stage 4/5 |         2          1          3          0 |        20 
            Dialysis |        10          4          2          1 |        76 
          Transplant |        32         17         12          4 |       285 
KRT unclear modality |         7          4          0          0 |        36 
---------------------+--------------------------------------------+----------
               Total |       214        108         88         30 |     2,159 


                     | modality_o
                     |   utcome
           CKD group | Unchanged |     Total
---------------------+-----------+----------
         Albuminuria |     1,084 |     1,341 
         CKD stage 3 |       317 |       401 
       CKD stage 4/5 |        14 |        20 
            Dialysis |        59 |        76 
          Transplant |       220 |       285 
KRT unclear modality |        25 |        36 
---------------------+-----------+----------
               Total |     1,719 |     2,159 

. 
. *eGFR outcome classification based on updated mean eGFR over previous 18 mont
> hs by the end of year
. gen sex = 1 if male == "Male"
(1,116 missing values generated)

. replace sex = 0 if male == "Female"
(1,116 real changes made)

. label define sex 0"Female" 1"Male"

. label values sex sex

. replace creatinine_outcome = . if !inrange(creatinine_outcome, 20, 3000)
(948 real changes made, 948 to missing)

. gen mgdl_creatinine_outcome = creatinine_outcome/88.4
(948 missing values generated)

. gen min_creatinine_outcome=.
(2,159 missing values generated)

. replace min_creatinine_outcome = mgdl_creatinine_outcome/0.7 if sex==0
(627 real changes made)

. replace min_creatinine_outcome = mgdl_creatinine_outcome/0.9 if sex==1
(584 real changes made)

. replace min_creatinine_outcome = min_creatinine_outcome^-0.329  if sex==0
(627 real changes made)

. replace min_creatinine_outcome = min_creatinine_outcome^-0.411  if sex==1
(584 real changes made)

. replace min_creatinine_outcome = 1 if min_creatinine_outcome<1
(800 real changes made)

. gen max_creatinine_outcome=.
(2,159 missing values generated)

. replace max_creatinine_outcome = mgdl_creatinine_outcome/0.7 if sex==0
(627 real changes made)

. replace max_creatinine_outcome = mgdl_creatinine_outcome/0.9 if sex==1
(584 real changes made)

. replace max_creatinine_outcome = max_creatinine_outcome^-1.209
(1,211 real changes made)

. replace max_creatinine_outcome = 1 if max_creatinine_outcome>1
(1,359 real changes made)

. gen egfr_outcome = min_creatinine_outcome*max_creatinine_outcome*141
(948 missing values generated)

. replace egfr_outcome = egfr_outcome*(0.993^age)
(1,211 real changes made)

. replace egfr_outcome = egfr_outcome*1.018 if sex==0
(627 real changes made)

. drop creatinine_outcome

. drop mgdl_creatinine_outcome

. drop min_creatinine_outcome

. drop max_creatinine_outcome

. egen egfr_end = cut(egfr_outcome), at(0, 30, 60, 5000)
(948 missing values generated)

. recode egfr_end 0=3 30=2 60=1
(egfr_end: 1211 changes made)

. label define egfr_end 1 "≥60" 2 "30-59" 3 "<30"

. label values egfr_end egfr_end

. label var egfr_end "Final eGFR"

. gen ckd_progression = 0

. replace ckd_progression = 1 if egfr_end==2 & ckd_group==1
(185 real changes made)

. replace ckd_progression = 2 if egfr_end==3 & ckd_group==1
(12 real changes made)

. replace ckd_progression = 2 if egfr_end==3 & ckd_group==2
(5 real changes made)

. egen esrd_egfr_end = cut(egfr_outcome), at (0, 15, 5000)
(948 missing values generated)

. recode esrd_egfr_end 0=1 15=0
(esrd_egfr_end: 1211 changes made)

. tab esrd_egfr_end, m

esrd_egfr_e |
         nd |      Freq.     Percent        Cum.
------------+-----------------------------------
          0 |      1,211       56.09       56.09
          . |        948       43.91      100.00
------------+-----------------------------------
      Total |      2,159      100.00

. gen dialysis_outcome = 0

. replace dialysis_outcome = 1 if modality_outcome=="Dialysis"
(108 real changes made)

. replace dialysis_outcome = 1 if modality_outcome=="Modality unclear" & esrd_e
> gfr_end==1
(0 real changes made)

. gen kidney_transplant_outcome = 0

. replace kidney_transplant_outcome = 1 if modality_outcome=="Kidney transplant
> "
(88 real changes made)

. replace kidney_transplant_outcome = 1 if modality_outcome=="Modality unclear"
>  & esrd_egfr_end==0
(9 real changes made)

. replace ckd_progression = 5 if modality_outcome=="Modality unclear"
(30 real changes made)

. replace ckd_progression = 3 if dialysis_outcome==1
(108 real changes made)

. replace ckd_progression = 4 if kidney_transplant_outcome==1
(97 real changes made)

. replace ckd_progression = 6 if modality_outcome=="Deceased"
(214 real changes made)

. label define ckd_progression 0 "No progression" 1 "CKD 3" 2 "CKD 4/5 pre-KRT"
>  3 "Dialysis" 4 "Kidney transplant" 5 "KRT unclear modality" 6 "Deceased"

. label values ckd_progression ckd_progression

. label var ckd_progression "CKD progression"

. tab ckd_progression, m

     CKD progression |      Freq.     Percent        Cum.
---------------------+-----------------------------------
      No progression |      1,547       71.65       71.65
               CKD 3 |        158        7.32       78.97
     CKD 4/5 pre-KRT |         14        0.65       79.62
            Dialysis |        108        5.00       84.62
   Kidney transplant |         97        4.49       89.12
KRT unclear modality |         21        0.97       90.09
            Deceased |        214        9.91      100.00
---------------------+-----------------------------------
               Total |      2,159      100.00

. 
. *eGFR cut-offs to investigate timing of access formation
. egen access_egfr = cut(baseline_egfr), at (0, 15, 5000)
(860 missing values generated)

. recode access_egfr 0=1 15=2
(access_egfr: 1299 changes made)

. replace access_egfr=0 if ckd_group==4
(76 real changes made)

. replace access_egfr=3 if access_egfr==.
(784 real changes made)

. label define access_egfr 0 "Dialysis" 1 "eGFR 0-14" 2 "eGFR >= 15" 3 "Unknown
> "

. label values access_egfr access_egfr

. 
. *Totals for non-binary healthcare resource outcomes (including by month)
. foreach aggregate of varlist hospital_days critical_care_days emergency_days 
> op_appts neph_appts tx_appts gp_interactions icd1_days icd2_days icd3_days ic
> d4_days icd5_days icd6_days icd7_days icd8_days icd9_days icd10_days icd11_da
> ys icd12_days icd13_days icd14_days icd15_days icd16_days icd17_days icd18_da
> ys icd19_days icd20_days icd21_days icd22_days {
  2. bysort ckd_group: egen total_`aggregate' = total(`aggregate')
  3. egen overall_`aggregate' = total(`aggregate')
  4. tab ckd_group, sum(total_`aggregate')
  5. sum overall_`aggregate'
  6. }

            |   Summary of total_hospital_days
  CKD group |        Mean   Std. Dev.       Freq.
------------+------------------------------------
  Albuminur |         409           0       1,341
  CKD stage |          86           0         401
  CKD stage |          15           0          20
   Dialysis |          36           0          76
  Transplan |          71           0         285
  KRT uncle |          11           0          36
------------+------------------------------------
      Total |    280.9736   164.48995       2,159

    Variable |        Obs        Mean    Std. Dev.       Min        Max
-------------+---------------------------------------------------------
overall_ho~s |      2,159         628           0        628        628

            | Summary of total_critical_care_days
  CKD group |        Mean   Std. Dev.       Freq.
------------+------------------------------------
  Albuminur |         320           0       1,341
  CKD stage |         130           0         401
  CKD stage |           4           0          20
   Dialysis |          34           0          76
  Transplan |          60           0         285
  KRT uncle |           9           0          36
------------+------------------------------------
      Total |   232.20843    115.5185       2,159

    Variable |        Obs        Mean    Std. Dev.       Min        Max
-------------+---------------------------------------------------------
overall_cr~s |      2,159         557           0        557        557

            |   Summary of total_emergency_days
  CKD group |        Mean   Std. Dev.       Freq.
------------+------------------------------------
  Albuminur |         346           0       1,341
  CKD stage |          85           0         401
  CKD stage |           2           0          20
   Dialysis |          23           0          76
  Transplan |          82           0         285
  KRT uncle |           4           0          36
------------+------------------------------------
      Total |   242.41454   133.60399       2,159

    Variable |        Obs        Mean    Std. Dev.       Min        Max
-------------+---------------------------------------------------------
overall_em~s |      2,159         542           0        542        542

            |      Summary of total_op_appts
  CKD group |        Mean   Std. Dev.       Freq.
------------+------------------------------------
  Albuminur |         375           0       1,341
  CKD stage |         116           0         401
  CKD stage |           6           0          20
   Dialysis |          15           0          76
  Transplan |         101           0         285
  KRT uncle |          10           0          36
------------+------------------------------------
      Total |    268.5484   138.17189       2,159

    Variable |        Obs        Mean    Std. Dev.       Min        Max
-------------+---------------------------------------------------------
overall_op~s |      2,159         623           0        623        623

            |     Summary of total_neph_appts
  CKD group |        Mean   Std. Dev.       Freq.
------------+------------------------------------
  Albuminur |         352           0       1,341
  CKD stage |          93           0         401
  CKD stage |           0           0          20
   Dialysis |          27           0          76
  Transplan |          80           0         285
  KRT uncle |          14           0          36
------------+------------------------------------
      Total |   247.65215   134.59697       2,159

    Variable |        Obs        Mean    Std. Dev.       Min        Max
-------------+---------------------------------------------------------
overall_ne~s |      2,159         566           0        566        566

            |      Summary of total_tx_appts
  CKD group |        Mean   Std. Dev.       Freq.
------------+------------------------------------
  Albuminur |         370           0       1,341
  CKD stage |         108           0         401
  CKD stage |           4           0          20
   Dialysis |           5           0          76
  Transplan |          50           0         285
  KRT uncle |           8           0          36
------------+------------------------------------
      Total |   256.82075   146.91175       2,159

    Variable |        Obs        Mean    Std. Dev.       Min        Max
-------------+---------------------------------------------------------
overall_tx~s |      2,159         545           0        545        545

            |  Summary of total_gp_interactions
  CKD group |        Mean   Std. Dev.       Freq.
------------+------------------------------------
  Albuminur |         326           0       1,341
  CKD stage |          96           0         401
  CKD stage |           4           0          20
   Dialysis |          27           0          76
  Transplan |          85           0         285
  KRT uncle |           9           0          36
------------+------------------------------------
      Total |   232.67392   120.71647       2,159

    Variable |        Obs        Mean    Std. Dev.       Min        Max
-------------+---------------------------------------------------------
overall_gp~s |      2,159         547           0        547        547

            |     Summary of total_icd1_days
  CKD group |        Mean   Std. Dev.       Freq.
------------+------------------------------------
  Albuminur |         370           0       1,341
  CKD stage |          96           0         401
  CKD stage |           3           0          20
   Dialysis |          16           0          76
  Transplan |          74           0         285
  KRT uncle |           4           0          36
------------+------------------------------------
      Total |   258.07133   144.51388       2,159

    Variable |        Obs        Mean    Std. Dev.       Min        Max
-------------+---------------------------------------------------------
overall_ic~s |      2,159         563           0        563        563

            |     Summary of total_icd2_days
  CKD group |        Mean   Std. Dev.       Freq.
------------+------------------------------------
  Albuminur |         358           0       1,341
  CKD stage |         110           0         401
  CKD stage |           9           0          20
   Dialysis |          13           0          76
  Transplan |          53           0         285
  KRT uncle |          12           0          36
------------+------------------------------------
      Total |   250.52941    139.5588       2,159

    Variable |        Obs        Mean    Std. Dev.       Min        Max
-------------+---------------------------------------------------------
overa~2_days |      2,159         555           0        555        555

            |     Summary of total_icd3_days
  CKD group |        Mean   Std. Dev.       Freq.
------------+------------------------------------
  Albuminur |         323           0       1,341
  CKD stage |          93           0         401
  CKD stage |           3           0          20
   Dialysis |          21           0          76
  Transplan |          82           0         285
  KRT uncle |           7           0          36
------------+------------------------------------
      Total |   229.60352   120.83191       2,159

    Variable |        Obs        Mean    Std. Dev.       Min        Max
-------------+---------------------------------------------------------
overa~3_days |      2,159         529           0        529        529

            |     Summary of total_icd4_days
  CKD group |        Mean   Std. Dev.       Freq.
------------+------------------------------------
  Albuminur |         374           0       1,341
  CKD stage |         106           0         401
  CKD stage |           6           0          20
   Dialysis |          11           0          76
  Transplan |          90           0         285
  KRT uncle |           4           0          36
------------+------------------------------------
      Total |   264.37703   141.96846       2,159

    Variable |        Obs        Mean    Std. Dev.       Min        Max
-------------+---------------------------------------------------------
overa~4_days |      2,159         591           0        591        591

            |     Summary of total_icd5_days
  CKD group |        Mean   Std. Dev.       Freq.
------------+------------------------------------
  Albuminur |         279           0       1,341
  CKD stage |          95           0         401
  CKD stage |           6           0          20
   Dialysis |           8           0          76
  Transplan |          90           0         285
  KRT uncle |           4           0          36
------------+------------------------------------
      Total |   203.22186   99.007247       2,159

    Variable |        Obs        Mean    Std. Dev.       Min        Max
-------------+---------------------------------------------------------
overa~5_days |      2,159         482           0        482        482

            |     Summary of total_icd6_days
  CKD group |        Mean   Std. Dev.       Freq.
------------+------------------------------------
  Albuminur |         321           0       1,341
  CKD stage |          98           0         401
  CKD stage |           6           0          20
   Dialysis |          31           0          76
  Transplan |         103           0         285
  KRT uncle |          20           0          36
------------+------------------------------------
      Total |   232.65864   114.46403       2,159

    Variable |        Obs        Mean    Std. Dev.       Min        Max
-------------+---------------------------------------------------------
overa~6_days |      2,159         579           0        579        579

            |     Summary of total_icd7_days
  CKD group |        Mean   Std. Dev.       Freq.
------------+------------------------------------
  Albuminur |         295           0       1,341
  CKD stage |          91           0         401
  CKD stage |           2           0          20
   Dialysis |          17           0          76
  Transplan |          65           0         285
  KRT uncle |          10           0          36
------------+------------------------------------
      Total |   209.49653   110.80435       2,159

    Variable |        Obs        Mean    Std. Dev.       Min        Max
-------------+---------------------------------------------------------
overa~7_days |      2,159         480           0        480        480

            |     Summary of total_icd8_days
  CKD group |        Mean   Std. Dev.       Freq.
------------+------------------------------------
  Albuminur |         357           0       1,341
  CKD stage |         102           0         401
  CKD stage |          15           0          20
   Dialysis |          14           0          76
  Transplan |          84           0         285
  KRT uncle |          18           0          36
------------+------------------------------------
      Total |   252.70542   134.86225       2,159

    Variable |        Obs        Mean    Std. Dev.       Min        Max
-------------+---------------------------------------------------------
overa~8_days |      2,159         590           0        590        590

            |     Summary of total_icd9_days
  CKD group |        Mean   Std. Dev.       Freq.
------------+------------------------------------
  Albuminur |         322           0       1,341
  CKD stage |         123           0         401
  CKD stage |           6           0          20
   Dialysis |           3           0          76
  Transplan |          51           0         285
  KRT uncle |          18           0          36
------------+------------------------------------
      Total |   230.03983   121.02946       2,159

    Variable |        Obs        Mean    Std. Dev.       Min        Max
-------------+---------------------------------------------------------
overa~9_days |      2,159         523           0        523        523

            |     Summary of total_icd10_days
  CKD group |        Mean   Std. Dev.       Freq.
------------+------------------------------------
  Albuminur |         366           0       1,341
  CKD stage |          92           0         401
  CKD stage |          15           0          20
   Dialysis |          18           0          76
  Transplan |          89           0         285
  KRT uncle |           4           0          36
------------+------------------------------------
      Total |   257.00556   140.68264       2,159

    Variable |        Obs        Mean    Std. Dev.       Min        Max
-------------+---------------------------------------------------------
overa~0_days |      2,159         584           0        584        584

            |     Summary of total_icd11_days
  CKD group |        Mean   Std. Dev.       Freq.
------------+------------------------------------
  Albuminur |         338           0       1,341
  CKD stage |         118           0         401
  CKD stage |           0           0          20
   Dialysis |          14           0          76
  Transplan |          85           0         285
  KRT uncle |          11           0          36
------------+------------------------------------
      Total |    243.7522   122.88211       2,159

    Variable |        Obs        Mean    Std. Dev.       Min        Max
-------------+---------------------------------------------------------
over~11_days |      2,159         566           0        566        566

            |     Summary of total_icd12_days
  CKD group |        Mean   Std. Dev.       Freq.
------------+------------------------------------
  Albuminur |         343           0       1,341
  CKD stage |         111           0         401
  CKD stage |           7           0          20
   Dialysis |          19           0          76
  Transplan |          67           0         285
  KRT uncle |           1           0          36
------------+------------------------------------
      Total |   243.25567   129.62597       2,159

    Variable |        Obs        Mean    Std. Dev.       Min        Max
-------------+---------------------------------------------------------
over~12_days |      2,159         548           0        548        548

            |     Summary of total_icd13_days
  CKD group |        Mean   Std. Dev.       Freq.
------------+------------------------------------
  Albuminur |         322           0       1,341
  CKD stage |         100           0         401
  CKD stage |           7           0          20
   Dialysis |           4           0          76
  Transplan |          82           0         285
  KRT uncle |          14           0          36
------------+------------------------------------
      Total |   229.83789   119.71096       2,159

    Variable |        Obs        Mean    Std. Dev.       Min        Max
-------------+---------------------------------------------------------
over~13_days |      2,159         529           0        529        529

            |     Summary of total_icd14_days
  CKD group |        Mean   Std. Dev.       Freq.
------------+------------------------------------
  Albuminur |         345           0       1,341
  CKD stage |         109           0         401
  CKD stage |          10           0          20
   Dialysis |          15           0          76
  Transplan |          26           0         285
  KRT uncle |          16           0          36
------------+------------------------------------
      Total |   238.85132   138.55292       2,159

    Variable |        Obs        Mean    Std. Dev.       Min        Max
-------------+---------------------------------------------------------
over~14_days |      2,159         521           0        521        521

            |     Summary of total_icd15_days
  CKD group |        Mean   Std. Dev.       Freq.
------------+------------------------------------
  Albuminur |         262           0       1,341
  CKD stage |         111           0         401
  CKD stage |          10           0          20
   Dialysis |          32           0          76
  Transplan |         106           0         285
  KRT uncle |          17           0          36
------------+------------------------------------
      Total |    198.8453   83.146906       2,159

    Variable |        Obs        Mean    Std. Dev.       Min        Max
-------------+---------------------------------------------------------
over~15_days |      2,159         538           0        538        538

            |     Summary of total_icd16_days
  CKD group |        Mean   Std. Dev.       Freq.
------------+------------------------------------
  Albuminur |         376           0       1,341
  CKD stage |          99           0         401
  CKD stage |           3           0          20
   Dialysis |          16           0          76
  Transplan |          81           0         285
  KRT uncle |           5           0          36
------------+------------------------------------
      Total |   263.29597   145.57684       2,159

    Variable |        Obs        Mean    Std. Dev.       Min        Max
-------------+---------------------------------------------------------
over~16_days |      2,159         580           0        580        580

            |     Summary of total_icd17_days
  CKD group |        Mean   Std. Dev.       Freq.
------------+------------------------------------
  Albuminur |         367           0       1,341
  CKD stage |         116           0         401
  CKD stage |          11           0          20
   Dialysis |          21           0          76
  Transplan |          70           0         285
  KRT uncle |          12           0          36
------------+------------------------------------
      Total |   259.77814   139.09545       2,159

    Variable |        Obs        Mean    Std. Dev.       Min        Max
-------------+---------------------------------------------------------
over~17_days |      2,159         597           0        597        597

            |     Summary of total_icd18_days
  CKD group |        Mean   Std. Dev.       Freq.
------------+------------------------------------
  Albuminur |         365           0       1,341
  CKD stage |         102           0         401
  CKD stage |           8           0          20
   Dialysis |          13           0          76
  Transplan |          50           0         285
  KRT uncle |          11           0          36
------------+------------------------------------
      Total |   252.96943    145.0379       2,159

    Variable |        Obs        Mean    Std. Dev.       Min        Max
-------------+---------------------------------------------------------
over~18_days |      2,159         549           0        549        549

            |     Summary of total_icd19_days
  CKD group |        Mean   Std. Dev.       Freq.
------------+------------------------------------
  Albuminur |         310           0       1,341
  CKD stage |         105           0         401
  CKD stage |           4           0          20
   Dialysis |          33           0          76
  Transplan |          67           0         285
  KRT uncle |           3           0          36
------------+------------------------------------
      Total |   222.14266   114.13726       2,159

    Variable |        Obs        Mean    Std. Dev.       Min        Max
-------------+---------------------------------------------------------
over~19_days |      2,159         522           0        522        522

            |     Summary of total_icd20_days
  CKD group |        Mean   Std. Dev.       Freq.
------------+------------------------------------
  Albuminur |         352           0       1,341
  CKD stage |          70           0         401
  CKD stage |          16           0          20
   Dialysis |          28           0          76
  Transplan |          78           0         285
  KRT uncle |           8           0          36
------------+------------------------------------
      Total |   243.19963   139.88074       2,159

    Variable |        Obs        Mean    Std. Dev.       Min        Max
-------------+---------------------------------------------------------
over~20_days |      2,159         552           0        552        552

            |     Summary of total_icd21_days
  CKD group |        Mean   Std. Dev.       Freq.
------------+------------------------------------
  Albuminur |         341           0       1,341
  CKD stage |         136           0         401
  CKD stage |           0           0          20
   Dialysis |          11           0          76
  Transplan |          69           0         285
  KRT uncle |           9           0          36
------------+------------------------------------
      Total |   246.70774   124.24342       2,159

    Variable |        Obs        Mean    Std. Dev.       Min        Max
-------------+---------------------------------------------------------
over~21_days |      2,159         566           0        566        566

            |     Summary of total_icd22_days
  CKD group |        Mean   Std. Dev.       Freq.
------------+------------------------------------
  Albuminur |         372           0       1,341
  CKD stage |          96           0         401
  CKD stage |           8           0          20
   Dialysis |          20           0          76
  Transplan |          66           0         285
  KRT uncle |           6           0          36
------------+------------------------------------
      Total |     258.478   146.47276       2,159

    Variable |        Obs        Mean    Std. Dev.       Min        Max
-------------+---------------------------------------------------------
over~22_days |      2,159         568           0        568        568

. 
. 
. 
. **Potential effect modifiers
. * Ethnicity
. * 1 = White ethnicities (white British, white Irish, with other)
. * 2 = Mixed ethnicities (white & black Caribbean, white & black African, whit
> e & Asian, other mixed ethnicities)
. * 3 = South Asian ethnicities (Indian, Pakistani, Bangladeshi, other South As
> ian)
. * 4 = Black ethnicities (black Caribbean, black African, other black)
. * 5 = Other ethnicities (Chinese, all other ethnicities)
. * . = Unknown ethnicity
. replace ethnicity = . if ethnicity==.
(0 real changes made)

. replace ethnicity=6 if ethnicity==2
(63 real changes made)

. replace ethnicity=2 if ethnicity==3
(70 real changes made)

. replace ethnicity=3 if ethnicity==4
(93 real changes made)

. replace ethnicity=4 if ethnicity==6
(63 real changes made)

. replace ethnicity=6 if ethnicity==.
(585 real changes made)

. label define ethnicity  1 "White"                                       ///
>                                                 2 "South Asian"              
>            ///                                             
>                                                 3 "Black"                    
>                    ///
>                                                 4 "Mixed"                    
>                    ///
>                                                 5 "Other"                    
>                    ///
>                                                 6 "Unknown"     

. label values ethnicity ethnicity

. 
. * Index of multiple deprivation
. * Ordered 1-5 from most deprived to least deprived
. label define imd 1 "1 Most deprived" 2 "2" 3 "3" 4 "4" 5 "5 Least deprived"

. label values imd imd

. 
. * Region
. rename region region_string

. gen region = 1 if region_string=="East Midlands"
(1,932 missing values generated)

. replace region = 2 if region_string=="East"
(180 real changes made)

. replace region = 3 if region_string=="London"
(462 real changes made)

. replace region = 4 if region_string=="North East"
(203 real changes made)

. replace region = 5 if region_string=="North West"
(209 real changes made)

. replace region = 6 if region_string=="South East"
(216 real changes made)

. replace region = 7 if region_string=="South West"
(233 real changes made)

. replace region = 8 if region_string=="West Midlands"
(228 real changes made)

. replace region = 9 if region_string=="Yorkshire and The Humber"
(201 real changes made)

. label define region     1 "East Midlands"                                    
>    ///
>                                                 2 "East"                     
>                                    ///
>                                                 3 "London"                   
>                                    ///
>                                                 4 "North East"               
>                            ///
>                                                 5 "North West"               
>                            ///
>                                                 6 "South East"               
>                            ///
>                                                 7 "South West"               
>                            ///
>                                                 8 "West Midlands"            
>                            ///
>                                                 9 "Yorkshire and The Humber" 
>            

. label values region region

. label var region "Region"

. 
. * Urban/rural
. replace rural_urban=. if rural_urban<1|rural_urban>8
(0 real changes made)

. label define rural_urban 1 "Urban major conurbation"                         
>                    ///
>                                                  2 "Urban minor conurbation" 
>                                            ///
>                                                  3 "Urban city and town"     
>                                                    ///
>                                                  4 "Urban city and town in a 
> sparse setting"            ///
>                                                  5 "Rural town and fringe"   
>                                                    ///
>                                                  6 "Rural town and fringe in 
> a sparse setting"          ///
>                                                  7 "Rural village and dispers
> ed"                                        ///
>                                                  8 "Rural village and dispers
> ed in a sparse setting"

. label values rural_urban rural_urban

. * Urban (binary)
. * Urban = 1-4 + missing, Rural = 5-8
. generate urban=.
(2,159 missing values generated)

. replace urban=1 if rural_urban<=4|rural_urban==.
(837 real changes made)

. replace urban=0 if rural_urban>4 & rural_urban!=.
(1,322 real changes made)

. label var urban "Urban/rural"

. label define urban 0 "Rural" 1 "Urban"

. label values urban urban

. drop rural_urban

. 
. *Age bands for standardisation
. egen agecat = cut(age), at(0,18,20,25,30,35,40,45,50,55,60,65,70,75,80,85,90,
> 200)

. drop if agecat==0
(0 observations deleted)

. 
. *Age-standardisation weights (European Standard Population 2013)
. gen weight = .
(2,159 missing values generated)

. replace weight = 0.027261 if agecat==18
(43 real changes made)

. replace weight = 0.074349 if agecat==20
(167 real changes made)

. replace weight = 0.074349 if agecat==25
(190 real changes made)

. replace weight = 0.080545 if agecat==30
(171 real changes made)

. replace weight = 0.086741 if agecat==35
(188 real changes made)

. replace weight = 0.086741 if agecat==40
(147 real changes made)

. replace weight = 0.086741 if agecat==45
(188 real changes made)

. replace weight = 0.086741 if agecat==50
(192 real changes made)

. replace weight = 0.080545 if agecat==55
(177 real changes made)

. replace weight = 0.074349 if agecat==60
(147 real changes made)

. replace weight = 0.068154 if agecat==65
(157 real changes made)

. replace weight = 0.061958 if agecat==70
(133 real changes made)

. replace weight = 0.049566 if agecat==75
(108 real changes made)

. replace weight = 0.030979 if agecat==80
(79 real changes made)

. replace weight = 0.018587 if agecat==85
(46 real changes made)

. replace weight = 0.012392 if agecat==90
(26 real changes made)

. 
. 
. *Age standardised counts for each non-binary healthcare resource outcomes
. foreach aggregate of varlist hospital_days critical_care_days emergency_days 
> op_appts neph_appts tx_appts gp_interactions icd1_days icd2_days icd3_days ic
> d4_days icd5_days icd6_days icd7_days icd8_days icd9_days icd10_days icd11_da
> ys icd12_days icd13_days icd14_days icd15_days icd16_days icd17_days icd18_da
> ys icd19_days icd20_days icd21_days icd22_days {
  2. replace `aggregate' = `aggregate' * weight
  3. }
variable hospital_days was byte now float
(216 real changes made)
variable critical_care_days was byte now float
(186 real changes made)
variable emergency_days was byte now float
(187 real changes made)
variable op_appts was byte now float
(196 real changes made)
variable neph_appts was byte now float
(188 real changes made)
variable tx_appts was byte now float
(188 real changes made)
variable gp_interactions was byte now float
(185 real changes made)
variable icd1_days was byte now float
(190 real changes made)
variable icd2_days was byte now float
(197 real changes made)
variable icd3_days was byte now float
(182 real changes made)
variable icd4_days was byte now float
(200 real changes made)
variable icd5_days was byte now float
(181 real changes made)
variable icd6_days was byte now float
(202 real changes made)
variable icd7_days was byte now float
(167 real changes made)
variable icd8_days was byte now float
(187 real changes made)
variable icd9_days was byte now float
(190 real changes made)
variable icd10_days was byte now float
(188 real changes made)
variable icd11_days was byte now float
(188 real changes made)
variable icd12_days was byte now float
(180 real changes made)
variable icd13_days was byte now float
(173 real changes made)
variable icd14_days was byte now float
(186 real changes made)
variable icd15_days was byte now float
(189 real changes made)
variable icd16_days was byte now float
(199 real changes made)
variable icd17_days was byte now float
(200 real changes made)
variable icd18_days was byte now float
(195 real changes made)
variable icd19_days was byte now float
(178 real changes made)
variable icd20_days was byte now float
(180 real changes made)
variable icd21_days was byte now float
(184 real changes made)
variable icd22_days was byte now float
(192 real changes made)

. 
. * Create variable for age-standardised total # of each aggregated outcome
. * `var'_`aggregate' = age-standardised total # of each aggregated outcome ove
> rall stratified by ethnicity/imd/region/urban
. * `var'_`aggregate'_ckd = age-standardised total # of each aggregated outcome
>  in each CKD group stratified by ethnicity/imd/region/urban
. foreach aggregate of varlist hospital_days critical_care_days emergency_days 
> op_appts neph_appts tx_appts gp_interactions icd1_days icd2_days icd3_days ic
> d4_days icd5_days icd6_days icd7_days icd8_days icd9_days icd10_days icd11_da
> ys icd12_days icd13_days icd14_days icd15_days icd16_days icd17_days icd18_da
> ys icd19_days icd20_days icd21_days icd22_days {
  2. egen overall_std_`aggregate' = total(`aggregate')
  3. bysort ckd_group: egen std_`aggregate' = total(`aggregate')
  4. foreach var of varlist ethnicity imd region urban {
  5. bysort `var': egen `var'_`aggregate' = total(`aggregate')
  6. bysort `var' ckd_group: egen `var'_`aggregate'_ckd = total(`aggregate')
  7. }
  8. }

. 
. foreach binary of varlist fistula_formation pd_insertion blood_pressure album
> inuria creatinine icd1 icd2 icd3 icd4 icd5 icd6 icd7 icd8 icd9 icd10 icd11 ic
> d12 icd13 icd14 icd15 icd16 icd17 icd18 icd19 icd20 icd21 icd22 {
  2. gen esp_`binary' = `binary' * weight
  3. egen overall_std_`binary' = total(esp_`binary')
  4. bysort ckd_group: egen std_`binary' = total(esp_`binary')
  5. foreach var of varlist ethnicity imd region urban {
  6. bysort `var': egen `var'_`binary' = total(esp_`binary')
  7. bysort `var' ckd_group: egen `var'_`binary'_ckd = total(esp_`binary')
  8. }
  9. }

. 
. *Merge cost data
. save "./output/`dataset'_ckd_complete.dta", replace
(note: file ./output/2020_ckd_complete.dta not found)
file ./output/2020_ckd_complete.dta saved

. capture noisily import delimited ./output/costs_`dataset'.csv, clear
(7 vars, 500 obs)

. keep patient_id apcs_cost ec_cost opa_cost

. merge 1:1 patient_id using ./output/`dataset'_ckd_complete
(note: variable patient_id was int, now long to accommodate using data's
       values)

    Result                           # of obs.
    -----------------------------------------
    not matched                         2,657
        from master                       499  (_merge==1)
        from using                      2,158  (_merge==2)

    matched                                 1  (_merge==3)
    -----------------------------------------

. drop if _merge==1
(499 observations deleted)

. foreach cost of varlist apcs_cost ec_cost opa_cost {
  2. sum `cost', d
  3. bysort ckd_group: egen total_`cost' = total(`cost')
  4. egen overall_`cost' = total(`cost')
  5. tab ckd_group, sum(total_`cost')
  6. sum overall_`cost'
  7. foreach var of varlist ethnicity imd region urban {
  8. bysort `var': egen `var'_`cost' = total(`cost')
  9. bysort `var' ckd_group: egen `var'_`cost'_ckd = total(`cost')
 10. }
 11. }

                          apcs_cost
-------------------------------------------------------------
no observations

            |     Summary of total_apcs_cost
  CKD group |        Mean   Std. Dev.       Freq.
------------+------------------------------------
  Albuminur |           0           0       1,341
  CKD stage |           0           0         401
  CKD stage |           0           0          20
   Dialysis |           0           0          76
  Transplan |           0           0         285
  KRT uncle |           0           0          36
------------+------------------------------------
      Total |           0           0       2,159

    Variable |        Obs        Mean    Std. Dev.       Min        Max
-------------+---------------------------------------------------------
overall_ap~t |      2,159           0           0          0          0

                           ec_cost
-------------------------------------------------------------
no observations

            |      Summary of total_ec_cost
  CKD group |        Mean   Std. Dev.       Freq.
------------+------------------------------------
  Albuminur |           0           0       1,341
  CKD stage |           0           0         401
  CKD stage |           0           0          20
   Dialysis |           0           0          76
  Transplan |           0           0         285
  KRT uncle |           0           0          36
------------+------------------------------------
      Total |           0           0       2,159

    Variable |        Obs        Mean    Std. Dev.       Min        Max
-------------+---------------------------------------------------------
overall_ec~t |      2,159           0           0          0          0

                          opa_cost
-------------------------------------------------------------
no observations

            |      Summary of total_opa_cost
  CKD group |        Mean   Std. Dev.       Freq.
------------+------------------------------------
  Albuminur |           0           0       1,341
  CKD stage |           0           0         401
  CKD stage |           0           0          20
   Dialysis |           0           0          76
  Transplan |           0           0         285
  KRT uncle |           0           0          36
------------+------------------------------------
      Total |           0           0       2,159

    Variable |        Obs        Mean    Std. Dev.       Min        Max
-------------+---------------------------------------------------------
overall_op~t |      2,159           0           0          0          0

. save "./output/`dataset'_ckd_complete.dta", replace
file ./output/2020_ckd_complete.dta saved

. 
. log close
      name:  <unnamed>
       log:  /workspace/logs/2020_ckd_complete.log
  log type:  text
 closed on:   7 Jun 2024, 10:22:21
-------------------------------------------------------------------------------
