-------------------------------------------------------------------------------
      name:  <unnamed>
       log:  /workspace/logs/2021_ckd_complete.log
  log type:  text
 opened on:  29 Apr 2024, 13:29:56

. clear

. 
. *Merge `dataset'_ckd with `dataset'_ckd_complete
. capture noisily import delimited ./output/`dataset'_ckd.csv, clear
(9 vars, 21,102 obs)

. tempfile `dataset'_ckd

. save ``dataset'_ckd', replace
(note: file /tmp/St00014.000001 not found)
file /tmp/St00014.000001 saved

. capture noisily import delimited ./output/input_`dataset'_ckd_complete.csv, c
> lear
(104 vars, 50,000 obs)

. merge 1:1 patient_id using ``dataset'_ckd'

    Result                           # of obs.
    -----------------------------------------
    not matched                        66,814
        from master                    47,856  (_merge==1)
        from using                     18,958  (_merge==2)

    matched                             2,144  (_merge==3)
    -----------------------------------------

. keep if _merge==3
(66,814 observations deleted)

. drop _merge

. tempfile `dataset'_ckd_complete

. save ``dataset'_ckd_complete', replace
(note: file /tmp/St00014.000002 not found)
file /tmp/St00014.000002 saved

. 
. /*Generate dummy data
> cd ckd-healthcare-use
> capture noisily import delimited ./output/2017_ckd.csv, clear
> tempfile 2017_ckd
> save ./output/2017_ckd, replace
> capture noisily import delimited ./output/input_2017_ckd_complete.csv, clear
> merge 1:1 patient_id using ./output/2017_ckd
> keep if _merge==3
> drop _merge
> tempfile 2017_ckd_complete
> save ./output/2017_ckd_complete, replace
> */
. 
. *CKD stage classification
. foreach var of varlist  dialysis_baseline_primary_care  ///
>                                                 dialysis_baseline_icd_10     
>            ///
>                                                 dialysis_baseline_opcs_4     
>            ///
>                                                 dialysis_baseline_date       
>            ///
>                                                 kt_baseline_primary_care     
>            ///
>                                                 kt_baseline_icd_10           
>                    ///
>                                                 kt_baseline_opcs_4           
>                    {
  2.         drop `var'
  3.         }

. tab modality_baseline, m

modality_baseline |      Freq.     Percent        Cum.
------------------+-----------------------------------
         Dialysis |        187        8.72        8.72
Kidney transplant |        178        8.30       17.02
 Modality unclear |         46        2.15       19.17
          Pre KRT |      1,733       80.83      100.00
------------------+-----------------------------------
            Total |      2,144      100.00

. *To reduce misclassification of dialysis, anyone with eGFR >15 with modality_
> baseline=="Dialysis" will be reclassified as non-dialysis (e.g. they may have
>  received acute dialysis and recovered)
. *For modality_baseline="Modality unclear" (i.e. whose dialysis and kidney tra
> nsplant baseline dates are identical), those with eGFR <15 will be assumed to
>  be on dialysis and those >15 as kidney transplant
. egen esrd_egfr = cut(baseline_egfr), at (0, 15, 5000)
(844 missing values generated)

. recode esrd_egfr 0=1 15=0
(esrd_egfr: 1300 changes made)

. tab esrd_egfr, m

  esrd_egfr |      Freq.     Percent        Cum.
------------+-----------------------------------
          0 |      1,300       60.63       60.63
          . |        844       39.37      100.00
------------+-----------------------------------
      Total |      2,144      100.00

. gen dialysis = 0

. replace dialysis = 1 if modality_baseline=="Dialysis"
(187 real changes made)

. replace dialysis = 1 if modality_baseline=="Modality unclear" & esrd_egfr!=.
(22 real changes made)

. replace dialysis = 0 if esrd_egfr==0
(127 real changes made)

. gen kidney_transplant = 0

. replace kidney_transplant = 1 if kidney_transplant_baseline_date!=""
(296 real changes made)

. replace kidney_transplant = 0 if dialysis==1
(10 real changes made)

. gen modality_unclear = 0

. replace modality_unclear = 1 if modality_baseline=="Modality unclear"
(46 real changes made)

. replace modality_unclear = 0 if dialysis==1
(0 real changes made)

. replace modality_unclear = 0 if kidney_transplant==1
(6 real changes made)

. tab modality_baseline dialysis

                  |       dialysis
modality_baseline |         0          1 |     Total
------------------+----------------------+----------
         Dialysis |       105         82 |       187 
Kidney transplant |       178          0 |       178 
 Modality unclear |        46          0 |        46 
          Pre KRT |     1,733          0 |     1,733 
------------------+----------------------+----------
            Total |     2,062         82 |     2,144 

. tab modality_baseline kidney_transplant

                  |   kidney_transplant
modality_baseline |         0          1 |     Total
------------------+----------------------+----------
         Dialysis |       173         14 |       187 
Kidney transplant |       151         27 |       178 
 Modality unclear |        40          6 |        46 
          Pre KRT |     1,494        239 |     1,733 
------------------+----------------------+----------
            Total |     1,858        286 |     2,144 

. tab modality_baseline modality_unclear

                  |   modality_unclear
modality_baseline |         0          1 |     Total
------------------+----------------------+----------
         Dialysis |       187          0 |       187 
Kidney transplant |       178          0 |       178 
 Modality unclear |         6         40 |        46 
          Pre KRT |     1,733          0 |     1,733 
------------------+----------------------+----------
            Total |     2,104         40 |     2,144 

. tab dialysis kidney_transplant

           |   kidney_transplant
  dialysis |         0          1 |     Total
-----------+----------------------+----------
         0 |     1,776        286 |     2,062 
         1 |        82          0 |        82 
-----------+----------------------+----------
     Total |     1,858        286 |     2,144 

. egen ckd_group = cut(baseline_egfr), at(0, 30, 60, 5000)
(844 missing values generated)

. recode ckd_group 0=3 30=2 60=1
(ckd_group: 1300 changes made)

. replace ckd_group = 4 if dialysis==1
(82 real changes made)

. replace ckd_group = 5 if kidney_transplant==1
(286 real changes made)

. replace ckd_group = 6 if modality_unclear==1
(40 real changes made)

. *ckd_group==. are those with albuminuria without available eGFR measurement o
> r code for KRT
. replace ckd_group = 1 if ckd_group==.
(629 real changes made)

. label define ckd_group 1 "Albuminuria" 2 "CKD stage 3" 3 "CKD stage 4/5" 4 "D
> ialysis" 5 "Transplant" 6 "KRT unclear modality"

. label values ckd_group ckd_group

. label var ckd_group "CKD group"

. tab ckd_group, m

           CKD group |      Freq.     Percent        Cum.
---------------------+-----------------------------------
         Albuminuria |      1,304       60.82       60.82
         CKD stage 3 |        413       19.26       80.08
       CKD stage 4/5 |         19        0.89       80.97
            Dialysis |         82        3.82       84.79
          Transplant |        286       13.34       98.13
KRT unclear modality |         40        1.87      100.00
---------------------+-----------------------------------
               Total |      2,144      100.00

. drop if ckd_group==.
(0 observations deleted)

. tab ckd_group modality_baseline

                     |              modality_baseline
           CKD group |  Dialysis  Kidney ..  Modalit..    Pre KRT |     Total
---------------------+--------------------------------------------+----------
         Albuminuria |        52        128          0      1,124 |     1,304 
         CKD stage 3 |        36         21          0        356 |       413 
       CKD stage 4/5 |         3          2          0         14 |        19 
            Dialysis |        82          0          0          0 |        82 
          Transplant |        14         27          6        239 |       286 
KRT unclear modality |         0          0         40          0 |        40 
---------------------+--------------------------------------------+----------
               Total |       187        178         46      1,733 |     2,144 

. 
. *Dialysis & kidney transplant outcome classification
. foreach var of varlist  dialysis_outcome_primary_care   ///
>                                                 dialysis_outcome_icd_10      
>            ///
>                                                 dialysis_outcome_opcs_4      
>            ///
>                                                 dialysis_outcome_date        
>            ///
>                                                 kt_outcome_primary_care      
>            ///
>                                                 kt_outcome_icd_10            
>                    ///
>                                                 kt_outcome_opcs_4            
>                    ///
>                                                 kidney_transplant_outcome_dat
> e  ///
>                                                 died                         
>                            {
  2.         drop `var'
  3.         }

. tab ckd_group modality_outcome, m

                     |              modality_outcome
           CKD group |  Deceased   Dialysis  Kidney ..  Modalit.. |     Total
---------------------+--------------------------------------------+----------
         Albuminuria |       113         79         54          7 |     1,304 
         CKD stage 3 |        51         20         20          2 |       413 
       CKD stage 4/5 |         3          1          0          0 |        19 
            Dialysis |         9         12          3          1 |        82 
          Transplant |        38         14         18          4 |       286 
KRT unclear modality |         2          4          1          0 |        40 
---------------------+--------------------------------------------+----------
               Total |       216        130         96         14 |     2,144 


                     | modality_o
                     |   utcome
           CKD group | Unchanged |     Total
---------------------+-----------+----------
         Albuminuria |     1,051 |     1,304 
         CKD stage 3 |       320 |       413 
       CKD stage 4/5 |        15 |        19 
            Dialysis |        57 |        82 
          Transplant |       212 |       286 
KRT unclear modality |        33 |        40 
---------------------+-----------+----------
               Total |     1,688 |     2,144 

. 
. *eGFR outcome classification based on updated mean eGFR over previous 18 mont
> hs by the end of year
. gen sex = 1 if male == "Male"
(1,156 missing values generated)

. replace sex = 0 if male == "Female"
(1,156 real changes made)

. label define sex 0"Female" 1"Male"

. label values sex sex

. replace creatinine_outcome = . if !inrange(creatinine_outcome, 20, 3000)
(969 real changes made, 969 to missing)

. gen mgdl_creatinine_outcome = creatinine_outcome/88.4
(969 missing values generated)

. gen min_creatinine_outcome=.
(2,144 missing values generated)

. replace min_creatinine_outcome = mgdl_creatinine_outcome/0.7 if sex==0
(637 real changes made)

. replace min_creatinine_outcome = mgdl_creatinine_outcome/0.9 if sex==1
(538 real changes made)

. replace min_creatinine_outcome = min_creatinine_outcome^-0.329  if sex==0
(637 real changes made)

. replace min_creatinine_outcome = min_creatinine_outcome^-0.411  if sex==1
(538 real changes made)

. replace min_creatinine_outcome = 1 if min_creatinine_outcome<1
(735 real changes made)

. gen max_creatinine_outcome=.
(2,144 missing values generated)

. replace max_creatinine_outcome = mgdl_creatinine_outcome/0.7 if sex==0
(637 real changes made)

. replace max_creatinine_outcome = mgdl_creatinine_outcome/0.9 if sex==1
(538 real changes made)

. replace max_creatinine_outcome = max_creatinine_outcome^-1.209
(1,175 real changes made)

. replace max_creatinine_outcome = 1 if max_creatinine_outcome>1
(1,409 real changes made)

. gen egfr_outcome = min_creatinine_outcome*max_creatinine_outcome*141
(969 missing values generated)

. replace egfr_outcome = egfr_outcome*(0.993^age)
(1,175 real changes made)

. replace egfr_outcome = egfr_outcome*1.018 if sex==0
(637 real changes made)

. drop creatinine_outcome

. drop mgdl_creatinine_outcome

. drop min_creatinine_outcome

. drop max_creatinine_outcome

. egen egfr_end = cut(egfr_outcome), at(0, 30, 60, 5000)
(969 missing values generated)

. recode egfr_end 0=3 30=2 60=1
(egfr_end: 1175 changes made)

. label define egfr_end 1 "≥60" 2 "30-59" 3 "<30"

. label values egfr_end egfr_end

. label var egfr_end "Final eGFR"

. gen ckd_progression = 0

. replace ckd_progression = 1 if egfr_end==2 & ckd_group==1
(168 real changes made)

. replace ckd_progression = 2 if egfr_end==3 & ckd_group==1
(6 real changes made)

. replace ckd_progression = 2 if egfr_end==3 & ckd_group==2
(2 real changes made)

. egen esrd_egfr_end = cut(egfr_outcome), at (0, 15, 5000)
(969 missing values generated)

. recode esrd_egfr_end 0=1 15=0
(esrd_egfr_end: 1175 changes made)

. tab esrd_egfr_end, m

esrd_egfr_e |
         nd |      Freq.     Percent        Cum.
------------+-----------------------------------
          0 |      1,175       54.80       54.80
          . |        969       45.20      100.00
------------+-----------------------------------
      Total |      2,144      100.00

. gen dialysis_outcome = 0

. replace dialysis_outcome = 1 if modality_outcome=="Dialysis"
(130 real changes made)

. replace dialysis_outcome = 1 if modality_outcome=="Modality unclear" & esrd_e
> gfr_end==1
(0 real changes made)

. gen kidney_transplant_outcome = 0

. replace kidney_transplant_outcome = 1 if modality_outcome=="Kidney transplant
> "
(96 real changes made)

. replace kidney_transplant_outcome = 1 if modality_outcome=="Modality unclear"
>  & esrd_egfr_end==0
(10 real changes made)

. replace ckd_progression = 5 if modality_outcome=="Modality unclear"
(14 real changes made)

. replace ckd_progression = 3 if dialysis_outcome==1
(130 real changes made)

. replace ckd_progression = 4 if kidney_transplant_outcome==1
(106 real changes made)

. replace ckd_progression = 6 if modality_outcome=="Deceased"
(216 real changes made)

. label define ckd_progression 0 "No progression" 1 "CKD 3" 2 "CKD 4/5 pre-KRT"
>  3 "Dialysis" 4 "Kidney transplant" 5 "KRT unclear modality" 6 "Deceased"

. label values ckd_progression ckd_progression

. label var ckd_progression "CKD progression"

. tab ckd_progression, m

     CKD progression |      Freq.     Percent        Cum.
---------------------+-----------------------------------
      No progression |      1,550       72.29       72.29
               CKD 3 |        133        6.20       78.50
     CKD 4/5 pre-KRT |          5        0.23       78.73
            Dialysis |        130        6.06       84.79
   Kidney transplant |        106        4.94       89.74
KRT unclear modality |          4        0.19       89.93
            Deceased |        216       10.07      100.00
---------------------+-----------------------------------
               Total |      2,144      100.00

. 
. *eGFR cut-offs to investigate timing of access formation
. egen access_egfr = cut(baseline_egfr), at (0, 15, 5000)
(844 missing values generated)

. recode access_egfr 0=1 15=2
(access_egfr: 1300 changes made)

. replace access_egfr=0 if ckd_group==4
(82 real changes made)

. replace access_egfr=3 if access_egfr==.
(762 real changes made)

. label define access_egfr 0 "Dialysis" 1 "eGFR 0-14" 2 "eGFR >= 15" 3 "Unknown
> "

. label values access_egfr access_egfr

. 
. *Totals for non-binary healthcare resource outcomes (including by month)
. foreach aggregate of varlist hospital_days critical_care_days emergency_days 
> op_appts neph_appts tx_appts gp_interactions icd1_days icd2_days icd3_days ic
> d4_days icd5_days icd6_days icd7_days icd8_days icd9_days icd10_days icd11_da
> ys icd12_days icd13_days icd14_days icd15_days icd16_days icd17_days icd18_da
> ys icd19_days icd20_days icd21_days icd22_days {
  2. bysort ckd_group: egen total_`aggregate' = total(`aggregate')
  3. egen overall_`aggregate' = total(`aggregate')
  4. tab ckd_group, sum(total_`aggregate')
  5. sum overall_`aggregate'
  6. }

            |   Summary of total_hospital_days
  CKD group |        Mean   Std. Dev.       Freq.
------------+------------------------------------
  Albuminur |         306           0       1,304
  CKD stage |          97           0         413
  CKD stage |          10           0          19
   Dialysis |          25           0          82
  Transplan |          71           0         286
  KRT uncle |          19           0          40
------------+------------------------------------
      Total |   215.66744   113.84325       2,144

    Variable |        Obs        Mean    Std. Dev.       Min        Max
-------------+---------------------------------------------------------
overall_ho~s |      2,144         528           0        528        528

            | Summary of total_critical_care_days
  CKD group |        Mean   Std. Dev.       Freq.
------------+------------------------------------
  Albuminur |         306           0       1,304
  CKD stage |         145           0         413
  CKD stage |           4           0          19
   Dialysis |          18           0          82
  Transplan |          74           0         286
  KRT uncle |          15           0          40
------------+------------------------------------
      Total |   224.91838   105.66195       2,144

    Variable |        Obs        Mean    Std. Dev.       Min        Max
-------------+---------------------------------------------------------
overall_cr~s |      2,144         562           0        562        562

            |   Summary of total_emergency_days
  CKD group |        Mean   Std. Dev.       Freq.
------------+------------------------------------
  Albuminur |         327           0       1,304
  CKD stage |         139           0         413
  CKD stage |           3           0          19
   Dialysis |          15           0          82
  Transplan |          79           0         286
  KRT uncle |          11           0          40
------------+------------------------------------
      Total |   237.00373   115.91356       2,144

    Variable |        Obs        Mean    Std. Dev.       Min        Max
-------------+---------------------------------------------------------
overall_em~s |      2,144         574           0        574        574

            |      Summary of total_op_appts
  CKD group |        Mean   Std. Dev.       Freq.
------------+------------------------------------
  Albuminur |         354           0       1,304
  CKD stage |         103           0         413
  CKD stage |           6           0          19
   Dialysis |          28           0          82
  Transplan |          68           0         286
  KRT uncle |          11           0          40
------------+------------------------------------
      Total |   245.54711   136.47937       2,144

    Variable |        Obs        Mean    Std. Dev.       Min        Max
-------------+---------------------------------------------------------
overall_op~s |      2,144         570           0        570        570

            |     Summary of total_neph_appts
  CKD group |        Mean   Std. Dev.       Freq.
------------+------------------------------------
  Albuminur |         341           0       1,304
  CKD stage |         106           0         413
  CKD stage |           2           0          19
   Dialysis |          28           0          82
  Transplan |          85           0         286
  KRT uncle |           0           0          40
------------+------------------------------------
      Total |   240.24534   127.16551       2,144

    Variable |        Obs        Mean    Std. Dev.       Min        Max
-------------+---------------------------------------------------------
overall_ne~s |      2,144         562           0        562        562

            |      Summary of total_tx_appts
  CKD group |        Mean   Std. Dev.       Freq.
------------+------------------------------------
  Albuminur |         342           0       1,304
  CKD stage |          92           0         413
  CKD stage |           9           0          19
   Dialysis |           9           0          82
  Transplan |          85           0         286
  KRT uncle |          21           0          40
------------+------------------------------------
      Total |   237.88386   131.01175       2,144

    Variable |        Obs        Mean    Std. Dev.       Min        Max
-------------+---------------------------------------------------------
overall_tx~s |      2,144         558           0        558        558

            |  Summary of total_gp_interactions
  CKD group |        Mean   Std. Dev.       Freq.
------------+------------------------------------
  Albuminur |         364           0       1,304
  CKD stage |          86           0         413
  CKD stage |           0           0          19
   Dialysis |          31           0          82
  Transplan |          86           0         286
  KRT uncle |           0           0          40
------------+------------------------------------
      Total |   250.61194   142.25467       2,144

    Variable |        Obs        Mean    Std. Dev.       Min        Max
-------------+---------------------------------------------------------
overall_gp~s |      2,144         567           0        567        567

            |     Summary of total_icd1_days
  CKD group |        Mean   Std. Dev.       Freq.
------------+------------------------------------
  Albuminur |         331           0       1,304
  CKD stage |         123           0         413
  CKD stage |           2           0          19
   Dialysis |          28           0          82
  Transplan |          77           0         286
  KRT uncle |           6           0          40
------------+------------------------------------
      Total |   236.48274   120.22703       2,144

    Variable |        Obs        Mean    Std. Dev.       Min        Max
-------------+---------------------------------------------------------
overall_ic~s |      2,144         567           0        567        567

            |     Summary of total_icd2_days
  CKD group |        Mean   Std. Dev.       Freq.
------------+------------------------------------
  Albuminur |         365           0       1,304
  CKD stage |          99           0         413
  CKD stage |           4           0          19
   Dialysis |          14           0          82
  Transplan |          73           0         286
  KRT uncle |          15           0          40
------------+------------------------------------
      Total |   251.65532   142.54259       2,144

    Variable |        Obs        Mean    Std. Dev.       Min        Max
-------------+---------------------------------------------------------
overa~2_days |      2,144         570           0        570        570

            |     Summary of total_icd3_days
  CKD group |        Mean   Std. Dev.       Freq.
------------+------------------------------------
  Albuminur |         387           0       1,304
  CKD stage |         105           0         413
  CKD stage |           5           0          19
   Dialysis |          15           0          82
  Transplan |          97           0         286
  KRT uncle |           9           0          40
------------+------------------------------------
      Total |   269.32836   148.16386       2,144

    Variable |        Obs        Mean    Std. Dev.       Min        Max
-------------+---------------------------------------------------------
overa~3_days |      2,144         618           0        618        618

            |     Summary of total_icd4_days
  CKD group |        Mean   Std. Dev.       Freq.
------------+------------------------------------
  Albuminur |         373           0       1,304
  CKD stage |          89           0         413
  CKD stage |          15           0          19
   Dialysis |          30           0          82
  Transplan |          66           0         286
  KRT uncle |           2           0          40
------------+------------------------------------
      Total |    254.1278   148.97082       2,144

    Variable |        Obs        Mean    Std. Dev.       Min        Max
-------------+---------------------------------------------------------
overa~4_days |      2,144         575           0        575        575

            |     Summary of total_icd5_days
  CKD group |        Mean   Std. Dev.       Freq.
------------+------------------------------------
  Albuminur |         373           0       1,304
  CKD stage |         130           0         413
  CKD stage |           2           0          19
   Dialysis |          20           0          82
  Transplan |          53           0         286
  KRT uncle |           8           0          40
------------+------------------------------------
      Total |   259.90578   143.96127       2,144

    Variable |        Obs        Mean    Std. Dev.       Min        Max
-------------+---------------------------------------------------------
overa~5_days |      2,144         586           0        586        586

            |     Summary of total_icd6_days
  CKD group |        Mean   Std. Dev.       Freq.
------------+------------------------------------
  Albuminur |         340           0       1,304
  CKD stage |          93           0         413
  CKD stage |           7           0          19
   Dialysis |          12           0          82
  Transplan |          60           0         286
  KRT uncle |           2           0          40
------------+------------------------------------
      Total |   233.26772   134.37205       2,144

    Variable |        Obs        Mean    Std. Dev.       Min        Max
-------------+---------------------------------------------------------
overa~6_days |      2,144         514           0        514        514

            |     Summary of total_icd7_days
  CKD group |        Mean   Std. Dev.       Freq.
------------+------------------------------------
  Albuminur |         398           0       1,304
  CKD stage |         107           0         413
  CKD stage |           2           0          19
   Dialysis |           7           0          82
  Transplan |          60           0         286
  KRT uncle |          21           0          40
------------+------------------------------------
      Total |   271.35961   159.41875       2,144

    Variable |        Obs        Mean    Std. Dev.       Min        Max
-------------+---------------------------------------------------------
overa~7_days |      2,144         595           0        595        595

            |     Summary of total_icd8_days
  CKD group |        Mean   Std. Dev.       Freq.
------------+------------------------------------
  Albuminur |         330           0       1,304
  CKD stage |          87           0         413
  CKD stage |           8           0          19
   Dialysis |          33           0          82
  Transplan |          90           0         286
  KRT uncle |          22           0          40
------------+------------------------------------
      Total |   231.21688   123.97439       2,144

    Variable |        Obs        Mean    Std. Dev.       Min        Max
-------------+---------------------------------------------------------
overa~8_days |      2,144         570           0        570        570

            |     Summary of total_icd9_days
  CKD group |        Mean   Std. Dev.       Freq.
------------+------------------------------------
  Albuminur |         388           0       1,304
  CKD stage |          93           0         413
  CKD stage |           6           0          19
   Dialysis |          27           0          82
  Transplan |          92           0         286
  KRT uncle |           8           0          40
------------+------------------------------------
      Total |   267.40718   151.29706       2,144

    Variable |        Obs        Mean    Std. Dev.       Min        Max
-------------+---------------------------------------------------------
overa~9_days |      2,144         614           0        614        614

            |     Summary of total_icd10_days
  CKD group |        Mean   Std. Dev.       Freq.
------------+------------------------------------
  Albuminur |         310           0       1,304
  CKD stage |         140           0         413
  CKD stage |           4           0          19
   Dialysis |          11           0          82
  Transplan |          70           0         286
  KRT uncle |          11           0          40
------------+------------------------------------
      Total |   225.51213   109.70414       2,144

    Variable |        Obs        Mean    Std. Dev.       Min        Max
-------------+---------------------------------------------------------
overa~0_days |      2,144         546           0        546        546

            |     Summary of total_icd11_days
  CKD group |        Mean   Std. Dev.       Freq.
------------+------------------------------------
  Albuminur |         409           0       1,304
  CKD stage |         100           0         413
  CKD stage |           0           0          19
   Dialysis |          14           0          82
  Transplan |          86           0         286
  KRT uncle |           7           0          40
------------+------------------------------------
      Total |   280.15858   161.82242       2,144

    Variable |        Obs        Mean    Std. Dev.       Min        Max
-------------+---------------------------------------------------------
over~11_days |      2,144         616           0        616        616

            |     Summary of total_icd12_days
  CKD group |        Mean   Std. Dev.       Freq.
------------+------------------------------------
  Albuminur |         390           0       1,304
  CKD stage |         110           0         413
  CKD stage |           0           0          19
   Dialysis |          26           0          82
  Transplan |          95           0         286
  KRT uncle |          12           0          40
------------+------------------------------------
      Total |   272.28172   148.13761       2,144

    Variable |        Obs        Mean    Std. Dev.       Min        Max
-------------+---------------------------------------------------------
over~12_days |      2,144         633           0        633        633

            |     Summary of total_icd13_days
  CKD group |        Mean   Std. Dev.       Freq.
------------+------------------------------------
  Albuminur |         355           0       1,304
  CKD stage |         153           0         413
  CKD stage |           5           0          19
   Dialysis |          25           0          82
  Transplan |          81           0         286
  KRT uncle |           9           0          40
------------+------------------------------------
      Total |   257.36007   125.82863       2,144

    Variable |        Obs        Mean    Std. Dev.       Min        Max
-------------+---------------------------------------------------------
over~13_days |      2,144         628           0        628        628

            |     Summary of total_icd14_days
  CKD group |        Mean   Std. Dev.       Freq.
------------+------------------------------------
  Albuminur |         335           0       1,304
  CKD stage |         117           0         413
  CKD stage |          15           0          19
   Dialysis |          24           0          82
  Transplan |          75           0         286
  KRT uncle |           9           0          40
------------+------------------------------------
      Total |   237.51119   123.55002       2,144

    Variable |        Obs        Mean    Std. Dev.       Min        Max
-------------+---------------------------------------------------------
over~14_days |      2,144         575           0        575        575

            |     Summary of total_icd15_days
  CKD group |        Mean   Std. Dev.       Freq.
------------+------------------------------------
  Albuminur |         288           0       1,304
  CKD stage |         111           0         413
  CKD stage |           7           0          19
   Dialysis |          19           0          82
  Transplan |         103           0         286
  KRT uncle |           7           0          40
------------+------------------------------------
      Total |   211.20522   98.223658       2,144

    Variable |        Obs        Mean    Std. Dev.       Min        Max
-------------+---------------------------------------------------------
over~15_days |      2,144         535           0        535        535

            |     Summary of total_icd16_days
  CKD group |        Mean   Std. Dev.       Freq.
------------+------------------------------------
  Albuminur |         301           0       1,304
  CKD stage |         115           0         413
  CKD stage |          12           0          19
   Dialysis |          12           0          82
  Transplan |          79           0         286
  KRT uncle |          12           0          40
------------+------------------------------------
      Total |   216.55084   107.72659       2,144

    Variable |        Obs        Mean    Std. Dev.       Min        Max
-------------+---------------------------------------------------------
over~16_days |      2,144         531           0        531        531

            |     Summary of total_icd17_days
  CKD group |        Mean   Std. Dev.       Freq.
------------+------------------------------------
  Albuminur |         333           0       1,304
  CKD stage |          97           0         413
  CKD stage |           1           0          19
   Dialysis |          21           0          82
  Transplan |          68           0         286
  KRT uncle |          17           0          40
------------+------------------------------------
      Total |   231.41884   127.85999       2,144

    Variable |        Obs        Mean    Std. Dev.       Min        Max
-------------+---------------------------------------------------------
over~17_days |      2,144         537           0        537        537

            |     Summary of total_icd18_days
  CKD group |        Mean   Std. Dev.       Freq.
------------+------------------------------------
  Albuminur |         336           0       1,304
  CKD stage |         133           0         413
  CKD stage |           9           0          19
   Dialysis |          31           0          82
  Transplan |         100           0         286
  KRT uncle |          10           0          40
------------+------------------------------------
      Total |   244.76959   116.35831       2,144

    Variable |        Obs        Mean    Std. Dev.       Min        Max
-------------+---------------------------------------------------------
over~18_days |      2,144         619           0        619        619

            |     Summary of total_icd19_days
  CKD group |        Mean   Std. Dev.       Freq.
------------+------------------------------------
  Albuminur |         403           0       1,304
  CKD stage |         128           0         413
  CKD stage |           9           0          19
   Dialysis |          24           0          82
  Transplan |          55           0         286
  KRT uncle |           3           0          40
------------+------------------------------------
      Total |   278.15532   158.12143       2,144

    Variable |        Obs        Mean    Std. Dev.       Min        Max
-------------+---------------------------------------------------------
over~19_days |      2,144         622           0        622        622

            |     Summary of total_icd20_days
  CKD group |        Mean   Std. Dev.       Freq.
------------+------------------------------------
  Albuminur |         310           0       1,304
  CKD stage |         101           0         413
  CKD stage |           7           0          19
   Dialysis |          13           0          82
  Transplan |          83           0         286
  KRT uncle |          26           0          40
------------+------------------------------------
      Total |    220.1166   113.60932       2,144

    Variable |        Obs        Mean    Std. Dev.       Min        Max
-------------+---------------------------------------------------------
over~20_days |      2,144         540           0        540        540

            |     Summary of total_icd21_days
  CKD group |        Mean   Std. Dev.       Freq.
------------+------------------------------------
  Albuminur |         326           0       1,304
  CKD stage |         158           0         413
  CKD stage |           1           0          19
   Dialysis |          14           0          82
  Transplan |          60           0         286
  KRT uncle |          12           0          40
------------+------------------------------------
      Total |   237.48368   116.38334       2,144

    Variable |        Obs        Mean    Std. Dev.       Min        Max
-------------+---------------------------------------------------------
over~21_days |      2,144         571           0        571        571

            |     Summary of total_icd22_days
  CKD group |        Mean   Std. Dev.       Freq.
------------+------------------------------------
  Albuminur |         308           0       1,304
  CKD stage |         112           0         413
  CKD stage |          10           0          19
   Dialysis |          22           0          82
  Transplan |          79           0         286
  KRT uncle |          17           0          40
------------+------------------------------------
      Total |   220.68843   110.78422       2,144

    Variable |        Obs        Mean    Std. Dev.       Min        Max
-------------+---------------------------------------------------------
over~22_days |      2,144         548           0        548        548

. 
. 
. 
. **Potential effect modifiers
. * Ethnicity
. * 1 = White ethnicities (white British, white Irish, with other)
. * 2 = Mixed ethnicities (white & black Caribbean, white & black African, whit
> e & Asian, other mixed ethnicities)
. * 3 = South Asian ethnicities (Indian, Pakistani, Bangladeshi, other South As
> ian)
. * 4 = Black ethnicities (black Caribbean, black African, other black)
. * 5 = Other ethnicities (Chinese, all other ethnicities)
. * . = Unknown ethnicity
. replace ethnicity = . if ethnicity==.
(0 real changes made)

. replace ethnicity=6 if ethnicity==2
(77 real changes made)

. replace ethnicity=2 if ethnicity==3
(65 real changes made)

. replace ethnicity=3 if ethnicity==4
(96 real changes made)

. replace ethnicity=4 if ethnicity==6
(77 real changes made)

. replace ethnicity=6 if ethnicity==.
(540 real changes made)

. label define ethnicity  1 "White"                                       ///
>                                                 2 "South Asian"              
>            ///                                             
>                                                 3 "Black"                    
>                    ///
>                                                 4 "Mixed"                    
>                    ///
>                                                 5 "Other"                    
>                    ///
>                                                 6 "Unknown"     

. label values ethnicity ethnicity

. 
. * Index of multiple deprivation
. * Ordered 1-5 from most deprived to least deprived
. label define imd 1 "1 Most deprived" 2 "2" 3 "3" 4 "4" 5 "5 Least deprived"

. label values imd imd

. 
. * Region
. rename region region_string

. gen region = 1 if region_string=="East Midlands"
(1,924 missing values generated)

. replace region = 2 if region_string=="East"
(225 real changes made)

. replace region = 3 if region_string=="London"
(414 real changes made)

. replace region = 4 if region_string=="North East"
(218 real changes made)

. replace region = 5 if region_string=="North West"
(225 real changes made)

. replace region = 6 if region_string=="South East"
(214 real changes made)

. replace region = 7 if region_string=="South West"
(200 real changes made)

. replace region = 8 if region_string=="West Midlands"
(196 real changes made)

. replace region = 9 if region_string=="Yorkshire and The Humber"
(232 real changes made)

. label define region     1 "East Midlands"                                    
>    ///
>                                                 2 "East"                     
>                                    ///
>                                                 3 "London"                   
>                                    ///
>                                                 4 "North East"               
>                            ///
>                                                 5 "North West"               
>                            ///
>                                                 6 "South East"               
>                            ///
>                                                 7 "South West"               
>                            ///
>                                                 8 "West Midlands"            
>                            ///
>                                                 9 "Yorkshire and The Humber" 
>            

. label values region region

. label var region "Region"

. 
. * Urban/rural
. replace rural_urban=. if rural_urban<1|rural_urban>8
(0 real changes made)

. label define rural_urban 1 "Urban major conurbation"                         
>                    ///
>                                                  2 "Urban minor conurbation" 
>                                            ///
>                                                  3 "Urban city and town"     
>                                                    ///
>                                                  4 "Urban city and town in a 
> sparse setting"            ///
>                                                  5 "Rural town and fringe"   
>                                                    ///
>                                                  6 "Rural town and fringe in 
> a sparse setting"          ///
>                                                  7 "Rural village and dispers
> ed"                                        ///
>                                                  8 "Rural village and dispers
> ed in a sparse setting"

. label values rural_urban rural_urban

. * Urban (binary)
. * Urban = 1-4 + missing, Rural = 5-8
. generate urban=.
(2,144 missing values generated)

. replace urban=1 if rural_urban<=4|rural_urban==.
(847 real changes made)

. replace urban=0 if rural_urban>4 & rural_urban!=.
(1,297 real changes made)

. label var urban "Urban/rural"

. label define urban 0 "Rural" 1 "Urban"

. label values urban urban

. drop rural_urban

. 
. *Age bands for standardisation
. egen agecat = cut(age), at(0,18,20,25,30,35,40,45,50,55,60,65,70,75,80,85,90,
> 200)

. drop if agecat==0
(0 observations deleted)

. 
. *Age-standardisation weights (European Standard Population 2013)
. gen weight = .
(2,144 missing values generated)

. replace weight = 0.027261 if agecat==18
(54 real changes made)

. replace weight = 0.074349 if agecat==20
(159 real changes made)

. replace weight = 0.074349 if agecat==25
(179 real changes made)

. replace weight = 0.080545 if agecat==30
(182 real changes made)

. replace weight = 0.086741 if agecat==35
(158 real changes made)

. replace weight = 0.086741 if agecat==40
(151 real changes made)

. replace weight = 0.086741 if agecat==45
(194 real changes made)

. replace weight = 0.086741 if agecat==50
(198 real changes made)

. replace weight = 0.080545 if agecat==55
(191 real changes made)

. replace weight = 0.074349 if agecat==60
(169 real changes made)

. replace weight = 0.068154 if agecat==65
(144 real changes made)

. replace weight = 0.061958 if agecat==70
(128 real changes made)

. replace weight = 0.049566 if agecat==75
(101 real changes made)

. replace weight = 0.030979 if agecat==80
(65 real changes made)

. replace weight = 0.018587 if agecat==85
(43 real changes made)

. replace weight = 0.012392 if agecat==90
(28 real changes made)

. 
. 
. *Age standardised counts for each non-binary healthcare resource outcomes
. foreach aggregate of varlist hospital_days critical_care_days emergency_days 
> op_appts neph_appts tx_appts gp_interactions icd1_days icd2_days icd3_days ic
> d4_days icd5_days icd6_days icd7_days icd8_days icd9_days icd10_days icd11_da
> ys icd12_days icd13_days icd14_days icd15_days icd16_days icd17_days icd18_da
> ys icd19_days icd20_days icd21_days icd22_days {
  2. replace `aggregate' = `aggregate' * weight
  3. }
variable hospital_days was byte now float
(173 real changes made)
variable critical_care_days was byte now float
(188 real changes made)
variable emergency_days was byte now float
(188 real changes made)
variable op_appts was byte now float
(191 real changes made)
variable neph_appts was byte now float
(197 real changes made)
variable tx_appts was byte now float
(187 real changes made)
variable gp_interactions was byte now float
(185 real changes made)
variable icd1_days was byte now float
(195 real changes made)
variable icd2_days was byte now float
(192 real changes made)
variable icd3_days was byte now float
(202 real changes made)
variable icd4_days was byte now float
(197 real changes made)
variable icd5_days was byte now float
(192 real changes made)
variable icd6_days was byte now float
(188 real changes made)
variable icd7_days was byte now float
(190 real changes made)
variable icd8_days was byte now float
(206 real changes made)
variable icd9_days was byte now float
(192 real changes made)
variable icd10_days was byte now float
(185 real changes made)
variable icd11_days was byte now float
(201 real changes made)
variable icd12_days was byte now float
(213 real changes made)
variable icd13_days was byte now float
(197 real changes made)
variable icd14_days was byte now float
(196 real changes made)
variable icd15_days was byte now float
(193 real changes made)
variable icd16_days was byte now float
(180 real changes made)
variable icd17_days was byte now float
(177 real changes made)
variable icd18_days was byte now float
(195 real changes made)
variable icd19_days was byte now float
(205 real changes made)
variable icd20_days was byte now float
(172 real changes made)
variable icd21_days was byte now float
(189 real changes made)
variable icd22_days was byte now float
(181 real changes made)

. 
. * Create variable for age-standardised total # of each aggregated outcome
. * `var'_`aggregate' = age-standardised total # of each aggregated outcome ove
> rall stratified by ethnicity/imd/region/urban
. * `var'_`aggregate'_ckd = age-standardised total # of each aggregated outcome
>  in each CKD group stratified by ethnicity/imd/region/urban
. foreach aggregate of varlist hospital_days critical_care_days emergency_days 
> op_appts neph_appts tx_appts gp_interactions icd1_days icd2_days icd3_days ic
> d4_days icd5_days icd6_days icd7_days icd8_days icd9_days icd10_days icd11_da
> ys icd12_days icd13_days icd14_days icd15_days icd16_days icd17_days icd18_da
> ys icd19_days icd20_days icd21_days icd22_days {
  2. egen overall_std_`aggregate' = total(`aggregate')
  3. bysort ckd_group: egen std_`aggregate' = total(`aggregate')
  4. foreach var of varlist ethnicity imd region urban {
  5. bysort `var': egen `var'_`aggregate' = total(`aggregate')
  6. bysort `var' ckd_group: egen `var'_`aggregate'_ckd = total(`aggregate')
  7. }
  8. }

. 
. foreach binary of varlist fistula_formation pd_insertion blood_pressure album
> inuria creatinine icd1 icd2 icd3 icd4 icd5 icd6 icd7 icd8 icd9 icd10 icd11 ic
> d12 icd13 icd14 icd15 icd16 icd17 icd18 icd19 icd20 icd21 icd22 {
  2. gen esp_`binary' = `binary' * weight
  3. egen overall_std_`binary' = total(esp_`binary')
  4. bysort ckd_group: egen std_`binary' = total(esp_`binary')
  5. foreach var of varlist ethnicity imd region urban {
  6. bysort `var': egen `var'_`binary' = total(esp_`binary')
  7. bysort `var' ckd_group: egen `var'_`binary'_ckd = total(esp_`binary')
  8. }
  9. }

. 
. *Merge cost data
. save "./output/`dataset'_ckd_complete.dta", replace
(note: file ./output/2021_ckd_complete.dta not found)
file ./output/2021_ckd_complete.dta saved

. capture noisily import delimited ./output/costs_`dataset'.csv, clear
(7 vars, 500 obs)

. keep patient_id apcs_cost ec_cost opa_cost

. merge 1:1 patient_id using ./output/`dataset'_ckd_complete
(note: variable patient_id was int, now long to accommodate using data's
       values)

    Result                           # of obs.
    -----------------------------------------
    not matched                         2,640
        from master                       498  (_merge==1)
        from using                      2,142  (_merge==2)

    matched                                 2  (_merge==3)
    -----------------------------------------

. drop if _merge==1
(498 observations deleted)

. foreach cost of varlist apcs_cost ec_cost opa_cost {
  2. sum `cost', d
  3. bysort ckd_group: egen total_`cost' = total(`cost')
  4. egen overall_`cost' = total(`cost')
  5. tab ckd_group, sum(total_`cost')
  6. sum overall_`cost'
  7. foreach var of varlist ethnicity imd region urban {
  8. bysort `var': egen `var'_`cost' = total(`cost')
  9. bysort `var' ckd_group: egen `var'_`cost'_ckd = total(`cost')
 10. }
 11. }

                          apcs_cost
-------------------------------------------------------------
no observations

            |     Summary of total_apcs_cost
  CKD group |        Mean   Std. Dev.       Freq.
------------+------------------------------------
  Albuminur |           0           0       1,304
  CKD stage |           0           0         413
  CKD stage |           0           0          19
   Dialysis |           0           0          82
  Transplan |           0           0         286
  KRT uncle |           0           0          40
------------+------------------------------------
      Total |           0           0       2,144

    Variable |        Obs        Mean    Std. Dev.       Min        Max
-------------+---------------------------------------------------------
overall_ap~t |      2,144           0           0          0          0

                           ec_cost
-------------------------------------------------------------
no observations

            |      Summary of total_ec_cost
  CKD group |        Mean   Std. Dev.       Freq.
------------+------------------------------------
  Albuminur |           0           0       1,304
  CKD stage |           0           0         413
  CKD stage |           0           0          19
   Dialysis |           0           0          82
  Transplan |           0           0         286
  KRT uncle |           0           0          40
------------+------------------------------------
      Total |           0           0       2,144

    Variable |        Obs        Mean    Std. Dev.       Min        Max
-------------+---------------------------------------------------------
overall_ec~t |      2,144           0           0          0          0

                          opa_cost
-------------------------------------------------------------
no observations

            |      Summary of total_opa_cost
  CKD group |        Mean   Std. Dev.       Freq.
------------+------------------------------------
  Albuminur |           0           0       1,304
  CKD stage |           0           0         413
  CKD stage |           0           0          19
   Dialysis |           0           0          82
  Transplan |           0           0         286
  KRT uncle |           0           0          40
------------+------------------------------------
      Total |           0           0       2,144

    Variable |        Obs        Mean    Std. Dev.       Min        Max
-------------+---------------------------------------------------------
overall_op~t |      2,144           0           0          0          0

. save "./output/`dataset'_ckd_complete.dta", replace
file ./output/2021_ckd_complete.dta saved

. 
. log close
      name:  <unnamed>
       log:  /workspace/logs/2021_ckd_complete.log
  log type:  text
 closed on:  29 Apr 2024, 13:30:07
-------------------------------------------------------------------------------
