-------------------------------------------------------------------------------
      name:  <unnamed>
       log:  /workspace/logs/2021_ckd_complete.log
  log type:  text
 opened on:   7 Jun 2024, 10:22:23

. clear

. 
. *Merge `dataset'_ckd with `dataset'_ckd_complete
. capture noisily import delimited ./output/`dataset'_ckd.csv, clear
(9 vars, 21,205 obs)

. tempfile `dataset'_ckd

. save ``dataset'_ckd', replace
(note: file /tmp/St00012.000001 not found)
file /tmp/St00012.000001 saved

. capture noisily import delimited ./output/input_`dataset'_ckd_complete.csv, c
> lear
(104 vars, 50,000 obs)

. merge 1:1 patient_id using ``dataset'_ckd'

    Result                           # of obs.
    -----------------------------------------
    not matched                        66,951
        from master                    47,873  (_merge==1)
        from using                     19,078  (_merge==2)

    matched                             2,127  (_merge==3)
    -----------------------------------------

. keep if _merge==3
(66,951 observations deleted)

. drop _merge

. tempfile `dataset'_ckd_complete

. save ``dataset'_ckd_complete', replace
(note: file /tmp/St00012.000002 not found)
file /tmp/St00012.000002 saved

. 
. /*Generate dummy data
> cd ckd-healthcare-use
> capture noisily import delimited ./output/2017_ckd.csv, clear
> tempfile 2017_ckd
> save ./output/2017_ckd, replace
> capture noisily import delimited ./output/input_2017_ckd_complete.csv, clear
> merge 1:1 patient_id using ./output/2017_ckd
> keep if _merge==3
> drop _merge
> tempfile 2017_ckd_complete
> save ./output/2017_ckd_complete, replace
> */
. 
. *CKD stage classification
. foreach var of varlist  dialysis_baseline_primary_care  ///
>                                                 dialysis_baseline_icd_10     
>            ///
>                                                 dialysis_baseline_opcs_4     
>            ///
>                                                 dialysis_baseline_date       
>            ///
>                                                 kt_baseline_primary_care     
>            ///
>                                                 kt_baseline_icd_10           
>                    ///
>                                                 kt_baseline_opcs_4           
>                    {
  2.         drop `var'
  3.         }

. tab modality_baseline, m

modality_baseline |      Freq.     Percent        Cum.
------------------+-----------------------------------
         Dialysis |        190        8.93        8.93
Kidney transplant |        185        8.70       17.63
 Modality unclear |         44        2.07       19.70
          Pre KRT |      1,708       80.30      100.00
------------------+-----------------------------------
            Total |      2,127      100.00

. *To reduce misclassification of dialysis, anyone with eGFR >15 with modality_
> baseline=="Dialysis" will be reclassified as non-dialysis (e.g. they may have
>  received acute dialysis and recovered)
. *For modality_baseline="Modality unclear" (i.e. whose dialysis and kidney tra
> nsplant baseline dates are identical), those with eGFR <15 will be assumed to
>  be on dialysis and those >15 as kidney transplant
. egen esrd_egfr = cut(baseline_egfr), at (0, 15, 5000)
(867 missing values generated)

. recode esrd_egfr 0=1 15=0
(esrd_egfr: 1260 changes made)

. tab esrd_egfr, m

  esrd_egfr |      Freq.     Percent        Cum.
------------+-----------------------------------
          0 |      1,260       59.24       59.24
          . |        867       40.76      100.00
------------+-----------------------------------
      Total |      2,127      100.00

. gen dialysis = 0

. replace dialysis = 1 if modality_baseline=="Dialysis"
(190 real changes made)

. replace dialysis = 1 if modality_baseline=="Modality unclear" & esrd_egfr!=.
(21 real changes made)

. replace dialysis = 0 if esrd_egfr==0
(137 real changes made)

. gen kidney_transplant = 0

. replace kidney_transplant = 1 if kidney_transplant_baseline_date!=""
(336 real changes made)

. replace kidney_transplant = 0 if dialysis==1
(7 real changes made)

. gen modality_unclear = 0

. replace modality_unclear = 1 if modality_baseline=="Modality unclear"
(44 real changes made)

. replace modality_unclear = 0 if dialysis==1
(0 real changes made)

. replace modality_unclear = 0 if kidney_transplant==1
(11 real changes made)

. tab modality_baseline dialysis

                  |       dialysis
modality_baseline |         0          1 |     Total
------------------+----------------------+----------
         Dialysis |       116         74 |       190 
Kidney transplant |       185          0 |       185 
 Modality unclear |        44          0 |        44 
          Pre KRT |     1,708          0 |     1,708 
------------------+----------------------+----------
            Total |     2,053         74 |     2,127 

. tab modality_baseline kidney_transplant

                  |   kidney_transplant
modality_baseline |         0          1 |     Total
------------------+----------------------+----------
         Dialysis |       174         16 |       190 
Kidney transplant |       156         29 |       185 
 Modality unclear |        33         11 |        44 
          Pre KRT |     1,435        273 |     1,708 
------------------+----------------------+----------
            Total |     1,798        329 |     2,127 

. tab modality_baseline modality_unclear

                  |   modality_unclear
modality_baseline |         0          1 |     Total
------------------+----------------------+----------
         Dialysis |       190          0 |       190 
Kidney transplant |       185          0 |       185 
 Modality unclear |        11         33 |        44 
          Pre KRT |     1,708          0 |     1,708 
------------------+----------------------+----------
            Total |     2,094         33 |     2,127 

. tab dialysis kidney_transplant

           |   kidney_transplant
  dialysis |         0          1 |     Total
-----------+----------------------+----------
         0 |     1,724        329 |     2,053 
         1 |        74          0 |        74 
-----------+----------------------+----------
     Total |     1,798        329 |     2,127 

. egen ckd_group = cut(baseline_egfr), at(0, 30, 60, 5000)
(867 missing values generated)

. recode ckd_group 0=3 30=2 60=1
(ckd_group: 1260 changes made)

. replace ckd_group = 4 if dialysis==1
(74 real changes made)

. replace ckd_group = 5 if kidney_transplant==1
(329 real changes made)

. replace ckd_group = 6 if modality_unclear==1
(33 real changes made)

. *ckd_group==. are those with albuminuria without available eGFR measurement o
> r code for KRT
. replace ckd_group = 1 if ckd_group==.
(641 real changes made)

. label define ckd_group 1 "Albuminuria" 2 "CKD stage 3" 3 "CKD stage 4/5" 4 "D
> ialysis" 5 "Transplant" 6 "KRT unclear modality"

. label values ckd_group ckd_group

. label var ckd_group "CKD group"

. tab ckd_group, m

           CKD group |      Freq.     Percent        Cum.
---------------------+-----------------------------------
         Albuminuria |      1,278       60.08       60.08
         CKD stage 3 |        393       18.48       78.56
       CKD stage 4/5 |         20        0.94       79.50
            Dialysis |         74        3.48       82.98
          Transplant |        329       15.47       98.45
KRT unclear modality |         33        1.55      100.00
---------------------+-----------------------------------
               Total |      2,127      100.00

. drop if ckd_group==.
(0 observations deleted)

. tab ckd_group modality_baseline

                     |              modality_baseline
           CKD group |  Dialysis  Kidney ..  Modalit..    Pre KRT |     Total
---------------------+--------------------------------------------+----------
         Albuminuria |        57        121          0      1,100 |     1,278 
         CKD stage 3 |        40         32          0        321 |       393 
       CKD stage 4/5 |         3          3          0         14 |        20 
            Dialysis |        74          0          0          0 |        74 
          Transplant |        16         29         11        273 |       329 
KRT unclear modality |         0          0         33          0 |        33 
---------------------+--------------------------------------------+----------
               Total |       190        185         44      1,708 |     2,127 

. 
. *Dialysis & kidney transplant outcome classification
. foreach var of varlist  dialysis_outcome_primary_care   ///
>                                                 dialysis_outcome_icd_10      
>            ///
>                                                 dialysis_outcome_opcs_4      
>            ///
>                                                 dialysis_outcome_date        
>            ///
>                                                 kt_outcome_primary_care      
>            ///
>                                                 kt_outcome_icd_10            
>                    ///
>                                                 kt_outcome_opcs_4            
>                    ///
>                                                 kidney_transplant_outcome_dat
> e  ///
>                                                 died                         
>                            {
  2.         drop `var'
  3.         }

. tab ckd_group modality_outcome, m

                     |              modality_outcome
           CKD group |  Deceased   Dialysis  Kidney ..  Modalit.. |     Total
---------------------+--------------------------------------------+----------
         Albuminuria |       128         53         44         17 |     1,278 
         CKD stage 3 |        48         18         12          7 |       393 
       CKD stage 4/5 |         2          3          1          1 |        20 
            Dialysis |         7          4          2          2 |        74 
          Transplant |        35         21         15          3 |       329 
KRT unclear modality |         2          1          1          0 |        33 
---------------------+--------------------------------------------+----------
               Total |       222        100         75         30 |     2,127 


                     | modality_o
                     |   utcome
           CKD group | Unchanged |     Total
---------------------+-----------+----------
         Albuminuria |     1,036 |     1,278 
         CKD stage 3 |       308 |       393 
       CKD stage 4/5 |        13 |        20 
            Dialysis |        59 |        74 
          Transplant |       255 |       329 
KRT unclear modality |        29 |        33 
---------------------+-----------+----------
               Total |     1,700 |     2,127 

. 
. *eGFR outcome classification based on updated mean eGFR over previous 18 mont
> hs by the end of year
. gen sex = 1 if male == "Male"
(1,105 missing values generated)

. replace sex = 0 if male == "Female"
(1,105 real changes made)

. label define sex 0"Female" 1"Male"

. label values sex sex

. replace creatinine_outcome = . if !inrange(creatinine_outcome, 20, 3000)
(908 real changes made, 908 to missing)

. gen mgdl_creatinine_outcome = creatinine_outcome/88.4
(908 missing values generated)

. gen min_creatinine_outcome=.
(2,127 missing values generated)

. replace min_creatinine_outcome = mgdl_creatinine_outcome/0.7 if sex==0
(617 real changes made)

. replace min_creatinine_outcome = mgdl_creatinine_outcome/0.9 if sex==1
(602 real changes made)

. replace min_creatinine_outcome = min_creatinine_outcome^-0.329  if sex==0
(617 real changes made)

. replace min_creatinine_outcome = min_creatinine_outcome^-0.411  if sex==1
(602 real changes made)

. replace min_creatinine_outcome = 1 if min_creatinine_outcome<1
(784 real changes made)

. gen max_creatinine_outcome=.
(2,127 missing values generated)

. replace max_creatinine_outcome = mgdl_creatinine_outcome/0.7 if sex==0
(617 real changes made)

. replace max_creatinine_outcome = mgdl_creatinine_outcome/0.9 if sex==1
(602 real changes made)

. replace max_creatinine_outcome = max_creatinine_outcome^-1.209
(1,219 real changes made)

. replace max_creatinine_outcome = 1 if max_creatinine_outcome>1
(1,343 real changes made)

. gen egfr_outcome = min_creatinine_outcome*max_creatinine_outcome*141
(908 missing values generated)

. replace egfr_outcome = egfr_outcome*(0.993^age)
(1,219 real changes made)

. replace egfr_outcome = egfr_outcome*1.018 if sex==0
(617 real changes made)

. drop creatinine_outcome

. drop mgdl_creatinine_outcome

. drop min_creatinine_outcome

. drop max_creatinine_outcome

. egen egfr_end = cut(egfr_outcome), at(0, 30, 60, 5000)
(908 missing values generated)

. recode egfr_end 0=3 30=2 60=1
(egfr_end: 1219 changes made)

. label define egfr_end 1 "≥60" 2 "30-59" 3 "<30"

. label values egfr_end egfr_end

. label var egfr_end "Final eGFR"

. gen ckd_progression = 0

. replace ckd_progression = 1 if egfr_end==2 & ckd_group==1
(172 real changes made)

. replace ckd_progression = 2 if egfr_end==3 & ckd_group==1
(9 real changes made)

. replace ckd_progression = 2 if egfr_end==3 & ckd_group==2
(3 real changes made)

. egen esrd_egfr_end = cut(egfr_outcome), at (0, 15, 5000)
(908 missing values generated)

. recode esrd_egfr_end 0=1 15=0
(esrd_egfr_end: 1219 changes made)

. tab esrd_egfr_end, m

esrd_egfr_e |
         nd |      Freq.     Percent        Cum.
------------+-----------------------------------
          0 |      1,219       57.31       57.31
          . |        908       42.69      100.00
------------+-----------------------------------
      Total |      2,127      100.00

. gen dialysis_outcome = 0

. replace dialysis_outcome = 1 if modality_outcome=="Dialysis"
(100 real changes made)

. replace dialysis_outcome = 1 if modality_outcome=="Modality unclear" & esrd_e
> gfr_end==1
(0 real changes made)

. gen kidney_transplant_outcome = 0

. replace kidney_transplant_outcome = 1 if modality_outcome=="Kidney transplant
> "
(75 real changes made)

. replace kidney_transplant_outcome = 1 if modality_outcome=="Modality unclear"
>  & esrd_egfr_end==0
(15 real changes made)

. replace ckd_progression = 5 if modality_outcome=="Modality unclear"
(30 real changes made)

. replace ckd_progression = 3 if dialysis_outcome==1
(100 real changes made)

. replace ckd_progression = 4 if kidney_transplant_outcome==1
(90 real changes made)

. replace ckd_progression = 6 if modality_outcome=="Deceased"
(222 real changes made)

. label define ckd_progression 0 "No progression" 1 "CKD 3" 2 "CKD 4/5 pre-KRT"
>  3 "Dialysis" 4 "Kidney transplant" 5 "KRT unclear modality" 6 "Deceased"

. label values ckd_progression ckd_progression

. label var ckd_progression "CKD progression"

. tab ckd_progression, m

     CKD progression |      Freq.     Percent        Cum.
---------------------+-----------------------------------
      No progression |      1,551       72.92       72.92
               CKD 3 |        138        6.49       79.41
     CKD 4/5 pre-KRT |         11        0.52       79.92
            Dialysis |        100        4.70       84.63
   Kidney transplant |         90        4.23       88.86
KRT unclear modality |         15        0.71       89.56
            Deceased |        222       10.44      100.00
---------------------+-----------------------------------
               Total |      2,127      100.00

. 
. *eGFR cut-offs to investigate timing of access formation
. egen access_egfr = cut(baseline_egfr), at (0, 15, 5000)
(867 missing values generated)

. recode access_egfr 0=1 15=2
(access_egfr: 1260 changes made)

. replace access_egfr=0 if ckd_group==4
(74 real changes made)

. replace access_egfr=3 if access_egfr==.
(793 real changes made)

. label define access_egfr 0 "Dialysis" 1 "eGFR 0-14" 2 "eGFR >= 15" 3 "Unknown
> "

. label values access_egfr access_egfr

. 
. *Totals for non-binary healthcare resource outcomes (including by month)
. foreach aggregate of varlist hospital_days critical_care_days emergency_days 
> op_appts neph_appts tx_appts gp_interactions icd1_days icd2_days icd3_days ic
> d4_days icd5_days icd6_days icd7_days icd8_days icd9_days icd10_days icd11_da
> ys icd12_days icd13_days icd14_days icd15_days icd16_days icd17_days icd18_da
> ys icd19_days icd20_days icd21_days icd22_days {
  2. bysort ckd_group: egen total_`aggregate' = total(`aggregate')
  3. egen overall_`aggregate' = total(`aggregate')
  4. tab ckd_group, sum(total_`aggregate')
  5. sum overall_`aggregate'
  6. }

            |   Summary of total_hospital_days
  CKD group |        Mean   Std. Dev.       Freq.
------------+------------------------------------
  Albuminur |         287           0       1,278
  CKD stage |          88           0         393
  CKD stage |           6           0          20
   Dialysis |          14           0          74
  Transplan |          97           0         329
  KRT uncle |           1           0          33
------------+------------------------------------
      Total |   204.26516   103.27264       2,127

    Variable |        Obs        Mean    Std. Dev.       Min        Max
-------------+---------------------------------------------------------
overall_ho~s |      2,127         493           0        493        493

            | Summary of total_critical_care_days
  CKD group |        Mean   Std. Dev.       Freq.
------------+------------------------------------
  Albuminur |         276           0       1,278
  CKD stage |          95           0         393
  CKD stage |           2           0          20
   Dialysis |          23           0          74
  Transplan |         108           0         329
  KRT uncle |          12           0          33
------------+------------------------------------
      Total |   201.09685   93.950178       2,127

    Variable |        Obs        Mean    Std. Dev.       Min        Max
-------------+---------------------------------------------------------
overall_cr~s |      2,127         516           0        516        516

            |   Summary of total_emergency_days
  CKD group |        Mean   Std. Dev.       Freq.
------------+------------------------------------
  Albuminur |         298           0       1,278
  CKD stage |         100           0         393
  CKD stage |           1           0          20
   Dialysis |          10           0          74
  Transplan |         101           0         329
  KRT uncle |           8           0          33
------------+------------------------------------
      Total |   213.63282   105.61174       2,127

    Variable |        Obs        Mean    Std. Dev.       Min        Max
-------------+---------------------------------------------------------
overall_em~s |      2,127         518           0        518        518

            |      Summary of total_op_appts
  CKD group |        Mean   Std. Dev.       Freq.
------------+------------------------------------
  Albuminur |         319           0       1,278
  CKD stage |         106           0         393
  CKD stage |          13           0          20
   Dialysis |          18           0          74
  Transplan |          97           0         329
  KRT uncle |           4           0          33
------------+------------------------------------
      Total |   227.06958    114.5985       2,127

    Variable |        Obs        Mean    Std. Dev.       Min        Max
-------------+---------------------------------------------------------
overall_op~s |      2,127         557           0        557        557

            |     Summary of total_neph_appts
  CKD group |        Mean   Std. Dev.       Freq.
------------+------------------------------------
  Albuminur |         352           0       1,278
  CKD stage |         119           0         393
  CKD stage |          12           0          20
   Dialysis |          23           0          74
  Transplan |          83           0         329
  KRT uncle |           5           0          33
------------+------------------------------------
      Total |   247.31406   130.35802       2,127

    Variable |        Obs        Mean    Std. Dev.       Min        Max
-------------+---------------------------------------------------------
overall_ne~s |      2,127         594           0        594        594

            |      Summary of total_tx_appts
  CKD group |        Mean   Std. Dev.       Freq.
------------+------------------------------------
  Albuminur |         319           0       1,278
  CKD stage |         116           0         393
  CKD stage |           3           0          20
   Dialysis |          17           0          74
  Transplan |         122           0         329
  KRT uncle |           3           0          33
------------+------------------------------------
      Total |   232.63987   108.74604       2,127

    Variable |        Obs        Mean    Std. Dev.       Min        Max
-------------+---------------------------------------------------------
overall_tx~s |      2,127         580           0        580        580

            |  Summary of total_gp_interactions
  CKD group |        Mean   Std. Dev.       Freq.
------------+------------------------------------
  Albuminur |         303           0       1,278
  CKD stage |          93           0         393
  CKD stage |           0           0          20
   Dialysis |          25           0          74
  Transplan |          84           0         329
  KRT uncle |          13           0          33
------------+------------------------------------
      Total |   213.30418   111.28373       2,127

    Variable |        Obs        Mean    Std. Dev.       Min        Max
-------------+---------------------------------------------------------
overall_gp~s |      2,127         518           0        518        518

            |     Summary of total_icd1_days
  CKD group |        Mean   Std. Dev.       Freq.
------------+------------------------------------
  Albuminur |         318           0       1,278
  CKD stage |         109           0         393
  CKD stage |           0           0          20
   Dialysis |          28           0          74
  Transplan |          87           0         329
  KRT uncle |          19           0          33
------------+------------------------------------
      Total |   225.93465   114.53617       2,127

    Variable |        Obs        Mean    Std. Dev.       Min        Max
-------------+---------------------------------------------------------
overall_ic~s |      2,127         561           0        561        561

            |     Summary of total_icd2_days
  CKD group |        Mean   Std. Dev.       Freq.
------------+------------------------------------
  Albuminur |         283           0       1,278
  CKD stage |          92           0         393
  CKD stage |           7           0          20
   Dialysis |           9           0          74
  Transplan |          84           0         329
  KRT uncle |           9           0          33
------------+------------------------------------
      Total |    200.5496   102.79015       2,127

    Variable |        Obs        Mean    Std. Dev.       Min        Max
-------------+---------------------------------------------------------
overa~2_days |      2,127         484           0        484        484

            |     Summary of total_icd3_days
  CKD group |        Mean   Std. Dev.       Freq.
------------+------------------------------------
  Albuminur |         317           0       1,278
  CKD stage |         115           0         393
  CKD stage |           4           0          20
   Dialysis |          21           0          74
  Transplan |          71           0         329
  KRT uncle |           3           0          33
------------+------------------------------------
      Total |    223.5134   116.89969       2,127

    Variable |        Obs        Mean    Std. Dev.       Min        Max
-------------+---------------------------------------------------------
overa~3_days |      2,127         531           0        531        531

            |     Summary of total_icd4_days
  CKD group |        Mean   Std. Dev.       Freq.
------------+------------------------------------
  Albuminur |         413           0       1,278
  CKD stage |         107           0         393
  CKD stage |           8           0          20
   Dialysis |          28           0          74
  Transplan |          81           0         329
  KRT uncle |          22           0          33
------------+------------------------------------
      Total |   281.83921   161.95792       2,127

    Variable |        Obs        Mean    Std. Dev.       Min        Max
-------------+---------------------------------------------------------
overa~4_days |      2,127         659           0        659        659

            |     Summary of total_icd5_days
  CKD group |        Mean   Std. Dev.       Freq.
------------+------------------------------------
  Albuminur |         360           0       1,278
  CKD stage |         100           0         393
  CKD stage |           1           0          20
   Dialysis |          10           0          74
  Transplan |          92           0         329
  KRT uncle |           9           0          33
------------+------------------------------------
      Total |    249.5087   137.06031       2,127

    Variable |        Obs        Mean    Std. Dev.       Min        Max
-------------+---------------------------------------------------------
overa~5_days |      2,127         572           0        572        572

            |     Summary of total_icd6_days
  CKD group |        Mean   Std. Dev.       Freq.
------------+------------------------------------
  Albuminur |         300           0       1,278
  CKD stage |         106           0         393
  CKD stage |           6           0          20
   Dialysis |           7           0          74
  Transplan |          91           0         329
  KRT uncle |           3           0          33
------------+------------------------------------
      Total |    214.2614   107.39066       2,127

    Variable |        Obs        Mean    Std. Dev.       Min        Max
-------------+---------------------------------------------------------
overa~6_days |      2,127         513           0        513        513

            |     Summary of total_icd7_days
  CKD group |        Mean   Std. Dev.       Freq.
------------+------------------------------------
  Albuminur |         306           0       1,278
  CKD stage |          83           0         393
  CKD stage |           9           0          20
   Dialysis |          19           0          74
  Transplan |          74           0         329
  KRT uncle |          16           0          33
------------+------------------------------------
      Total |    211.6347   116.68405       2,127

    Variable |        Obs        Mean    Std. Dev.       Min        Max
-------------+---------------------------------------------------------
overa~7_days |      2,127         507           0        507        507

            |     Summary of total_icd8_days
  CKD group |        Mean   Std. Dev.       Freq.
------------+------------------------------------
  Albuminur |         308           0       1,278
  CKD stage |          97           0         393
  CKD stage |           1           0          20
   Dialysis |          32           0          74
  Transplan |          76           0         329
  KRT uncle |          11           0          33
------------+------------------------------------
      Total |   216.03197   114.03679       2,127

    Variable |        Obs        Mean    Std. Dev.       Min        Max
-------------+---------------------------------------------------------
overa~8_days |      2,127         525           0        525        525

            |     Summary of total_icd9_days
  CKD group |        Mean   Std. Dev.       Freq.
------------+------------------------------------
  Albuminur |         269           0       1,278
  CKD stage |          95           0         393
  CKD stage |           3           0          20
   Dialysis |          24           0          74
  Transplan |          87           0         329
  KRT uncle |           7           0          33
------------+------------------------------------
      Total |   193.60931   94.109523       2,127

    Variable |        Obs        Mean    Std. Dev.       Min        Max
-------------+---------------------------------------------------------
overa~9_days |      2,127         485           0        485        485

            |     Summary of total_icd10_days
  CKD group |        Mean   Std. Dev.       Freq.
------------+------------------------------------
  Albuminur |         359           0       1,278
  CKD stage |          87           0         393
  CKD stage |          10           0          20
   Dialysis |          20           0          74
  Transplan |          79           0         329
  KRT uncle |           0           0          33
------------+------------------------------------
      Total |   244.78796    141.0836       2,127

    Variable |        Obs        Mean    Std. Dev.       Min        Max
-------------+---------------------------------------------------------
overa~0_days |      2,127         555           0        555        555

            |     Summary of total_icd11_days
  CKD group |        Mean   Std. Dev.       Freq.
------------+------------------------------------
  Albuminur |         324           0       1,278
  CKD stage |         126           0         393
  CKD stage |           1           0          20
   Dialysis |          30           0          74
  Transplan |          69           0         329
  KRT uncle |           1           0          33
------------+------------------------------------
      Total |   229.69629   118.41355       2,127

    Variable |        Obs        Mean    Std. Dev.       Min        Max
-------------+---------------------------------------------------------
over~11_days |      2,127         551           0        551        551

            |     Summary of total_icd12_days
  CKD group |        Mean   Std. Dev.       Freq.
------------+------------------------------------
  Albuminur |         319           0       1,278
  CKD stage |         104           0         393
  CKD stage |           8           0          20
   Dialysis |          25           0          74
  Transplan |          84           0         329
  KRT uncle |           3           0          33
------------+------------------------------------
      Total |   224.87024   117.02507       2,127

    Variable |        Obs        Mean    Std. Dev.       Min        Max
-------------+---------------------------------------------------------
over~12_days |      2,127         543           0        543        543

            |     Summary of total_icd13_days
  CKD group |        Mean   Std. Dev.       Freq.
------------+------------------------------------
  Albuminur |         350           0       1,278
  CKD stage |          99           0         393
  CKD stage |           3           0          20
   Dialysis |          10           0          74
  Transplan |          94           0         329
  KRT uncle |          13           0          33
------------+------------------------------------
      Total |   243.70569   131.92123       2,127

    Variable |        Obs        Mean    Std. Dev.       Min        Max
-------------+---------------------------------------------------------
over~13_days |      2,127         569           0        569        569

            |     Summary of total_icd14_days
  CKD group |        Mean   Std. Dev.       Freq.
------------+------------------------------------
  Albuminur |         364           0       1,278
  CKD stage |         100           0         393
  CKD stage |           4           0          20
   Dialysis |          19           0          74
  Transplan |          90           0         329
  KRT uncle |           6           0          33
------------+------------------------------------
      Total |   251.89751   138.85341       2,127

    Variable |        Obs        Mean    Std. Dev.       Min        Max
-------------+---------------------------------------------------------
over~14_days |      2,127         583           0        583        583

            |     Summary of total_icd15_days
  CKD group |        Mean   Std. Dev.       Freq.
------------+------------------------------------
  Albuminur |         338           0       1,278
  CKD stage |         127           0         393
  CKD stage |           8           0          20
   Dialysis |          24           0          74
  Transplan |          77           0         329
  KRT uncle |           5           0          33
------------+------------------------------------
      Total |   239.44946   123.41971       2,127

    Variable |        Obs        Mean    Std. Dev.       Min        Max
-------------+---------------------------------------------------------
over~15_days |      2,127         579           0        579        579

            |     Summary of total_icd16_days
  CKD group |        Mean   Std. Dev.       Freq.
------------+------------------------------------
  Albuminur |         422           0       1,278
  CKD stage |          97           0         393
  CKD stage |           8           0          20
   Dialysis |          17           0          74
  Transplan |          90           0         329
  KRT uncle |           9           0          33
------------+------------------------------------
      Total |   286.20686   167.64018       2,127

    Variable |        Obs        Mean    Std. Dev.       Min        Max
-------------+---------------------------------------------------------
over~16_days |      2,127         643           0        643        643

            |     Summary of total_icd17_days
  CKD group |        Mean   Std. Dev.       Freq.
------------+------------------------------------
  Albuminur |         324           0       1,278
  CKD stage |         103           0         393
  CKD stage |           6           0          20
   Dialysis |          30           0          74
  Transplan |          98           0         329
  KRT uncle |           0           0          33
------------+------------------------------------
      Total |    229.9638   116.93969       2,127

    Variable |        Obs        Mean    Std. Dev.       Min        Max
-------------+---------------------------------------------------------
over~17_days |      2,127         561           0        561        561

            |     Summary of total_icd18_days
  CKD group |        Mean   Std. Dev.       Freq.
------------+------------------------------------
  Albuminur |         304           0       1,278
  CKD stage |         116           0         393
  CKD stage |           5           0          20
   Dialysis |          13           0          74
  Transplan |          91           0         329
  KRT uncle |          11           0          33
------------+------------------------------------
      Total |   218.83592   106.86031       2,127

    Variable |        Obs        Mean    Std. Dev.       Min        Max
-------------+---------------------------------------------------------
over~18_days |      2,127         540           0        540        540

            |     Summary of total_icd19_days
  CKD group |        Mean   Std. Dev.       Freq.
------------+------------------------------------
  Albuminur |         350           0       1,278
  CKD stage |         109           0         393
  CKD stage |           9           0          20
   Dialysis |          14           0          74
  Transplan |          67           0         329
  KRT uncle |          10           0          33
------------+------------------------------------
      Total |   241.52609   134.81862       2,127

    Variable |        Obs        Mean    Std. Dev.       Min        Max
-------------+---------------------------------------------------------
over~19_days |      2,127         559           0        559        559

            |     Summary of total_icd20_days
  CKD group |        Mean   Std. Dev.       Freq.
------------+------------------------------------
  Albuminur |         349           0       1,278
  CKD stage |         102           0         393
  CKD stage |          13           0          20
   Dialysis |          13           0          74
  Transplan |          76           0         329
  KRT uncle |          16           0          33
------------+------------------------------------
      Total |   241.11989   133.71784       2,127

    Variable |        Obs        Mean    Std. Dev.       Min        Max
-------------+---------------------------------------------------------
over~20_days |      2,127         569           0        569        569

            |     Summary of total_icd21_days
  CKD group |        Mean   Std. Dev.       Freq.
------------+------------------------------------
  Albuminur |         333           0       1,278
  CKD stage |         102           0         393
  CKD stage |           1           0          20
   Dialysis |          42           0          74
  Transplan |          91           0         329
  KRT uncle |           7           0          33
------------+------------------------------------
      Total |   234.58298   121.94427       2,127

    Variable |        Obs        Mean    Std. Dev.       Min        Max
-------------+---------------------------------------------------------
over~21_days |      2,127         576           0        576        576

            |     Summary of total_icd22_days
  CKD group |        Mean   Std. Dev.       Freq.
------------+------------------------------------
  Albuminur |         318           0       1,278
  CKD stage |          91           0         393
  CKD stage |           3           0          20
   Dialysis |          14           0          74
  Transplan |         117           0         329
  KRT uncle |          16           0          33
------------+------------------------------------
      Total |   226.74377   114.06874       2,127

    Variable |        Obs        Mean    Std. Dev.       Min        Max
-------------+---------------------------------------------------------
over~22_days |      2,127         559           0        559        559

. 
. 
. 
. **Potential effect modifiers
. * Ethnicity
. * 1 = White ethnicities (white British, white Irish, with other)
. * 2 = Mixed ethnicities (white & black Caribbean, white & black African, whit
> e & Asian, other mixed ethnicities)
. * 3 = South Asian ethnicities (Indian, Pakistani, Bangladeshi, other South As
> ian)
. * 4 = Black ethnicities (black Caribbean, black African, other black)
. * 5 = Other ethnicities (Chinese, all other ethnicities)
. * . = Unknown ethnicity
. replace ethnicity = . if ethnicity==.
(0 real changes made)

. replace ethnicity=6 if ethnicity==2
(83 real changes made)

. replace ethnicity=2 if ethnicity==3
(82 real changes made)

. replace ethnicity=3 if ethnicity==4
(64 real changes made)

. replace ethnicity=4 if ethnicity==6
(83 real changes made)

. replace ethnicity=6 if ethnicity==.
(540 real changes made)

. label define ethnicity  1 "White"                                       ///
>                                                 2 "South Asian"              
>            ///                                             
>                                                 3 "Black"                    
>                    ///
>                                                 4 "Mixed"                    
>                    ///
>                                                 5 "Other"                    
>                    ///
>                                                 6 "Unknown"     

. label values ethnicity ethnicity

. 
. * Index of multiple deprivation
. * Ordered 1-5 from most deprived to least deprived
. label define imd 1 "1 Most deprived" 2 "2" 3 "3" 4 "4" 5 "5 Least deprived"

. label values imd imd

. 
. * Region
. rename region region_string

. gen region = 1 if region_string=="East Midlands"
(1,902 missing values generated)

. replace region = 2 if region_string=="East"
(240 real changes made)

. replace region = 3 if region_string=="London"
(431 real changes made)

. replace region = 4 if region_string=="North East"
(218 real changes made)

. replace region = 5 if region_string=="North West"
(234 real changes made)

. replace region = 6 if region_string=="South East"
(196 real changes made)

. replace region = 7 if region_string=="South West"
(197 real changes made)

. replace region = 8 if region_string=="West Midlands"
(194 real changes made)

. replace region = 9 if region_string=="Yorkshire and The Humber"
(192 real changes made)

. label define region     1 "East Midlands"                                    
>    ///
>                                                 2 "East"                     
>                                    ///
>                                                 3 "London"                   
>                                    ///
>                                                 4 "North East"               
>                            ///
>                                                 5 "North West"               
>                            ///
>                                                 6 "South East"               
>                            ///
>                                                 7 "South West"               
>                            ///
>                                                 8 "West Midlands"            
>                            ///
>                                                 9 "Yorkshire and The Humber" 
>            

. label values region region

. label var region "Region"

. 
. * Urban/rural
. replace rural_urban=. if rural_urban<1|rural_urban>8
(0 real changes made)

. label define rural_urban 1 "Urban major conurbation"                         
>                    ///
>                                                  2 "Urban minor conurbation" 
>                                            ///
>                                                  3 "Urban city and town"     
>                                                    ///
>                                                  4 "Urban city and town in a 
> sparse setting"            ///
>                                                  5 "Rural town and fringe"   
>                                                    ///
>                                                  6 "Rural town and fringe in 
> a sparse setting"          ///
>                                                  7 "Rural village and dispers
> ed"                                        ///
>                                                  8 "Rural village and dispers
> ed in a sparse setting"

. label values rural_urban rural_urban

. * Urban (binary)
. * Urban = 1-4 + missing, Rural = 5-8
. generate urban=.
(2,127 missing values generated)

. replace urban=1 if rural_urban<=4|rural_urban==.
(812 real changes made)

. replace urban=0 if rural_urban>4 & rural_urban!=.
(1,315 real changes made)

. label var urban "Urban/rural"

. label define urban 0 "Rural" 1 "Urban"

. label values urban urban

. drop rural_urban

. 
. *Age bands for standardisation
. egen agecat = cut(age), at(0,18,20,25,30,35,40,45,50,55,60,65,70,75,80,85,90,
> 200)

. drop if agecat==0
(0 observations deleted)

. 
. *Age-standardisation weights (European Standard Population 2013)
. gen weight = .
(2,127 missing values generated)

. replace weight = 0.027261 if agecat==18
(60 real changes made)

. replace weight = 0.074349 if agecat==20
(184 real changes made)

. replace weight = 0.074349 if agecat==25
(172 real changes made)

. replace weight = 0.080545 if agecat==30
(164 real changes made)

. replace weight = 0.086741 if agecat==35
(163 real changes made)

. replace weight = 0.086741 if agecat==40
(158 real changes made)

. replace weight = 0.086741 if agecat==45
(174 real changes made)

. replace weight = 0.086741 if agecat==50
(201 real changes made)

. replace weight = 0.080545 if agecat==55
(179 real changes made)

. replace weight = 0.074349 if agecat==60
(146 real changes made)

. replace weight = 0.068154 if agecat==65
(152 real changes made)

. replace weight = 0.061958 if agecat==70
(152 real changes made)

. replace weight = 0.049566 if agecat==75
(95 real changes made)

. replace weight = 0.030979 if agecat==80
(69 real changes made)

. replace weight = 0.018587 if agecat==85
(43 real changes made)

. replace weight = 0.012392 if agecat==90
(15 real changes made)

. 
. 
. *Age standardised counts for each non-binary healthcare resource outcomes
. foreach aggregate of varlist hospital_days critical_care_days emergency_days 
> op_appts neph_appts tx_appts gp_interactions icd1_days icd2_days icd3_days ic
> d4_days icd5_days icd6_days icd7_days icd8_days icd9_days icd10_days icd11_da
> ys icd12_days icd13_days icd14_days icd15_days icd16_days icd17_days icd18_da
> ys icd19_days icd20_days icd21_days icd22_days {
  2. replace `aggregate' = `aggregate' * weight
  3. }
variable hospital_days was byte now float
(168 real changes made)
variable critical_care_days was byte now float
(165 real changes made)
variable emergency_days was byte now float
(182 real changes made)
variable op_appts was byte now float
(182 real changes made)
variable neph_appts was byte now float
(198 real changes made)
variable tx_appts was byte now float
(192 real changes made)
variable gp_interactions was byte now float
(187 real changes made)
variable icd1_days was byte now float
(187 real changes made)
variable icd2_days was byte now float
(165 real changes made)
variable icd3_days was byte now float
(181 real changes made)
variable icd4_days was byte now float
(215 real changes made)
variable icd5_days was byte now float
(187 real changes made)
variable icd6_days was byte now float
(173 real changes made)
variable icd7_days was byte now float
(179 real changes made)
variable icd8_days was byte now float
(177 real changes made)
variable icd9_days was byte now float
(169 real changes made)
variable icd10_days was byte now float
(181 real changes made)
variable icd11_days was byte now float
(173 real changes made)
variable icd12_days was byte now float
(175 real changes made)
variable icd13_days was byte now float
(187 real changes made)
variable icd14_days was byte now float
(196 real changes made)
variable icd15_days was byte now float
(179 real changes made)
variable icd16_days was byte now float
(216 real changes made)
variable icd17_days was byte now float
(188 real changes made)
variable icd18_days was byte now float
(185 real changes made)
variable icd19_days was byte now float
(185 real changes made)
variable icd20_days was byte now float
(188 real changes made)
variable icd21_days was byte now float
(190 real changes made)
variable icd22_days was byte now float
(185 real changes made)

. 
. * Create variable for age-standardised total # of each aggregated outcome
. * `var'_`aggregate' = age-standardised total # of each aggregated outcome ove
> rall stratified by ethnicity/imd/region/urban
. * `var'_`aggregate'_ckd = age-standardised total # of each aggregated outcome
>  in each CKD group stratified by ethnicity/imd/region/urban
. foreach aggregate of varlist hospital_days critical_care_days emergency_days 
> op_appts neph_appts tx_appts gp_interactions icd1_days icd2_days icd3_days ic
> d4_days icd5_days icd6_days icd7_days icd8_days icd9_days icd10_days icd11_da
> ys icd12_days icd13_days icd14_days icd15_days icd16_days icd17_days icd18_da
> ys icd19_days icd20_days icd21_days icd22_days {
  2. egen overall_std_`aggregate' = total(`aggregate')
  3. bysort ckd_group: egen std_`aggregate' = total(`aggregate')
  4. foreach var of varlist ethnicity imd region urban {
  5. bysort `var': egen `var'_`aggregate' = total(`aggregate')
  6. bysort `var' ckd_group: egen `var'_`aggregate'_ckd = total(`aggregate')
  7. }
  8. }

. 
. foreach binary of varlist fistula_formation pd_insertion blood_pressure album
> inuria creatinine icd1 icd2 icd3 icd4 icd5 icd6 icd7 icd8 icd9 icd10 icd11 ic
> d12 icd13 icd14 icd15 icd16 icd17 icd18 icd19 icd20 icd21 icd22 {
  2. gen esp_`binary' = `binary' * weight
  3. egen overall_std_`binary' = total(esp_`binary')
  4. bysort ckd_group: egen std_`binary' = total(esp_`binary')
  5. foreach var of varlist ethnicity imd region urban {
  6. bysort `var': egen `var'_`binary' = total(esp_`binary')
  7. bysort `var' ckd_group: egen `var'_`binary'_ckd = total(esp_`binary')
  8. }
  9. }

. 
. *Merge cost data
. save "./output/`dataset'_ckd_complete.dta", replace
(note: file ./output/2021_ckd_complete.dta not found)
file ./output/2021_ckd_complete.dta saved

. capture noisily import delimited ./output/costs_`dataset'.csv, clear
(7 vars, 500 obs)

. keep patient_id apcs_cost ec_cost opa_cost

. merge 1:1 patient_id using ./output/`dataset'_ckd_complete
(note: variable patient_id was int, now long to accommodate using data's
       values)

    Result                           # of obs.
    -----------------------------------------
    not matched                         2,619
        from master                       496  (_merge==1)
        from using                      2,123  (_merge==2)

    matched                                 4  (_merge==3)
    -----------------------------------------

. drop if _merge==1
(496 observations deleted)

. foreach cost of varlist apcs_cost ec_cost opa_cost {
  2. sum `cost', d
  3. bysort ckd_group: egen total_`cost' = total(`cost')
  4. egen overall_`cost' = total(`cost')
  5. tab ckd_group, sum(total_`cost')
  6. sum overall_`cost'
  7. foreach var of varlist ethnicity imd region urban {
  8. bysort `var': egen `var'_`cost' = total(`cost')
  9. bysort `var' ckd_group: egen `var'_`cost'_ckd = total(`cost')
 10. }
 11. }

                          apcs_cost
-------------------------------------------------------------
no observations

            |     Summary of total_apcs_cost
  CKD group |        Mean   Std. Dev.       Freq.
------------+------------------------------------
  Albuminur |           0           0       1,278
  CKD stage |           0           0         393
  CKD stage |           0           0          20
   Dialysis |           0           0          74
  Transplan |           0           0         329
  KRT uncle |           0           0          33
------------+------------------------------------
      Total |           0           0       2,127

    Variable |        Obs        Mean    Std. Dev.       Min        Max
-------------+---------------------------------------------------------
overall_ap~t |      2,127           0           0          0          0

                           ec_cost
-------------------------------------------------------------
      Percentiles      Smallest
 1%     5.755028       5.755028
 5%     5.755028              .
10%     5.755028              .       Obs                   1
25%     5.755028              .       Sum of Wgt.           1

50%     5.755028                      Mean           5.755028
                        Largest       Std. Dev.             .
75%     5.755028              .
90%     5.755028              .       Variance              .
95%     5.755028              .       Skewness              .
99%     5.755028       5.755028       Kurtosis              .

            |      Summary of total_ec_cost
  CKD group |        Mean   Std. Dev.       Freq.
------------+------------------------------------
  Albuminur |           0           0       1,278
  CKD stage |   5.7550282           0         393
  CKD stage |           0           0          20
   Dialysis |           0           0          74
  Transplan |           0           0         329
  KRT uncle |           0           0          33
------------+------------------------------------
      Total |   1.0633409   2.2341015       2,127

    Variable |        Obs        Mean    Std. Dev.       Min        Max
-------------+---------------------------------------------------------
overall_ec~t |      2,127    5.755028           0   5.755028   5.755028

                          opa_cost
-------------------------------------------------------------
      Percentiles      Smallest
 1%     82.55164       82.55164
 5%     82.55164              .
10%     82.55164              .       Obs                   1
25%     82.55164              .       Sum of Wgt.           1

50%     82.55164                      Mean           82.55164
                        Largest       Std. Dev.             .
75%     82.55164              .
90%     82.55164              .       Variance              .
95%     82.55164              .       Skewness              .
99%     82.55164       82.55164       Kurtosis              .

            |      Summary of total_opa_cost
  CKD group |        Mean   Std. Dev.       Freq.
------------+------------------------------------
  Albuminur |           0           0       1,278
  CKD stage |   82.551636           0         393
  CKD stage |           0           0          20
   Dialysis |           0           0          74
  Transplan |           0           0         329
  KRT uncle |           0           0          33
------------+------------------------------------
      Total |   15.252841   32.046539       2,127

    Variable |        Obs        Mean    Std. Dev.       Min        Max
-------------+---------------------------------------------------------
overall_op~t |      2,127    82.55164           0   82.55164   82.55164

. save "./output/`dataset'_ckd_complete.dta", replace
file ./output/2021_ckd_complete.dta saved

. 
. log close
      name:  <unnamed>
       log:  /workspace/logs/2021_ckd_complete.log
  log type:  text
 closed on:   7 Jun 2024, 10:22:27
-------------------------------------------------------------------------------
