-------------------------------------------------------------------------------
      name:  <unnamed>
       log:  /workspace/logs/2022_ckd_complete.log
  log type:  text
 opened on:  29 Apr 2024, 13:33:41

. clear

. 
. *Merge `dataset'_ckd with `dataset'_ckd_complete
. capture noisily import delimited ./output/`dataset'_ckd.csv, clear
(9 vars, 21,004 obs)

. tempfile `dataset'_ckd

. save ``dataset'_ckd', replace
(note: file /tmp/St00015.000001 not found)
file /tmp/St00015.000001 saved

. capture noisily import delimited ./output/input_`dataset'_ckd_complete.csv, c
> lear
(104 vars, 50,000 obs)

. merge 1:1 patient_id using ``dataset'_ckd'

    Result                           # of obs.
    -----------------------------------------
    not matched                        66,826
        from master                    47,911  (_merge==1)
        from using                     18,915  (_merge==2)

    matched                             2,089  (_merge==3)
    -----------------------------------------

. keep if _merge==3
(66,826 observations deleted)

. drop _merge

. tempfile `dataset'_ckd_complete

. save ``dataset'_ckd_complete', replace
(note: file /tmp/St00015.000002 not found)
file /tmp/St00015.000002 saved

. 
. /*Generate dummy data
> cd ckd-healthcare-use
> capture noisily import delimited ./output/2017_ckd.csv, clear
> tempfile 2017_ckd
> save ./output/2017_ckd, replace
> capture noisily import delimited ./output/input_2017_ckd_complete.csv, clear
> merge 1:1 patient_id using ./output/2017_ckd
> keep if _merge==3
> drop _merge
> tempfile 2017_ckd_complete
> save ./output/2017_ckd_complete, replace
> */
. 
. *CKD stage classification
. foreach var of varlist  dialysis_baseline_primary_care  ///
>                                                 dialysis_baseline_icd_10     
>            ///
>                                                 dialysis_baseline_opcs_4     
>            ///
>                                                 dialysis_baseline_date       
>            ///
>                                                 kt_baseline_primary_care     
>            ///
>                                                 kt_baseline_icd_10           
>                    ///
>                                                 kt_baseline_opcs_4           
>                    {
  2.         drop `var'
  3.         }

. tab modality_baseline, m

modality_baseline |      Freq.     Percent        Cum.
------------------+-----------------------------------
         Dialysis |        183        8.76        8.76
Kidney transplant |        179        8.57       17.33
 Modality unclear |         47        2.25       19.58
          Pre KRT |      1,680       80.42      100.00
------------------+-----------------------------------
            Total |      2,089      100.00

. *To reduce misclassification of dialysis, anyone with eGFR >15 with modality_
> baseline=="Dialysis" will be reclassified as non-dialysis (e.g. they may have
>  received acute dialysis and recovered)
. *For modality_baseline="Modality unclear" (i.e. whose dialysis and kidney tra
> nsplant baseline dates are identical), those with eGFR <15 will be assumed to
>  be on dialysis and those >15 as kidney transplant
. egen esrd_egfr = cut(baseline_egfr), at (0, 15, 5000)
(833 missing values generated)

. recode esrd_egfr 0=1 15=0
(esrd_egfr: 1256 changes made)

. tab esrd_egfr, m

  esrd_egfr |      Freq.     Percent        Cum.
------------+-----------------------------------
          0 |      1,256       60.12       60.12
          . |        833       39.88      100.00
------------+-----------------------------------
      Total |      2,089      100.00

. gen dialysis = 0

. replace dialysis = 1 if modality_baseline=="Dialysis"
(183 real changes made)

. replace dialysis = 1 if modality_baseline=="Modality unclear" & esrd_egfr!=.
(30 real changes made)

. replace dialysis = 0 if esrd_egfr==0
(136 real changes made)

. gen kidney_transplant = 0

. replace kidney_transplant = 1 if kidney_transplant_baseline_date!=""
(304 real changes made)

. replace kidney_transplant = 0 if dialysis==1
(10 real changes made)

. gen modality_unclear = 0

. replace modality_unclear = 1 if modality_baseline=="Modality unclear"
(47 real changes made)

. replace modality_unclear = 0 if dialysis==1
(0 real changes made)

. replace modality_unclear = 0 if kidney_transplant==1
(4 real changes made)

. tab modality_baseline dialysis

                  |       dialysis
modality_baseline |         0          1 |     Total
------------------+----------------------+----------
         Dialysis |       106         77 |       183 
Kidney transplant |       179          0 |       179 
 Modality unclear |        47          0 |        47 
          Pre KRT |     1,680          0 |     1,680 
------------------+----------------------+----------
            Total |     2,012         77 |     2,089 

. tab modality_baseline kidney_transplant

                  |   kidney_transplant
modality_baseline |         0          1 |     Total
------------------+----------------------+----------
         Dialysis |       164         19 |       183 
Kidney transplant |       160         19 |       179 
 Modality unclear |        43          4 |        47 
          Pre KRT |     1,428        252 |     1,680 
------------------+----------------------+----------
            Total |     1,795        294 |     2,089 

. tab modality_baseline modality_unclear

                  |   modality_unclear
modality_baseline |         0          1 |     Total
------------------+----------------------+----------
         Dialysis |       183          0 |       183 
Kidney transplant |       179          0 |       179 
 Modality unclear |         4         43 |        47 
          Pre KRT |     1,680          0 |     1,680 
------------------+----------------------+----------
            Total |     2,046         43 |     2,089 

. tab dialysis kidney_transplant

           |   kidney_transplant
  dialysis |         0          1 |     Total
-----------+----------------------+----------
         0 |     1,718        294 |     2,012 
         1 |        77          0 |        77 
-----------+----------------------+----------
     Total |     1,795        294 |     2,089 

. egen ckd_group = cut(baseline_egfr), at(0, 30, 60, 5000)
(833 missing values generated)

. recode ckd_group 0=3 30=2 60=1
(ckd_group: 1256 changes made)

. replace ckd_group = 4 if dialysis==1
(77 real changes made)

. replace ckd_group = 5 if kidney_transplant==1
(294 real changes made)

. replace ckd_group = 6 if modality_unclear==1
(43 real changes made)

. *ckd_group==. are those with albuminuria without available eGFR measurement o
> r code for KRT
. replace ckd_group = 1 if ckd_group==.
(635 real changes made)

. label define ckd_group 1 "Albuminuria" 2 "CKD stage 3" 3 "CKD stage 4/5" 4 "D
> ialysis" 5 "Transplant" 6 "KRT unclear modality"

. label values ckd_group ckd_group

. label var ckd_group "CKD group"

. tab ckd_group, m

           CKD group |      Freq.     Percent        Cum.
---------------------+-----------------------------------
         Albuminuria |      1,258       60.22       60.22
         CKD stage 3 |        410       19.63       79.85
       CKD stage 4/5 |          7        0.34       80.18
            Dialysis |         77        3.69       83.87
          Transplant |        294       14.07       97.94
KRT unclear modality |         43        2.06      100.00
---------------------+-----------------------------------
               Total |      2,089      100.00

. drop if ckd_group==.
(0 observations deleted)

. tab ckd_group modality_baseline

                     |              modality_baseline
           CKD group |  Dialysis  Kidney ..  Modalit..    Pre KRT |     Total
---------------------+--------------------------------------------+----------
         Albuminuria |        50        128          0      1,080 |     1,258 
         CKD stage 3 |        34         32          0        344 |       410 
       CKD stage 4/5 |         3          0          0          4 |         7 
            Dialysis |        77          0          0          0 |        77 
          Transplant |        19         19          4        252 |       294 
KRT unclear modality |         0          0         43          0 |        43 
---------------------+--------------------------------------------+----------
               Total |       183        179         47      1,680 |     2,089 

. 
. *Dialysis & kidney transplant outcome classification
. foreach var of varlist  dialysis_outcome_primary_care   ///
>                                                 dialysis_outcome_icd_10      
>            ///
>                                                 dialysis_outcome_opcs_4      
>            ///
>                                                 dialysis_outcome_date        
>            ///
>                                                 kt_outcome_primary_care      
>            ///
>                                                 kt_outcome_icd_10            
>                    ///
>                                                 kt_outcome_opcs_4            
>                    ///
>                                                 kidney_transplant_outcome_dat
> e  ///
>                                                 died                         
>                            {
  2.         drop `var'
  3.         }

. tab ckd_group modality_outcome, m

                     |              modality_outcome
           CKD group |  Deceased   Dialysis  Kidney ..  Modalit.. |     Total
---------------------+--------------------------------------------+----------
         Albuminuria |       123         76         48         12 |     1,258 
         CKD stage 3 |        32         16         12         10 |       410 
       CKD stage 4/5 |         1          1          0          0 |         7 
            Dialysis |         6          5          5          1 |        77 
          Transplant |        29         15         11          2 |       294 
KRT unclear modality |         7          1          0          0 |        43 
---------------------+--------------------------------------------+----------
               Total |       198        114         76         25 |     2,089 


                     | modality_o
                     |   utcome
           CKD group | Unchanged |     Total
---------------------+-----------+----------
         Albuminuria |       999 |     1,258 
         CKD stage 3 |       340 |       410 
       CKD stage 4/5 |         5 |         7 
            Dialysis |        60 |        77 
          Transplant |       237 |       294 
KRT unclear modality |        35 |        43 
---------------------+-----------+----------
               Total |     1,676 |     2,089 

. 
. *eGFR outcome classification based on updated mean eGFR over previous 18 mont
> hs by the end of year
. gen sex = 1 if male == "Male"
(1,124 missing values generated)

. replace sex = 0 if male == "Female"
(1,124 real changes made)

. label define sex 0"Female" 1"Male"

. label values sex sex

. replace creatinine_outcome = . if !inrange(creatinine_outcome, 20, 3000)
(905 real changes made, 905 to missing)

. gen mgdl_creatinine_outcome = creatinine_outcome/88.4
(905 missing values generated)

. gen min_creatinine_outcome=.
(2,089 missing values generated)

. replace min_creatinine_outcome = mgdl_creatinine_outcome/0.7 if sex==0
(632 real changes made)

. replace min_creatinine_outcome = mgdl_creatinine_outcome/0.9 if sex==1
(552 real changes made)

. replace min_creatinine_outcome = min_creatinine_outcome^-0.329  if sex==0
(632 real changes made)

. replace min_creatinine_outcome = min_creatinine_outcome^-0.411  if sex==1
(552 real changes made)

. replace min_creatinine_outcome = 1 if min_creatinine_outcome<1
(755 real changes made)

. gen max_creatinine_outcome=.
(2,089 missing values generated)

. replace max_creatinine_outcome = mgdl_creatinine_outcome/0.7 if sex==0
(632 real changes made)

. replace max_creatinine_outcome = mgdl_creatinine_outcome/0.9 if sex==1
(552 real changes made)

. replace max_creatinine_outcome = max_creatinine_outcome^-1.209
(1,184 real changes made)

. replace max_creatinine_outcome = 1 if max_creatinine_outcome>1
(1,334 real changes made)

. gen egfr_outcome = min_creatinine_outcome*max_creatinine_outcome*141
(905 missing values generated)

. replace egfr_outcome = egfr_outcome*(0.993^age)
(1,184 real changes made)

. replace egfr_outcome = egfr_outcome*1.018 if sex==0
(632 real changes made)

. drop creatinine_outcome

. drop mgdl_creatinine_outcome

. drop min_creatinine_outcome

. drop max_creatinine_outcome

. egen egfr_end = cut(egfr_outcome), at(0, 30, 60, 5000)
(905 missing values generated)

. recode egfr_end 0=3 30=2 60=1
(egfr_end: 1184 changes made)

. label define egfr_end 1 "≥60" 2 "30-59" 3 "<30"

. label values egfr_end egfr_end

. label var egfr_end "Final eGFR"

. gen ckd_progression = 0

. replace ckd_progression = 1 if egfr_end==2 & ckd_group==1
(188 real changes made)

. replace ckd_progression = 2 if egfr_end==3 & ckd_group==1
(5 real changes made)

. replace ckd_progression = 2 if egfr_end==3 & ckd_group==2
(5 real changes made)

. egen esrd_egfr_end = cut(egfr_outcome), at (0, 15, 5000)
(905 missing values generated)

. recode esrd_egfr_end 0=1 15=0
(esrd_egfr_end: 1184 changes made)

. tab esrd_egfr_end, m

esrd_egfr_e |
         nd |      Freq.     Percent        Cum.
------------+-----------------------------------
          0 |      1,184       56.68       56.68
          . |        905       43.32      100.00
------------+-----------------------------------
      Total |      2,089      100.00

. gen dialysis_outcome = 0

. replace dialysis_outcome = 1 if modality_outcome=="Dialysis"
(114 real changes made)

. replace dialysis_outcome = 1 if modality_outcome=="Modality unclear" & esrd_e
> gfr_end==1
(0 real changes made)

. gen kidney_transplant_outcome = 0

. replace kidney_transplant_outcome = 1 if modality_outcome=="Kidney transplant
> "
(76 real changes made)

. replace kidney_transplant_outcome = 1 if modality_outcome=="Modality unclear"
>  & esrd_egfr_end==0
(7 real changes made)

. replace ckd_progression = 5 if modality_outcome=="Modality unclear"
(25 real changes made)

. replace ckd_progression = 3 if dialysis_outcome==1
(114 real changes made)

. replace ckd_progression = 4 if kidney_transplant_outcome==1
(83 real changes made)

. replace ckd_progression = 6 if modality_outcome=="Deceased"
(198 real changes made)

. label define ckd_progression 0 "No progression" 1 "CKD 3" 2 "CKD 4/5 pre-KRT"
>  3 "Dialysis" 4 "Kidney transplant" 5 "KRT unclear modality" 6 "Deceased"

. label values ckd_progression ckd_progression

. label var ckd_progression "CKD progression"

. tab ckd_progression, m

     CKD progression |      Freq.     Percent        Cum.
---------------------+-----------------------------------
      No progression |      1,519       72.71       72.71
               CKD 3 |        150        7.18       79.89
     CKD 4/5 pre-KRT |          7        0.34       80.23
            Dialysis |        114        5.46       85.69
   Kidney transplant |         83        3.97       89.66
KRT unclear modality |         18        0.86       90.52
            Deceased |        198        9.48      100.00
---------------------+-----------------------------------
               Total |      2,089      100.00

. 
. *eGFR cut-offs to investigate timing of access formation
. egen access_egfr = cut(baseline_egfr), at (0, 15, 5000)
(833 missing values generated)

. recode access_egfr 0=1 15=2
(access_egfr: 1256 changes made)

. replace access_egfr=0 if ckd_group==4
(77 real changes made)

. replace access_egfr=3 if access_egfr==.
(756 real changes made)

. label define access_egfr 0 "Dialysis" 1 "eGFR 0-14" 2 "eGFR >= 15" 3 "Unknown
> "

. label values access_egfr access_egfr

. 
. *Totals for non-binary healthcare resource outcomes (including by month)
. foreach aggregate of varlist hospital_days critical_care_days emergency_days 
> op_appts neph_appts tx_appts gp_interactions icd1_days icd2_days icd3_days ic
> d4_days icd5_days icd6_days icd7_days icd8_days icd9_days icd10_days icd11_da
> ys icd12_days icd13_days icd14_days icd15_days icd16_days icd17_days icd18_da
> ys icd19_days icd20_days icd21_days icd22_days {
  2. bysort ckd_group: egen total_`aggregate' = total(`aggregate')
  3. egen overall_`aggregate' = total(`aggregate')
  4. tab ckd_group, sum(total_`aggregate')
  5. sum overall_`aggregate'
  6. }

            |   Summary of total_hospital_days
  CKD group |        Mean   Std. Dev.       Freq.
------------+------------------------------------
  Albuminur |         311           0       1,258
  CKD stage |          97           0         410
  CKD stage |           0           0           7
   Dialysis |          38           0          77
  Transplan |          80           0         294
  KRT uncle |           5           0          43
------------+------------------------------------
      Total |   219.08521   114.25685       2,089

    Variable |        Obs        Mean    Std. Dev.       Min        Max
-------------+---------------------------------------------------------
overall_ho~s |      2,089         531           0        531        531

            | Summary of total_critical_care_days
  CKD group |        Mean   Std. Dev.       Freq.
------------+------------------------------------
  Albuminur |         375           0       1,258
  CKD stage |          99           0         410
  CKD stage |           0           0           7
   Dialysis |          23           0          77
  Transplan |          90           0         294
  KRT uncle |           7           0          43
------------+------------------------------------
      Total |   258.91431     144.021       2,089

    Variable |        Obs        Mean    Std. Dev.       Min        Max
-------------+---------------------------------------------------------
overall_cr~s |      2,089         594           0        594        594

            |   Summary of total_emergency_days
  CKD group |        Mean   Std. Dev.       Freq.
------------+------------------------------------
  Albuminur |         259           0       1,258
  CKD stage |         122           0         410
  CKD stage |           0           0           7
   Dialysis |           8           0          77
  Transplan |          77           0         294
  KRT uncle |           5           0          43
------------+------------------------------------
      Total |   191.14935   87.294991       2,089

    Variable |        Obs        Mean    Std. Dev.       Min        Max
-------------+---------------------------------------------------------
overall_em~s |      2,089         471           0        471        471

            |      Summary of total_op_appts
  CKD group |        Mean   Std. Dev.       Freq.
------------+------------------------------------
  Albuminur |         331           0       1,258
  CKD stage |          89           0         410
  CKD stage |           0           0           7
   Dialysis |          30           0          77
  Transplan |          90           0         294
  KRT uncle |          16           0          43
------------+------------------------------------
      Total |   230.89804   124.11432       2,089

    Variable |        Obs        Mean    Std. Dev.       Min        Max
-------------+---------------------------------------------------------
overall_op~s |      2,089         556           0        556        556

            |     Summary of total_neph_appts
  CKD group |        Mean   Std. Dev.       Freq.
------------+------------------------------------
  Albuminur |         286           0       1,258
  CKD stage |         107           0         410
  CKD stage |           0           0           7
   Dialysis |          24           0          77
  Transplan |          72           0         294
  KRT uncle |           9           0          43
------------+------------------------------------
      Total |   204.43322   102.31968       2,089

    Variable |        Obs        Mean    Std. Dev.       Min        Max
-------------+---------------------------------------------------------
overall_ne~s |      2,089         498           0        498        498

            |      Summary of total_tx_appts
  CKD group |        Mean   Std. Dev.       Freq.
------------+------------------------------------
  Albuminur |         334           0       1,258
  CKD stage |          96           0         410
  CKD stage |           0           0           7
   Dialysis |          28           0          77
  Transplan |          82           0         294
  KRT uncle |           3           0          43
------------+------------------------------------
      Total |    232.6113   125.94846       2,089

    Variable |        Obs        Mean    Std. Dev.       Min        Max
-------------+---------------------------------------------------------
overall_tx~s |      2,089         543           0        543        543

            |  Summary of total_gp_interactions
  CKD group |        Mean   Std. Dev.       Freq.
------------+------------------------------------
  Albuminur |         328           0       1,258
  CKD stage |         126           0         410
  CKD stage |           6           0           7
   Dialysis |          28           0          77
  Transplan |          60           0         294
  KRT uncle |           6           0          43
------------+------------------------------------
      Total |   231.87171   121.17003       2,089

    Variable |        Obs        Mean    Std. Dev.       Min        Max
-------------+---------------------------------------------------------
overall_gp~s |      2,089         554           0        554        554

            |     Summary of total_icd1_days
  CKD group |        Mean   Std. Dev.       Freq.
------------+------------------------------------
  Albuminur |         341           0       1,258
  CKD stage |         114           0         410
  CKD stage |           0           0           7
   Dialysis |          13           0          77
  Transplan |         102           0         294
  KRT uncle |          11           0          43
------------+------------------------------------
      Total |   242.78602    122.9246       2,089

    Variable |        Obs        Mean    Std. Dev.       Min        Max
-------------+---------------------------------------------------------
overall_ic~s |      2,089         581           0        581        581

            |     Summary of total_icd2_days
  CKD group |        Mean   Std. Dev.       Freq.
------------+------------------------------------
  Albuminur |         373           0       1,258
  CKD stage |          77           0         410
  CKD stage |          12           0           7
   Dialysis |           4           0          77
  Transplan |          71           0         294
  KRT uncle |           1           0          43
------------+------------------------------------
      Total |   249.93442   152.32159       2,089

    Variable |        Obs        Mean    Std. Dev.       Min        Max
-------------+---------------------------------------------------------
overa~2_days |      2,089         538           0        538        538

            |     Summary of total_icd3_days
  CKD group |        Mean   Std. Dev.       Freq.
------------+------------------------------------
  Albuminur |         312           0       1,258
  CKD stage |          92           0         410
  CKD stage |           6           0           7
   Dialysis |          13           0          77
  Transplan |          79           0         294
  KRT uncle |           5           0          43
------------+------------------------------------
      Total |   217.66395   117.45706       2,089

    Variable |        Obs        Mean    Std. Dev.       Min        Max
-------------+---------------------------------------------------------
overa~3_days |      2,089         507           0        507        507

            |     Summary of total_icd4_days
  CKD group |        Mean   Std. Dev.       Freq.
------------+------------------------------------
  Albuminur |         359           0       1,258
  CKD stage |          82           0         410
  CKD stage |           2           0           7
   Dialysis |          16           0          77
  Transplan |          68           0         294
  KRT uncle |          15           0          43
------------+------------------------------------
      Total |   242.75969   143.78654       2,089

    Variable |        Obs        Mean    Std. Dev.       Min        Max
-------------+---------------------------------------------------------
overa~4_days |      2,089         542           0        542        542

            |     Summary of total_icd5_days
  CKD group |        Mean   Std. Dev.       Freq.
------------+------------------------------------
  Albuminur |         324           0       1,258
  CKD stage |          99           0         410
  CKD stage |           3           0           7
   Dialysis |          15           0          77
  Transplan |          86           0         294
  KRT uncle |          14           0          43
------------+------------------------------------
      Total |   227.49832   120.18752       2,089

    Variable |        Obs        Mean    Std. Dev.       Min        Max
-------------+---------------------------------------------------------
overa~5_days |      2,089         541           0        541        541

            |     Summary of total_icd6_days
  CKD group |        Mean   Std. Dev.       Freq.
------------+------------------------------------
  Albuminur |         351           0       1,258
  CKD stage |         105           0         410
  CKD stage |           3           0           7
   Dialysis |          31           0          77
  Transplan |          51           0         294
  KRT uncle |          17           0          43
------------+------------------------------------
      Total |   240.66108   137.31151       2,089

    Variable |        Obs        Mean    Std. Dev.       Min        Max
-------------+---------------------------------------------------------
overa~6_days |      2,089         558           0        558        558

            |     Summary of total_icd7_days
  CKD group |        Mean   Std. Dev.       Freq.
------------+------------------------------------
  Albuminur |         321           0       1,258
  CKD stage |          91           0         410
  CKD stage |           4           0           7
   Dialysis |          11           0          77
  Transplan |          87           0         294
  KRT uncle |          21           0          43
------------+------------------------------------
      Total |   224.26233   120.28692       2,089

    Variable |        Obs        Mean    Std. Dev.       Min        Max
-------------+---------------------------------------------------------
overa~7_days |      2,089         535           0        535        535

            |     Summary of total_icd8_days
  CKD group |        Mean   Std. Dev.       Freq.
------------+------------------------------------
  Albuminur |         320           0       1,258
  CKD stage |         127           0         410
  CKD stage |           6           0           7
   Dialysis |          13           0          77
  Transplan |          52           0         294
  KRT uncle |           7           0          43
------------+------------------------------------
      Total |   225.59215   119.72476       2,089

    Variable |        Obs        Mean    Std. Dev.       Min        Max
-------------+---------------------------------------------------------
overa~8_days |      2,089         525           0        525        525

            |     Summary of total_icd9_days
  CKD group |        Mean   Std. Dev.       Freq.
------------+------------------------------------
  Albuminur |         331           0       1,258
  CKD stage |         101           0         410
  CKD stage |           2           0           7
   Dialysis |          25           0          77
  Transplan |          58           0         294
  KRT uncle |          17           0          43
------------+------------------------------------
      Total |   228.59263   127.41894       2,089

    Variable |        Obs        Mean    Std. Dev.       Min        Max
-------------+---------------------------------------------------------
overa~9_days |      2,089         534           0        534        534

            |     Summary of total_icd10_days
  CKD group |        Mean   Std. Dev.       Freq.
------------+------------------------------------
  Albuminur |         351           0       1,258
  CKD stage |         118           0         410
  CKD stage |           0           0           7
   Dialysis |          26           0          77
  Transplan |          81           0         294
  KRT uncle |           6           0          43
------------+------------------------------------
      Total |   247.01388   129.86897       2,089

    Variable |        Obs        Mean    Std. Dev.       Min        Max
-------------+---------------------------------------------------------
overa~0_days |      2,089         582           0        582        582

            |     Summary of total_icd11_days
  CKD group |        Mean   Std. Dev.       Freq.
------------+------------------------------------
  Albuminur |         343           0       1,258
  CKD stage |          52           0         410
  CKD stage |           0           0           7
   Dialysis |          25           0          77
  Transplan |          77           0         294
  KRT uncle |          11           0          43
------------+------------------------------------
      Total |   228.74581   141.15246       2,089

    Variable |        Obs        Mean    Std. Dev.       Min        Max
-------------+---------------------------------------------------------
over~11_days |      2,089         508           0        508        508

            |     Summary of total_icd12_days
  CKD group |        Mean   Std. Dev.       Freq.
------------+------------------------------------
  Albuminur |         264           0       1,258
  CKD stage |         112           0         410
  CKD stage |           3           0           7
   Dialysis |          10           0          77
  Transplan |          67           0         294
  KRT uncle |          23           0          43
------------+------------------------------------
      Total |   191.24461   92.244127       2,089

    Variable |        Obs        Mean    Std. Dev.       Min        Max
-------------+---------------------------------------------------------
over~12_days |      2,089         479           0        479        479

            |     Summary of total_icd13_days
  CKD group |        Mean   Std. Dev.       Freq.
------------+------------------------------------
  Albuminur |         346           0       1,258
  CKD stage |         104           0         410
  CKD stage |           0           0           7
   Dialysis |          11           0          77
  Transplan |          62           0         294
  KRT uncle |           7           0          43
------------+------------------------------------
      Total |   238.04883   134.55079       2,089

    Variable |        Obs        Mean    Std. Dev.       Min        Max
-------------+---------------------------------------------------------
over~13_days |      2,089         530           0        530        530

            |     Summary of total_icd14_days
  CKD group |        Mean   Std. Dev.       Freq.
------------+------------------------------------
  Albuminur |         330           0       1,258
  CKD stage |         156           0         410
  CKD stage |           2           0           7
   Dialysis |          25           0          77
  Transplan |         104           0         294
  KRT uncle |           2           0          43
------------+------------------------------------
      Total |   244.95022   109.11723       2,089

    Variable |        Obs        Mean    Std. Dev.       Min        Max
-------------+---------------------------------------------------------
over~14_days |      2,089         619           0        619        619

            |     Summary of total_icd15_days
  CKD group |        Mean   Std. Dev.       Freq.
------------+------------------------------------
  Albuminur |         301           0       1,258
  CKD stage |          89           0         410
  CKD stage |           0           0           7
   Dialysis |          21           0          77
  Transplan |          92           0         294
  KRT uncle |           7           0          43
------------+------------------------------------
      Total |   212.59646    110.1442       2,089

    Variable |        Obs        Mean    Std. Dev.       Min        Max
-------------+---------------------------------------------------------
over~15_days |      2,089         510           0        510        510

            |     Summary of total_icd16_days
  CKD group |        Mean   Std. Dev.       Freq.
------------+------------------------------------
  Albuminur |         316           0       1,258
  CKD stage |         118           0         410
  CKD stage |           3           0           7
   Dialysis |          26           0          77
  Transplan |          53           0         294
  KRT uncle |          19           0          43
------------+------------------------------------
      Total |   222.27382   117.87708       2,089

    Variable |        Obs        Mean    Std. Dev.       Min        Max
-------------+---------------------------------------------------------
over~16_days |      2,089         535           0        535        535

            |     Summary of total_icd17_days
  CKD group |        Mean   Std. Dev.       Freq.
------------+------------------------------------
  Albuminur |         298           0       1,258
  CKD stage |         100           0         410
  CKD stage |           4           0           7
   Dialysis |          18           0          77
  Transplan |          70           0         294
  KRT uncle |           5           0          43
------------+------------------------------------
      Total |   209.71422   110.31094       2,089

    Variable |        Obs        Mean    Std. Dev.       Min        Max
-------------+---------------------------------------------------------
over~17_days |      2,089         495           0        495        495

            |     Summary of total_icd18_days
  CKD group |        Mean   Std. Dev.       Freq.
------------+------------------------------------
  Albuminur |         317           0       1,258
  CKD stage |         103           0         410
  CKD stage |           0           0           7
   Dialysis |          13           0          77
  Transplan |          73           0         294
  KRT uncle |           5           0          43
------------+------------------------------------
      Total |   221.96936   118.70107       2,089

    Variable |        Obs        Mean    Std. Dev.       Min        Max
-------------+---------------------------------------------------------
over~18_days |      2,089         511           0        511        511

            |     Summary of total_icd19_days
  CKD group |        Mean   Std. Dev.       Freq.
------------+------------------------------------
  Albuminur |         324           0       1,258
  CKD stage |         109           0         410
  CKD stage |           3           0           7
   Dialysis |          23           0          77
  Transplan |          68           0         294
  KRT uncle |           9           0          43
------------+------------------------------------
      Total |   227.11967   121.01333       2,089

    Variable |        Obs        Mean    Std. Dev.       Min        Max
-------------+---------------------------------------------------------
over~19_days |      2,089         536           0        536        536

            |     Summary of total_icd20_days
  CKD group |        Mean   Std. Dev.       Freq.
------------+------------------------------------
  Albuminur |         324           0       1,258
  CKD stage |          91           0         410
  CKD stage |           0           0           7
   Dialysis |           6           0          77
  Transplan |          62           0         294
  KRT uncle |          19           0          43
------------+------------------------------------
      Total |   222.31163   126.40006       2,089

    Variable |        Obs        Mean    Std. Dev.       Min        Max
-------------+---------------------------------------------------------
over~20_days |      2,089         502           0        502        502

            |     Summary of total_icd21_days
  CKD group |        Mean   Std. Dev.       Freq.
------------+------------------------------------
  Albuminur |         325           0       1,258
  CKD stage |          79           0         410
  CKD stage |           4           0           7
   Dialysis |          15           0          77
  Transplan |          63           0         294
  KRT uncle |           5           0          43
------------+------------------------------------
      Total |   220.75634   129.12998       2,089

    Variable |        Obs        Mean    Std. Dev.       Min        Max
-------------+---------------------------------------------------------
over~21_days |      2,089         491           0        491        491

            |     Summary of total_icd22_days
  CKD group |        Mean   Std. Dev.       Freq.
------------+------------------------------------
  Albuminur |         334           0       1,258
  CKD stage |         116           0         410
  CKD stage |           3           0           7
   Dialysis |          19           0          77
  Transplan |          90           0         294
  KRT uncle |           2           0          43
------------+------------------------------------
      Total |   237.32025    121.0773       2,089

    Variable |        Obs        Mean    Std. Dev.       Min        Max
-------------+---------------------------------------------------------
over~22_days |      2,089         564           0        564        564

. 
. 
. 
. **Potential effect modifiers
. * Ethnicity
. * 1 = White ethnicities (white British, white Irish, with other)
. * 2 = Mixed ethnicities (white & black Caribbean, white & black African, whit
> e & Asian, other mixed ethnicities)
. * 3 = South Asian ethnicities (Indian, Pakistani, Bangladeshi, other South As
> ian)
. * 4 = Black ethnicities (black Caribbean, black African, other black)
. * 5 = Other ethnicities (Chinese, all other ethnicities)
. * . = Unknown ethnicity
. replace ethnicity = . if ethnicity==.
(0 real changes made)

. replace ethnicity=6 if ethnicity==2
(77 real changes made)

. replace ethnicity=2 if ethnicity==3
(69 real changes made)

. replace ethnicity=3 if ethnicity==4
(78 real changes made)

. replace ethnicity=4 if ethnicity==6
(77 real changes made)

. replace ethnicity=6 if ethnicity==.
(553 real changes made)

. label define ethnicity  1 "White"                                       ///
>                                                 2 "South Asian"              
>            ///                                             
>                                                 3 "Black"                    
>                    ///
>                                                 4 "Mixed"                    
>                    ///
>                                                 5 "Other"                    
>                    ///
>                                                 6 "Unknown"     

. label values ethnicity ethnicity

. 
. * Index of multiple deprivation
. * Ordered 1-5 from most deprived to least deprived
. label define imd 1 "1 Most deprived" 2 "2" 3 "3" 4 "4" 5 "5 Least deprived"

. label values imd imd

. 
. * Region
. rename region region_string

. gen region = 1 if region_string=="East Midlands"
(1,880 missing values generated)

. replace region = 2 if region_string=="East"
(235 real changes made)

. replace region = 3 if region_string=="London"
(409 real changes made)

. replace region = 4 if region_string=="North East"
(212 real changes made)

. replace region = 5 if region_string=="North West"
(187 real changes made)

. replace region = 6 if region_string=="South East"
(189 real changes made)

. replace region = 7 if region_string=="South West"
(223 real changes made)

. replace region = 8 if region_string=="West Midlands"
(207 real changes made)

. replace region = 9 if region_string=="Yorkshire and The Humber"
(218 real changes made)

. label define region     1 "East Midlands"                                    
>    ///
>                                                 2 "East"                     
>                                    ///
>                                                 3 "London"                   
>                                    ///
>                                                 4 "North East"               
>                            ///
>                                                 5 "North West"               
>                            ///
>                                                 6 "South East"               
>                            ///
>                                                 7 "South West"               
>                            ///
>                                                 8 "West Midlands"            
>                            ///
>                                                 9 "Yorkshire and The Humber" 
>            

. label values region region

. label var region "Region"

. 
. * Urban/rural
. replace rural_urban=. if rural_urban<1|rural_urban>8
(0 real changes made)

. label define rural_urban 1 "Urban major conurbation"                         
>                    ///
>                                                  2 "Urban minor conurbation" 
>                                            ///
>                                                  3 "Urban city and town"     
>                                                    ///
>                                                  4 "Urban city and town in a 
> sparse setting"            ///
>                                                  5 "Rural town and fringe"   
>                                                    ///
>                                                  6 "Rural town and fringe in 
> a sparse setting"          ///
>                                                  7 "Rural village and dispers
> ed"                                        ///
>                                                  8 "Rural village and dispers
> ed in a sparse setting"

. label values rural_urban rural_urban

. * Urban (binary)
. * Urban = 1-4 + missing, Rural = 5-8
. generate urban=.
(2,089 missing values generated)

. replace urban=1 if rural_urban<=4|rural_urban==.
(852 real changes made)

. replace urban=0 if rural_urban>4 & rural_urban!=.
(1,237 real changes made)

. label var urban "Urban/rural"

. label define urban 0 "Rural" 1 "Urban"

. label values urban urban

. drop rural_urban

. 
. *Age bands for standardisation
. egen agecat = cut(age), at(0,18,20,25,30,35,40,45,50,55,60,65,70,75,80,85,90,
> 200)

. drop if agecat==0
(0 observations deleted)

. 
. *Age-standardisation weights (European Standard Population 2013)
. gen weight = .
(2,089 missing values generated)

. replace weight = 0.027261 if agecat==18
(48 real changes made)

. replace weight = 0.074349 if agecat==20
(160 real changes made)

. replace weight = 0.074349 if agecat==25
(199 real changes made)

. replace weight = 0.080545 if agecat==30
(185 real changes made)

. replace weight = 0.086741 if agecat==35
(157 real changes made)

. replace weight = 0.086741 if agecat==40
(157 real changes made)

. replace weight = 0.086741 if agecat==45
(196 real changes made)

. replace weight = 0.086741 if agecat==50
(196 real changes made)

. replace weight = 0.080545 if agecat==55
(181 real changes made)

. replace weight = 0.074349 if agecat==60
(137 real changes made)

. replace weight = 0.068154 if agecat==65
(131 real changes made)

. replace weight = 0.061958 if agecat==70
(119 real changes made)

. replace weight = 0.049566 if agecat==75
(92 real changes made)

. replace weight = 0.030979 if agecat==80
(57 real changes made)

. replace weight = 0.018587 if agecat==85
(46 real changes made)

. replace weight = 0.012392 if agecat==90
(28 real changes made)

. 
. 
. *Age standardised counts for each non-binary healthcare resource outcomes
. foreach aggregate of varlist hospital_days critical_care_days emergency_days 
> op_appts neph_appts tx_appts gp_interactions icd1_days icd2_days icd3_days ic
> d4_days icd5_days icd6_days icd7_days icd8_days icd9_days icd10_days icd11_da
> ys icd12_days icd13_days icd14_days icd15_days icd16_days icd17_days icd18_da
> ys icd19_days icd20_days icd21_days icd22_days {
  2. replace `aggregate' = `aggregate' * weight
  3. }
variable hospital_days was byte now float
(181 real changes made)
variable critical_care_days was byte now float
(192 real changes made)
variable emergency_days was byte now float
(155 real changes made)
variable op_appts was byte now float
(190 real changes made)
variable neph_appts was byte now float
(185 real changes made)
variable tx_appts was byte now float
(180 real changes made)
variable gp_interactions was byte now float
(188 real changes made)
variable icd1_days was byte now float
(193 real changes made)
variable icd2_days was byte now float
(179 real changes made)
variable icd3_days was byte now float
(178 real changes made)
variable icd4_days was byte now float
(183 real changes made)
variable icd5_days was byte now float
(170 real changes made)
variable icd6_days was byte now float
(177 real changes made)
variable icd7_days was byte now float
(170 real changes made)
variable icd8_days was byte now float
(178 real changes made)
variable icd9_days was byte now float
(185 real changes made)
variable icd10_days was byte now float
(193 real changes made)
variable icd11_days was byte now float
(173 real changes made)
variable icd12_days was byte now float
(163 real changes made)
variable icd13_days was byte now float
(188 real changes made)
variable icd14_days was byte now float
(197 real changes made)
variable icd15_days was byte now float
(186 real changes made)
variable icd16_days was byte now float
(178 real changes made)
variable icd17_days was byte now float
(183 real changes made)
variable icd18_days was byte now float
(174 real changes made)
variable icd19_days was byte now float
(178 real changes made)
variable icd20_days was byte now float
(161 real changes made)
variable icd21_days was byte now float
(166 real changes made)
variable icd22_days was byte now float
(186 real changes made)

. 
. * Create variable for age-standardised total # of each aggregated outcome
. * `var'_`aggregate' = age-standardised total # of each aggregated outcome ove
> rall stratified by ethnicity/imd/region/urban
. * `var'_`aggregate'_ckd = age-standardised total # of each aggregated outcome
>  in each CKD group stratified by ethnicity/imd/region/urban
. foreach aggregate of varlist hospital_days critical_care_days emergency_days 
> op_appts neph_appts tx_appts gp_interactions icd1_days icd2_days icd3_days ic
> d4_days icd5_days icd6_days icd7_days icd8_days icd9_days icd10_days icd11_da
> ys icd12_days icd13_days icd14_days icd15_days icd16_days icd17_days icd18_da
> ys icd19_days icd20_days icd21_days icd22_days {
  2. egen overall_std_`aggregate' = total(`aggregate')
  3. bysort ckd_group: egen std_`aggregate' = total(`aggregate')
  4. foreach var of varlist ethnicity imd region urban {
  5. bysort `var': egen `var'_`aggregate' = total(`aggregate')
  6. bysort `var' ckd_group: egen `var'_`aggregate'_ckd = total(`aggregate')
  7. }
  8. }

. 
. foreach binary of varlist fistula_formation pd_insertion blood_pressure album
> inuria creatinine icd1 icd2 icd3 icd4 icd5 icd6 icd7 icd8 icd9 icd10 icd11 ic
> d12 icd13 icd14 icd15 icd16 icd17 icd18 icd19 icd20 icd21 icd22 {
  2. gen esp_`binary' = `binary' * weight
  3. egen overall_std_`binary' = total(esp_`binary')
  4. bysort ckd_group: egen std_`binary' = total(esp_`binary')
  5. foreach var of varlist ethnicity imd region urban {
  6. bysort `var': egen `var'_`binary' = total(esp_`binary')
  7. bysort `var' ckd_group: egen `var'_`binary'_ckd = total(esp_`binary')
  8. }
  9. }

. 
. *Merge cost data
. save "./output/`dataset'_ckd_complete.dta", replace
(note: file ./output/2022_ckd_complete.dta not found)
file ./output/2022_ckd_complete.dta saved

. capture noisily import delimited ./output/costs_`dataset'.csv, clear
(7 vars, 500 obs)

. keep patient_id apcs_cost ec_cost opa_cost

. merge 1:1 patient_id using ./output/`dataset'_ckd_complete
(note: variable patient_id was int, now long to accommodate using data's
       values)

    Result                           # of obs.
    -----------------------------------------
    not matched                         2,585
        from master                       498  (_merge==1)
        from using                      2,087  (_merge==2)

    matched                                 2  (_merge==3)
    -----------------------------------------

. drop if _merge==1
(498 observations deleted)

. foreach cost of varlist apcs_cost ec_cost opa_cost {
  2. sum `cost', d
  3. bysort ckd_group: egen total_`cost' = total(`cost')
  4. egen overall_`cost' = total(`cost')
  5. tab ckd_group, sum(total_`cost')
  6. sum overall_`cost'
  7. foreach var of varlist ethnicity imd region urban {
  8. bysort `var': egen `var'_`cost' = total(`cost')
  9. bysort `var' ckd_group: egen `var'_`cost'_ckd = total(`cost')
 10. }
 11. }

                          apcs_cost
-------------------------------------------------------------
      Percentiles      Smallest
 1%     231.4668       231.4668
 5%     231.4668              .
10%     231.4668              .       Obs                   1
25%     231.4668              .       Sum of Wgt.           1

50%     231.4668                      Mean           231.4668
                        Largest       Std. Dev.             .
75%     231.4668              .
90%     231.4668              .       Variance              .
95%     231.4668              .       Skewness              .
99%     231.4668       231.4668       Kurtosis              .

            |     Summary of total_apcs_cost
  CKD group |        Mean   Std. Dev.       Freq.
------------+------------------------------------
  Albuminur |           0           0       1,258
  CKD stage |   231.46681           0         410
  CKD stage |           0           0           7
   Dialysis |           0           0          77
  Transplan |           0           0         294
  KRT uncle |           0           0          43
------------+------------------------------------
      Total |   45.429101   91.954193       2,089

    Variable |        Obs        Mean    Std. Dev.       Min        Max
-------------+---------------------------------------------------------
overall_ap~t |      2,089    231.4668           0   231.4668   231.4668

                           ec_cost
-------------------------------------------------------------
      Percentiles      Smallest
 1%     448.3297       448.3297
 5%     448.3297              .
10%     448.3297              .       Obs                   1
25%     448.3297              .       Sum of Wgt.           1

50%     448.3297                      Mean           448.3297
                        Largest       Std. Dev.             .
75%     448.3297              .
90%     448.3297              .       Variance              .
95%     448.3297              .       Skewness              .
99%     448.3297       448.3297       Kurtosis              .

            |      Summary of total_ec_cost
  CKD group |        Mean   Std. Dev.       Freq.
------------+------------------------------------
  Albuminur |           0           0       1,258
  CKD stage |   448.32968           0         410
  CKD stage |           0           0           7
   Dialysis |           0           0          77
  Transplan |           0           0         294
  KRT uncle |           0           0          43
------------+------------------------------------
      Total |   87.991943   178.10672       2,089

    Variable |        Obs        Mean    Std. Dev.       Min        Max
-------------+---------------------------------------------------------
overall_ec~t |      2,089    448.3297           0   448.3297   448.3297

                          opa_cost
-------------------------------------------------------------
      Percentiles      Smallest
 1%     160.5152       160.5152
 5%     160.5152              .
10%     160.5152              .       Obs                   1
25%     160.5152              .       Sum of Wgt.           1

50%     160.5152                      Mean           160.5152
                        Largest       Std. Dev.             .
75%     160.5152              .
90%     160.5152              .       Variance              .
95%     160.5152              .       Skewness              .
99%     160.5152       160.5152       Kurtosis              .

            |      Summary of total_opa_cost
  CKD group |        Mean   Std. Dev.       Freq.
------------+------------------------------------
  Albuminur |           0           0       1,258
  CKD stage |   160.51521           0         410
  CKD stage |           0           0           7
   Dialysis |           0           0          77
  Transplan |           0           0         294
  KRT uncle |           0           0          43
------------+------------------------------------
      Total |   31.503704   63.767444       2,089

    Variable |        Obs        Mean    Std. Dev.       Min        Max
-------------+---------------------------------------------------------
overall_op~t |      2,089    160.5152           0   160.5152   160.5152

. save "./output/`dataset'_ckd_complete.dta", replace
file ./output/2022_ckd_complete.dta saved

. 
. log close
      name:  <unnamed>
       log:  /workspace/logs/2022_ckd_complete.log
  log type:  text
 closed on:  29 Apr 2024, 13:33:49
-------------------------------------------------------------------------------
